pathway,pval,padj,ES,NES,nMoreExtreme,size,leadingEdge
PID_S1P_META_PATHWAY,0.8828630364688683,1,0.29331100190584075,0.6874973162389386,44083,19,"GNAZ, SPHK2, S1PR2, S1PR3, ABCC1, GNAQ, GNA13, GNA12, S1PR1, GNA15, SGPL1"
REACTOME_MEIOSIS,0.8832414859453673,1,-0.26111800156304976,-0.7793354510837558,44555,68,"SYCP2, HIST2H2AC, SMC1B, HIST1H4J, HIST1H2BD, TEX15"
REACTOME_N_GLYCAN_ANTENNAE_ELONGATION_IN_THE_MEDIAL_TRANS_GOLGI,0.8833071273610255,1,-0.3008158890259641,-0.6779282652562246,44379,16,"MGAT4A, B4GALT4, MGAT3, B4GALT3"
KEGG_ADIPOCYTOKINE_SIGNALING_PATHWAY,0.88421094322435,1,-0.26452133695057284,-0.7601864751921069,44649,54,"IRS4, SLC2A4"
KEGG_SPHINGOLIPID_METABOLISM,0.8849161560786843,1,0.2759499501348325,0.723323692006944,43905,33,"DEGS2, UGT8, NEU4, SPHK2"
PID_INTEGRIN1_PATHWAY,0.8853692927928822,1,-0.26614134096997605,-0.7564914815615766,44580,51,"TNC, SPP1, JAM2, COL6A3, COL11A2, COL1A1, ITGA10, COL5A1, LAMA2, COL4A1, NID1"
REACTOME_CHROMOSOME_MAINTENANCE,0.8856310217675747,1,-0.2558298601108439,-0.7919394177203504,44672,86,"SYCP2, HIST2H2AC, SMC1B, HIST1H4J, HIST1H2BD, CENPA"
KEGG_ENDOCYTOSIS,0.886197921840542,1,-0.2473959394230407,-0.8349104935770689,44604,164,"SH3GL3, ERBB4, PARD6G, CBLC, FGFR2, FGFR3, PIP5K1B, HSPA1L, IQSEC3, EGF, ASAP3, ACAP1, ADRB2, RAB11FIP4, EPN3, HSPA2, FGFR4, DAB2, VPS25, LDLR, EHD1, PLD1, EHD4, ACAP3, VTA1, SNF8, F2R, ARRB2, CHMP5, CHMP4C, PRKCZ, CBLB, VPS4B, RAB5B, RAB5C, ARFGAP1, KIT, RET, ASAP2, RAB11A, CHMP1B"
PID_CD40_PATHWAY,0.8870187040615103,1,-0.28212363040946464,-0.7105493241495362,44530,27,"MAPK11, STAT5A, TRAF1, MAP2K4, CBLB, JAK3, MAPK8, BIRC3"
BIOCARTA_MCALPAIN_PATHWAY,0.8874331873166419,1,0.2880709157248975,0.6963448865762044,44163,22,"EGFR, ACTA1, TLN1, MYLK, PRKACB, PRKAR2A, PRKAR1B"
BIOCARTA_MET_PATHWAY,0.8877816553365744,1,0.27387776978209216,0.7259517625884869,44009,35,"MAP4K1, ACTA1, PIK3R1, RASA1, CRKL, PTK2B, MET, PAK1, RAPGEF1, MAPK1, SOS1, RAP1B, DOCK1, GAB1, SRC, MAP2K2"
REACTOME_NETRIN1_SIGNALING,0.8893305354909002,1,0.27639769136078984,0.715443052419445,44076,31,"UNC5A, SLIT1, TRIO, PRKCQ, RGMB, SIAH1, NEO1"
BIOCARTA_AKAPCENTROSOME_PATHWAY,0.8915423881493344,1,0.300179793580334,0.6579248496404764,44536,14,"MAP2, AKAP9, PCNT, PRKACB, PRKAR2A, PKN1"
BIOCARTA_SKP2E2F_PATHWAY,0.8920186852182281,1,0.31184948213273966,0.6348340650651366,44492,10,"CCNA1, SKP2, RB1, CCNE1"
REACTOME_METABOLISM_OF_PORPHYRINS,0.8929191356916263,1,-0.30246454643453097,-0.6509020486469232,44753,13,"HMOX2, ALAD, UROS, ALAS1, CPOX"
BIOCARTA_ETC_PATHWAY,0.8930231630189733,1,-0.3121048051376156,-0.6329207023635739,44760,10,"SDHC, SLC25A4, NDUFA1, SDHD"
REACTOME_ASSEMBLY_OF_THE_PRE_REPLICATIVE_COMPLEX,0.8932340653030513,1,-0.26001055574667337,-0.7646207995073228,45110,62,"PSMB8, CDT1, PSMA2, PSMA5, PSMD6, PSMD9, E2F1, PSMD10, PSMA4, MCM2, E2F2, PSMC1, ORC2, PSMD2, PSMD3, ORC6, CDC6, PSMA6, PSMD13, PSME1, PSMD12, RPS27AP11, PSMB7, MCM4, PSMA1, PSMD11, GMNN, PSMC2, ORC5"
REACTOME_SYNTHESIS_OF_PIPS_AT_THE_PLASMA_MEMBRANE,0.8934725016433281,1,-0.2796784872155459,-0.7043910493486405,44854,27,"PIP5K1B, INPP5J, PIK3CD"
PID_RANBP2_PATHWAY,0.8935263031467692,1,0.3068041626200175,0.6379949492997588,44636,11,"HDAC4, MDM2, UBE2I, RANBP2, XPO1"
REACTOME_DNA_REPAIR,0.8938609617017835,1,0.25137339199625275,0.7985248001475963,44204,103,"ZBTB32, GTF2H2B, PRKDC, POLR2I, ATM, ATR, GTF2H2, USP1, ERCC4, TCEA1, REV3L, ERCC1, XPA, POLD3, BRCA1, MAD2L2, POLD1, RAD50, TP53BP1"
KEGG_B_CELL_RECEPTOR_SIGNALING_PATHWAY,0.8940260974595569,1,-0.25980363798508105,-0.7640123102717736,45150,62,"RASGRP3, CD72, DAPP1, FOS, CD22, PIK3CD, PIK3AP1, CARD11, RAC2, IFITM1"
REACTOME_ACTIVATED_TLR4_SIGNALLING,0.8944736789048167,1,0.2534484680229873,0.7849363199232074,44364,87,"TMEM189-UBE2V1, TLR2, AGER, PELI2, MAPK10, TLR4, RIPK2, TLR6, MEF2A, RPS6KA3, TLR1, RPS6KA5, NFKB2, TLR3"
REACTOME_CONVERSION_FROM_APC_C_CDC20_TO_APC_C_CDH1_IN_LATE_ANAPHASE,0.8946519913221742,1,-0.29514032394700795,-0.6651376310886475,44949,16,"CDC20, UBE2C, ANAPC7, CDC27, ANAPC10, UBE2E1"
REACTOME_SYNTHESIS_OF_GLYCOSYLPHOSPHATIDYLINOSITOL_GPI,0.8955874450172163,1,-0.29461910174976136,-0.6639629881496174,44996,16,"PIGV, DPM2, PIGQ, PIGF, PIGL, PIGX, PIGG, PIGN"
REACTOME_ACTIVATION_OF_BH3_ONLY_PROTEINS,0.8958178419984324,1,0.2946757241783927,0.663956646861681,44574,16,"BCL2, BBC3, PMAIP1, BCL2L11, AKT1, DYNLL2"
REACTOME_CELL_CELL_JUNCTION_ORGANIZATION,0.8959877537866581,1,0.2687818191202336,0.7241162793206521,44483,38,"CDH13, CLDN16, CDH11, CLDN8, CDH8, CLDN11, PARD6A, PVR, CDH4"
REACTOME_AKT_PHOSPHORYLATES_TARGETS_IN_THE_CYTOSOL,0.8968870038412292,1,-0.3025391782019738,-0.6390945293901134,44829,12,"CASP9, CDKN1A"
PID_NOTCH_PATHWAY,0.8969443729330455,1,-0.2608143671305411,-0.7495333144542267,45292,54,"LNX1, DTX1, SSPO, MFAP5, MFAP2, CDKN1A"
PID_BETA_CATENIN_NUC_PATHWAY,0.8981300304601295,1,0.2559083499468363,0.7687860206411066,44522,71,"CCND2, CDKN2A, ZCCHC12, TRRAP, TERT, BCL9, AR, MMP2, ADCY7, NCOA2"
BIOCARTA_PPARA_PATHWAY,0.8989335292832602,1,-0.2644508409720159,-0.7409343117134205,45263,47,"LPL, PRKAR2B, NR1H3, EHHADH"
REACTOME_JNK_C_JUN_KINASES_PHOSPHORYLATION_AND_ACTIVATION_MEDIATED_BY_ACTIVATED_HUMAN_TAK1,0.8989610959341163,1,-0.2943470575587761,-0.6541635954400389,45081,15,NOD2
REACTOME_BOTULINUM_NEUROTOXICITY,0.8990431869696909,1,0.2954231898780256,0.6566849456816977,44819,15,"STX1B, SYT1, STX4, STX10"
REACTOME_ADENYLATE_CYCLASE_INHIBITORY_PATHWAY,0.9022152025270902,1,0.29869279616886263,0.6332792654213161,45126,12,"ADCY5, ADCY2, ADCY7"
REACTOME_REGULATION_OF_PYRUVATE_DEHYDROGENASE_PDH_COMPLEX,0.9027088668373879,1,-0.2989620469412456,-0.6315380699813569,45120,12,"PDK4, PDK2"
REACTOME_CRMPS_IN_SEMA3A_SIGNALING,0.9030127114402963,1,0.2940658419458867,0.644524478276951,45109,14,"CRMP1, PLXNA1, DPYSL5, PLXNA3, FES"
REACTOME_N_GLYCAN_ANTENNAE_ELONGATION,0.9031890204865557,1,-0.2987385509666075,-0.6310659491288418,45144,12,"MGAT4A, B4GALT4, B4GALT3"
KEGG_NOTCH_SIGNALING_PATHWAY,0.9035197427193139,1,-0.2650256642433948,-0.7303325596847682,45512,43,"MFNG, DTX1, LFNG"
PID_BARD1_PATHWAY,0.9036084129405154,1,0.2732398389082369,0.6940184738624725,45024,28,"PRKDC, ATM, ATR, RBBP8, BRCA1, RAD50, NBN, FANCA, FANCF, CCNE1, CSTF1, XRCC5, FANCC, NPM1"
KEGG_GLYCOSPHINGOLIPID_BIOSYNTHESIS_GANGLIO_SERIES,0.9036907840660773,1,0.2960096289255961,0.6379994082303335,45076,13,"ST6GALNAC4, B4GALNT1, ST3GAL1, B3GALT4"
BIOCARTA_NFKB_PATHWAY,0.9045340351716713,1,-0.2815534851773815,-0.6725167991354957,45365,21,"IL1A, TNFRSF1B, FADD, IL1R1, TAB1, TRADD"
KEGG_OXIDATIVE_PHOSPHORYLATION,0.9045977011494253,1,-0.25062161214424583,-0.7860876543643784,45645,94,"ATP6V1G2, ATP6V0A4, UQCRFS1, UQCRHL, COX17, NDUFA2, ATP6V0B, UQCRC2, COX8A, COX7C, SDHC, NDUFA8, NDUFB3, COX7B, NDUFB4, COX7A2, ATP6V1F, ATP6V0D1, ATP6V1D, ATP6AP1, UQCRB, NDUFAB1, NDUFA1, NDUFB6, COX6B1, COX15, ATP6V1E1, ATP6V0E2, SDHD, ATP6V0E1, NDUFS3, COX6C, NDUFB1, ATP6V0C, NDUFB5, ATP6V1E2, COX5A, PPA1, COX11, UQCRH, ATP6V1C1, ATP6V1B2, NDUFV2, ATP6V0A1, COX5B, PPA2"
REACTOME_ACTIVATION_OF_THE_PRE_REPLICATIVE_COMPLEX,0.9075936510465418,1,-0.2726918610748003,-0.6966602307467203,45572,29,"CDT1, RPA2, CDC7, RPA1, CDK2, PRIM2, MCM2, ORC2, DBF4, ORC6, CDC6, MCM4, ORC5, PRIM1, MCM7"
REACTOME_DOWNSTREAM_SIGNALING_EVENTS_OF_B_CELL_RECEPTOR_BCR,0.9090764836559823,1,-0.25020297147247617,-0.77827684959031,45831,89,"RASGRP1, RASGRP3, CASP9, CDKN1A, NR4A1, PSMB8, CARD11"
BIOCARTA_RACCYCD_PATHWAY,0.9094511949786754,1,0.27424041685526124,0.6799646279028645,45206,25,"PIK3R1, CDK6, CDKN1B, NFKB1, RB1, PAK1, MAPK1, IKBKB, CCNE1, CDK4, AKT1, RAC1, HRAS, RAF1, PIK3CA"
REACTOME_DOUBLE_STRAND_BREAK_REPAIR,0.9096653827636013,1,0.27875405503645057,0.6673067819400093,45344,21,"PRKDC, ATM, BRCA1, RAD50, TP53BP1, LIG4, NBN, LIG1"
PID_REELIN_PATHWAY,0.9104444974554707,1,-0.2729395137379808,-0.6824975153368089,45798,26,"MAPK8IP1, GRIN2A"
REACTOME_EXTENSION_OF_TELOMERES,0.9114841663487219,1,0.2706954426159245,0.6820671072399154,45390,27,"TERT, DNA2, DKC1, POLD3, POLD1, POLA1, POLE, POLA2, LIG1"
REACTOME_REGULATION_OF_RHEB_GTPASE_ACTIVITY_BY_AMPK,0.911497867056538,1,0.30121997233052444,0.5988245458701563,45511,9,"PRKAB2, PRKAA2, PRKAA1, TSC2, TSC1, PRKAG1, PRKAB1, RHEB, PRKAG2"
KEGG_HOMOLOGOUS_RECOMBINATION,0.9124688178965157,1,0.2727224907913017,0.6762010104058526,45356,25,"MUS81, TOP3A, BLM, POLD3, POLD1, RAD51D, RAD50"
REACTOME_MEIOTIC_RECOMBINATION,0.912700012091411,1,0.26029080685154177,0.7203549142283195,45289,44,"H3F3AP6, HIST1H4C, HIST1H3D, HIST2H3C, HIST2H3A, ATM, HIST3H2BB, TOP3A, BLM, RBBP8, BRCA1, RAD50, MLH3"
PID_S1P_S1P4_PATHWAY,0.9134139251418376,1,0.28997037244014573,0.6249827976631245,45561,13,"GNAZ, MAPK1, GNA13, GNA12"
NABA_PROTEOGLYCANS,0.913572343149808,1,-0.2918828287437166,-0.6165836774650286,45663,12,"FMOD, HAPLN3, PODNL1"
PID_ECADHERIN_KERATINOCYTE_PATHWAY,0.9139647127150381,1,0.2788758363662861,0.6536624532320117,45636,19,"EGFR, VASP, PIK3R1, ZYX, AKT2, CTNND1, PIP5K1A, AKT1, SRC, RAC1, PLCG1"
REACTOME_SIGNALING_BY_CONSTITUTIVELY_ACTIVE_EGFR,0.9141837430324418,1,0.2808933470541405,0.6498827632634907,45593,18,"EGFR, CBL, PIK3R1, KRAS, SOS1, UBA52, CDC37, GAB1, NRAS, PLCG1, HRAS"
REACTOME_G2_M_CHECKPOINTS,0.9143072408597034,1,-0.2618693929233044,-0.7155872172610522,46113,41,"CCNB2, CCNB1, CDK1, RPA2, CDC7, RPA1, CDK2, MCM2, ORC2, DBF4, ORC6, CHEK1, CDC6, CDC25C, RFC2, CHEK2, MCM4, ORC5"
BIOCARTA_MEF2D_PATHWAY,0.9147289937498744,1,0.2845640985169462,0.6411733616514266,45515,16,"PPP3CC, CABIN1, PRKCA, PPP3CA, NFATC2, NFATC1, CAPNS1, EP300"
PID_FAS_PATHWAY,0.9151282000436257,1,-0.26436755655925753,-0.7014152946459828,46148,35,"MAP2K6, MAPK11, PIK3CD, SMPD1, FADD, MAPK8, BIRC3"
KEGG_CHRONIC_MYELOID_LEUKEMIA,0.9162850745365421,1,0.25096816453091164,0.7539449828714248,45422,71,"CDKN2A, SHC4, PIK3R2, SHC3, AKT3, CBL, PIK3R1, GAB2, CDK6, MDM2, CRKL, CDKN1B"
REACTOME_ALPHA_LINOLENIC_ACID_ALA_METABOLISM,0.9171761978979339,1,-0.2922360172365598,-0.6057498485989187,45900,11,"FADS2, ACAA1, FADS1, ELOVL5, ACSL1, ABCD1"
REACTOME_RNA_POL_III_CHAIN_ELONGATION,0.9175908068145291,1,0.2806886190926886,0.6408159274058789,45673,17,"LZTS1, POLR3B"
BIOCARTA_PTEN_PATHWAY,0.917691256830601,1,0.28061978740455124,0.6406587837275523,45678,17,"PIK3R1, FOXO3, CDKN1B, MAPK1, SOS1, PDPK1, AKT1"
REACTOME_INNATE_IMMUNE_SYSTEM,0.9193110248103508,1,0.24023624406930325,0.821213875845888,45686,181,"TMEM189-UBE2V1, PSTPIP1, RIPK3, C4BPB, P2RX7, TLR2, CFD, AGER, C3, PELI2, MAPK10, TLR4, CCR2, CFHR3, C1S, C4A, BCL2, RIPK2, TLR6, ISG15, HERC5, IFIH1, MEF2A, RPS6KA3, TLR1"
REACTOME_SYNTHESIS_SECRETION_AND_DEACYLATION_OF_GHRELIN,0.9218055944615631,1,-0.30056360378551306,-0.579639937194632,46069,8,"SEC11A, SPCS3"
BIOCARTA_P53HYPOXIA_PATHWAY,0.9233361247358137,1,-0.2722711483998503,-0.6503450706832973,46308,21,ABCB1
BIOCARTA_EIF_PATHWAY,0.9239735525231616,1,0.27895404655316774,0.6285329200236828,45975,16,"EIF2S2, EIF5, EIF1, EIF3A, EIF2S3, EIF4G2, EEF2K, EEF2, EIF4G1, EIF6"
BIOCARTA_STATHMIN_PATHWAY,0.9250760243277849,1,-0.2837244791224117,-0.5993496893157415,46238,12,"PRKAR2B, CAMK2G, CCNB1, CDK1"
PID_AURORA_B_PATHWAY,0.9252191435768262,1,0.25842257933269197,0.6925325767577473,45913,37,"DES, SEPT1, MYLK, RASA1, CBX5, SMC2, KLHL13"
REACTOME_RECYCLING_PATHWAY_OF_L1,0.925585418846061,1,0.2663628080042485,0.6604325128610097,46008,25,"RPS6KA6, RPS6KA3, RPS6KA5, AP2S1, RPS6KA4, MAPK1, RPS6KA2"
SIG_REGULATION_OF_THE_ACTIN_CYTOSKELETON_BY_RHO_GTPASES,0.9259605999641456,1,-0.26568345060748316,-0.6691435098608126,46485,27,FSCN2
REACTOME_ANTIVIRAL_MECHANISM_BY_IFN_STIMULATED_GENES,0.9259662493195427,1,0.2497997572108246,0.7395370109543409,45926,65,"MX2, ISG15, FLNB, HERC5, MX1, KPNA5, NEDD4, NUPL2, DDX58, NUP188, SEH1L, POM121, STAT1, RANBP2, NUP43, USP18, NUP88, NUP153, TPR, NUP50, EIF2AK2"
PID_AVB3_OPN_PATHWAY,0.9262939876127696,1,-0.2642779659172343,-0.6751648105356243,46511,29,"SPP1, FOS, CD44"
BIOCARTA_P38MAPK_PATHWAY,0.9268975652381142,1,-0.25844863239537924,-0.6959465153085105,46672,38,"MAP2K6, TGFB3, PLA2G4A, TGFB2"
PID_REG_GR_PATHWAY,0.9275136871451949,1,0.249845652903755,0.7334957367542331,45910,62,"IL6, NR1I3, PCK2, GATA3, MAPK10"
BIOCARTA_IL2RB_PATHWAY,0.9276644630764269,1,0.2591535924077399,0.6792968549754688,46026,33,"NMI, IL2RG, BCL2, CBL, PIK3R1, CRKL, IRS1"
REACTOME_CDT1_ASSOCIATION_WITH_THE_CDC6_ORC_ORIGIN_COMPLEX,0.929006286314871,1,-0.2511557022351072,-0.7191451298352285,46846,53,"PSMB8, CDT1, PSMA2, PSMA5, PSMD6, PSMD9, PSMD10, PSMA4, PSMC1, ORC2, PSMD2, PSMD3, ORC6, CDC6, PSMA6, PSMD13, PSME1, PSMD12, RPS27AP11, PSMB7, PSMA1, PSMD11, GMNN, PSMC2, ORC5"
REACTOME_RNA_POL_III_TRANSCRIPTION_TERMINATION,0.9291250275368994,1,0.2701791275529433,0.6332780696581419,46393,19,"LZTS1, POLR3B"
PID_HDAC_CLASSIII_PATHWAY,0.929322794102858,1,0.26587746522322153,0.6537308156464964,46204,24,"HIST1H1E, HDAC4, FOXO3, SIRT3, CREBBP, BAX, FOXO1"
REACTOME_SHC_MEDIATED_SIGNALLING,0.9308660192625975,1,-0.2744457774357433,-0.6099345378536796,46681,15,SHC2
BIOCARTA_P35ALZHEIMERS_PATHWAY,0.9317279492448577,1,-0.28350418212691025,-0.5749211903214899,46700,10,"CDK5, CDK5R1, CAPN1, APP, GSK3B, PPP2CA, MAPT, CAPNS1, CSNK1D, CSNK1A1"
ST_FAS_SIGNALING_PATHWAY,0.9318168043798865,1,0.24852557380483725,0.7296202545115721,46123,62,"PTPN13, TNFRSF6B, MAPK8IP2, MAPK10, EGFR, NFKB2, NFKBIB, DAXX, NFAT5, FAF1, ROCK1, BAX, NFKB1, DIABLO, MET, DEDD, MAP3K5, CSNK1A1, MAPK1, CASP8AP2, XIAP"
PID_P73PATHWAY,0.9321633888048412,1,0.24560518316406477,0.7407250038322857,46211,73,"GDF15, WT1, CLCA2, SERPINE1, TP73, S100A2, BBC3, CCNE2, FOXO3, CDK6, MDM2, PRKACB, BAX, DCP1B, ABL1, CASP2, SP1, RB1, FBXO45, HSF1, DEDD, FASN, BCL2L11"
BIOCARTA_INTEGRIN_PATHWAY,0.9323825469509612,1,0.2559261542360266,0.6783684667359395,46220,35,"ACTA1, TLN1, CRKL, ZYX, ROCK1, RAPGEF1, CSK, MAPK1, SOS1, CAPNS1, PPP1R12B, SRC, MAP2K2, CAV1, HRAS"
PID_VEGFR1_PATHWAY,0.9332904160296129,1,0.2621579375292371,0.650006758624245,46391,25,"VEGFA, PGF, CBL, PIK3R1, NRP2, RASA1, PRKCA"
REACTOME_DCC_MEDIATED_ATTRACTIVE_SIGNALING,0.9340437442520693,1,0.2760132744590605,0.5851948421184835,46718,12,"TRIO, WASL, DOCK1, SRC, RAC1, NTN1"
KEGG_ALZHEIMERS_DISEASE,0.9342288096340898,1,0.23960096272655554,0.7891602326154707,46390,133,"PLCB1, NDUFA4L2, GRIN2C, CALML3, ATP2A3, ATP2A1, MME, SNCA, COX6B2"
REACTOME_G2_M_DNA_DAMAGE_CHECKPOINT,0.934649816747111,1,0.2836173815863834,0.5638306398321724,46667,9,"ATM, ATR"
PID_RHOA_PATHWAY,0.935779088003494,1,-0.2526972729303041,-0.696359149561679,47137,43,"MAP2K6, F2RL2, FOS, PIP5K1B"
REACTOME_SYNTHESIS_AND_INTERCONVERSION_OF_NUCLEOTIDE_DI_AND_TRIPHOSPHATES,0.9361434727098628,1,-0.2675756475583805,-0.6185888074362327,46926,18,"NME1-NME2, NME1, AK1, GLRX, NME2, GUK1, RRM2, RRM1, NME4"
REACTOME_CASPASE_MEDIATED_CLEAVAGE_OF_CYTOSKELETAL_PROTEINS,0.937525022019377,1,0.2754311501145171,0.5727552102039846,46834,11,"PLEC, CASP8, MAPT, CASP3"
KEGG_GLYCOSAMINOGLYCAN_BIOSYNTHESIS_CHONDROITIN_SULFATE,0.9379094160671945,1,0.26132429272169566,0.6316911046607558,46675,22,"B3GAT2, XYLT1, CHPF, CSGALNACT2"
BIOCARTA_GLEEVEC_PATHWAY,0.9381519229237997,1,-0.2626420203758864,-0.6336632592463133,47128,22,"FOS, STAT5A, MAP2K4, MAPK8"
BIOCARTA_HSP27_PATHWAY,0.9382222399936023,1,0.2722878613003259,0.5772963358979967,46927,12,"BCL2, ACTA1, DAXX, CYCS"
PID_TRAIL_PATHWAY,0.9391470629245264,1,-0.25825298762144544,-0.6504293367687378,47147,27,"PIK3CD, TNFSF10, SMPD1, FADD, TRADD, MAP2K4, MAPK8"
REACTOME_MHC_CLASS_II_ANTIGEN_PRESENTATION,0.9392484721353799,1,0.2424280924760252,0.7468011467690482,46566,84,"HLA-DMB, HLA-DOB, DYNC1I1"
REACTOME_TRANSPORT_OF_MATURE_TRANSCRIPT_TO_CYTOPLASM,0.9395362903225807,1,0.24788410508581737,0.7021766684476942,46600,50,"UPF3B, NUPL2, NUP188, SEH1L, POM121, RANBP2, NUP43, U2AF2, SRSF4, NUP88, NUP153, TPR, NUP50, U2AF1, NUP210, NUP85, RNPS1, NUP62, DHX38, NUP205, CPSF2, SRSF2, SRSF3, SLBP, CPSF1, NUP107, CDC40"
PID_LYMPH_ANGIOGENESIS_PATHWAY,0.9395967806199698,1,-0.2612354531269164,-0.6361033642447115,47163,23,"MAPK11, COL1A1, MAP2K4, ITGA1"
KEGG_PROSTATE_CANCER,0.9400278096850251,1,0.2429285794665329,0.7429374551166591,46646,80,"CREB5, PIK3R2, PDGFB, BCL2, EGFR, AKT3, ATF4, AR, CCNE2, PIK3R1, IGF1R, MDM2, CREBBP, CDKN1B, PDGFA"
WNT_SIGNALING,0.9405903253339685,1,-0.2428161243641763,-0.7431814011574652,47385,80,"WNT10A, WNT4, WNT3A, CXXC4, KREMEN1, WNT7B, TLE2, RHOU, CTNNBIP1, DKK1, SLC9A3R1, NKD1, SFRP1, NLK, CTNNB1"
REACTOME_TRANSCRIPTION_COUPLED_NER_TC_NER,0.942122445689412,1,0.24888889622289784,0.688800121908588,46749,44,"GTF2H2B, POLR2I, GTF2H2, ERCC4, TCEA1, ERCC1, POLD3, POLD1"
BIOCARTA_P53_PATHWAY,0.9424827669366346,1,0.2662132707086537,0.5998256933536681,46896,16,"BCL2, ATM, MDM2, BAX, RB1, CCNE1, APAF1, CDK4"
BIOCARTA_BIOPEPTIDES_PATHWAY,0.9425864328192722,1,0.250857362158865,0.66867367933135,46756,36,"CAMK2B, AGT, STAT4, MYLK, PTK2B, PRKCA, STAT1, JAK2, CAMK2D, MAPK1, SOS1"
REACTOME_TRANSPORT_OF_MATURE_MRNA_DERIVED_FROM_AN_INTRONLESS_TRANSCRIPT,0.9427585650296598,1,0.25352144633753726,0.6562289161263631,46724,31,"NUPL2, NUP188, SEH1L, POM121, RANBP2, NUP43, NUP88, NUP153, TPR, NUP50, NUP210, NUP85, NUP62, NUP205, CPSF2"
REACTOME_MRNA_CAPPING,0.9434413223804455,1,0.25349190343731953,0.648017595227386,46972,29,"GTF2H2B, POLR2I, GTF2H2"
REACTOME_TRIF_MEDIATED_TLR3_SIGNALING,0.9440614848268758,1,-0.24268106467037667,-0.7260215280062527,47659,69,"NOD2, MAP2K6, FOS, MAPK11, SAA1"
BIOCARTA_RAS_PATHWAY,0.9445019507922605,1,-0.2587777626777398,-0.6243401580758653,47447,22,"CASP9, PLD1, FOXO4, CDC42, RALA"
REACTOME_UNFOLDED_PROTEIN_RESPONSE,0.9454501422776533,1,0.2408475975953951,0.7276945200370388,46847,74,"ASNS, DDIT3, SULT1A3, ATF4, TLN1, HERPUD1, XBP1, EDEM1, ATF3, EXOSC8"
REACTOME_RESOLUTION_OF_AP_SITES_VIA_THE_MULTIPLE_NUCLEOTIDE_PATCH_REPLACEMENT_PATHWAY,0.9468402819256958,1,-0.2607593638840978,-0.5954173622638801,47555,17,"CCNO, POLB, FEN1, SMUG1, OGG1, APEX1, MPG, MUTYH"
REACTOME_DOWNREGULATION_OF_SMAD2_3_SMAD4_TRANSCRIPTIONAL_ACTIVITY,0.9470265067971287,1,0.25715053505707636,0.6094589542383971,47231,20,"NCOR1, SKIL, NCOR2, SKI, SMAD2, TRIM33"
PID_CDC42_PATHWAY,0.9477563714204935,1,0.2413876421652926,0.7217440295860069,46930,69,"RASGRF1, ARHGEF6, PAX6, TIAM1, PARD6A, CBL, CDC42BPA, PIK3R1"
REACTOME_NFKB_ACTIVATION_THROUGH_FADD_RIP1_PATHWAY_MEDIATED_BY_CASPASE_8_AND10,0.9479341820802306,1,0.266058835809342,0.5532656141734467,47354,11,"IFIH1, DDX58, IKBKB, CASP10, CASP8"
REACTOME_MICRORNA_MIRNA_BIOGENESIS,0.9481292858002165,1,0.2591347592650264,0.5995414814018907,47286,18,"POLR2I, DGCR8, DICER1"
ST_ADRENERGIC,0.948519335041411,1,-0.2511307445577882,-0.6462557753247636,47756,30,"PTX3, PIK3CD, ITPR1, ITPKB, GNAI1"
ST_TYPE_I_INTERFERON_PATHWAY,0.9487446025907564,1,0.2748968463894899,0.5326394037868865,47459,8,"IRF9, STAT1, PTPRU"
REACTOME_NUCLEOTIDE_EXCISION_REPAIR,0.9495656030155819,1,0.24340119564177745,0.6868638280809671,47106,49,"GTF2H2B, POLR2I, GTF2H2, ERCC4, TCEA1, ERCC1, XPA, POLD3, POLD1"
PID_PI3KCI_PATHWAY,0.950328854456684,1,0.245645634842421,0.670621328273756,47103,41,"LCK, PIK3R2, PIK3R1, FOXO3, ADAP1, KRAS, SGK1, ARF6, CYTH2, PIK3R3, ARAP3"
ST_JAK_STAT_PATHWAY,0.9505102754089193,1,-0.2690227644321469,-0.5326819413775471,47592,9,"JAK3, SOAT1, JAK1, PIAS1, REG1A, CISH, PTPRU, PIAS3, JAK2"
REACTOME_PLATELET_SENSITIZATION_BY_LDL,0.9511382454460207,1,-0.2608523530670648,-0.5613528362487741,47671,13,PLA2G4A
BIOCARTA_TNFR2_PATHWAY,0.9512566946823662,1,0.26026246514513673,0.5785275111861882,47422,15,"TNFAIP3, TANK, MAP3K14, NFKB1, TRAF3, IKBKB"
SIG_CHEMOTAXIS,0.9514857970899419,1,-0.24577129054258073,-0.6589233476064952,47932,37,"ARHGAP4, PIK3CD, ITPR1"
REACTOME_METABOLISM_OF_MRNA,0.9518077075883988,1,-0.23276841999113349,-0.811162352767274,47913,218,"RPL23AP2, RPS17, RPL3L, RPSAP9, RPL21P16, MAPK11, TNFSF13, RPL7AP66, RPL17P36, PSMB8, RPL39, RPL23AP42, EIF4A2, PSMA2, RPL23AP74, RPS7, NCBP2, LSM3, MAPKAPK2, EXOSC2, RPL27, SMG9, PSMA5, PSMD6, RPL27A, SMG8, RPL23, RPS15A, PSMD9, PSMD10, EIF4E, RPL26L1, DIS3, EXOSC9, MAPK14, PSMA4, GSPT2, MAGOH, CNOT7, PSMC1, RPS24, CNOT8, RPS3A, PSMD2, PSMD3, CNOT2, RPL22, LSM2, LSM1, PSMA6, RPL34, RPS25, RPL10P9, 
RPS18, PSMD13, RPS14, PSME1, RPL31, RPL3, RPS26, RPL5, RPS3, PSMD12, RPS27AP11, PSMB7, HSPB1, EIF4A1, PSMA1, RPL12, EIF4B, PSMD11, RPL9, PSMC2, PPP2R2A, RPS16, DCP2, RPSA"
REACTOME_CDC6_ASSOCIATION_WITH_THE_ORC_ORIGIN_COMPLEX,0.9522379694130835,1,0.2616981132075472,0.5441975527381523,47569,11,"MCM8, ORC4, E2F3, ORC1, ORC3, ORC5, CDC6, ORC6, ORC2, E2F2, E2F1"
REACTOME_UNWINDING_OF_DNA,0.9522439355792671,1,-0.2633934652072858,-0.5459647074990919,47655,11,"GINS4, GINS2, MCM2, MCM4, MCM7"
PID_TCR_CALCIUM_PATHWAY,0.9524655974754839,1,-0.2556163252467566,-0.597380670384551,47688,19,"FOS, CREM, AKAP5, PRKACA"
REACTOME_METABOLISM_OF_POLYAMINES,0.9530377339605645,1,0.25830635937904356,0.5661479429665713,47608,14,"PAOX, SMOX, ODC1, SAT1, SRM"
REACTOME_POST_TRANSLATIONAL_PROTEIN_MODIFICATION,0.953314418364715,1,-0.23353113594121702,-0.7848089778609822,48047,158,"MAN1C1, GALNT14, MUC17, MAN1A1, GALNT3, B3GNT7, F10, MGAT4A, PROC, SUMF1, GALNT12, GCNT1, B4GALT4, PIGV, GMPPA, MGAT3, ARSG, ARSA, GALNT6, MPI, PREB, B4GALT3, B3GNTL1, C1GALT1C1, DAD1, ALG11, CALR, MANEA, DPM2, PIGQ, PIGF, SEC13, DOLK, SEC23A, B4GALT1, PIGL, SEC24C, PGM3, GALNT2, B3GNT8, PIGX, ALG8, RPN2, GALNT10, MGAT2, SEC24D, ALG6, ST6GALNAC2, GMPPB, SEC31A, GFPT2, SUMF2, B3GNT9, SEC24B, 
FURIN, PIGG"
REACTOME_ACTIVATION_OF_NF_KAPPAB_IN_B_CELLS,0.9540728417800487,1,-0.24071084419606953,-0.6999467905565838,48173,58,"PSMB8, CARD11, PSMA2, SKP1, BTRC, PSMA5, PSMD6, PSMD9, PSMD10, PSMA4, PSMC1, PSMD2, PSMD3, CUL1, PSMA6, PSMD13, PSME1, PSMD12, RPS27AP11, PSMB7, PSMA1, PSMD11, MALT1, PSMC2"
ST_IL_13_PATHWAY,0.954607262837946,1,0.28255265639735927,0.5142629112019161,47737,6,"JAK2, TYK2, IL13RA2, IL4R, IL13RA1, JAK1"
KEGG_HUNTINGTONS_DISEASE,0.9546847900617109,1,0.23352101033384653,0.779570735052017,47338,149,"CREB5, PLCB1, NDUFA4L2, DNAH2"
PID_ERBB1_RECEPTOR_PROXIMAL_PATHWAY,0.9554596251992011,1,0.24355944998485507,0.6455887681291798,47364,35,"PIK3R2, EGFR, TLN1, PIK3R1, RASA1, KRAS, STAT1, PIK3R3, PAK1, MAPK1, SOS1"
REACTOME_METAL_ION_SLC_TRANSPORTERS,0.9557610497513431,1,-0.2525881802186362,-0.590303832451082,47853,19,"SLC30A3, SLC30A2, SLC40A1, SLC39A8"
REACTOME_ACYL_CHAIN_REMODELLING_OF_PS,0.9564817958498931,1,-0.2630747611724805,-0.5209045219819547,47891,9,"PLA2G4A, MBOAT1, PLA2G12A"
BIOCARTA_CHREBP2_PATHWAY,0.9571403059705935,1,-0.24304738426391131,-0.6481800347011857,48236,36,"PRKAR2B, MLXIPL, PRKACA, YWHAQ, PPP2R2B, MLX"
REACTOME_BIOSYNTHESIS_OF_THE_N_GLYCAN_PRECURSOR_DOLICHOL_LIPID_LINKED_OLIGOSACCHARIDE_LLO_AND_TRANSFER_TO_A_NASCENT_PROTEIN,0.9580061386375414,1,-0.24626671803302,-0.6246299890806606,48066,28,"GMPPA, MPI, ALG11, DPM2, DOLK, PGM3, ALG8, ALG6, GMPPB, GFPT2, ALG12, DPM1, PMM1"
KEGG_BIOSYNTHESIS_OF_UNSATURATED_FATTY_ACIDS,0.9580179352493559,1,-0.2506915578802675,-0.5858713865857121,47966,19,"FADS2, PECR, ACAA1, HADHA, ACOT4, SCD, FADS1, TECR, ELOVL5"
REACTOME_ACTIVATION_OF_CHAPERONE_GENES_BY_XBP1S,0.9580190551806272,1,-0.24124641467939043,-0.6678895522697307,48264,44,"KDELR3, WFS1, GOSR2, PREB, KLHDC3, PDIA6, ATP6V0D1, ARFGAP1, ACADVL, WIPI1, TPP1, DNAJB9, SEC31A, DNAJB11, PDIA5, CUL7, SULT1A4, LMNA"
BIOCARTA_41BB_PATHWAY,0.9586001875461383,1,-0.2536168071455529,-0.5457819810232332,48045,13,"MAPK8, ATF2, MAPK14, JUN, NFKBIA, TRAF2, MAP3K1, RELA, MAP4K5, CHUK, IKBKB, MAP3K5, NFKB1"
REACTOME_SPHINGOLIPID_METABOLISM,0.9598360168736261,1,-0.23794791716320815,-0.69191266182569,48464,58,"SGPP2, SUMF1, NEU1, CERS6, GALC, ARSG, ARSA, SMPD1, GLB1, GM2A, SMPD3, UGCG, ASAH1, ASAH2, HEXB, GBA, CTSA, PSAP, SPTLC1, DEGS1"
REACTOME_DNA_REPLICATION,0.9599960254372019,1,-0.23136862449019482,-0.7885533488532966,48306,178,"KIF20A, NUF2, CENPA, CDCA8, CDKN1A, KIF2C, PSMB8, AURKB, MAD2L1, NDC80, BIRC5, CDC20, KIF18A, GINS4, BUB1, B9D2, CDT1, RPA2, NUP37, CDC7, CCNA2, PSMA2, RANGAP1, NDEL1, CENPO, RPA1, SEC13, SKA2, PSMA5, KIF23, PSMD6, PLK1, MAPRE1, PSMD9, E2F1, BUB1B, CENPN, ITGB3BP, PSMD10, CDK2, PRIM2, GINS2, MIS12, FEN1, PSMA4, MCM2, ZWINT, E2F2, PSMC1, ORC2, RAD21, PSMD2, PSMD3, DBF4, ORC6, CDC6, PSMA6, 
CENPT, DSN1, SKA1, RFC2, INCENP, PSMD13, PSME1, SPC24, CENPM, PSMD12, RPS27AP11, PSMB7, MCM4, PSMA1, PSMD11, PPP2R5C, GMNN, PSMC2, ORC5, PPP1CC, CENPI"
BIOCARTA_ETS_PATHWAY,0.9608402489626556,1,-0.24722962893054756,-0.5715523169562067,48164,18,"FOS, HDAC5"
KEGG_PURINE_METABOLISM,0.9610289005859569,1,-0.23175379340746513,-0.7625067737237758,48382,133,"PDE6G, PDE11A, GDA, ADCY1, GUCY1A2, ENPP3, POLR2J2, NPR1, FHIT, AMPD3, AK7, POLR3GL, ADSSL1, ENPP1, NME1-NME2, NUDT9, PAPSS1, PDE7B, PDE6D, POLR2G, POLR2K, GMPR2, POLR2F, POLR3D, NME1, PRPS1, AK1, NT5M, POLR2B, NT5C2, ENTPD4, POLR2L"
REACTOME_CELL_CELL_COMMUNICATION,0.9616005488518503,1,0.23306860389216108,0.7268424056399737,47654,91,"ARHGEF6, COL17A1, CDH13, PIK3R2, CLDN16, CDH11, CLDN8, CDH8, CLDN11, PLEC, PARD6A, SIRPA, LAMC2, VASP, PIK3R1, PVR, CDH4, LAMA3, ITGB4, PTK2B"
BIOCARTA_PML_PATHWAY,0.9622301076562219,1,0.2500698253650496,0.5389838201488608,47996,13,"CREBBP, DAXX, SP100, TNFRSF1A, RB1"
REACTOME_PROCESSIVE_SYNTHESIS_ON_THE_LAGGING_STRAND,0.9622490120955609,1,0.24892909815823194,0.5533350017990302,47970,15,"DNA2, POLD3, POLD1, POLA1, POLA2, LIG1"
PID_NEPHRIN_NEPH1_PATHWAY,0.9625896102331372,1,0.24125459690032255,0.6078854650301918,47935,27,"PIK3R2, MAPK10, PARD6A, PIK3R1"
BIOCARTA_HIF_PATHWAY,0.9628948788139149,1,-0.2486844824349887,-0.5438869964929316,48189,14,"NOS3, EDN1, LDHA, HIF1A"
KEGG_CELL_CYCLE,0.9636791693496458,1,0.23100880018841402,0.7520771766371734,47890,122,"CCND2, CDKN2A, GADD45G, CDKN2B, CCNA1, PRKDC, ATM, ATR, CCNE2, SMC1A, CDK6, MDM2, STAG2, CDC26, ANAPC4, CREBBP, CDKN1B, MAD1L1, GADD45B, MAD2L2, SMC3, CDC25B, SKP2, ABL1, ORC4, ANAPC11, TFDP2, RB1"
REACTOME_CIRCADIAN_REPRESSION_OF_EXPRESSION_BY_REV_ERBA,0.9639302492236643,1,-0.24392083125881245,-0.5884955831223108,48423,22,"ELOVL3, HDAC3, RORA"
