pathway,pval,padj,ES,NES,nMoreExtreme,size,leadingEdge
BIOCARTA_CCR3_PATHWAY,1.602146876814932e-4,0.2100414555504376,0.8197958801328789,1.9215353798287567,7,19,"CCR3, PLCB1, PRKCA"
KEGG_BUTANOATE_METABOLISM,7.97225654721569e-4,0.3948874475391072,-0.7141453676351643,-1.8113556584131927,39,28,"ABAT, HMGCS2, OXCT2, BDH2, GAD1, HMGCS1, EHHADH, AACS, ACSM3, ALDH7A1, AKR1B10, HADHA, HADH, ACAT2, HMGCL, BDH1, ACAT1"
REACTOME_CHOLESTEROL_BIOSYNTHESIS,0.0010173954676029366,0.3948874475391072,-0.7590147223421796,-1.793304298179444,50,20,"DHCR24, IDI1, FDFT1, HSD17B7, MSMO1, HMGCS1, TM7SF2, DHCR7, HMGCR, NSDHL, LSS, SQLE, FDPS, EBP, MVD, MVK, GGPS1"
REACTOME_GABA_SYNTHESIS_RELEASE_REUPTAKE_AND_DEGRADATION,0.0013587499500459577,0.3948874475391072,-0.8481642732451129,-1.758083705641756,67,11,"RAB3A, ABAT, SLC6A11, GAD1"
PID_EPHA_FWDPATHWAY,0.001506054338440531,0.3948874475391072,0.7184086284657505,1.8101630758855032,74,27,"LCK, EPHA1, VAV3, EPHA6, EFNA2, EPHA3, EPHA7, EPHA4, CBL"
REACTOME_SIGNAL_AMPLIFICATION,0.002505817075353499,0.4320337933651561,-0.7113182457872405,-1.7487321551094488,125,24,"P2RY1, TBXA2R, GNG2, GNB3, GNG7, PLA2G4A"
PID_HIF1A_PATHWAY,0.002532205229204767,0.4320337933651561,0.7822465549608368,1.7625401654615924,125,16,"CDKN2A, HIF3A, VHL"
REACTOME_ADP_SIGNALLING_THROUGH_P2RY1,0.0026363618206874514,0.4320337933651561,-0.7447795227784957,-1.7405652404110252,131,19,"P2RY1, GNG2, GNB3, GNG7, PLA2G4A"
PID_RHODOPSIN_PATHWAY,0.003471460207888594,0.5056760369491051,-0.8404640900860754,-1.7043861980083606,173,10,"PDE6G, LRAT, RGS9, GUCA1B, RDH5"
REACTOME_CYTOSOLIC_TRNA_AMINOACYLATION,0.0058327802248637345,0.6940838975321039,0.6909687934716217,1.6989314704171739,289,24,"MARS, GARS, WARS, SARS, CARS, YARS, AARS, IARS, EPRS, TARS, NARS, LARS, DARS, VARS"
BIOCARTA_D4GDI_PATHWAY,0.00632202304737516,0.6940838975321039,-0.7935744353944529,-1.6763748858531604,315,12,"CASP1, PRF1, ARHGDIB, CASP9"
KEGG_VALINE_LEUCINE_AND_ISOLEUCINE_DEGRADATION,0.0064112743152044465,0.6940838975321039,-0.5887395019783154,-1.629922512640737,322,44,"ABAT, HMGCS2, AOX1, OXCT2, IL4I1, HMGCS1, EHHADH, BCKDHB, ACAA1, ALDH7A1, MCEE, HADHA, HADHB, HADH, ACAT2, HMGCL, PCCB, ACAT1, MCCC1, IVD"
PID_CONE_PATHWAY,0.006910187533702143,0.6940838975321039,-0.8334454189048299,-1.6502741866903388,345,9,"LRAT, RGS9, GUCA1B, GNB3, RDH5, CNGB3"
PID_SHP2_PATHWAY,0.007412032467924832,0.6940838975321039,0.5783719149792532,1.620668998121674,367,47,"NTRK2, SDC2, LCK, NGF, IL6, IL2RG, VEGFA, PDGFB, EGFR, LMO4"
KEGG_TERPENOID_BACKBONE_BIOSYNTHESIS,0.00933122864507363,0.7488795826041168,-0.7564351634995459,-1.6543663886425248,466,14,"HMGCS2, IDI1, HMGCS1, HMGCR, ACAT2, FDPS, MVD, MVK, ACAT1, GGPS1"
KEGG_CYTOKINE_CYTOKINE_RECEPTOR_INTERACTION,0.009410010477955992,0.7488795826041168,0.43906145796226625,1.4487728266192113,466,135,"CCR3, IL7R, CTF1, PRLR, CXCR4, EDA, IL6, CCL26, TNFRSF11B, TNFSF9, TNFRSF6B, CD70, TPO, TNFRSF25, CSF1R, LIF, IL2RG, CX3CL1, CXCL12, CCR2, VEGFA, BMPR1B, PDGFB, ACVR2B, TSLP, AMH, INHBB, EGFR, INHBE, IL3RA"
PID_ANTHRAX_PATHWAY,0.009710871780526304,0.7488795826041168,-0.7549840023744723,-1.6511926173721365,485,14,"CASP1, IL1B, MAP2K6"
KEGG_AMINOACYL_TRNA_BIOSYNTHESIS,0.012064721785094622,0.8457211974599335,0.5813327555236165,1.5870591184263363,597,41,"MARS, GARS, WARS, SARS, CARS, YARS, AARS, IARS, EPRS, TARS, TARSL2, NARS, LARS, MARS2, DARS, VARS, VARS2"
REACTOME_PHASE1_FUNCTIONALIZATION_OF_COMPOUNDS,0.012256828948694688,0.8457211974599335,0.6031082360351374,1.6076171723804602,607,36,"CYP4B1, CYP1B1, ADH7, CYP4F8, CYP26B1, PTGS1, CYP4F3, TBXAS1, CYP2J2, PAOX, CYP27A1, CYP7B1, SMOX, CYP4F11"
KEGG_STEROID_BIOSYNTHESIS,0.013838760493728688,0.9071307503639154,-0.7307107911914053,-1.6239482818582476,693,15,"CEL, DHCR24, FDFT1, HSD17B7, MSMO1, TM7SF2, DHCR7, NSDHL, LSS, SQLE"
REACTOME_FORMATION_OF_TUBULIN_FOLDING_INTERMEDIATES_BY_CCT_TRIC,0.015460421321417173,0.9651720167799006,-0.6974975059234478,-1.6124940902358988,774,18,"TUBB4A, TUBB2B, TUBA1A, TUBB2A, TUBB3, TUBA4A, TUBB6, TUBA1C, TUBB4B"
REACTOME_BIOLOGICAL_OXIDATIONS,0.01783447191826371,1,0.47800165040013,1.4618507648201986,884,80,"CYP4B1, CYP1B1, ADH7, MAT1A, CYP4F8, CYP26B1, PTGS1, UGT1A4, SULT4A1, UGT1A7, CYP4F3, SULT1A3, TBXAS1, CYP2J2, PAOX, GCLC, CYP27A1, GCLM, CYP7B1, SMOX, CYP4F11"
REACTOME_OLFACTORY_SIGNALING_PATHWAY,0.019123553743780348,1,0.937478648364987,1.4808377244528175,956,3,"OR2A7, GNAL"
REACTOME_GLUTAMATE_NEUROTRANSMITTER_RELEASE_CYCLE,0.019926376440460948,1,-0.7524662370491471,-1.589536464357781,995,12,"RAB3A, SLC1A6, SLC1A1"
REACTOME_ION_CHANNEL_TRANSPORT,0.02039294710327456,1,0.5786590488798199,1.5507168267561398,1011,37,"ATP1B2, ATP8A2, ATP2A3, ATP2A1, GABRB1, ATP12A, GABRA3"
NABA_CORE_MATRISOME,0.021178198562978843,1,-0.3979771009892934,-1.3483813415357206,1066,169,"NELL2, VWA5B2, NOV, COL8A2, SMOC1, AEBP1, LTBP1, TNC, EYS, LRG1, TSPEAR, EMILIN3, FMOD, FNDC1, CILP2, SPP1, SSPO, FRAS1, IGFBP7, COL6A3, GAS6, KCP, COL9A2, NTNG2, ECM1, COL9A3, COL28A1, EFEMP2, BMPER, CRELD1, CRISPLD2, WISP2, COL11A2, MFAP5, COL13A1, CTHRC1, RSPO4, CRISPLD1, HAPLN3, MFAP2, VWA5A, COL1A1, SPARC, ABI3BP, COL16A1, COL27A1, COL5A1, FBLN5, LAMA2, COL23A1"
KEGG_JAK_STAT_SIGNALING_PATHWAY,0.02122294175795356,1,0.45419189936605264,1.4255900278333982,1051,95,"CCND2, IL7R, CTF1, PRLR, IL6, TPO, LIF, SPRY3, PIK3R2, IL2RG, STAT4, TSLP, IRF9, AKT3, IL3RA, SPRY4, LEPR, CBL, SOCS2, SOCS5, IL20RB, PIK3R1"
KEGG_PROXIMAL_TUBULE_BICARBONATE_RECLAMATION,0.022175883225728835,1,0.6848182735486158,1.5844148557257447,1105,18,"ATP1B2, SLC4A4, CA2, SLC9A3, PCK2"
REACTOME_BILE_SALT_AND_ORGANIC_ANION_SLC_TRANSPORTERS,0.023202784334120093,1,-0.8504693670766051,-1.541384515125512,1159,6,"SLC47A2, SLC16A7, SLC16A1"
REACTOME_CD28_DEPENDENT_VAV1_PATHWAY,0.023468735007196546,1,0.8110837900434348,1.57155381018027,1173,8,"LCK, VAV1, PAK1"
PID_EPHRINB_REV_PATHWAY,0.02393285949483998,1,0.6422862182156887,1.5656505939099818,1191,23,"PTPN13, LCK, CXCR4, TIAM1, ITGA2B, PIK3R1"
BIOCARTA_CELLCYCLE_PATHWAY,0.024635586073966993,1,0.6408729948573195,1.5622056904890353,1226,23,"CCND2, CDKN2A, CDKN2B, CCNA1"
REACTOME_TRNA_AMINOACYLATION,0.026718327481131694,1,0.5488689060507077,1.5056307057056035,1323,42,"MARS, GARS, WARS, SARS, CARS, YARS, AARS, IARS, EPRS, TARS, NARS, LARS, MARS2, DARS, VARS, VARS2"
REACTOME_POST_CHAPERONIN_TUBULIN_FOLDING_PATHWAY,0.02909265290626811,1,-0.7117313445362581,-1.5565966139077363,1455,14,"TUBB4A, TUBB2B, TUBA1A, TUBB2A, TUBB3, TUBA4A, TUBB6, TUBA1C, TUBB4B, TBCA"
REACTOME_ION_TRANSPORT_BY_P_TYPE_ATPASES,0.03058521313317813,1,0.6002239806183698,1.5245453688922583,1523,28,"ATP1B2, ATP8A2, ATP2A3, ATP2A1, ATP12A"
REACTOME_PREFOLDIN_MEDIATED_TRANSFER_OF_SUBSTRATE_TO_CCT_TRIC,0.030646540580315414,1,-0.6192245677705565,-1.5223255122546249,1540,24,"TUBB4A, TUBB2B, TUBA1A, TUBB2A, TUBB3, PFDN6, TUBA4A, TUBB6, TUBA1C, PFDN5, TUBB4B, PFDN1"
PID_FRA_PATHWAY,0.031110662766064764,1,0.5800577809991546,1.510614375507202,1541,32,"GJA1, CDKN2A, IL6, LIF, MGP, JUNB, ATF4, MMP2, JUND, USF2, LAMA3, ITGB4, HMOX1, PLAUR, FOSL1, SP1"
REACTOME_ACETYLCHOLINE_NEUROTRANSMITTER_RELEASE_CYCLE,0.032205119993595,1,-0.8613441602595302,-1.5034548688188663,1608,5,RAB3A
REACTOME_PECAM1_INTERACTIONS,0.03406364944826483,1,0.793893296845028,1.5382455559450479,1703,8,"LCK, ITGAV, YES1, SRC, PLCG1"
PID_PTP1B_PATHWAY,0.035382538435189105,1,0.5329059179289343,1.468320544530856,1755,43,"LCK, PRLR, CSF1R, TRPV6, PDGFB, EGFR, LEPR, INSR, ITGA2B, FER, PIK3R1, DOK1"
NABA_ECM_GLYCOPROTEINS,0.03597736523379331,1,-0.40950314480368394,-1.337335679585327,1811,126,"NELL2, VWA5B2, NOV, SMOC1, AEBP1, LTBP1, TNC, EYS, LRG1, TSPEAR, EMILIN3, FNDC1, CILP2, SPP1, SSPO, FRAS1, IGFBP7, GAS6, KCP, NTNG2, ECM1, EFEMP2, BMPER, CRELD1, CRISPLD2, WISP2, MFAP5, CTHRC1, RSPO4, CRISPLD1, MFAP2, VWA5A"
REACTOME_THROMBOXANE_SIGNALLING_THROUGH_TP_RECEPTOR,0.03683351252339426,1,-0.667785727994487,-1.524820473548449,1849,17,"TBXA2R, GNG2, GNB3, GNG7"
REACTOME_CD28_CO_STIMULATION,0.036888290929536736,1,0.5957272355441646,1.5010446733976035,1836,27,"LCK, TRIB3, VAV1, PIK3R2, AKT3, PIK3R1, THEM4, MAP3K14, RICTOR"
REACTOME_TRANSPORT_OF_GLUCOSE_AND_OTHER_SUGARS_BILE_SALTS_AND_ORGANIC_ACIDS_METAL_IONS_AND_AMINE_COMPOUNDS,0.037550777766769045,1,-0.49188144612972295,-1.4216842206447327,1894,56,"SLC47A2, SLC44A4, RHCG, SLC2A4, SLC5A3, SLC6A15, SLC16A7, SLC6A11, SLC30A3, SLC2A6, SLC16A1, SLC44A3, SLC18A2, SLC22A15"
REACTOME_G1_PHASE,0.037637334946073984,1,0.5549303574126553,1.4791964671492828,1866,36,"CCND2, CDKN2A, CDKN2B"
REACTOME_NUCLEOTIDE_LIKE_PURINERGIC_RECEPTORS,0.03783664812517508,1,-0.7872549064913495,-1.5182290164462229,1890,8,"P2RY1, ADORA2A"
BIOCARTA_IL7_PATHWAY,0.03902811551679093,1,0.6769785082838502,1.525352594316375,1941,16,"IL7R, LCK, NMI, IL2RG, BCL2, PIK3R1, CREBBP, PTK2B"
REACTOME_GLUCAGON_TYPE_LIGAND_RECEPTORS,0.03916963557112434,1,-0.6747473510590403,-1.5206321137850736,1967,16,"VIPR1, GNG2, GNB3, GNG7, GLP2R"
NABA_ECM_REGULATORS,0.03928613967522929,1,-0.38861858694845175,-1.3029761420749426,1978,155,"PRSS3, SERPINB7, ADAM21, MMP25, ADAMTS17, ADAMTS15, SERPING1, SERPINA1, ADAMTSL3, TLL2, ADAMTS14, ADAMTS8, ADAM22, LOXL4, SERPIND1, SLPI, TIMP4, SERPINF2, LOX, ADAMTSL2, PLAT, HTRA3, TMPRSS15, HYAL3, F10, MMP11, ADAM28, CTSV, ADAMTS7, ADAMTS10, HYAL1, HPSE, CST7, MMP7, HYAL2, MMP24, CTSF, HTRA1, CTSK, LOXL1"
REACTOME_CYTOCHROME_P450_ARRANGED_BY_SUBSTRATE_TYPE,0.03957905750734436,1,0.5975647366969388,1.4931378857696886,1966,26,"CYP4B1, CYP1B1, CYP4F8, CYP26B1, CYP4F3, TBXAS1, CYP2J2, CYP27A1, CYP7B1, CYP4F11"
REACTOME_SLC_MEDIATED_TRANSMEMBRANE_TRANSPORT,0.040300817525200414,1,-0.38065202167541945,-1.2914924316853011,2030,171,"SLC47A2, SLC16A10, SLC4A8, SLC15A2, SLC44A4, RHCG, SLC2A4, SLC7A7, SLC5A3, SLC6A15, SLC16A7, SLC4A3, SLC6A11, SLC1A6, SLC1A2, SLC1A1, SLC8A2, SLCO1A2, SLC5A5, SLC3A1, SLC30A3, SLC29A4, SLC2A6, SLC7A8, SLC29A3, SLC16A1, SLC9A5, SLC44A3"
REACTOME_SHC_MEDIATED_CASCADE,0.041737157414963276,1,-0.6713449958671417,-1.5129644577962298,2096,16,"FGF1, FGFR2, FGFR3"
REACTOME_SYNTHESIS_OF_PE,0.042076491830097956,1,-0.7465756746307646,-1.5139888671259452,2108,10,"PHOSPHO1, PCYT2, LPIN1, LPIN3"
KEGG_GALACTOSE_METABOLISM,0.04525404018125677,1,0.6309854245816461,1.495465358140691,2256,20,"MGAM, GANC, HK2"
REACTOME_PEPTIDE_CHAIN_ELONGATION,0.04612059564174251,1,-0.422242812227425,-1.334657438234961,2325,99,"RPL23AP2, RPS17, RPL3L, RPSAP9, RPL21P16"
REACTOME_SIGNALING_BY_ACTIVATED_POINT_MUTANTS_OF_FGFR1,0.047917042742242816,1,-0.8724233390579691,-1.453964702553333,2388,4,FGF1
REACTOME_FGFR1_LIGAND_BINDING_AND_ACTIVATION,0.047917042742242816,1,-0.8724233390579691,-1.453964702553333,2388,4,FGF1
REACTOME_P130CAS_LINKAGE_TO_MAPK_SIGNALING_FOR_INTEGRINS,0.04907877062491229,1,0.7386647891209356,1.5037048244913365,2447,10,"VWF, TLN1, ITGA2B, FN1"
REACTOME_CD28_DEPENDENT_PI3K_AKT_SIGNALING,0.05008621726751414,1,0.6423151172325199,1.4860783555422763,2497,18,"LCK, TRIB3, PIK3R2, AKT3, PIK3R1, THEM4, MAP3K14, RICTOR"
REACTOME_TRYPTOPHAN_CATABOLISM,0.051631738921772516,1,0.8134101152850731,1.4804555696666861,2581,6,"TDO2, KYNU, AADAT"
BIOCARTA_ALK_PATHWAY,0.05277871403929655,1,-0.5498043232558221,-1.4341227911128807,2661,32,"BMP2, NOG, TGFB3, CHRD, TGFB2, HNF1A, SMAD6, BMP4, BMP7"
PID_RAC1_REG_PATHWAY,0.05313376233030077,1,0.5394906233525569,1.429996195873647,2633,35,"ARHGAP9, RASGRF1, VAV3, ARHGEF6, VAV1, DOCK6, TRIO, TIAM1, ARHGEF2, CHN2, NGEF, CHN1, SPATA13"
KEGG_RIBOFLAVIN_METABOLISM,0.05358962575179332,1,-0.6786679003547051,-1.4842849956936097,2681,14,"ACP5, ACPP, ENPP3"
KEGG_OLFACTORY_TRANSDUCTION,0.053943989728775475,1,0.6134513194954275,1.4685355010739387,2688,21,"CALML3, PRKG1, OR2A7, CAMK2B, CLCA2"
REACTOME_FGFR_LIGAND_BINDING_AND_ACTIVATION,0.05670051672884704,1,-0.7284612938834231,-1.4772545189302058,2841,10,"FGF1, FGFR2, FGFR3"
REACTOME_PROSTACYCLIN_SIGNALLING_THROUGH_PROSTACYCLIN_RECEPTOR,0.056902296442608885,1,-0.6868618572996641,-1.4781229579598125,2851,13,"GNG2, GNB3, GNG7"
REACTOME_ACTIVATED_POINT_MUTANTS_OF_FGFR2,0.05730469766417806,1,-0.8339009903515802,-1.4555534963854604,2862,5,"FGF1, FGFR2"
REACTOME_FGFR2C_LIGAND_BINDING_AND_ACTIVATION,0.05730469766417806,1,-0.8339009903515802,-1.4555534963854604,2862,5,"FGF1, FGFR2"
PID_AR_PATHWAY,0.05761350101944002,1,0.4766693994550376,1.376662691684367,2853,56,"CDKN2A, VAV3, PRKDC, RPS6KA3, AR, CDK11B, CARM1, CTDSP1, KDM4C, NCOA2, CDK6, ZMIZ1, PTK2B, BRCA1, APPL1, SNURF, TGFB1I1, UBE3A, UBE2I"
REACTOME_P75NTR_SIGNALS_VIA_NFKB,0.05955359823841457,1,0.6724096563175489,1.4737668273835167,2974,14,"NGF, RIPK2, SQSTM1, TRAF6"
PID_PLK1_PATHWAY,0.06092549580132214,1,-0.5039835578568935,-1.3888300323648186,3068,43,"SSPO, KIF20A, CCNB1, AURKA, TPX2, NDC80, CDC20, BUB1, CDK1, PPP1CB, CDC14B, CENPE, PRC1, TPT1, ECT2, TUBG1, RAB1A"
REACTOME_PHOSPHOLIPASE_C_MEDIATED_CASCADE,0.06139254320693692,1,-0.5259436617423241,-1.402632585211605,3093,36,"FGF1, PRKCG, ADCY1, FGFR2, PRKAR2B, FGFR3"
PID_AP1_PATHWAY,0.06167107414659749,1,0.4734168019324968,1.367268907091804,3054,56,"GJA1, CDKN2A, IL6, FOSB, TRIP6, AGT, JUNB, ACTA1"
PID_CASPASE_PATHWAY,0.06167567138089941,1,-0.4890823539278385,-1.375060788620786,3104,48,"SATB1, CASP1, PRF1, ARHGDIB, CASP9"
REACTOME_HYALURONAN_METABOLISM,0.06202293889621548,1,-0.708671900480718,-1.4689424680839742,3103,11,"HAS3, HMMR, HYAL1, HYAL2, CD44, ABCC5, HEXB"
KEGG_PROPANOATE_METABOLISM,0.06319080716149204,1,-0.5542786228874003,-1.4160447319430265,3172,29,"ABAT, EHHADH, ALDH7A1, MCEE, ACSS2, HADHA, ACSS1, ACAT2, PCCB, LDHA, ACAT1, HIBCH, ALDH9A1, ACADM, SUCLG1, ALDH6A1, ALDH1B1"
REACTOME_REGULATION_OF_THE_FANCONI_ANEMIA_PATHWAY,0.06540860387014233,1,0.7575267919348605,1.467781912045257,3271,8,"ZBTB32, ATM, ATR, USP1"
REACTOME_APOPTOTIC_EXECUTION_PHASE,0.06604560622914349,1,-0.48571141297289216,-1.3655833484909659,3324,48,"SATB1, HIST1H1D, DSG3, PKP1, HIST1H1B"
REACTOME_NOREPINEPHRINE_NEUROTRANSMITTER_RELEASE_CYCLE,0.06643894448772497,1,-0.7758024128675777,-1.4547258943431796,3325,7,"RAB3A, SLC18A2"
REACTOME_GRB2_SOS_PROVIDES_LINKAGE_TO_MAPK_SIGNALING_FOR_INTERGRINS_,0.06754345516149081,1,0.7193158637841867,1.464316088482656,3368,10,"VWF, TLN1, ITGA2B, FN1"
REACTOME_BETA_DEFENSINS,0.07028236845786455,1,0.8216868826459163,1.4367685940794916,3516,5,"TLR2, CCR2, TLR1"
REACTOME_P75NTR_RECRUITS_SIGNALLING_COMPLEXES,0.07063457155424048,1,0.6856130081458507,1.4536155800571828,3532,12,"NGF, RIPK2, SQSTM1, TRAF6"
REACTOME_CTLA4_INHIBITORY_SIGNALING,0.07097886674419537,1,0.6208408174036585,1.4363948103166955,3539,18,"LCK, AKT3, AKT2, PDPK1, PPP2R5B, YES1, PPP2R5E, AKT1, PPP2CB, SRC, PPP2R1A"
SA_MMP_CYTOKINE_CONNECTION,0.0716829385403329,1,-0.6845033188708237,-1.4459691767512897,3582,12,"ACE, IL1B, TGFB2, CD44, TNFRSF1B"
REACTOME_OXYGEN_DEPENDENT_PROLINE_HYDROXYLATION_OF_HYPOXIA_INDUCIBLE_FACTOR_ALPHA,0.073275429763504707,1,0.648404558643942,1.4413137727903675,3652,15,"HIF3A, VHL, UBE2D2"
BIOCARTA_ARF_PATHWAY,0.0740971482545871,1,0.6373066397933496,1.4359648415548198,3686,16,"CDKN2A, TWIST1, TBX2, POLR1A, PIK3R1, MDM2, ABL1, RB1"
BIOCARTA_CASPASE_PATHWAY,0.07444860259574806,1,-0.5846042093854651,-1.4104453208140142,3739,22,"CASP1, PRF1, ARHGDIB, CASP9"
REACTOME_FRS2_MEDIATED_CASCADE,0.0752540620090289,1,-0.5709825657384762,-1.4037255175546612,3783,24,"FGF1, FGFR2, FGFR3"
KEGG_MAPK_SIGNALING_PATHWAY,0.07650652596500972,1,-0.34728302600617034,-1.2094639329439938,3856,216,"CACNA1C, RASGRP1, FGF1, CACNA2D2, PRKCG, PLA2G4B, PTPRR, CACNG4, RASGRP3, IL1B, CACNA2D4, FGFR2, CACNB4, MAP2K6, MAPK8IP1, DUSP9, TGFB3, DUSP8, FOS, FGFR3, MAPK11, HSPA1L, DUSP10, RASGRF2, MRAS, EGF, PLA2G4A, TGFB2, PLA2G6"
KEGG_LYSOSOME,0.07835939360266687,1,-0.39102463872411475,-1.2621452641004711,3948,115,"ACP5, LAPTM5, CD68, ATP6V0A4, HYAL1, SUMF1, NEU1, FUCA1, NAPSA, GGA3, CTSF, AP4B1, CTSK, GALC, ARSG, LAPTM4A, ARSA, CTSB, SMPD1, GLB1, GM2A, ATP6V0B, NPC1, ABCB9, NPC2, LAMP2, NAGLU, ASAH1, PPT1, SORT1, ATP6V0D1, HEXB, LAMP1, PLA2G15, GBA, ATP6AP1, HGSNAT, CTSA, CLN5, ENTPD4, LIPA, PSAP, CTSZ, AP1M1, TPP1, CD63, GGA2"
PID_S1P_S1P3_PATHWAY,0.08004176790698608,1,0.5512752400340054,1.3890396699307577,3985,27,"CXCR4, GNAZ, VEGFA, PDGFB, AKT3, S1PR2"
PID_AURORA_A_PATHWAY,0.0811932709686389,1,-0.5339094062977567,-1.3739537862149038,4087,30,"CPEB1, CENPA, DLGAP5, AURKA, PRKACA, AURKB, TPX2, BIRC5"
PID_TRKR_PATHWAY,0.08196157735085946,1,0.4528376990087021,1.3184371086826026,4052,59,"NTRK2, NGF, RASGRF1, SHC3, MATK, TIAM1, SQSTM1, PIK3R1, GAB2, RASA1, MCF2L, BDNF, CRKL, KRAS, FRS3, FRS2, ABL1"
KEGG_PRIMARY_BILE_ACID_BIOSYNTHESIS,0.08241373094870921,1,0.7220803598102561,1.4354939355437888,4114,9,"SLC27A5, CYP27A1, CYP7B1"
REACTOME_RETROGRADE_NEUROTROPHIN_SIGNALLING,0.08419409079990392,1,0.6875832135572971,1.42981964040742,4205,11,"NGF, AP2S1"
KEGG_NEUROACTIVE_LIGAND_RECEPTOR_INTERACTION,0.08658637454860901,1,0.39038293530607704,1.2538765601932784,4291,111,"EDNRB, THRB, GRIN2C, PRLR, ADRA2A, LTB4R2, SSTR5, ADRA1D, OPRK1, GRM4, CYSLTR1, GRIN3B, GABBR1, P2RX7, DRD1, GRID1, GPR35, ADRA2C, GIPR, GABRB1, PTGER3, CNR1, PTGER4, NPFFR1, GPR156, HTR6, BDKRB2, HTR7, GABRA3, TACR1, P2RY11, ADRB1, P2RX5"
REACTOME_NEGATIVE_REGULATION_OF_FGFR_SIGNALING,0.08680955978844394,1,-0.5557092390176986,-1.377951722879359,4365,25,"FGF1, FGFR2, FGFR3"
PID_THROMBIN_PAR4_PATHWAY,0.0870094371620678,1,-0.6579429800418752,-1.4158896923637139,4360,13,"GNG2, F2RL2, PLCB2"
PID_INTEGRIN_A9B1_PATHWAY,0.08987597115979948,1,-0.595563697060668,-1.3918447511650778,4499,19,"TNC, KCNJ15, SPP1"
REACTOME_STRIATED_MUSCLE_CONTRACTION,0.09153005464480875,1,0.6125345183349497,1.3984246197930315,4555,17,"DES, DMD, MYH3, TNNI3, TMOD1, TNNT1"
SA_PTEN_PATHWAY,0.09205239472838316,1,0.6120713435633782,1.397367185502482,4581,17,"IPCEF1, AKT3"
REACTOME_XENOBIOTICS,0.09376817698618048,1,-0.8338372171248012,-1.389657780916156,4674,4,"CYP2C18, CYP1A2"
PID_RB_1PATHWAY,0.09411147223287644,1,0.45200871413534444,1.3054404872177001,4661,56,"CCND2, CDKN2A, CEBPA, CEBPB, CBX4, PPARG, PPP2R3B, CDK6, MDM2, TAF1, CREBBP, CDKN1B, ATF7, SKP2, ABL1, BRD2, RB1, MET, DNMT1"
REACTOME_IMMUNOREGULATORY_INTERACTIONS_BETWEEN_A_LYMPHOID_AND_A_NON_LYMPHOID_CELL,0.09522183614854687,1,0.5308281741360603,1.3569900743107983,4740,29,"CD8A, ULBP1, CD19, HLA-F, C3, HLA-G, HLA-K, PVR, HLA-B, HLA-C"
PID_IL1_PATHWAY,0.09578057396895963,1,-0.5104111361616988,-1.3388991436780597,4825,33,"CASP1, IL1B, MAP2K6, TICAM2, IL1A, IL1R1, UBE2V1, TAB1, PRKCZ, UBE2N, MAP3K3, MAPK8"
REACTOME_ENDOGENOUS_STEROLS,0.09678451447768358,1,0.7736195316565844,1.408034302650061,4839,6,"CYP1B1, CYP27A1, CYP7B1"
KEGG_ETHER_LIPID_METABOLISM,0.09688629691026383,1,-0.5903484896672521,-1.3796567029804956,4850,19,"PLA2G4B, PLA2G4A, PLA2G6, PAFAH2, LPCAT1, PLD1"
REACTOME_TRANSPORT_OF_VITAMINS_NUCLEOSIDES_AND_RELATED_MOLECULES,0.09829468483544505,1,-0.5595078245195364,-1.3623909206734166,4933,23,"SLCO1A2, SLC29A4, SLC29A3, SLC35A2, SLC27A1, SLC29A2, SLC35B2"
PID_IL12_STAT4_PATHWAY,0.09842802425789977,1,-0.5813103330735419,-1.373446770123309,4933,20,"PRF1, CD4, FOS, HLA-DRA"
PID_EPHA2_FWD_PATHWAY,0.10073498487973885,1,0.5875834932990379,1.377248286237383,5029,19,"VAV3, TIAM1, CBL, PIK3R1, ARHGAP35, PAK1, EPHA2, INPPL1, VAV2, SRC, RAC1"
REACTOME_CLASS_C_3_METABOTROPIC_GLUTAMATE_PHEROMONE_RECEPTORS,0.1011729912275443,1,0.8636717965719712,1.3642527007311427,5062,3,"GRM4, GABBR1"
REACTOME_TRAFFICKING_OF_GLUR2_CONTAINING_AMPA_RECEPTORS,0.10139601765493,1,-0.7072539796446337,-1.4004072247169315,5076,9,PRKCG
BIOCARTA_ASBCELL_PATHWAY,0.10145913812773964,1,-0.7975276668169337,-1.3920647622808362,5068,5,"CD4, HLA-DRA"
PID_RETINOIC_ACID_PATHWAY,0.10158723836456694,1,-0.5247081407569616,-1.340499466957533,5100,29,"PRKCG, RARB, RBP1, PRKACA, HDAC3, CDK7, CDK1"
KEGG_VEGF_SIGNALING_PATHWAY,0.10340736053157197,1,-0.4359467704064177,-1.2784793678473512,5228,61,"PRKCG, PLA2G4B, SHC2, NOS3, MAPK11, PLA2G4A, CASP9, PIK3CD, PLA2G6"
PID_INTEGRIN_CS_PATHWAY,0.10543009894669646,1,-0.5759462169173525,-1.3607731127149991,5284,20,"ITGB8, ITGAM, ITGAX, ITGAE, ITGA10"
BIOCARTA_SPPA_PATHWAY,0.10592193539342719,1,0.5842999774285085,1.3695519900393236,5288,19,"PLCB1, PTGS1, TBXAS1"
KEGG_ALPHA_LINOLENIC_ACID_METABOLISM,0.10873251800570596,1,-0.6843785337087689,-1.3878586138605455,5449,10,"PLA2G4B, FADS2, PLA2G4A, PLA2G6"
REACTOME_REGULATION_OF_HYPOXIA_INDUCIBLE_FACTOR_HIF_BY_OXYGEN,0.10945273631840796,1,0.566096193281745,1.355172497698496,5455,21,"HIF3A, VEGFA, CREBBP, VHL, UBE2D2"
PID_SYNDECAN_2_PATHWAY,0.10985791121457815,1,0.525432807983693,1.3345787238462734,5473,28,"SDC2, LAMA1, MMP2, ITGA2, FN1, RASA1, LAMA3, BAX, TGFB1, CAV2, EPB41, NF1, MAPK1"
BIOCARTA_MYOSIN_PATHWAY,0.11004237032872147,1,0.5297997692090939,1.334928259259742,5479,27,"PLCB1, ARHGEF6, ARHGEF19, ARHGEF11, MYLK, ARHGEF2, ARHGEF5, ARHGEF16, PRKCA, ARHGEF12, ARHGEF1, ROCK1, PKN1, GNAQ, ARHGEF7"
PID_CIRCADIAN_PATHWAY,0.11010370489238361,1,0.6181084590129,1.373969727968455,5488,15,"PER2, ATR, CLOCK, BHLHE40, CRY2, CSNK1E, NPAS2"
REACTOME_P75_NTR_RECEPTOR_MEDIATED_SIGNALLING,0.1109565567987098,1,0.4144139971405914,1.2547172290935347,5503,75,"NGF, RASGRF1, VAV3, ARHGEF6, MAG, APH1B, VAV1, FGD2, OBSCN, RIPK2, TRIO, TIAM1, ARHGEF11, SQSTM1"
KEGG_GLYCOSPHINGOLIPID_BIOSYNTHESIS_LACTO_AND_NEOLACTO_SERIES,0.11107767613545177,1,0.5649050352836339,1.3523209954651108,5536,21,"B3GNT3, ABO, FUT9, FUT3, B3GALT5, FUT2, B3GNT4, FUT1"
REACTOME_GPVI_MEDIATED_ACTIVATION_CASCADE,0.11221779548472775,1,0.5346092619823064,1.335830737873666,5576,26,"LCK, VAV3, VAV1, PIK3R2, AKT3, PIK3R1"
REACTOME_IL_7_SIGNALING,0.11341446300046111,1,0.6800796173207518,1.3844426005745456,5656,10,"IL7R, PIK3R2, IL2RG, PIK3R1"
PID_RHOA_REG_PATHWAY,0.11545668862963186,1,0.4689901578772225,1.2922128668980695,5729,43,"ARHGAP9, ARHGAP8, VAV3, VAV1, OBSCN, ARHGDIG, TRIO, ARHGEF11, ARHGEF2, ARHGEF5, MCF2L, NGEF, ARHGAP35, SRGAP1, CDKN1B"
KEGG_HYPERTROPHIC_CARDIOMYOPATHY_HCM,0.11552317985668474,1,-0.4322234301514097,-1.2638699028538956,5835,60,"CACNA1C, CACNA2D2, ITGB8, CACNG4, ACE, CACNA2D4, CACNB4, TGFB3, TPM2"
PID_TAP63_PATHWAY,0.11592768407231593,1,0.44495856862440397,1.2769516531841432,5738,54,"CDKN2A, GPX2, GDF15, SHH, CLCA2, S100A2, EGR2, BBC3, DST, DICER1, SPATA18, TRAF4, EVPL, MDM2, VDR, ITGB4, PMAIP1, BAX, CABLES1, ABL1, IGFBP3, ITGA3, SP1"
REACTOME_SIGNALING_BY_FGFR3_MUTANTS,0.11857248653950081,1,-0.7853615274211225,-1.3708290677080073,5923,5,"FGF1, FGFR3"
REACTOME_EXTRACELLULAR_MATRIX_ORGANIZATION,0.1189863902516221,1,-0.4321265649291364,-1.2604999884052404,6014,59,"COL8A2, MMP25, TLL2, ADAMTS14, COL6A3, COL9A2, COL9A3, COL28A1, MMP11, COL11A2, COL13A1, MMP7, MMP24, COL1A1, COL16A1, COL27A1, COL5A1, COL23A1, ADAMTS2, BMP1, COL4A1, COL4A2"
KEGG_CHEMOKINE_SIGNALING_PATHWAY,0.11912093219827326,1,0.36950259211680225,1.2056069391324125,5918,124,"CCR3, PLCB1, CXCR4, SHC4, CCL26, VAV3, VAV1, PIK3R2, CX3CL1, CXCL12, CCR2, ADCY5, ADCY2, SHC3, AKT3, TIAM1"
PID_ALPHA_SYNUCLEIN_PATHWAY,0.119240210873677,1,0.5303071348170254,1.3250809920044784,5925,26,"LCK, KLK6, SNCA"
REACTOME_AMINO_ACID_SYNTHESIS_AND_INTERCONVERSION_TRANSAMINATION,0.12009307363649128,1,0.611083035736295,1.3583531824132697,5986,15,"ASNS, PSAT1, GLUL, PHGDH, GPT2, PSPH, PYCR1"
REACTOME_ADP_SIGNALLING_THROUGH_P2RY12,0.12026162037129355,1,-0.6097477870053402,-1.355117350134787,6030,15,"GNG2, GNB3, GNG7, GNAI1"
REACTOME_REGULATION_OF_WATER_BALANCE_BY_RENAL_AQUAPORINS,0.12064555782461288,1,-0.5000613914312977,-1.3043721339993106,6084,32,"AQP1, ADCY1, GNG2, PRKAR2B, GNB3, GNG7, AQP3, PRKACA"
PID_CDC42_REG_PATHWAY,0.122336259013035,1,0.5136813169752351,1.313156464667274,6090,29,"VAV3, ARHGEF6, DOCK10, DOCK6, MCF2L, NGEF, SPATA13, BCAR3, FGD1, ARHGDIA"
KEGG_SELENOAMINO_ACID_METABOLISM,0.12420535929830208,1,0.5318869041767604,1.3187854840369384,6173,25,"MAT1A, CBS, MARS, CTH, MARS2, METTL6, GGT5"
REACTOME_NRIF_SIGNALS_CELL_DEATH_FROM_THE_NUCLEUS,0.1248871682747277,1,0.6078559847045113,1.3511798937070112,6225,15,"NGF, APH1B, SQSTM1"
BIOCARTA_CDK5_PATHWAY,0.12531027304027545,1,0.6554901189190057,1.3630825006249063,6259,11,"NGF, MAPK1"
KEGG_COMPLEMENT_AND_COAGULATION_CASCADES,0.12696111530365015,1,-0.4760719012259438,-1.2819591174606526,6392,38,"CFH, C2, SERPING1, SERPINA1, SERPIND1, SERPINF2, PLAT, C1R, C3AR1, F10, PROC"
REACTOME_GAP_JUNCTION_DEGRADATION,0.12716774594518734,1,0.6704184382081917,1.3647752739931331,6342,10,"GJA1, CLTC"
BIOCARTA_TRKA_PATHWAY,0.12857114216403698,1,0.669535121211713,1.3629770997079598,6412,10,"NGF, PIK3R1, PRKCA"
KEGG_CELL_ADHESION_MOLECULES_CAMS,0.12927434485262967,1,0.38687865434694396,1.214311290862776,6407,95,"SDC2, HLA-DMB, PDCD1, HLA-DOB, PTPRM, CD8A, NLGN3, CNTN1, MAG, NRCAM, PDCD1LG2, NCAM1, HLA-F, JAM3, NCAM2, HLA-DQB1, CLDN16, CLDN8, HLA-G"
REACTOME_TRANSMEMBRANE_TRANSPORT_OF_SMALL_MOLECULES,0.1295973712340156,1,-0.31701385479861316,-1.1393673760044094,6546,297,"SLC47A2, SLC16A10, SLC4A8, SLC15A2, SLC44A4, RHCG, SLC2A4, AQP1, SLC7A7, SLC5A3, SLC6A15, SLC16A7, ABCB1, SLC4A3, SLC6A11, SLC1A6, SLC1A2, SLC1A1, ADCY1, SLC8A2, SLCO1A2, SLC5A5, ATP6V1G2, SLC3A1, SLC30A3, GNG2, PRKAR2B, GNB3, GNG7, SLC29A4, ATP6V0A4, SLC2A6, ATP1A3, SLC7A8, SLC29A3, SLC16A1, ATP2C2, SLC9A5, ABCB5, SLC44A3"
REACTOME_SIGNALING_BY_SCF_KIT,0.13043390555342627,1,0.41111190556175603,1.235040146133036,6465,71,"LCK, TRIB3, VAV1, PIK3R2, SH2B3, AKT3, CBL, FER, PIK3R1, FOXO3, KITLG, GAB2, SH2B2, MDM2, GRB10, THEM4, CDKN1B, PRKCA, KRAS, RICTOR, FES, STAT1"
KEGG_FOCAL_ADHESION,0.13053978988044923,1,0.34729160681614146,1.174205088382526,6485,165,"CCND2, VWF, SHC4, COL4A4, RASGRF1, LAMA1, VAV3, THBS4, COL5A3, VAV1, PIK3R2, MYL5, CHAD, MAPK10, VEGFA, PDGFB, TNXB, PGF, SHC3, LAMA5, BCL2, EGFR, AKT3, FLNB, LAMC3, COL6A2, TLN1, ITGA2B, LAMC1, LAMC2, MYLK, VASP, ITGA2"
REACTOME_PLATELET_AGGREGATION_PLUG_FORMATION,0.13057382489591504,1,0.5333138078172696,1.3112945479874094,6491,24,"RAPGEF4, VWF, ADRA2A, TLN1, ITGA2B"
KEGG_PRIMARY_IMMUNODEFICIENCY,0.13232225966939495,1,0.5505959189911743,1.318066532891363,6595,21,"IL7R, LCK, CD8A, CD19, IL2RG, CIITA, TAP2"
