pathway,pval,padj,ES,NES,nMoreExtreme,size,leadingEdge
KEGG_BASAL_CELL_CARCINOMA,0.28232095727581213,1,-0.3937296145643786,-1.1115170902329514,14226,49,"WNT8B, WNT10A, BMP2, WNT4"
SIG_PIP3_SIGNALING_IN_B_LYMPHOCYTES,0.28235650156360337,1,0.4333217709707299,1.1284773998223083,13994,32,"CDKN2A, CD19, VAV1, AKT3, RPS6KA3, ITPR3, FOXO3, ITPR2"
REACTOME_TRIGLYCERIDE_BIOSYNTHESIS,0.28279999205450607,1,-0.4273561930318953,-1.1274772435613059,14236,34,"ELOVL3, ELOVL7, GPD1, ACSL5, LPCAT1, LCLAT1, DGAT2, LPIN1, GPD1L, LPIN3, ACLY, ACSL3"
PID_MYC_PATHWAY,0.28341277982260304,1,0.4637524520518445,1.140259361519731,14090,24,"CDKN2A, TRRAP, AXIN1, MAX"
BIOCARTA_BARRESTIN_PATHWAY,0.28385171536720677,1,0.5962216707991675,1.1852871789739459,14172,9,"PLCB1, PPARA, GNAS"
BIOCARTA_CDMAC_PATHWAY,0.28465619057151437,1,0.5309796690238058,1.1637849261534183,14219,14,"PLCB1, CUZD1, PRKCA, NFKB1, MAPK1"
BIOCARTA_ERK5_PATHWAY,0.2849377168876497,1,0.521682673724525,1.1596285261130568,14204,15,"MEF2A, PIK3R1, MAPK1, CREB1, AKT1, MEF2D, MEF2C, PLCG1, HRAS, PIK3CA"
BIOCARTA_FEEDER_PATHWAY,0.28523422810737287,1,-0.6609194870828259,-1.1978456868304845,14259,6,"KHK, MPI"
PID_ENDOTHELIN_PATHWAY,0.28726002785796473,1,0.3824327817366495,1.1044991419542063,14229,56,"EDNRB, PLCB1, SLC9A3, CYSLTR1, GNAZ, ADCY5, ADCY2"
REACTOME_NOD1_2_SIGNALING_PATHWAY,0.2879533188616494,1,-0.44200571946895456,-1.1292152442794996,14458,29,"CASP1, NOD2, MAP2K6, MAPK11, CASP9"
KEGG_PATHOGENIC_ESCHERICHIA_COLI_INFECTION,0.2891274581787153,1,-0.39207966026458396,-1.1068591921869684,14569,49,"TUBB4A, TLR5, TUBB2B, TUBA1A, TUBB2A, TUBB3, YWHAQ, CTNNB1, TUBA4A, TUBB6, WAS, CDH1, ARPC3, TUBA1C, TUBB4B, KRT18, CDC42, NCK1, ACTG1"
REACTOME_GASTRIN_CREB_SIGNALLING_PATHWAY_VIA_PKC_AND_MAPK,0.2911651372502284,1,-0.3332801186464827,-1.078043537505215,14658,117,"P2RY1, RASGRP1, GPR132, CHRM1, KALRN, TBXA2R, KISS1, GNG2, F2RL2, TACR2, CCKBR, EDNRA, PLCB2, GNB3, SAA1, PTAFR, GNG7"
KEGG_TYPE_I_DIABETES_MELLITUS,0.29192509541984735,1,-0.45216385783897306,-1.13065603903896,14684,26,"HLA-DPA1, CPE, PRF1, IL1B, HLA-DMA, HLA-DRB5, GAD1, HLA-DRA"
BIOCARTA_BARR_MAPK_PATHWAY,0.29325806709904717,1,0.5616795735168487,1.1680047883587987,14649,11,"PLCB1, MAPK1"
REACTOME_PROLACTIN_RECEPTOR_SIGNALING,0.2934301008440426,1,0.5759132689397687,1.1723904723060015,14635,10,"PRLR, JAK2"
BIOCARTA_IL2_PATHWAY,0.29409408607534093,1,0.4865814701907695,1.1405076956340714,14684,19,"LCK, IL2RG"
REACTOME_NEUROTRANSMITTER_RELEASE_CYCLE,0.29636117525280675,1,-0.46966989807908055,-1.1331490595478158,14887,22,"RAB3A, ABAT, SLC6A11, SLC1A6, SLC1A1, GAD1"
REACTOME_HDL_MEDIATED_LIPID_TRANSPORT,0.2963890168432437,1,0.5899094071028642,1.1727384146536177,14798,9,"CUBN, ABCA1, LCAT, PLTP, APOE"
REACTOME_DOPAMINE_NEUROTRANSMITTER_RELEASE_CYCLE,0.29787701903086516,1,0.6069725407775783,1.176068392493358,14900,8,"SYN1, SYN2"
KEGG_DORSO_VENTRAL_AXIS_FORMATION,0.2990883032088542,1,-0.46870697295249486,-1.130825858282271,15024,22,"CPEB1, FMN2"
PID_MAPK_TRK_PATHWAY,0.30244512364545706,1,-0.42367624831420875,-1.1113781143774233,15238,33,"TRPV1, MAP2K6, FOS"
REACTOME_CLASS_A1_RHODOPSIN_LIKE_RECEPTORS,0.302893380895759,1,-0.3347836989324842,-1.0728645968452117,15283,109,"P2RY1, HCAR2, PTGER2, GPR132, CHRM1, ADORA2A, NPY1R, CCR7, TBXA2R, KISS1, RLN2, CXCR6, OPRL1, F2RL2, C3AR1, TACR2, CCKBR, EDNRA, GPR55, SAA1, PTAFR, FPR1, ADRB2, CCK, S1PR5"
PID_CXCR4_PATHWAY,0.3030596202684726,1,0.35146087667263654,1.081077204206452,15035,83,"PLCB1, LCK, CXCR4, VAV1, GNAZ, PIK3R2, CXCL12"
REACTOME_MUSCLE_CONTRACTION,0.30482102547565304,1,0.42226951417213265,1.1068584859816974,15123,33,"DES, DMD, MYH3, TNNI3, TLN1, MYLK, TMOD1, TNNT1"
REACTOME_TRANSPORT_OF_INORGANIC_CATIONS_ANIONS_AND_AMINO_ACIDS_OLIGOPEPTIDES,0.3059024061521386,1,-0.364332266901221,-1.084866463558904,15433,67,"SLC16A10, SLC4A8, SLC15A2, SLC7A7, SLC6A15, SLC4A3, SLC1A6, SLC1A2, SLC1A1, SLC8A2, SLC5A5, SLC3A1"
PID_NECTIN_PATHWAY,0.30896435181459725,1,0.4504428724603654,1.1168493093622345,15357,25,"PTPRM, PDGFB, TLN1, PIK3R1, PVR"
BIOCARTA_TH1TH2_PATHWAY,0.3102993748876595,1,-0.5854253677703816,-1.15917893451818,15536,9,"HLA-DRA, IFNGR1"
BIOCARTA_THELPER_PATHWAY,0.31062839721603785,1,-0.7076997724184573,-1.1794394338561967,15486,4,"CD4, THY1"
BIOCARTA_STEM_PATHWAY,0.3114501679731243,1,0.644140001756672,1.1723737329127777,15574,6,"IL6, CD8A, IL11"
REACTOME_NUCLEAR_RECEPTOR_TRANSCRIPTION_PATHWAY,0.31165404447309053,1,0.40769736475121754,1.0983640925520568,15472,38,"THRB, NR1I3, HNF4G, NR3C2, RORC, PPARG, NR0B1, AR"
KEGG_CITRATE_CYCLE_TCA_CYCLE,0.31197318776591476,1,0.4369320612802359,1.1097902983800667,15544,28,"OGDHL, PCK2, IDH3G"
REACTOME_VOLTAGE_GATED_POTASSIUM_CHANNELS,0.3121819338422392,1,-0.44525249765228236,-1.1133738724137845,15703,26,"KCND3, KCNS3, KCNH2, KCNH4, KCNQ4, KCNF1, KCNC3"
REACTOME_ACTIVATION_OF_RAC,0.3122399167733675,1,-0.5415537187705052,-1.1439973529842944,15606,12,ROBO1
PID_ATM_PATHWAY,0.31290101287276545,1,0.4261355058960355,1.1030326830212234,15507,31,"ATM, TOP3A, BLM, SMC1A, TRIM28, MDM2, RBBP8, BRCA1, SMC3, RAD50, TP53BP1, ABL1, RNF8, NBN, DCLRE1C"
REACTOME_GAMMA_CARBOXYLATION_TRANSPORT_AND_AMINO_TERMINAL_CLEAVAGE_OF_PROTEINS,0.3129581910069715,1,-0.6220779779700485,-1.1664734832529358,15666,7,"F10, PROC"
REACTOME_RIP_MEDIATED_NFKB_ACTIVATION_VIA_DAI,0.31440434878542917,1,0.5086705966971112,1.1307044761781775,15673,15,"RIPK3, AGER, NFKB2, TLR3, NFKBIB"
REACTOME_SYNTHESIS_OF_SUBSTRATES_IN_N_GLYCAN_BIOSYTHESIS,0.31574320139069273,1,-0.5181756539182649,-1.1332793960678342,15801,14,"GMPPA, MPI, DPM2, DOLK, PGM3, GMPPB, GFPT2, DPM1, PMM1"
REACTOME_REGULATION_OF_INSULIN_SECRETION_BY_ACETYLCHOLINE,0.3160283064129218,1,0.5976893648570953,1.1580813353390933,15808,8,"PLCB1, PRKCA"
REACTOME_CA_DEPENDENT_EVENTS,0.31605115048823657,1,-0.45276543819240556,-1.113095980847511,15891,24,"PRKCG, ADCY1, PRKAR2B, PLA2G4A"
REACTOME_RAP1_SIGNALLING,0.3163447102392153,1,0.5168173625995693,1.1327444180179682,15802,14,"RAPGEF4, PRKG1, RAP1GAP"
KEGG_TRYPTOPHAN_METABOLISM,0.31657704469014963,1,0.4288426402381471,1.1029478869783267,15718,30,"CYP1B1, DDC, OGDHL, WARS, TDO2, KYNU, AADAT"
REACTOME_RESPIRATORY_ELECTRON_TRANSPORT_ATP_SYNTHESIS_BY_CHEMIOSMOTIC_COUPLING_AND_HEAT_PRODUCTION_BY_UNCOUPLING_PROTEINS_,0.317302541515386,1,-0.3641877776730115,-1.0789489255787037,15992,65,"UQCRFS1, UQCRHL, NDUFA2, UQCRC2, COX8A, COX7C, SDHC, NDUFA8, NDUFB3, COX7B, NDUFB4, UQCRB, NDUFAB1, NDUFA1, NDUFB6, COX6B1, ETFA, SDHD, NDUFS3, COX6C, NDUFB1, NDUFA12, NDUFB5, COX5A, UQCRH, NDUFV2, COX5B, NDUFB2, NDUFA4, NDUFA10, ETFB"
REACTOME_BASIGIN_INTERACTIONS,0.31788771450387815,1,0.4598468110249723,1.1115734285769074,15819,22,"ATP1B2, MAG, SLC7A11, SLC7A5, SLC3A2"
REACTOME_PROTEIN_FOLDING,0.3180743947729033,1,-0.38811511130648835,-1.0874149683338723,16015,47,"TUBB4A, TUBB2B, TUBA1A, TUBB2A, TUBB3, PFDN6, TUBA4A, TUBB6, TUBA1C, PFDN5, TUBB4B, TBCA, PFDN1"
BIOCARTA_VITCB_PATHWAY,0.32058240371712965,1,0.5780161281394451,1.1490946060473224,16006,9,"COL4A4, SLC2A1"
SA_TRKA_RECEPTOR,0.32084648003376276,1,0.4982330609506457,1.1226074133753794,15964,16,"NGF, AKT3"
KEGG_MELANOGENESIS,0.32113167866992043,1,-0.3449128995914405,-1.0693712184031625,16185,87,"WNT8B, TYRP1, WNT10A, PRKCG, WNT4, ADCY1, WNT3A, PLCB2, WNT7B, WNT10B"
PID_NCADHERIN_PATHWAY,0.3212145667305558,1,0.42091244627927105,1.0961604395412745,15920,32,"GJA1, CNR1, AXIN1, FER, PIK3R1, DAGLA"
REACTOME_ACTIVATION_OF_CHAPERONE_GENES_BY_ATF6_ALPHA,0.32152370270973946,1,0.577463597357881,1.1479961762460396,16053,9,"DDIT3, ATF4, XBP1, ATF6, NFYA, NFYB, HSPA5"
KEGG_SNARE_INTERACTIONS_IN_VESICULAR_TRANSPORT,0.3219972634793472,1,-0.4127824666675699,-1.0951870919812774,16237,35,"STX19, STX3, GOSR2, VAMP5, VAMP8, SNAP23, VAMP4, TSNARE1, STX7, STX12"
SA_G1_AND_S_PHASES,0.32220998899009107,1,0.5141896589089702,1.1269850977955211,16095,14,"CDKN2A, NXT1, MDM2, CDKN1B"
REACTOME_TRAF6_MEDIATED_IRF7_ACTIVATION,0.3222532607166543,1,0.49758255878511387,1.1211417166750253,16034,16,"IFIH1, DDX58, CREBBP, TANK, TRAF6, TBK1, IRF7, IRF1, IRF2, EP300"
BIOCARTA_GH_PATHWAY,0.3228128791042698,1,-0.45032577738027646,-1.1070982248009062,16231,24,"SLC2A4, HNF1A, STAT5A, SOCS1"
BIOCARTA_NGF_PATHWAY,0.3242727418836387,1,0.48939809768387915,1.117302500014818,16140,17,"NGF, PIK3R1"
KEGG_PANCREATIC_CANCER,0.3245136029708565,1,0.3605789395197447,1.0730236607782926,16078,67,"CDKN2A, ARHGEF6, PIK3R2, MAPK10, VEGFA, PGF, EGFR, AKT3"
KEGG_CALCIUM_SIGNALING_PATHWAY,0.3247197568878424,1,0.3240826208000107,1.0574114088087456,16134,124,"CACNA1B, EDNRB, PLCB1, GRIN2C, CALML3, LTB4R2, ADRA1D, CYSLTR1, ATP2A3, CAMK2B, P2RX7, DRD1, ATP2A1, PTGER3, HTR6, BDKRB2, ADCY2, HTR7, TACR1, EGFR, ADRB1, P2RX5, RYR1, RYR2, PLCD4, SLC8A1, SPHK2"
KEGG_GLYCOSAMINOGLYCAN_DEGRADATION,0.32484838812639644,1,-0.4828149943398666,-1.1161851023676064,16283,18,"HS3ST3B1, HYAL3, HYAL1, HPSE, HYAL2, GLB1, NAGLU, HEXB, HGSNAT"
REACTOME_SYNTHESIS_OF_PA,0.32536706032556656,1,-0.4826143442494202,-1.1157212339203326,16309,18,"PLA2G4A, GPD1, LPCAT1, LCLAT1, GPD1L, PLD1"
BIOCARTA_TID_PATHWAY,0.32648264223722273,1,0.4884943191221762,1.115239161290721,16250,17,"USH1C, WT1, HSPA1A, TNFRSF1A, NFKB1, RB1, JAK2"
PID_IL2_PI3K_PATHWAY,0.32803357410919654,1,0.4215399542684003,1.0911373033317644,16257,31,"LCK, IL2RG, BCL2, TERT, PIK3R1, FOXO3, GAB2"
PID_CMYB_PATHWAY,0.3287378562502519,1,0.3606477681002979,1.0707428312417586,16309,66,"CDKN2A, CEBPA, CSF1R, CEBPB, GATA3, CCNA1, CBX4, BCL2, HIPK2, NCOR1, ZFHX3, KITLG, TRIM28, CDK6, CREBBP, CDKN1B, MAD1L1, KRAS, PPP3CA, UBE2I"
KEGG_LEISHMANIA_INFECTION,0.32939661151292976,1,-0.37174163786525827,-1.0744443094328182,16622,56,"HLA-DPA1, IL1B, ITGAM, TGFB3, HLA-DMA, HLA-DRB5, FOS, MAPK11, HLA-DRA, IFNGR1, TGFB2, NCF2, IL1A, NCF1"
REACTOME_IL_2_SIGNALING,0.3305788455336988,1,0.4147589804798558,1.0871717748350354,16401,33,"LCK, PIK3R2, IL2RG, IL3RA, PIK3R1, GAB2, PTK2B, KRAS"
BIOCARTA_CYTOKINE_PATHWAY,0.3310885074239124,1,0.6637442458238614,1.1605964596025444,16567,5,"IL6, IL18"
BIOCARTA_TCYTOTOXIC_PATHWAY,0.33253564662478813,1,0.6954963324559161,1.1623537220756714,16674,4,"CD8A, ICAM1"
REACTOME_SEROTONIN_RECEPTORS,0.33263535746335626,1,0.6954004145053966,1.162193418445591,16679,4,"HTR6, HTR7"
REACTOME_ROLE_OF_SECOND_MESSENGERS_IN_NETRIN1_SIGNALING,0.33295224341617025,1,-0.6961025066806525,-1.1601116439244112,16599,4,"TRPC4, PITPNA"
BIOCARTA_FREE_PATHWAY,0.3332932860775715,1,0.6093478569660198,1.1455807903366153,16644,7,"XDH, GSR, NFKB1"
REACTOME_PHOSPHORYLATION_OF_CD3_AND_TCR_ZETA_CHAINS,0.33372610892532606,1,-0.5741433137837719,-1.1368397602367808,16709,9,"HLA-DPA1, CD4, HLA-DRB5"
REACTOME_REGULATION_OF_SIGNALING_BY_CBL,0.3362664738026358,1,0.48464677419355084,1.1064551639927804,16737,17,"VAV1, PIK3R2, CBL, PIK3R1, CRKL, PIK3R3, RAPGEF1"
BIOCARTA_EGFR_SMRTE_PATHWAY,0.3364961165825927,1,0.5412702867817973,1.1255639630956158,16809,11,"THRB, EGFR, NCOR2"
PID_LYSOPHOSPHOLIPID_PATHWAY,0.33734136286476435,1,0.36542026226214297,1.067012730337319,16692,60,"IL6, PRKD1, GNAZ, ADCY5, TRIP6, ADCY2, EGFR, TIAM1, MMP2, ADCY7, PIK3R1"
REACTOME_IL_6_SIGNALING,0.33948154533972213,1,0.5527873125986427,1.1253128091585385,16932,10,"IL6, CBL, STAT1, JAK2"
PID_P53_REGULATION_PATHWAY,0.34073520802632373,1,0.3688697817506881,1.065328018132674,16878,56,"CDKN2A, HUWE1, HIPK2, DYRK2, ATM, ATR, E4F1, TTC5, TRIM28, MDM2, MDM4, CREBBP, DAXX, SKP2, ABL1, PPP1R13L, CSNK1G1, FBXO11, CSNK1A1"
PID_GMCSF_PATHWAY,0.3409203560877927,1,-0.4151718208875109,-1.0829441409931824,17194,32,"IRF8, FOS, CCL2, PRKACA, STAT5A"
BIOCARTA_SHH_PATHWAY,0.34150402182416306,1,0.49780172150644053,1.1065444678959786,17024,15,"SHH, GLI1, GLI2, DYRK1A, PRKACB, PRKAR2A, PRKAR1B"
REACTOME_APOPTOTIC_CLEAVAGE_OF_CELL_ADHESION_PROTEINS,0.34186548375494547,1,-0.5403365205161106,-1.1200151459433214,17108,11,"DSG3, PKP1"
KEGG_BETA_ALANINE_METABOLISM,0.3425231407596553,1,-0.4759398218330906,-1.1002908877756115,17169,18,"ABAT, GAD1, EHHADH, ALDH7A1, HADHA"
BIOCARTA_PAR1_PATHWAY,0.3426611520225966,1,0.41468053812733774,1.0799310045616501,16983,32,"PLCB1, ARHGEF6, ARHGEF19, ARHGEF11, PIK3R1, ARHGEF2, ARHGEF5, ARHGEF16, PTK2B, PRKCA, ARHGEF12, ARHGEF1, ROCK1"
REACTOME_TCA_CYCLE_AND_RESPIRATORY_ELECTRON_TRANSPORT,0.3437939574046558,1,-0.3325564593467512,-1.0528917756823475,17352,100,"SLC16A1, PDK4, UQCRFS1, UQCRHL, PDK2, NDUFA2, UQCRC2, COX8A, COX7C, NNT, SDHC, NDUFA8, NDUFB3, COX7B, NDUFB4, IDH2, LDHA, UQCRB, NDUFAB1, NDUFA1, NDUFB6, COX6B1, ADHFE1, ETFA, SDHD, NDUFS3, COX6C, NDUFB1, SUCLG1, NDUFA12, NDUFB5, DLST, COX5A, UQCRH, PDHA1, IDH3B, NDUFV2, COX5B, FH, PDP1, NDUFB2, NDUFA4, PDK3, SUCLG2, NDUFA10, ETFB"
REACTOME_IONOTROPIC_ACTIVITY_OF_KAINATE_RECEPTORS,0.34388046583168536,1,-0.6068643043860813,-1.1379459554396658,17214,7,"NCALD, CALM2, CALM3, DLG3"
REACTOME_A_TETRASACCHARIDE_LINKER_SEQUENCE_IS_REQUIRED_FOR_GAG_SYNTHESIS,0.35146485552385165,1,0.44811051166059246,1.0832036362667454,17490,22,"SDC2, B3GAT2, GPC5, HSPG2, CSPG4, BGN, GPC1"
KEGG_TASTE_TRANSDUCTION,0.3516549769890874,1,0.4857043865049944,1.0943780887584649,17497,16,"CACNA1B, GRM4, KCNB1, ITPR3"
BIOCARTA_DREAM_PATHWAY,0.35302567785957983,1,-0.5122294123618336,-1.102314892154458,17693,13,"KCNIP3, PRKAR2B, FOS, CREM"
PID_ARF6_TRAFFICKING_PATHWAY,0.35379490839876276,1,-0.38988344659600177,-1.0653998449047173,17843,41,"CPE, SLC2A4, ACAP1, ADRB2, ITGA10, PLD1, CTNNB1, MAPK8IP3, ITGA1, NME1, EXOC7, CDH1, ASAP2"
REACTOME_PROSTANOID_LIGAND_RECEPTORS,0.35477672584616,1,-0.6525057873781899,-1.1389326685289654,17724,5,"PTGER2, TBXA2R"
KEGG_METABOLISM_OF_XENOBIOTICS_BY_CYTOCHROME_P450,0.3574967773122784,1,0.39510477322877985,1.064438804933725,17748,38,"CYP1B1, ADH7, GSTT2, UGT1A4, UGT1A7, AKR1C2, ALDH3A1"
KEGG_HEMATOPOIETIC_CELL_LINEAGE,0.3584475806451613,1,0.37299858912635864,1.0565861274475965,17778,50,"IL7R, IL6, CD8A, CD19, TPO, CSF1R, CD37, MME, CD1D"
KEGG_TAURINE_AND_HYPOTAURINE_METABOLISM,0.3586424562034318,1,-0.5991792016897122,-1.123535433240113,17953,7,"GAD1, GGT1"
BIOCARTA_TOB1_PATHWAY,0.3589170640225046,1,-0.5465401083011379,-1.108334583516892,17989,10,"TGFB3, TGFB2"
BIOCARTA_PTC1_PATHWAY,0.36019697333653616,1,0.5300777640085194,1.1022892691074582,17993,11,"SHH, CDC25B"
KEGG_TYROSINE_METABOLISM,0.36159958576464263,1,-0.4184658576846426,-1.0690767220743713,18156,29,"TYRP1, HGD, AOX1, IL4I1, HPD"
REACTOME_SEMAPHORIN_INTERACTIONS,0.3616220818565234,1,-0.35770641502263323,-1.051917927939752,18262,62,"TREM2, SEMA4A, CD72, SEMA3A, RND1, MYL9, PLXNC1, PLXNB1, RAC2, RHOB, CDK5, ITGA1, LIMK2, MYL6"
REACTOME_ACTIVATION_OF_CHAPERONES_BY_ATF6_ALPHA,0.3618984706541757,1,0.5292666493111965,1.1006025674806756,18078,11,"DDIT3, ATF4, XBP1, ATF6, NFYA, NFYB, HSPA5"
REACTOME_NITRIC_OXIDE_STIMULATES_GUANYLATE_CYCLASE,0.3634138088888004,1,-0.48211086726577673,-1.0865004005105992,18258,16,"PDE6G, PDE11A, GUCY1A2, NOS1, NOS3"
REACTOME_REGULATED_PROTEOLYSIS_OF_P75NTR,0.36724874195553237,1,0.5400998010964578,1.0994847576017164,18317,10,"APH1B, TRAF6, ADAM17"
REACTOME_SIGNALING_BY_ERBB4,0.36845817463676117,1,0.34092838307138174,1.0426458091193183,18283,80,"BTC, PRLR, TRIB3, APH1B, CXCL12, EGFR, AKT3, NCOR1, PIK3R1, FOXO3, MDM2, NEDD4, EREG, NRG4, THEM4, CDKN1B, KRAS, RICTOR"
PID_SYNDECAN_3_PATHWAY,0.3700467831580631,1,0.514219811903239,1.0902330050272484,18508,12,"APH1B, EGFR"
PID_FGF_PATHWAY,0.3729285061399674,1,-0.3778892176937707,-1.0502889122679182,18767,45,"FGF1, SPP1, FGFR2, FOS, FGFR3"
REACTOME_AMINE_COMPOUND_SLC_TRANSPORTERS,0.37399493226392133,1,-0.50362183454599,-1.0837914318009547,18744,13,"SLC44A4, RHCG, SLC6A15, SLC6A11"
REACTOME_SIGNALLING_BY_NGF,0.37438800797856264,1,0.2977452952331742,1.0275947548699729,18581,198,"NTRK2, NGF, RASGRF1, TRIB3, VAV3, ARHGEF6, MAG, APH1B, VAV1, PIK3R2, FGD2, OBSCN, ADCY5, ADCY2, SHC3, AKT3, RIPK2, TRIO, TIAM1, ARHGEF11, SQSTM1, PCSK6, MEF2A, RPS6KA3, IRS2, ITPR3, ADCY7, RPS6KA5, PIK3R1, ARHGEF2, FOXO3, MDM2, ITPR2, NGEF, MAP2K5, PRKACB, THEM4, ARHGEF16, CDKN1B, PRKAR2A, AP2S1, PRKCA, PRKAR1B, TRAF6, KRAS, RICTOR, SMPD2, FGD1, IRS1, FRS2, ARHGEF12, ARHGEF1"
REACTOME_MEIOTIC_SYNAPSIS,0.3761072492552135,1,-0.38634611848884076,-1.0501344164112272,18936,40,"SYCP2, HIST2H2AC, SMC1B, HIST1H4J, HIST1H2BD"
BIOCARTA_MPR_PATHWAY,0.3761147192595682,1,-0.4106149599857031,-1.0566698625163524,18936,30,"ADCY1, PRKAR2B, PAQR7, CCNB1, GNAI1, CDK1"
KEGG_ACUTE_MYELOID_LEUKEMIA,0.37660110943015634,1,0.36435720529597315,1.0422949062174578,18669,53,"CEBPA, EIF4EBP1, PIK3R2, CCNA1, AKT3, PIK3R1"
REACTOME_ABACAVIR_TRANSPORT_AND_METABOLISM,0.3778253390406849,1,-0.6141547206974309,-1.1130895632705198,18888,6,ABCB1
REACTOME_PTM_GAMMA_CARBOXYLATION_HYPUSINE_FORMATION_AND_ARYLSULFATASE_ACTIVATION,0.3780122885413342,1,-0.4516369338045639,-1.0670708100483717,18948,20,"F10, PROC, SUMF1, ARSG, ARSA"
REACTOME_POTASSIUM_CHANNELS,0.3799005739228842,1,0.3561289783695857,1.0398825484115428,18798,60,"KCNAB1, KCNH1, KCNK2, KCNJ4, KCNJ11, KCNV1, GABBR1, KCNG1, KCNMB3, HCN2, KCNN1, KCNB2, KCNA7, KCNS1, KCNK1, KCNK7, KCNB1, KCNAB2, KCNJ12"
PID_KIT_PATHWAY,0.38003184905964643,1,0.3694231825463373,1.0424904474137209,18852,49,"VAV1, SH2B3, MAP4K1, MATK, BCL2, CBL, FER, PIK3R1, FOXO3, DOK1, KITLG, SH2B2, EPOR, GRB10, CRKL, CREBBP, SPRED1, STAT1"
REACTOME_TRANSMISSION_ACROSS_CHEMICAL_SYNAPSES,0.3808757180052869,1,-0.3157068087608116,-1.0298561858860238,19162,125,"PRKCG, RAB3A, CACNG4, ABAT, KCNJ15, SLC6A11, SLC1A6, SLC1A2, SLC1A1, ADCY1, CACNB4, NCALD, GNG2, GRIN2A, PLCB2, GAD1, GNB3, GNG7, RASGRF2, KCNJ2, GRIN1, CACNB3, MYO6, SLC18A2, COMT, AKAP5, SLC1A3"
REACTOME_SYNTHESIS_OF_BILE_ACIDS_AND_BILE_SALTS,0.382256385619345,1,0.5203145874504295,1.0819868805088466,19095,11,"SLC27A5, CYP27A1, CYP7B1"
REACTOME_STEROID_HORMONES,0.3825643078770894,1,0.4896997428014628,1.0733088520344032,19110,14,"STAR, CUBN, STARD5, HSD17B1"
BIOCARTA_SARS_PATHWAY,0.3839289287286406,1,-0.5685951803630533,-1.0965415322541998,19187,8,GPT
REACTOME_SYNTHESIS_OF_PC,0.38448214072392783,1,-0.4667619747996311,-1.0658032743315209,19310,17,"SLC44A4, PHOSPHO1, SLC44A3, LPIN1, LPIN3"
ST_WNT_BETA_CATENIN_PATHWAY,0.3847572218807621,1,-0.40239207740290267,-1.049609151396665,19405,32,"DKK4, DKK3, CXXC4, DKK1, NKD1, SFRP1, CTNNB1, LRP1, AXIN2, PTPRA"
REACTOME_DOWNSTREAM_SIGNALING_OF_ACTIVATED_FGFR,0.38494213858949167,1,-0.3381054398425948,-1.034831089488603,19392,80,"FGF1, PRKCG, ADCY1, FGFR2, PRKAR2B, FGFR3, CASP9, CDKN1A, NR4A1, PRKACA, FGFR4"
KEGG_GLYCOSPHINGOLIPID_BIOSYNTHESIS_GLOBO_SERIES,0.3854268841957762,1,0.4886786778449995,1.0710709132313223,19253,14,"FUT9, B3GALT5, FUT2, FUT1, ST3GAL1"
KEGG_SYSTEMIC_LUPUS_ERYTHEMATOSUS,0.38653747077240125,1,-0.3581519394534548,-1.0383270182398132,19506,57,"HLA-DPA1, C2, HIST2H2AC, C1R, HLA-DMA, GRIN2A, HLA-DRB5, HIST1H4J, HIST1H2BD, HLA-DRA, HIST2H2BF, HIST1H2AI, HIST1H2AG"
REACTOME_SMOOTH_MUSCLE_CONTRACTION,0.38914379189275455,1,-0.44792293666913857,-1.0582958458344605,19506,20,"TPM2, MYL9, ACTA2, SORBS1, CALM2, ITGA1, MYL6, CALM3, TPM1, VCL"
REACTOME_ACTIVATION_OF_NMDA_RECEPTOR_UPON_GLUTAMATE_BINDING_AND_POSTSYNAPTIC_EVENTS,0.38952379039546886,1,0.40983306473961445,1.0476825234100773,19393,29,"GRIN2C, RASGRF1, CAMK2B, RPS6KA6, AKAP9, RPS6KA3"
REACTOME_POST_NMDA_RECEPTOR_ACTIVATION_EVENTS,0.38952379039546886,1,0.40983306473961445,1.0476825234100773,19393,29,"GRIN2C, RASGRF1, CAMK2B, RPS6KA6, AKAP9, RPS6KA3"
REACTOME_APOPTOSIS_INDUCED_DNA_FRAGMENTATION,0.39042493597951344,1,-0.508055483789058,-1.0732344889873042,19514,12,"HIST1H1D, HIST1H1B"
PID_EPO_PATHWAY,0.3923227196745413,1,0.405872113765267,1.0438695881832873,19479,30,"SH2B3, BCL2, CBL, IRS2, PIK3R1, EPOR, CRKL, STAT1, NFKB1, JAK2, RAPGEF1"
BIOCARTA_VDR_PATHWAY,0.39233875804710305,1,0.5049869604523967,1.0706577977924947,19623,12,"NCOR1, CARM1, NCOA2, CREBBP, RXRA, NCOA3, MED1, EP300"
BIOCARTA_IL10_PATHWAY,0.39347412671404264,1,0.4856675711207726,1.0644712620184291,19655,14,"IL6, STAT4, BLVRB, HMOX1, STAT1"
PID_ATF2_PATHWAY,0.39533525347942555,1,0.3627930263291485,1.03125651839838,19627,51,"HRK, IL6, DDIT3, COL24A1, ACHE, BCL2, CSRP2, JUNB, MMP2, JUND, ATF3, JDP2, PRKCA, BRCA1, POU2F1"
PID_IL27_PATHWAY,0.3959136933461909,1,0.46250824395801715,1.0559125989605949,19706,17,"IL6, GATA3, IL27RA, STAT4"
ST_GRANULE_CELL_SURVIVAL_PATHWAY,0.39721920399211236,1,0.418166314547583,1.044874184268242,19740,26,"CREB5, MAPK8IP2, MAPK10"
REACTOME_ACTIVATION_OF_KAINATE_RECEPTORS_UPON_GLUTAMATE_BINDING,0.39760331236563423,1,-0.43492491149815943,-1.0493215691568025,19973,22,"NCALD, GNG2, PLCB2, GNB3, GNG7"
KEGG_PENTOSE_AND_GLUCURONATE_INTERCONVERSIONS,0.3994188245128675,1,-0.4686720158199005,-1.0562141770094442,20067,16,"UGT1A6, UGT1A10"
PID_IL3_PATHWAY,0.3995498935015874,1,0.4325107032850065,1.0454947034972821,19883,22,"CEBPB, IL3RA, PIK3R1, ID1, GAB2, PRKACB"
BIOCARTA_IL17_PATHWAY,0.4003117443696169,1,0.626966774672548,1.0962888545575191,20031,5,"IL6, CD8A, KITLG"
PID_INTEGRIN_A4B1_PATHWAY,0.4020074482703682,1,-0.4061189060870462,-1.037533315846194,20185,29,"SPP1, JAM2, ADAM28"
REACTOME_MITOCHONDRIAL_FATTY_ACID_BETA_OXIDATION,0.4028251631052852,1,-0.4918443355187774,-1.0584463183484294,20189,13,"MCEE, HADHA, HADHB, HADH, PCCB, ACADVL, DECR1, ACADM"
REACTOME_GLYCOSPHINGOLIPID_METABOLISM,0.4035331205265975,1,-0.3970415260886577,-1.03565264494481,20352,32,"SUMF1, NEU1, GALC, ARSG, ARSA, SMPD1, GLB1, GM2A, SMPD3, UGCG, ASAH1, ASAH2, HEXB, GBA, CTSA, PSAP, SMPD4, CERK, SUMF2"
PID_ALK2_PATHWAY,0.4053994512427149,1,0.5385072135329679,1.0705509833784845,20241,9,"AMH, SMAD1, ACVR1, SMAD5"
KEGG_ASCORBATE_AND_ALDARATE_METABOLISM,0.40601743780052274,1,-0.49043679857784356,-1.0554173065544856,20349,13,"UGT1A6, UGT1A10"
REACTOME_RECEPTOR_LIGAND_BINDING_INITIATES_THE_SECOND_PROTEOLYTIC_CLEAVAGE_OF_NOTCH_RECEPTOR,0.40697814076387223,1,0.509591374279539,1.0596881092507595,20330,11,"DLL4, NOTCH2, DLL1, NOTCH3"
REACTOME_REGULATION_OF_COMPLEMENT_CASCADE,0.4076372124573549,1,-0.5247281318379803,-1.0641018410670846,20431,10,"CFH, C2"
REACTOME_ETHANOL_OXIDATION,0.4077656321816111,1,0.6227227937470879,1.088868000414225,20404,5,"ADH7, ALDH2"
KEGG_NON_SMALL_CELL_LUNG_CANCER,0.4079798420697591,1,-0.36214316107198474,-1.0262466340687035,20562,50,"PRKCG, RARB, FHIT, EGF, CASP9, PIK3CD, RASSF1"
REACTOME_BASE_FREE_SUGAR_PHOSPHATE_REMOVAL_VIA_THE_SINGLE_NUCLEOTIDE_REPLACEMENT_PATHWAY,0.41368234144005744,1,-0.522017323342055,-1.058604563264977,20734,10,"CCNO, POLB, SMUG1, OGG1, APEX1, MPG, MUTYH"
PID_INTEGRIN2_PATHWAY,0.41538676626255766,1,-0.44460037746985975,-1.039040332380098,20797,19,"ITGAM, ITGAX, PLAT, F10, PROC, F11R, THY1"
REACTOME_CREB_PHOSPHORYLATION_THROUGH_THE_ACTIVATION_OF_CAMKII,0.41930899191288334,1,0.5049511544962292,1.050038837350042,20946,11,"GRIN2C, CAMK2B, AKAP9"
REACTOME_CELL_JUNCTION_ORGANIZATION,0.42059019572198997,1,0.349923830389161,1.0163357991591948,20822,58,"ARHGEF6, COL17A1, CDH13, CLDN16, CDH11, CLDN8, CDH8, CLDN11, PLEC, PARD6A, LAMC2, VASP, PVR, CDH4, LAMA3, ITGB4"
REACTOME_UNBLOCKING_OF_NMDA_RECEPTOR_GLUTAMATE_BINDING_AND_ACTIVATION,0.4212170361026011,1,0.566442525824777,1.0649182876355023,21035,7,"GRIN2C, CAMK2B, AKAP9, GRIN2D"
REACTOME_ANTIGEN_ACTIVATES_B_CELL_RECEPTOR_LEADING_TO_GENERATION_OF_SECOND_MESSENGERS,0.4236207486071723,1,0.4174120167307368,1.0263190147722263,21061,24,"CD19, VAV1, CBL, ITPR3, PIK3R1, ITPR2"
BIOCARTA_EPHA4_PATHWAY,0.4242454587330516,1,0.5301163509450616,1.0538699697000542,21182,9,"EPHA4, ACTA1, RAP1B"
PID_IFNG_PATHWAY,0.42435556261667395,1,-0.3782222332510893,-1.018471031568919,21367,38,"CASP1, IL1B, DAPK1"
REACTOME_G_ALPHA_S_SIGNALLING_EVENTS,0.4253953156580668,1,-0.350125904682425,-1.0150585451867014,21467,57,"PDE11A, PTGER2, VIPR1, ADORA2A, ADCY1, RLN2, GNG2, GNB3, GNG7, GLP2R, ADRB2"
REACTOME_G_PROTEIN_ACTIVATION,0.42579540477043765,1,-0.4522060410533721,-1.0325662869904353,21385,17,"GNG2, GNB3, GNG7, GNAI1"
BIOCARTA_SET_PATHWAY,0.42593517205568093,1,-0.5321608599955092,-1.0537118694245315,21326,9,PRF1
REACTOME_SIGNALING_BY_ILS,0.4272630071213864,1,0.32153569513914604,1.009216767676034,21178,95,"IL7R, LCK, TMEM189-UBE2V1, IL6, VAV1, PIK3R2, IL2RG, PELI2, IL1RN, RIPK2, IL3RA, SQSTM1"
BIOCARTA_EXTRINSIC_PATHWAY,0.4287968678212581,1,-0.5655639057335771,-1.0605025776285306,21465,7,"F10, PROC, F2R, F3"
REACTOME_NCAM1_INTERACTIONS,0.43037268689122166,1,-0.40486475566690405,-1.019681967418192,21605,27,"CACNB4, COL6A3, ARTN, COL9A2, COL9A3, ST8SIA4, CACNB3, COL1A1, COL5A1, PSPN, COL4A1, COL4A2, COL6A1, CACNA1H"
BIOCARTA_ACE2_PATHWAY,0.43053413710921073,1,0.5269585859679052,1.0475923408835444,21496,9,"COL4A4, ACE2, AGT"
PID_INTEGRIN5_PATHWAY,0.43237356884528544,1,-0.47121587989055636,-1.0305757203023225,21638,14,ITGB8
REACTOME_SEMA3A_PLEXIN_REPULSION_SIGNALING_BY_INHIBITING_INTEGRIN_ADHESION,0.4335109036132559,1,-0.4795823850168797,-1.0320586679736112,21727,13,"SEMA3A, RND1"
REACTOME_DAG_AND_IP3_SIGNALING,0.4352337786259542,1,-0.40680985235833594,-1.0172463109010899,21893,26,"PRKCG, ADCY1, PRKAR2B"
KEGG_STARCH_AND_SUCROSE_METABOLISM,0.4355580549920665,1,0.3963179216480949,1.0131328971436664,21685,29,"MGAM, UGT1A4, UGT1A7, GBA3, GANC, HK2"
KEGG_AUTOIMMUNE_THYROID_DISEASE,0.4357781609656334,1,0.4302425715974373,1.0196952835288184,21733,20,"HLA-DMB, HLA-DOB, TPO, HLA-F, HLA-DQB1, HLA-G"
BIOCARTA_ARAP_PATHWAY,0.43629958402165475,1,-0.4551031026765453,-1.025634842325786,21920,16,"GPLD1, KDELR3, ARFGAP1, ASAP2, CYTH3, KDELR2, CLTB, ARF1"
PID_FCER1_PATHWAY,0.43820564516129035,1,0.3550959116491184,1.005873547780941,21734,50,"PTPN13, VAV1, HCLS1, CBL, FER, PIK3R1, DOK1, GAB2, RASA1"
REACTOME_IL_RECEPTOR_SHC_SIGNALING,0.43874792221576914,1,0.4346050730358761,1.0186792155580675,21907,19,"PIK3R2, IL2RG, IL3RA, PIK3R1, GAB2, JAK2, PIK3R3, SOS1, INPPL1"
REACTOME_TRAF3_DEPENDENT_IRF_ACTIVATION_PATHWAY,0.4409212683433964,1,0.484664776670232,1.0275713297477462,22053,12,"IFIH1, DDX58, CREBBP, TBK1, IRF7, TRAF3, EP300, IRF3, MAVS"
PID_TXA2PATHWAY,0.44257836539415957,1,-0.3647872196268733,-1.0052459810296428,22293,43,"PRKCG, TBXA2R, GNG2, PLCB2, NOS3, MAPK11, EGF"
PID_NFKAPPAB_CANONICAL_PATHWAY,0.4426765562068828,1,-0.42551621731388783,-1.0163852323401072,22201,21,"NOD2, SSPO"
