pathway,pval,padj,ES,NES,nMoreExtreme,size,leadingEdge
GO_MITOTIC_G2_DNA_DAMAGE_CHECKPOINT,0.4895744332745551,1,-0.4702294216565883,-0.9938670051870446,26930,12,"FOXO4, NBN, FOXN3, ATM, BLM, FANCI, HMGA2, CDK1, CCNA2"
GO_RESPONSE_TO_ORGANOPHOSPHORUS,0.48974259474841547,1,0.29387653461408936,0.9807619451212544,18930,108,"PFKFB1, IL1B, P2RX5, THBD, SELL, ALDH3A1, GPD1, LPAR1, P2RX6, AREG, REN, PENK, AKR1C1, CIB2, ASS1, FOS, DUSP1, STAR, JUNB, P2RX4, CITED1, DUOX2, SLC26A3, JUND, MMP19, RAPGEF3, ATP7B, DUOX1, VGF, JUN, EZR, PDE4D"
GO_LIMBIC_SYSTEM_DEVELOPMENT,0.4898512641703303,1,-0.32853094665690574,-0.9805066599937509,29080,71,"DCLK2, GLI3, WNT3A, NR4A3, DLX2, ATP2B4, CDK5R2, AKAP5, ID4, NKX2-6, DRD1, TSC1, CASP3, NKX2-1, CNTNAP2, TBX3, CDK5, DLX1, KIF14, PHLPP2, ATAT1, BBS2, EZH2, PLXNA3"
GO_PEPTIDYL_TYROSINE_MODIFICATION,0.4900933982597589,1,-0.2992411273492149,-0.9838973044592427,30696,142,"EFEMP1, EPHA7, FLT4, ERBB4, NRG2, MAP2K6, EPHA10, GHR, PDGFRB, LTK, KIT, FGF1, DYRK3, PEAK1, CSF1R, SYK, EIF2AK2, ZAP70, INSR, EPHA6, NRG1, BTC, IL3RA, TXK, CNTRL, EPHB2, EPHA4, ERBB3, DDR2, JAK3, IGF1R, FRK, NRG4, MATK, EPHB3, TTN, LYN, JAK2, F2R"
GO_COLUMNAR_CUBOIDAL_EPITHELIAL_CELL_DIFFERENTIATION,0.4905157574152542,1,-0.3171217385355358,-0.9805993101429684,29634,90,"GATA5, SOX11, GATA6, GLI3, TMC1, NKX6-1, CDH2, FOXA1, PAX6"
GO_ALPHA_AMINO_ACID_CATABOLIC_PROCESS,0.4908250074191315,1,0.3107345268791764,0.9786078933508165,19846,74,"NOS1, CRYM, AASS, CBS, GLDC, ALDH1L2, HPD, GCAT, HGD, GOT1, THNSL2, HOGA1, SLC25A21"
GO_POSITIVE_REGULATION_OF_NUCLEOTIDE_CATABOLIC_PROCESS,0.4911242603550296,1,-0.48995564511618306,-0.9958460834610089,26808,10,"PRKAA2, P2RX7, INSR"
GO_FATTY_ACID_HOMEOSTASIS,0.4911815772640044,1,-0.4794382965568183,-0.9941172917022334,26874,11,PRKAA2
GO_ROUNDABOUT_SIGNALING_PATHWAY,0.49129615013592914,1,0.48470744618592976,0.9906941602274316,22408,9,"ROBO1, ROBO2, FMOD, ROBO3"
GO_NEUROTRANSMITTER_BIOSYNTHETIC_PROCESS,0.4927245250431779,1,0.5129291498034678,0.9941328147896722,22822,7,"NOS1, SLC44A4"
GO_RESPONSE_TO_COPPER_ION,0.4928460025767953,1,0.39528613113500405,0.9754540330583114,21803,21,"IL1A, SNCA, PRNP, ATP7B, ATP7A, S100A13"
GO_RESPONSE_TO_THYROID_HORMONE,0.4928932178932179,1,-0.4333390719152693,-0.9857536288221425,27325,17,"LMO2, KIT, GBA, PPARGC1A"
GO_GROOMING_BEHAVIOR,0.4929278380973484,1,-0.5171609593127595,-1.0003537149787713,26694,8,"DDO, DRD1, CTNS"
GO_REGULATION_OF_RESPIRATORY_BURST,0.49328185665052565,1,0.49701310631562906,0.9902841974992594,22614,8,"DUSP10, NOXO1, RPS19, RAC2"
GO_TEMPERATURE_HOMEOSTASIS,0.4933800098738836,1,0.41494732974661774,0.9767305134677319,21985,17,"IL1A, IL1B, FOXO1, ADRB1, ARRDC3"
GO_POSITIVE_REGULATION_OF_MYOBLAST_DIFFERENTIATION,0.49346106717166094,1,0.44172328655504295,0.9791867317010293,22148,13,"BOC, IGFBP3, BTG1"
GO_REGULATION_OF_MYOBLAST_FUSION,0.49376225108542326,1,-0.4888166878149842,-0.9935311266298467,26952,10,CXCL10
GO_ACIDIC_AMINO_ACID_TRANSPORT,0.4939606309193966,1,-0.43943236344803704,-0.9861471965270646,27276,16,"SLC1A2, SLC1A1"
GO_REGULATION_OF_CARBOHYDRATE_CATABOLIC_PROCESS,0.49423306842956605,1,-0.3759315937684886,-0.9785958675071701,28109,33,"PRKAA2, P2RX7, CBFA2T3, PGAM4, PPARGC1A, INSR"
GO_ISOPRENOID_METABOLIC_PROCESS,0.494311377245509,1,-0.31871430014773283,-0.9788815764930501,29717,86,"RBP1, LRAT, PLB1, ADH7, GPC3, CYP1B1, UGT1A7, CYP4V2, CYP26A1, HMGCS2, CYP1A1, AKR1C3, GPC4, LRP1"
GO_MAMMARY_GLAND_MORPHOGENESIS,0.4952869613670134,1,0.3542265775041322,0.973073729120388,21332,35,"SOSTDC1, TBX2, AREG, WNT4, WNT5A"
GO_POSITIVE_REGULATION_OF_STEM_CELL_DIFFERENTIATION,0.495574148175094,1,-0.35371410012131166,-0.9762394398729519,28608,45,"SOX6, GATA6, CRB2, GLIPR2, HOXB4, GCNT2"
GO_NEGATIVE_REGULATION_OF_FAT_CELL_DIFFERENTIATION,0.4956039520558763,1,-0.3691099266127901,-0.9768401167072325,28240,36,"IL6, ENPP1, WNT3A, ZFPM2"
GO_POSITIVE_REGULATION_OF_EPITHELIAL_CELL_DIFFERENTIATION,0.4965624617322394,1,-0.3633071886145188,-0.9755999085967375,28384,39,"ADAMTS20, PROM1, ADAMTS9, NKX6-1, PAX6, ATOH8, ETV2, BCL2"
GO_BODY_FLUID_SECRETION,0.4966773404951279,1,-0.34676597406892135,-0.9754086881666221,28849,50,"UCN, ERBB4, GUCA1B, CHRM1, OXTR, SLC4A5"
GO_COCHLEA_MORPHOGENESIS,0.4968757024050348,1,0.4076101371886919,0.9718092172705015,22105,18,"SIX1, FRZB, WNT5A, SOX9, GLI2, ZEB1"
GO_POSITIVE_REGULATION_OF_NUCLEOSIDE_METABOLIC_PROCESS,0.49687618840658443,1,-0.438484634809586,-0.9840203619613456,27437,16,"PRKAA2, P2RX7, PPARGC1A, INSR"
GO_RNA_3_END_PROCESSING,0.4972970242004749,1,0.3002197895300597,0.9762002089312761,19685,90,"FBLL1, THOC1, RPS21, THOC5, MAGOH, EXOSC8, PABPC1L, SUPV3L1, EXOSC7, PAF1, SRSF5, ERI1, ZC3H3, NCBP1, SRSF6, THOC2, U2AF1, SRSF9, SRSF7, SSU72, THOC3, EXOSC2, EXOSC4, SRSF3, CDC73, RPSA, SRSF2, PABPC1, CPSF6, CPSF2, DDX39B, FIP1L1, PAPOLA, GRSF1, PABPN1, SARNP, SRSF1, EIF4A3"
GO_EPIDERMAL_CELL_DIFFERENTIATION,0.498012565713553,1,0.2946778044919036,0.9777004624213832,19419,103,"POU3F1, GLI1, SLITRK6, CSTA, FOXN1, CYP26B1, EREG, KRT16, CERS3, WNT5A, MCOLN3, JAG1, KRT17, PDZD7, SPINK5, CLIC5, CASP14, OVOL2, GLI2, SLC4A7, FA2H, SAV1, KRT10, ANXA1, PTCH1"
GO_DOPAMINE_METABOLIC_PROCESS,0.4983679686649984,1,-0.4442209252046314,-0.9836053282282494,27482,15,"SNCB, GPR37, NR4A2, DRD1, GRIN2A, SNCAIP, GCH1"
GO_MACROPHAGE_DIFFERENTIATION,0.4986266496951832,1,0.41949727993280445,0.9740565349573381,22328,16,"TSPAN2, CEBPA, VEGFA"
GO_CARDIAC_CHAMBER_FORMATION,0.49995420154981957,1,-0.4862229751788486,-0.9882593462226498,27290,10,"SOX11, TBX20"
GO_REGULATION_OF_CATION_CHANNEL_ACTIVITY,0.5001788908765653,1,-0.3355465187690183,-0.9741048590188907,29357,60,"KCNJ11, KCNQ1, KCNAB1, KCNE1, JPH3, NOS1AP, CACNB4, KCNE3, KCNS1, AHNAK"
GO_SIALYLATION,0.5010995915802702,1,0.4124569737709171,0.9708685485953495,22329,17,"ST3GAL6, ST8SIA1, ST6GALNAC2, ST6GAL1"
GO_METHYLATION_DEPENDENT_CHROMATIN_SILENCING,0.5018524755810037,1,-0.5514379881500023,-1.002877750947426,26819,6,"HELLS, MBD1, DNMT3A, MBD3"
GO_O_GLYCAN_PROCESSING,0.5023927578045367,1,-0.34973889856592455,-0.9726940233085761,29079,47,"GALNT14, MUCL1, MUC5B, GCNT4, MUC21, GALNT5, GALNT4, ST3GAL2, GALNT12, GXYLT2, B3GNT4, MUC16, GALNT10"
GO_REGULATION_OF_ANDROGEN_RECEPTOR_SIGNALING_PATHWAY,0.5027011143509414,1,0.3926177136224731,0.9688691356398063,22239,21,"DAB2, SIRT1, PIAS2, DDX5, RNF14, PRMT2, BUD31, PARK7, NODAL, PHB, SFRP1"
GO_SYNAPTIC_VESICLE_RECYCLING,0.5033721202093412,1,-0.41373021300951407,-0.9731624067191665,27988,20,"WNT3A, PACSIN1, SYT1, SYNJ1, OPHN1, SYT12, PIP5K1C, CDK5"
GO_CELLULAR_MONOVALENT_INORGANIC_CATION_HOMEOSTASIS,0.503542289225397,1,-0.3237999991106307,-0.9727786718430135,29993,74,"ATP12A, ATP6V1G2, TTPA, LRRK2, SLC4A5, SLC26A1, SLC4A4, SLC4A8, ATP6V0E2, BCL2, ATP1A3, SLC9A8, ATP1A4, SGK3, ATP6V1B1, GPR89A"
GO_SEMAPHORIN_PLEXIN_SIGNALING_PATHWAY_INVOLVED_IN_NEURON_PROJECTION_GUIDANCE,0.5039098644701272,1,-0.45558898454435187,-0.9797586016973635,27773,13,"PLXNA2, PLXNA4, PLXNB1, PLXNA1, PLXNA3, PLXNB2, PLXNC1"
GO_NEGATIVE_REGULATION_OF_HEART_CONTRACTION,0.5041228635565532,1,0.4462119724644081,0.9718304204602664,22681,12,"NOS1, FKBP1B, PDE4D, SRI"
GO_POSITIVE_REGULATION_OF_EMBRYONIC_DEVELOPMENT,0.5042808219178082,1,-0.3974082208587466,-0.9710896665297076,28271,24,"WNT3A, SHH, DMRT2, STOX1, AMOT, NR2C2, FOXA2"
GO_MUCOPOLYSACCHARIDE_METABOLIC_PROCESS,0.5045933228769885,1,0.3034246202393728,0.9706954437405912,20267,81,"ST3GAL6, CSGALNACT1, IL1B, UST, FMOD, B3GAT2, HAS3, PIM1, CHSY3"
GO_NUCLEUS_LOCALIZATION,0.5052229666450544,1,-0.4182602719939565,-0.9735338111233984,28051,19,"SLIT1, SYNE2, WDR81, MYH10, HHEX"
GO_RESPONSE_TO_GONADOTROPIN,0.5052276680834275,1,-0.4086705883649273,-0.9718813670217638,28171,21,"GATA6, SLC5A5, ICAM1, PPARGC1A, FOXM1"
GO_POSITIVE_REGULATION_OF_INTERLEUKIN_17_PRODUCTION,0.5053657898180867,1,0.49142853828475097,0.979157107689024,23168,8,"IL23A, IL18, TGFB1, PRKCQ"
GO_DENTATE_GYRUS_DEVELOPMENT,0.5057800286249037,1,0.46619586359474324,0.9750008089259395,22969,10,"PROX1, SMO, EMX2, CDK6, MDK"
GO_PROTEIN_HETEROOLIGOMERIZATION,0.5060119904879927,1,-0.32210659108884293,-0.9718402902072397,30215,76,"GLRB, CDH2, CHRNB4, LRP4, CLDN1, BIRC3, HIST1H4H, MAGI2, HIST1H3D, RRM2, C1QTNF2, INSR, TSC1, C1QTNF1, TRAF2"
GO_EPIDERMIS_MORPHOGENESIS,0.5069028253424658,1,-0.3967041967935371,-0.9693693435498862,28418,24,"IGFBP5, KRT27, SHH, FOXE1"
GO_CATECHOLAMINE_TRANSPORT,0.5072416350390437,1,0.4905771545138843,0.9774607502216192,23254,8,"SNCA, SLC22A3"
GO_REGULATION_OF_MICROTUBULE_POLYMERIZATION_OR_DEPOLYMERIZATION,0.5074355035395848,1,-0.2940213179935783,-0.9765314977339553,32040,154,"BIRC7, KIF4B, MAP1A, CLIP3, C16orf45, BIRC3, RGS2, HAUS8, ESPL1, MYBL2, APC, STIL, PSRC1, KIFC1, FBXO5, STARD9, SKA1, ARHGEF10, CEP192, SKA3, DYNC1H1, MYH9, NDC80, CEP120, ASPM, MAPT, CKAP2, KIF11, TUBGCP6, PKD1, STMN1, SPAST, TUBGCP3, AURKB, RACGAP1, HAUS2, MID1, NEK6, INO80, KIF3B, TERF1, CLASP1, PRC1, CAV1, CEP63, HAUS3, ABL1, CEP72"
GO_REGULATION_OF_CGMP_METABOLIC_PROCESS,0.5074951752614335,1,0.410219600688467,0.9656020716162719,22614,17,"NOS1, RUNDC3A, WNT5A, VEGFA, NPPC"
GO_NEGATIVE_REGULATION_OF_PRODUCTION_OF_MOLECULAR_MEDIATOR_OF_IMMUNE_RESPONSE,0.5075624971949194,1,0.41020043039663545,0.9655569473133985,22617,17,"IL13RA2, SPINK5, THOC1, HMOX1"
GO_MEMBRANE_FUSION,0.5083368178967176,1,0.2883283951416303,0.9736903511521011,19450,117,"BET1L, SYTL5, SYT11, CD4, SYT3, SYT14, C2CD4C, SYT15, SERPINA5, NKD2, DYSF, CXCR4, SEC22A"
GO_POSITIVE_REGULATION_OF_OSTEOBLAST_DIFFERENTIATION,0.5084454213154311,1,0.32709704286346764,0.965733763353869,21281,51,"FBN2, CEBPA, PRKD1, CEBPB, WNT4, PTGER4, JAG1, GJA1"
GO_NATURAL_KILLER_CELL_ACTIVATION,0.5084714801114308,1,0.37633717326275806,0.9635047908299491,22267,25,"IL21R, ULBP1, IL18R1"
GO_RESPONSE_TO_ANGIOTENSIN,0.5087087635931645,1,-0.4721209654374855,-0.9789447753490732,27833,11,"RXFP4, CA2, SLC26A6, AGTRAP, CAV1, PRKCD, CDC6, SRC"
GO_CARDIAC_LEFT_VENTRICLE_MORPHOGENESIS,0.5089186793707069,1,-0.5100535068707122,-0.9866056423015814,27560,8,"FOXF1, RYR2"
GO_NUCLEOPHAGY,0.5090660203761052,1,0.4096400864655872,0.9642379726478054,22684,17,"ATG9B, WIPI1, ATG5, ATG4B, WDR45, ATG4C, ATG4A, ATG9A, ATG4D, ATG7"
GO_NEURON_MIGRATION,0.5090931769988774,1,0.30237856539673946,0.9689509850430089,20406,82,"SPOCK1, NRCAM, TLX3, DCLK1, KIRREL3, CXCL12, FGF13, DDIT4, DCDC2, GJA1, NDEL1, TUBB2B, CXCR4, GFRA3, PEX7, NDN"
GO_REGULATION_OF_POSITIVE_CHEMOTAXIS,0.5093714347802466,1,-0.4341420457539833,-0.9742749895694505,28127,16,"NTF3, F7, CDH13"
GO_RESPONSE_TO_PROGESTERONE,0.5099209802624708,1,-0.3568341565139439,-0.9675071184890972,29296,41,"CATSPERB, CCL2, OXTR, GABRB1, SOCS1, C3, CATSPER1, ADRB2, TGFB3, THBS1, FOSB"
GO_LONG_TERM_SYNAPTIC_DEPRESSION,0.5099459915986931,1,0.4441849832891705,0.9674157255080894,22943,12,"SLC24A2, PICK1, SHANK2, SRF"
GO_SENSORY_PERCEPTION_OF_CHEMICAL_STIMULUS,0.5102885004664589,1,-0.37588157107400355,-0.966762449515878,28989,31,"PIP, SCNN1G, CST1, SCNN1D, PDE4A, RTP4, FZD2"
GO_NEGATIVE_REGULATION_OF_EXOCYTOSIS,0.5107601408930803,1,0.3821852791637653,0.9619821766537354,22475,23,"IL13RA2, SNCA, IL1RAPL1"
GO_ALDITOL_METABOLIC_PROCESS,0.5110285116517171,1,0.4281749050858963,0.9656367855547575,22959,14,"MOGAT3, GK, GOT1, COQ3"
GO_ACTIVATION_OF_GTPASE_ACTIVITY,0.5112504235852253,1,-0.3286987101231959,-0.9691446665336964,30173,66,"NTF3, CCR7, SYDE1, RASGRP1, SYDE2, TBC1D10C, SGSM1"
GO_VESICLE_FUSION_TO_PLASMA_MEMBRANE,0.5114221334750032,1,-0.48140697076543426,-0.9784707068206233,27916,10,"STX19, STX1B"
GO_NEUTRAL_LIPID_METABOLIC_PROCESS,0.5114798379316998,1,0.3197060241632319,0.9654511424423219,21207,58,"SNCA, MOGAT3, GPD1, APOBR, GK, APOC1, ANG, CEL, FABP6, FABP3"
GO_CELLULAR_RESPONSE_TO_RETINOIC_ACID,0.5116875644314449,1,0.3257023825278774,0.9642594460967402,21342,52,"EPHA3, FZD10, CYP26B1, RET, WNT5A, TESC, SOX9, OSR1, WNT6, WNT5B, WNT3, PPARG, KRT13, HTRA2, WNT11"
GO_NEGATIVE_REGULATION_OF_CD4_POSITIVE_ALPHA_BETA_T_CELL_ACTIVATION,0.5122070933847188,1,-0.46104414809831334,-0.9744532043852449,28175,12,"TNFSF4, LGALS9, RC3H1, TNFSF18, XCL1, JAK3"
GO_POSITIVE_REGULATION_OF_CELL_MORPHOGENESIS_INVOLVED_IN_DIFFERENTIATION,0.5123319883494107,1,0.2810707136344853,0.973754925233157,19172,141,"ROBO1, DAB2, OLFM1, IL1RAPL1, CDH4, PTPRD, SHOX2, ROBO2, CXCL12, BHLHB9, TIAM1, VEGFA, TNFRSF12A, NDEL1, SERPINB3, ITPKA, ISLR2, LIF"
GO_ALDITOL_PHOSPHATE_METABOLIC_PROCESS,0.5130942214631369,1,-0.3914673482989459,-0.9647561982477741,28839,25,"PLA2G4E, PLA2G1B"
GO_HEART_PROCESS,0.5134457222809952,1,-0.33423973058480977,-0.9675059883259954,30090,59,"SCN4B, SCN3B, KCNQ1, KCNE1, MAP2K6, RYR2, TNNI1"
GO_NEGATIVE_REGULATION_OF_CYSTEINE_TYPE_ENDOPEPTIDASE_ACTIVITY,0.5141187925998053,1,-0.32192491360568937,-0.9671454315956419,30623,74,"BIRC7, IL6, LAMP3, RAG1, BIRC3, IFI6, NAIP, DHCR24, THBS1, NGF, ARRB1, EP300, HTT, IFI16"
GO_RESPONSE_TO_PARATHYROID_HORMONE,0.5141883598659022,1,-0.48005409770140434,-0.9757209612963837,28067,10,SOST
GO_REGULATION_OF_ERAD_PATHWAY,0.5142942364170338,1,0.3684486035099122,0.9585579493393132,22414,27,"HERPUD1, BRSK2, XBP1, UBE2J1, NFE2L2, UBXN1, ERLEC1, USP19, DERL2"
GO_NEGATIVE_REGULATION_OF_CHEMOKINE_PRODUCTION,0.5144976276609282,1,-0.4601091997369411,-0.972477117213481,28301,12,"IL6, LGALS9"
GO_CELLULAR_ANION_HOMEOSTASIS,0.5146902004044861,1,-0.4938616531244252,-0.9797730611971898,27993,9,"ENPP1, ABCC2, SLC34A2"
GO_POSITIVE_REGULATION_OF_SYNAPTIC_TRANSMISSION_GLUTAMATERGIC,0.5156733875459507,1,0.4342347406584597,0.9625865546108527,23145,13,"NRXN1, NLGN3, NLGN1, RAB3GAP1, NGFR"
GO_REGULATION_OF_RESPONSE_TO_FOOD,0.5157821459321816,1,-0.4793752989128785,-0.9743412871937388,28154,10,"UCN, CCK"
GO_PHAGOSOME_MATURATION,0.515903603268945,1,0.34944443143872905,0.9599369940457705,22220,35,"SRPX, RAB38, ATP6V0A4"
GO_MUSCLE_CELL_FATE_COMMITMENT,0.5159387880382356,1,0.4741055390195907,0.9690249088065724,23532,9,"TBX2, MYL2, NKX2-5"
GO_REGULATION_OF_ALPHA_BETA_T_CELL_PROLIFERATION,0.5162347657594031,1,-0.4316372469510498,-0.968653873505091,28506,16,"TNFSF4, CCR2, SYK, LGALS9, ZAP70, XCL1, EBI3"
GO_TOOTH_MINERALIZATION,0.5162584498140583,1,-0.4792048391743172,-0.9739948238664435,28180,10,"TBX1, ALPL, CNNM4, MSX2, COL1A1, WDR72"
GO_REGULATION_OF_SYNAPTIC_VESICLE_TRANSPORT,0.516430926300117,1,-0.38559012360460293,-0.9641639069894069,29135,27,"CNIH2, LRRK2, BTBD9, SYNJ1, RIMS4, STX1B, FMR1, CDK5"
GO_REGULATION_OF_TRANSCRIPTION_INVOLVED_IN_CELL_FATE_COMMITMENT,0.5170496731315984,1,-0.43131058396099864,-0.9679207964296557,28551,16,"NKX6-1, PAX6, POU5F1, DLX2, ETV2, RORC, DLX1, NR2F2, SMARCC2"
GO_STARTLE_RESPONSE,0.5181661865523325,1,0.4127052442053124,0.9582856894655937,23203,16,"NPAS1, NRXN1, SLITRK6, PENK"
GO_DISRUPTION_OF_CELLS_OF_OTHER_ORGANISM,0.5185164487165158,1,-0.522915024528931,-0.9810908300458983,27834,7,"CCR2, CAMP, APOL1, BCL2L11"
GO_PROTEIN_REFOLDING,0.518615944961554,1,0.39572697161348824,0.9555726943265551,23066,19,"HSPA1L, FKBP1B, HSPA1A, DNAJA2, DNAJB2, PTGES3, FKBP1A, HSPD1, BAG1"
GO_CYTOKINE_PRODUCTION_INVOLVED_IN_IMMUNE_RESPONSE,0.518947578668313,1,-0.44309444394512054,-0.9671893679499024,28579,14,"CAMK4, KIT, IL31RA, TLR2, MR1"
GO_MESODERMAL_CELL_DIFFERENTIATION,0.5193500738552437,1,0.379829271871189,0.9560519717319663,22853,23,"TAL1, EYA2, INHBA"
GO_MYOFIBRIL_ASSEMBLY,0.5195634955557511,1,-0.371381245413661,-0.9612739054116332,29518,32,"MYH3, OBSL1, MYPN, TMOD1, TMOD2, PDGFRB"
GO_NEGATIVE_REGULATION_OF_CELL_JUNCTION_ASSEMBLY,0.5197926484448633,1,0.40623003587777917,0.9562111696711131,23162,17,"ARHGAP6, APOD, MMP14"
GO_CYTOPLASMIC_MRNA_PROCESSING_BODY_ASSEMBLY,0.5201694268210656,1,-0.4579749947384744,-0.9679663064632544,28613,12,"RC3H1, LIMD1, DYNC1H1, PATL2, DDX6"
GO_GABAERGIC_NEURON_DIFFERENTIATION,0.5206471777900349,1,-0.4913209035886431,-0.9747324634211535,28317,9,"DLX2, DRD1, NKX2-1, DLX1"
GO_REGULATION_OF_IMMUNOGLOBULIN_PRODUCTION,0.5206583927471173,1,-0.3757927348526852,-0.9608066954535368,29575,30,"CD40, IL6, TNFSF4"
GO_NEGATIVE_REGULATION_OF_PLATELET_ACTIVATION,0.5208439983084422,1,0.42460272783266495,0.9575806717581067,23400,14,"ALOX12, THBD, SERPINE2"
GO_POSITIVE_REGULATION_OF_CHOLESTEROL_EFFLUX,0.5208784017160828,1,-0.457696088362199,-0.9673768158185818,28652,12,"ABCA1, LRP1"
GO_EMBRYONIC_CRANIAL_SKELETON_MORPHOGENESIS,0.5209336403600586,1,-0.35608640501407013,-0.9608429484150182,29861,40,"FOXC2, TBX1, DLX2, TGFB3, SIX2, TWIST1, WDR19, MED12, HOXA2"
GO_ADENYLATE_CYCLASE_ACTIVATING_G_PROTEIN_COUPLED_RECEPTOR_SIGNALING_PATHWAY,0.5209648959881129,1,0.34841752132782555,0.9571160333540882,22438,35,"ADCY1, GPR78, NPR3, GNG2, ADM2, CALCRL, ADORA2A, PTHLH, ADCY8"
GO_REFLEX,0.5211083471029361,1,-0.4422918573226253,-0.9654374767701693,28698,14,"GLRB, TMC1, NR4A3"
GO_VOCALIZATION_BEHAVIOR,0.5212431770079091,1,0.43225164326668836,0.9581905385691415,23395,13,"NRXN1, NLGN3, NRXN2, DLG4, SHANK2"
GO_METHIONINE_BIOSYNTHETIC_PROCESS,0.5215773643756266,1,0.4321403714016211,0.9579438775096007,23410,13,"APIP, BHMT2, ENOPH1, EIF2B1, EIF2B4, EIF2B2, MTAP, MTRR, MRI1"
GO_INSULIN_LIKE_GROWTH_FACTOR_RECEPTOR_SIGNALING_PATHWAY,0.5221075167371229,1,-0.44862679826520624,-0.9647861986651997,28776,13,"GHR, PIK3R1, CRIM1, IGF1R"
GO_RESPONSE_TO_AUDITORY_STIMULUS,0.5224178551517005,1,-0.40769647004240084,-0.9589700377725319,29047,20,"CXCL10, UCN, IL6"
GO_MOLTING_CYCLE,0.5231283488177751,1,0.3084384029721713,0.9621668920394264,21283,70,"SOSTDC1, SOX21, DKK1, KRT83, FOXN1, KRT16, FUZ, KRT17, SPINK5, LHX2, SMO, INHBA, LGR5, SOX9, EDAR, FOXQ1, AARS, SAV1"
GO_CELLULAR_RESPONSE_TO_CARBOHYDRATE_STIMULUS,0.5231815231131914,1,-0.3332974029071589,-0.962048991219437,30625,58,"CLEC7A, KCNB1, KCNJ11, MAP2K6, ICAM1, ZNF236, PPARGC1A, COLEC12, NOX4, GJB6, FN1, EP300, NFKB1, IL1R1, AGER"
GO_POSITIVE_REGULATION_OF_PROTEIN_TYROSINE_KINASE_ACTIVITY,0.523229366856498,1,-0.3778334288542907,-0.9592818364963848,29675,29,"ADRA2A, WNT3A, ADORA1, CSF1R, NRG1, ERBB3, FBXW7"
GO_RRNA_CONTAINING_RIBONUCLEOPROTEIN_COMPLEX_EXPORT_FROM_NUCLEUS,0.5235056417956588,1,0.44822290900007766,0.9581150697176914,23707,11,"RPS28, NMD3, RPS15, RRS1, EIF6, RPSA, NUP88, RAN"
GO_CONVERGENT_EXTENSION,0.5238721176339535,1,0.4314198314997091,0.9563466261690253,23513,13,"FRZB, WNT5A, MESP1, WNT11, DVL1"
GO_MUSCLE_ATROPHY,0.5246622506642715,1,-0.539702699541713,-0.9815352607688229,28038,6,"PPARGC1A, PSMB9"
GO_REGULATION_OF_PRI_MIRNA_TRANSCRIPTION_FROM_RNA_POLYMERASE_II_PROMOTER,0.5247904405207776,1,0.4169676148663163,0.953293590358422,23539,15,"FOS, PPARD, JUN, PDGFB, SRF, NFATC4, GNL3, HIF1A"
GO_POLYSACCHARIDE_METABOLIC_PROCESS,0.5250310302027307,1,0.3126657191540149,0.960565656277892,21572,64,"PYGL, CSGALNACT1, GNMT, PPP1R1A, GBE1, HAS3"
GO_REGULATION_OF_SYNAPSE_STRUCTURE_OR_ACTIVITY,0.5254456131510991,1,-0.2894965898092919,-0.9695382224946989,33369,165,"GRIK2, NCAM1, SLIT1, DISC1, SYNDIG1, SHISA9, EPHA7, KCNB1, SYP, OXTR, CDH2, JPH3, CPEB3, UNC13A, LRP4, NRXN3, NRGN, CPLX2, DGKI, LZTS1, KIT, MAGI2, ADORA1, SYNGAP1, SLC8A2"
GO_MAMMARY_GLAND_DEVELOPMENT,0.5256803562592776,1,-0.30930134712463675,-0.963907522325682,31871,95,"IGFBP5, ESR1, FOXF1, ERBB4, GLI3, WNT3A, OXTR, CSF1, UPRT, CSF1R, MSX1, TNFRSF11A, TGFB3, XDH, BRCA2"
GO_MESONEPHRIC_TUBULE_MORPHOGENESIS,0.5261480365154428,1,-0.347051210950283,-0.9578500819422681,30373,45,"NOG, GLI3, GPC3, SHH, FGF1, HOXA11, ADAMTS16, BCL2, PBX1, EYA1"
GO_REGULATION_OF_CIRCADIAN_SLEEP_WAKE_CYCLE_NON_REM_SLEEP,0.5272070656038322,1,-0.5386901053478887,-0.9796936970580387,28174,6,"IL6, ADORA1"
GO_SKELETAL_MUSCLE_ORGAN_DEVELOPMENT,0.5272477134340526,1,0.29319508740254124,0.9644549015205585,20694,97,"ACTA1, MSC, BASP1, SIX1, HOXD10, HLX, FOXP2, KLHL31, NUPR1, FGFRL1, EGR2, ATF3, ASS1, FOS, GPCPD1"
GO_REGULATION_OF_INTERFERON_GAMMA_BIOSYNTHETIC_PROCESS,0.5274579933683544,1,-0.5187557646221976,-0.9732872452130668,28314,7,"TLR3, CD276, INHA, EBI3"
GO_PROTEIN_FOLDING_IN_ENDOPLASMIC_RETICULUM,0.5281088082901555,1,0.4958570325291388,0.96104451788385,24461,7,"HSPA5, VAPA, CANX, PDIA3, HSP90B1, CALR"
GO_ATP_HYDROLYSIS_COUPLED_TRANSMEMBRANE_TRANSPORT,0.5283951930235031,1,-0.3822733419676055,-0.9558703306087073,29810,27,"ATP12A, ATP6AP1L, ATP6V0E2, ATP1A3, ATP1A4, ATP6V1B1"
GO_REGULATION_OF_PLASMA_MEMBRANE_ORGANIZATION,0.5284027133863648,1,0.3103683572882271,0.9587320401391219,21654,66,"NRXN1, DAB2, WNK3, AGR2, DPP10, NKD2, PID1, LZTFL1, RER1, S100A9, EZR, TMBIM1, RHOG, TGFB1, BCL2L1, DLG1"
GO_BEHAVIORAL_RESPONSE_TO_PAIN,0.5284639171416863,1,-0.5183345479092126,-0.9724969603002476,28368,7,"THBS1, THBS4, TACR1, GIT2"
GO_REGULATION_OF_SKELETAL_MUSCLE_CELL_DIFFERENTIATION,0.528540199174156,1,0.4462853738635658,0.9539734214995295,23935,11,"SIX1, CYP26B1, GPC1, SIX4, MEF2C, DDX5, ARNTL"
GO_UROGENITAL_SYSTEM_DEVELOPMENT,0.5288201741218853,1,-0.27707157748496797,-0.9726034389280029,35229,256,"NOG, HOXC11, SOX11, ESR1, FOXF1, FOXC2, EPHA7, PLCE1, FBN1, GLI3, PROM1, GPC3, AR, COL4A1, SHH, TBX18, LRRK2, FOXA1, COL4A4, PDGFRB, LRP4, NPHP3, HMGCS2, GCNT4, PTPRO, MAGI2, SMAD9, FRAS1, FGF1, HOXA11, ADAMTS16, STAT1, LGR4, BCL2, SIX2, ID4, PBX1, UPK3A, CENPF, POU3F3, BMPER, EYA1, IRX1, DACT2"
GO_DENDRITE_MORPHOGENESIS,0.5294172342453335,1,0.34433625393364603,0.9512496605051258,22774,36,"SDC2, DCLK1, EPHB1, VLDLR, MAP2, SLITRK5, WNT7A, SEMA3A, DLG4"
GO_AMINO_ACID_TRANSPORT,0.5294234264001322,1,-0.3098334695096959,-0.9612042341952011,32045,92,"SLC1A2, SLC1A1, SLC16A10, SERINC4, SLC6A15, SLC3A1, PDPN, CACNB4, SYT1, SLC7A4, TRPC4, SLC13A3, APBA1, PPFIA4, PQLC2, SLC7A5P2, SLC6A6, SLC6A11, SLC16A12, CTNS, NFKBIE, SLC36A1"
GO_NEGATIVE_REGULATION_OF_NUCLEOTIDE_METABOLIC_PROCESS,0.5295033500691007,1,-0.35563587525746354,-0.9549998961430866,30267,39,"ADRA2A, DNAJC15, GABBR2, CBFA2T3, CCR2, PDE2A, EDN1, AKAP5, PPARGC1A, GPR87, EDNRB, EDNRA"
GO_NEGATIVE_REGULATION_OF_INTRINSIC_APOPTOTIC_SIGNALING_PATHWAY_BY_P53_CLASS_MEDIATOR,0.5296219378754382,1,0.409148231297737,0.9500264424256452,23716,16,"MIF, ZNF385A, MUC1, SIRT1, RRN3, TAF9B, BCL2L12, ING2"
GO_RESPONSE_TO_EPIDERMAL_GROWTH_FACTOR,0.5298214367264922,1,0.3705814023911628,0.9487687689758721,23202,25,"SNAI2, ERRFI1, ID1, SOX9"
GO_REGULATION_OF_T_CELL_MIGRATION,0.5299510121749154,1,-0.4103950492379234,-0.9552268840788762,29424,19,"CXCL10, S100A7, CCR2, ITGA4, PYDC1, XCL1"
GO_REGULATION_OF_DNA_METHYLATION,0.5300542482355716,1,-0.44592466623168375,-0.9589751777832672,29214,13,"BRCA1, MBD1, DNMT3A, DNMT1, MECP2, MBD3"
GO_EPITHELIAL_CELL_DEVELOPMENT,0.530131338230074,1,0.2752743549899698,0.9696229793043976,19414,160,"RARB, BASP1, GPR4, SLITRK6, HYDIN, PPP1R16B, VIM, WNT4, WNT5A, PROX1, JAG1, GJA1, XBP1, PDZD7, RILPL2, CLDN3, CXCR4, SMO, CITED1, ID1, CLIC5, SOX9, SIX3, WNT7A, SALL1, INSM1, TCF15, HOXA5, SLC4A7, RILPL1, PRDM1, RAPGEF3, WNT5B, CDK6, RAB25, C1GALT1, KLF5, EZR, GSTM3, PDE4D, PDGFB"
GO_CELLULAR_RESPONSE_TO_RADIATION,0.5302884490337347,1,0.2863270582586405,0.9646855104580072,20387,115,"PTN, SNAI2, CERS1, CNGA1, HIST3H2A, CRYAB, ATF4, TSPYL5"
GO_CALCIUM_ION_TRANSPORT,0.5305299539170507,1,-0.29419479037496454,-0.965395982430198,33155,140,"PKD1L1, TRPM8, CCR7, TMC1, SLC24A3, RYR2, ATP2A1, JPH3, CACNA1D, CTGF, TRPV6, CACNB4, CATSPER1, CACNG8, P2RX7, PDE2A, CYSLTR1, SLC8A2, TRPC4, ATP2B4, ITPR2, ATP2A3, TRPC1, MCOLN1, NALCN, MCOLN2, ATP2B3, ADRA1A, XCL1, GRIN2A, CACNG4, PRKCE, CACNB3, PKD2, CACNG6, TMEM37, ORAI2, ANXA6, DENND5B"
GO_REGULATION_OF_PEPTIDYL_THREONINE_PHOSPHORYLATION,0.5307081510290066,1,0.3570951427862602,0.9489596453337026,22924,30,"WNK3, WNT5A, DDIT4, RIPK2"
GO_AMINE_CATABOLIC_PROCESS,0.5310479708806433,1,-0.4264567508212038,-0.9570281213757282,29324,16,"KMO, HAAO, CHDH, AADAT"
GO_CARDIAC_CELL_FATE_COMMITMENT,0.5310584238126893,1,-0.49977063240491737,-0.9667152938766199,28759,8,"WNT3A, POU5F1, ISL1, TBX3"
GO_REGULATION_OF_EPITHELIAL_CELL_PROLIFERATION,0.531168278294715,1,-0.2791991800526626,-0.9710406749671583,34935,234,"NOG, SOX11, ESR1, SLURP1, CCR3, IL6, FLT4, TNFSF12, VASH1, GPC3, WNT3A, CCL2, NR4A3, SPARC, SHH, VASH2, TBX1, NKX2-8, DLL4, PAX6, CDH13, SEMA5A, PTPRM, KRT4, ATOH8, STXBP4, CCL26, LRG1, FGF1"
GO_BLASTOCYST_GROWTH,0.5314075363580314,1,-0.4318932186889244,-0.9563090053274365,29304,15,"GINS1, SALL4, BRCA2, GINS4, RAD51B, NBN, ZNF830"
GO_NEGATIVE_REGULATION_OF_GLYCOPROTEIN_METABOLIC_PROCESS,0.5314915896179124,1,0.42858751681273577,0.9500681141550552,23855,13,"PTX3, HBEGF"
GO_POSITIVE_REGULATION_OF_OSSIFICATION,0.5315122431401501,1,0.30617501190838714,0.9576559012761493,21597,71,"FBN2, CEBPA, PRKD1, CEBPB, WNT4, WNT5A, PTGER4, JAG1, GJA1, KL, TFAP2A, ZBTB16, NPPC, JUND, OSR1, PDLIM7"
GO_REGULATION_OF_SMOOTH_MUSCLE_CELL_APOPTOTIC_PROCESS,0.5315551321743273,1,-0.4729911394557665,-0.9613653367073474,29015,10,"IL12A, EDN1, ARRB1"
GO_REGULATION_OF_MUSCLE_CELL_DIFFERENTIATION,0.531772926681903,1,0.2834654346482195,0.9643547541305245,20242,123,"NEK5, BOC, PRICKLE1, MYLK3, DKK1, GDF15, SHOX2, RBM24, HEY2, CYP26B1, EREG, NKX2-5, DDIT3, IGFBP3, PROX1, XBP1, MAMSTR, MESP1, BTG1, CEACAM5, PPARD, SOX9"
GO_CHONDROCYTE_DEVELOPMENT,0.5318498538997527,1,0.3966952464342216,0.9457863329677383,23661,18,"SHOX2, SOX9, COL27A1, SULF2, MEX3C"
GO_CARDIOBLAST_DIFFERENTIATION,0.5328681520083026,1,0.4445744638278454,0.9503162039516538,24131,11,"TBX2, SRF"
GO_RESPONSE_TO_TOPOLOGICALLY_INCORRECT_PROTEIN,0.5330892251359647,1,0.2778845969121071,0.9668232115119026,19799,146,"CHAC1, ASNS, HSPB7, DDIT3, HERPUD1, ATF4, HSPA1L, STC2, XBP1, ATF3, RNF5, CREB3L2, WIPI1, PLA2G4B, PPP2R5B, STUB1, AARS, RNF126, RHBDD1, TBL2, HSPB1, F12, SEC61B, PDIA5, ZBTB17, STT3B, CTH, SEC61G, HSPA5, GSK3A, NFE2L2, DNAJB9, PPP1R15A, DERL1, CREB3, VAPB, GFPT1, CUL7, YIF1A, HSPE1, SRPRB, SERP1, DNAJB11, MANF, HDGF, ANKZF1, HYOU1, DERL2, GOSR2, SYVN1, UBXN4, LMNA, EIF2AK3, DNAJB2, FAF2
"
GO_PHOSPHOLIPID_EFFLUX,0.5334380316712473,1,0.4785280285211801,0.9534532161895587,24455,8,"APOC1, ABCA13, APOE"
GO_EMBRYONIC_SKELETAL_SYSTEM_MORPHOGENESIS,0.5336437016445055,1,-0.31728668301941276,-0.9572979586109414,31865,76,"NOG, HOXC11, SOX11, FOXC2, GLI3, TBX1, DLX2, HOXB4"
GO_REGULATION_OF_EXCRETION,0.5340217055390936,1,-0.45245045771332104,-0.9562897613230315,29375,12,"ADORA1, EDN1, STC1, EDNRB, TACR1"
