pathway,pval,padj,ES,NES,nMoreExtreme,size,leadingEdge
GO_LYMPHOCYTE_MEDIATED_IMMUNITY,0.7595674015721748,1,-0.27798511024897904,-0.8482019063997449,45510,82,"CADM1, BATF, VAMP7, POU2F2, C1S, C2, C3, ICAM1, C1R, IRF7, RAET1G, RAB27A, CLU, MSH2, IL31RA, BTN3A3, SUSD4, SLAMF7, MICB, C5, BTN3A2, C4BPB, CD74, HLA-DRB1, ULBP3"
GO_REGULATION_OF_KIDNEY_DEVELOPMENT,0.7597418327796235,1,-0.29712501794784013,-0.8231374719879555,43906,46,"NOG, PROM1, SHH, C3AR1, PDGFRB"
GO_POSITIVE_REGULATION_OF_NITRIC_OXIDE_SYNTHASE_ACTIVITY,0.7598537253206514,1,-0.34209116727843336,-0.787198553872191,42180,18,"ESR1, NOS1AP, DHFRP1, NOD1, GCH1, DHFR, TERT, CALM3, CALM1"
GO_VESICLE_CYTOSKELETAL_TRAFFICKING,0.760174087008406,1,-0.3070879287825409,-0.812700462824467,43316,36,"VAMP7, RASGRP1, WDR81, HTT, KIF13A, DTNBP1, NDE1, FYCO1, AP3S1, AP3B2, KIF3B"
GO_NEGATIVE_REGULATION_OF_REPRODUCTIVE_PROCESS,0.7610782349377941,1,0.2936241037355599,0.8202089031089569,32666,38,"HORMAD1, WNT4, NKX3-1, WNT5A, DUSP1, LIF, RPS6KA2, NPPC"
GO_MALE_GENITALIA_DEVELOPMENT,0.7612170473719542,1,-0.3605568692040406,-0.7753890150725101,41955,13,"SHH, DHCR24, LGR4, TBX3"
GO_REGULATION_OF_RESPONSE_TO_REACTIVE_OXYGEN_SPECIES,0.7612293561776914,1,-0.3182321358280221,-0.8023723105526919,43096,28,"NR4A3, LRRK2, GPR37, GPR37L1, DHFRP1, SZT2"
GO_REGULATION_OF_OXIDATIVE_STRESS_INDUCED_NEURON_DEATH,0.761867990439419,1,-0.3859153823871017,-0.7656182519383267,41437,9,NR4A3
GO_REGULATION_OF_HETEROTYPIC_CELL_CELL_ADHESION,0.7619185206587692,1,0.35230955186884916,0.7673150006125886,34280,12,"IL1B, MAP2K5"
GO_NEGATIVE_REGULATION_OF_RECEPTOR_MEDIATED_ENDOCYTOSIS,0.7626254757506288,1,0.34308977148966063,0.7737494658439406,34263,14,"APOC1, DLG4, UNC119, ATXN2, PICALM, ANXA2, RAC1"
GO_REGULATION_OF_ESTABLISHMENT_OF_PLANAR_POLARITY_INVOLVED_IN_NEURAL_TUBE_CLOSURE,0.7627047916250884,1,-0.3600110594223152,-0.7742152337769178,42037,13,"NPHP3, FZD2, CELSR1, PTK7"
GO_POSITIVE_REGULATION_OF_APOPTOTIC_SIGNALING_PATHWAY,0.7628499280458334,1,0.2530107454782167,0.8874753663856546,28094,155,"SRPX, INCA1, HRK, RET, DDIT3, NKX3-1, BNIP3, BBC3, INHBB, PLEKHF1, TNFRSF12A, ATF3, TRADD, CIDEB, LCK, INHBA, BIK, RIPK3, BMF, S100A9, HTRA2, RBCK1, AGT, MFF, MAPK8, APOPT1, PPP3CC, PMAIP1, BCL2L1, GSK3A, PPP3R1, TFAP4, NFATC4, BCL2L14, FADD, PRKRA, TGFBR1, STK3, PTPN2, MOAP1, CRADD, SIRT1, PINK1, PLAUR, YWHAE, BCL10, PIAS4, RPS3, SLC9A3R1, PDCD5, SKIL"
GO_REGULATION_OF_RNA_SPLICING,0.7629660953707619,1,0.2676684444968121,0.854589630653879,30671,80,"SRSF12, HSPA1A, AFF2, RPS26, RPS13, MAGOH, CLK4, SNRNP70, RBM42, C1QBP, AKAP17A, CLK3, CLK1, ESRP2, DDX5, NSRP1, RBM5, SFSWAP, ESRP1, SRSF6, RBMX, SRSF10, SAP18, PTBP1, SRSF9, SNW1, RBM22, SRSF7, SRSF3, SF3A1, ACIN1, RBM20, PTBP2, SRSF2, CLK2, YTHDC1, DAZAP1"
GO_PHENOL_CONTAINING_COMPOUND_BIOSYNTHETIC_PROCESS,0.7633996109790361,1,-0.3379462640593678,-0.7865966156340675,42386,19,"PNMT, GPR37, NR4A2"
GO_DRUG_TRANSMEMBRANE_TRANSPORT,0.7634399019717054,1,0.3471883819678856,0.7696272018508128,34266,13,"SLC47A1, SLC47A2, SLC22A18, SLC22A3, SLC31A1"
GO_PURINE_NUCLEOTIDE_TRANSPORT,0.7643289662005945,1,0.36197885508246885,0.7570416300953902,34711,10,"GJA1, GJB1, SLC25A6, ABCC11"
GO_UNSATURATED_FATTY_ACID_BIOSYNTHETIC_PROCESS,0.7645550763048035,1,-0.29687367992025937,-0.8193617243388881,44136,45,"PLA2G1B, EDN2, ELOVL5, PTGS1, PTGIS, AKR1C3, ALOX15, GGT5, SYK, EDN1"
GO_CEREBELLAR_PURKINJE_CELL_LAYER_FORMATION,0.7650831043057191,1,0.3748716297472841,0.7469208483886114,35075,8,"LHX5, RORA, ATP7A"
GO_REGULATION_OF_OXIDOREDUCTASE_ACTIVITY,0.7655944433205206,1,-0.2813982811003786,-0.8381222950867337,45411,70,"CNR1, ESR1, EDN2, LRRK2, NOS1AP, SIRT4, DHFRP1, ATP2B4, EDN1, CYGB, SZT2"
GO_INNATE_IMMUNE_RESPONSE_ACTIVATING_CELL_SURFACE_RECEPTOR_SIGNALING_PATHWAY,0.7658505859536873,1,-0.2748962227155719,-0.8487916221001645,46202,89,"CLEC7A, CARD9, PRKACB, SYK, PSMB9, EP300, NFKB1, LYN, PDPK1, CREBBP, PSME2, PRKACA, PSMD9, TRAF6, PSMB8, BTRC, NFKBIA"
GO_INTESTINAL_EPITHELIAL_CELL_DEVELOPMENT,0.766420786083893,1,0.36106088682242943,0.7551217936789847,34806,10,"HOXA5, PRDM1, C1GALT1, KLF5, CDKN1A, HIF1A, YIPF6"
GO_GLYCOLIPID_CATABOLIC_PROCESS,0.7668281092936123,1,-0.3688551070170091,-0.7648225906268016,41956,11,"GBA3, GBA"
GO_HISTONE_UBIQUITINATION,0.7672973686526445,1,-0.3104959595828554,-0.8036799579103489,43593,32,"RAG1, DTX3L, HUWE1, PHC1, CUL4B, DDB2, RNF20, BCOR, RNF168, KDM2B, RNF40, USP22, SUZ12, CBX8, UBE2A"
GO_MULTI_ORGANISM_ORGANELLE_ORGANIZATION,0.7673803953783238,1,-0.3265317499448643,-0.7912192193487665,42970,23,"VPS37D, CHMP6"
GO_REGULATION_OF_CELLULAR_RESPONSE_TO_GROWTH_FACTOR_STIMULUS,0.7675743611227482,1,0.24974078699985033,0.8957008456560576,27482,185,"SOSTDC1, FBN2, IL1B, DAB2, RASL11B, DKK1, FOXD1, DKK3, FLT1, FGF9, WNT4, RNF165, WNT5A, VEGFA, FGFBP3, FUZ, PRDM16, CDKN2B, CDKN1C, PMEPA1, CITED1, CCBE1, RPS27A, HTRA1, VWC2, GATA4, FGF2, FGFBP1, FSTL3, PPP2R5B, STUB1, ZEB1"
GO_RESPONSE_TO_FLUID_SHEAR_STRESS,0.768215528452427,1,-0.30776503176435566,-0.8055947153259624,43712,34,"MMP13, PDGFRB, ABCA1, P2RX7, TGFB3"
GO_NEURAL_CREST_CELL_DIFFERENTIATION,0.7683061221029788,1,-0.28380867736755444,-0.8346579674648785,45316,65,"SOX11, FOXC2, ERBB4, SEMA3G, SHH, TBX1, SEMA5A, SEMA6A, EDN1, ISL1, SEMA3D, EDNRB, EDNRA, TWIST1, SEMA6D, SEMA4D, NRG1"
GO_POSITIVE_REGULATION_OF_MEMBRANE_PROTEIN_ECTODOMAIN_PROTEOLYSIS,0.7685287861986221,1,-0.36305827424870274,-0.7673523244563218,42275,12,ADRA2A
GO_ZINC_II_ION_TRANSPORT,0.7685590299480329,1,-0.32621610464992135,-0.790454379103069,43036,23,"SLC39A2, SLC30A3"
GO_NUCLEOTIDE_TRANSMEMBRANE_TRANSPORT,0.7687651111636278,1,-0.36297034838102915,-0.7671664861936385,42288,12,"SLC25A42, SLC35D1, SLC35A3, SLC35E3, SLC25A17, SLC35B4"
GO_AGING,0.7688043884086275,1,0.24692130937987317,0.9012156185645366,26768,215,"GNAO1, NOS1, ALOX12, IL1B, TBX2, SNCA, KRT83, ALDH3A1, FOXG1, CRYAB, DDIT3, ATP8A2, KRT16, PENK, RNF165, MAGEA2B, BBC3, APOD, SOCS3, PLA2R1, ASS1, FOS, ENO3, CDKN1C"
GO_REGULATION_OF_PLATELET_DERIVED_GROWTH_FACTOR_RECEPTOR_SIGNALING_PATHWAY,0.7695468014324929,1,-0.36264614502066345,-0.7664812567970961,42331,12,"F7, NDRG4, LRP1"
GO_HEPATOCYTE_APOPTOTIC_PROCESS,0.7696530571422221,1,0.349155043548235,0.760444617618075,34628,12,"KRT8, KRT18, BCL2L1, STK3, BID, RB1, GSN"
GO_POSITIVE_REGULATION_OF_SMOOTH_MUSCLE_CELL_PROLIFERATION,0.7698757015459835,1,-0.29231289907599356,-0.822239097095574,44718,50,"IL6, NR4A3, C3AR1, CDH13, PDGFRB, SERPINF2, STAT1, EDN1, PPARGC1A"
GO_NUCLEAR_PORE_COMPLEX_ASSEMBLY,0.7703181768138281,1,0.3596629142821206,0.7521980775671614,34983,10,"RTN4, TMEM33, NUP205, NUP93, AHCTF1, TPR, NUP153, NUP98, NUP107, TMEM170A"
GO_BENZENE_CONTAINING_COMPOUND_METABOLIC_PROCESS,0.7704600592045227,1,0.3401016214594236,0.7670104730732769,34615,14,"UGT1A1, PON3, STAR"
GO_NUCLEAR_PORE_ORGANIZATION,0.7713280954394711,1,0.33974963829653393,0.7662166668834582,34654,14,"SEH1L, RTN4, NUP54, TMEM33, NUP133, NUP205, NUP93, AHCTF1, TPR, NUP153, NUP98, NUP107, TMEM170A, NUP35"
GO_POSITIVE_REGULATION_OF_ORGANIC_ACID_TRANSPORT,0.77164829623226,1,-0.3354134852948394,-0.7807013730579344,42844,19,"MAP2K6, P2RX7, DPYSL2, CCK, ABAT, TNFRSF11A, EDN1"
GO_NEGATIVE_REGULATION_OF_RESPONSE_TO_EXTRACELLULAR_STIMULUS,0.77165576458557394,1,-0.31354722622473197,-0.7960655040854059,43765,29,"UCN, LRRK2, LZTS1, CCK"
GO_RECEPTOR_CATABOLIC_PROCESS,0.7718005404077622,1,0.3323605234057553,0.7717283407345906,34561,16,"GPRASP1, TGFB1"
GO_TRANSMEMBRANE_RECEPTOR_PROTEIN_SERINE_THREONINE_KINASE_SIGNALING_PATHWAY,0.7718509813885537,1,-0.26226401587945763,-0.8674549956750053,48604,149,"NOG, GDF9, CCL2, RYR2, POU5F1, PARD6A, LRP4, CHRDL1, GCNT2, ATOH8, MAGI2, SMAD9, CHRD, AKAP3, LNPEP, MSX1, BMP1, ETV2, TGFB3, GREM2, RBM14, GDF1, INHA, COL3A1"
GO_URETER_DEVELOPMENT,0.7723110865968009,1,-0.38103593403033564,-0.7559379051788309,42005,9,"FOXF1, NPHP3"
GO_REACTIVE_OXYGEN_SPECIES_BIOSYNTHETIC_PROCESS,0.7724961009018784,1,0.3171702389647595,0.7826861718519975,34175,21,"NOS1, RORA, DUOX2, DUOX1, SLC7A2"
GO_NEGATIVE_REGULATION_OF_CELL_KILLING,0.772556561496453,1,-0.3557744732324261,-0.7651043204269661,42580,13,"TAP1, LGALS9, SERPINB4, IGF2, HLA-B, HLA-E"
GO_NATURAL_KILLER_CELL_DIFFERENTIATION,0.7727155727155727,1,-0.38086642858159026,-0.7556016230007022,42027,9,PIK3CD
GO_PYRIMIDINE_NUCLEOTIDE_METABOLIC_PROCESS,0.7727593175729661,1,0.28721185910550734,0.8178848063834346,32883,42,"NME5, NT5M, NME2P1, AK5, DHODH, ERH, NEIL1, AK3, NME7, UMPS, NME2, SMUG1, NT5C, NTHL1, TDG"
GO_REGULATION_OF_TRANSCRIPTION_REGULATORY_REGION_DNA_BINDING,0.7729409312987705,1,0.298647080001881,0.8048422036529568,33380,32,"ZBTB7C, HEY2, DDIT3, HAND1, HEY1, LIF, LHX2, ID1, HAND2"
GO_CYTOKINESIS,0.7730592462605499,1,-0.2761439885092492,-0.8408689637831142,46255,81,"ZNF365, KIF4B, KLHL13, ESPL1, BRCA2, MYH10, APC, KIF20A, ARHGEF11, CIT, SPTBN1, INCENP, MYH9, KIF13A, RAB11FIP3, ROCK2, NUSAP1, SPIRE2, CKAP2, RAB11FIP4, STMN1, SPAST, ANLN, AURKB, RACGAP1"
GO_NEGATIVE_REGULATION_OF_TYPE_2_IMMUNE_RESPONSE,0.7731754133403133,1,0.370860656396048,0.7389291003323794,35446,8,"HLX, ANXA1, NDFIP1"
GO_NEGATIVE_REGULATION_OF_RETINOIC_ACID_RECEPTOR_SIGNALING_PATHWAY,0.7732855304283875,1,-0.3805458976615877,-0.7549657211064927,42058,9,"CYP26A1, ZNF536"
GO_REGULATION_OF_TRANSCRIPTION_FROM_RNA_POLYMERASE_III_PROMOTER,0.7734183202324376,1,0.31936661888668766,0.7796418869001179,34338,20,"CEBPA, POLR3F, POLR3G, ZNF345"
GO_POSITIVE_REGULATION_OF_CYTOSKELETON_ORGANIZATION,0.7735975386185018,1,-0.2626508019684172,-0.8650696099443786,48526,144,"NTF3, WIPF3, CCR7, IQGAP2, SEMA5A, CTGF, RGS2, SERPINF2, ICAM1, CCL26, P2RX7, ALOX15, AMOT, EDN1, SORBS3, PSRC1, ACTR3C, PPM1E, PYDC1, NOX4, TACR1, PRKCE, PDXP, EP300"
GO_REGULATION_OF_DENDRITE_DEVELOPMENT,0.7735988321551003,1,-0.2703877806616404,-0.8508502840377681,47163,102,"DISC1, OBSL1, VAMP7, SARM1, KIAA0319, LRRK2, CPEB3, PACSIN1, PREX1"
GO_NUCLEOSIDE_DIPHOSPHATE_METABOLIC_PROCESS,0.7744203256043414,1,0.269591493841471,0.8451408335703716,31394,72,"PFKFB1, NME5, AK8, ENTPD3, HK2, ENO3, NME2P1, AK5, ENTPD8, NUDT9, PFKP, DLG4, AK1, HK1, DLG1, AMPD3, PGM1, ALDOC, MPP3, AK3, NME7, NUDT16"
GO_NEGATIVE_REGULATION_OF_WOUND_HEALING,0.7751418526125248,1,-0.2981298932643029,-0.8083385200159122,44534,41,"HRG, PRKG1, GP1BA, SERPINF2, ADRB2, ABAT, EDN1"
GO_MULTIVESICULAR_BODY_ORGANIZATION,0.7753542821934689,1,-0.3109120364741897,-0.794923208024763,44043,30,"VPS37D, RAB27A, CHMP6"
GO_REGULATION_OF_LIPOPOLYSACCHARIDE_MEDIATED_SIGNALING_PATHWAY,0.7759856305677014,1,-0.35444258626836894,-0.7622400551488477,42769,13,LY96
GO_RESPONSE_TO_VITAMIN_A,0.776040060235499,1,-0.3544251694132492,-0.7622025996479532,42772,13,"CYP1A1, RXRA, AGER, CAT, PITX2, DNMT3A, DNMT1, RARA, DNMT3B"
GO_POSITIVE_REGULATION_OF_CIRCADIAN_RHYTHM,0.7761651812504168,1,0.3464777814910223,0.7546136563904471,34921,12,"PTGER4, RORA, NLGN1"
GO_POSITIVE_REGULATION_OF_CELL_SIZE,0.7763666382422846,1,-0.35426623307084754,-0.7618608019884991,42790,13,"AMOT, EDN1, PRR16, EP300"
GO_OOCYTE_MATURATION,0.7765329653369164,1,-0.3505818169659955,-0.765252217895258,42765,14,"DMC1, INSL3, BRCA2, FBXO5"
GO_NEGATIVE_REGULATION_OF_INTRACELLULAR_ESTROGEN_RECEPTOR_SIGNALING_PATHWAY,0.7768483639855233,1,-0.38726202079906924,-0.7490878694542964,42070,8,"ISL1, BRCA1, KANK2, CNOT1"
GO_POSITIVE_REGULATION_OF_TISSUE_REMODELING,0.7774331310406833,1,0.32417724791374686,0.7728915667426723,34587,18,"SPP1, IL23A, PTGER4, IL18, TMBIM1"
GO_LIPID_HOMEOSTASIS,0.7776058919473356,1,-0.2783913422132093,-0.834531519186654,46244,73,"ACOXL, PRKAA2, NR5A2, LCAT, ABCA1"
GO_CARBOHYDRATE_CATABOLIC_PROCESS,0.7778237552966102,1,-0.2726827277765952,-0.8431856358395589,46992,90,"MGAM, PGM5, ENO4, FUT5, GLYCTK, CPS1, DHDH, PFKFB4, PGAM4"
GO_EMBRYONIC_HINDLIMB_MORPHOGENESIS,0.7782355878995434,1,-0.32156205604673527,-0.7857552345048793,43630,24,"MMP13, GPC3, SHH"
GO_QUINONE_METABOLIC_PROCESS,0.7788571021918588,1,-0.3188737731364473,-0.7858521289931819,43777,25,"AKR1C2, AKR1C3"
GO_POST_GOLGI_VESICLE_MEDIATED_TRANSPORT,0.7790522690031101,1,-0.27573538227949973,-0.8366206291035853,46591,79,"RAB26, RAB34, VAMP7"
GO_POSITIVE_REGULATION_OF_HISTONE_METHYLATION,0.7799992910064164,1,-0.3147348279918319,-0.7869910115576962,44005,27,HIST1H1B
GO_COENZYME_A_METABOLIC_PROCESS,0.7802828634034153,1,-0.34128450466486027,-0.7658897830204483,43087,16,"ACACB, PANK1, DCAKD"
GO_REGULATION_OF_OLIGODENDROCYTE_DIFFERENTIATION,0.7803664734092047,1,-0.3254867993500064,-0.7812855524234317,43609,22,"SHH, DLX2, ID4, DLX1, TP73"
GO_REGULATION_OF_MAST_CELL_ACTIVATION_INVOLVED_IN_IMMUNE_RESPONSE,0.7808040810502284,1,-0.32071146540418977,-0.783676767729235,43774,24,"FOXF1, VAMP7, SYK, LGALS9, ZAP70"
GO_POSITIVE_REGULATION_OF_NATURAL_KILLER_CELL_ACTIVATION,0.7808545022061627,1,-0.34896510575329875,-0.7617232503865629,43003,14,"IL12A, RASGRP1"
GO_POSITIVE_REGULATION_OF_NF_KAPPAB_IMPORT_INTO_NUCLEUS,0.7810069678579457,1,0.3231111340741283,0.7703497770238328,34746,18,"IL1B, IL23A, IL18R1, EDAR, IL18, RBCK1"
GO_VENTRICULAR_SEPTUM_MORPHOGENESIS,0.781314277608341,1,-0.316172502716778,-0.7852904233789748,44062,26,"SOX11, ZFPM2, RBM15, FZD2"
GO_CELLULAR_RESPONSE_TO_EPINEPHRINE_STIMULUS,0.7815955405281916,1,-0.3623763267217691,-0.7513888128771042,42764,11,"KCNQ1, RYR2, ATP2B4, SLC9A1, PDE4B"
GO_NEUROLOGICAL_SYSTEM_PROCESS_INVOLVED_IN_REGULATION_OF_SYSTEMIC_ARTERIAL_BLOOD_PRESSURE,0.7816144874155924,1,0.3602080393371426,0.736229665639164,35650,9,"NAV2, RPS6KA2, AGT"
GO_RENAL_FILTRATION,0.7817890540590887,1,-0.39448272319325123,-0.7401267207517778,41967,7,"MCAM, EDNRA"
GO_DETECTION_OF_MECHANICAL_STIMULUS_INVOLVED_IN_SENSORY_PERCEPTION,0.7817981246552675,1,-0.37670727766312134,-0.7473502756818962,42521,9,"TMC1, KIT"
GO_SPERMATID_DIFFERENTIATION,0.7822988121131003,1,-0.27544264108122546,-0.8342391509175016,46757,78,"CATSPERB, DMC1, DPY19L2P2, TSSK6, TDRD5, KIT, SPAG16, SEPT4, FAM9C, DMRTC2, QKI, CABYR, SMARCA2, HSPA2, NPHP1, TTLL5, BBS2, PYGO2"
GO_REGULATION_OF_SEQUESTERING_OF_TRIGLYCERIDE,0.7823140556909668,1,-0.3847660284352428,-0.7442598266781548,42366,8,"ABHD5, LPL"
GO_RESPONSE_TO_YEAST,0.7829983907787882,1,-0.4035683564533655,-0.7339532900722205,41844,6,IL6
GO_POSITIVE_REGULATION_OF_LAMELLIPODIUM_ASSEMBLY,0.7831440446291645,1,0.3436636804526689,0.748484665766963,35235,12,"RAC2, TWF2, ARPC2, RAC1, WASF2, NCKAP1, FSCN1, BRK1"
GO_MUSCLE_ORGAN_MORPHOGENESIS,0.7834844770541546,1,-0.28699377107814134,-0.8161210376265541,45702,53,"FOXC2, ZFPM2, TBX20, TBX1, RYR2, DLL4, TNNI1, HEG1, FZD2, MYLK, ISL1, COL3A1"
GO_REGULATION_OF_COLLATERAL_SPROUTING,0.7837598015247822,1,-0.33994496486725734,-0.76288366984827,43279,16,"EPHA7, WNT3A"
GO_REGULATION_OF_LIPASE_ACTIVITY,0.784153052303156,1,-0.2868929491034224,-0.8158343312833674,45741,53,"ESR1, PLA2G1B, PDGFRB, RGS2, KIT, RASGRP1, LRP1, ABHD5, EDNRA, ADRA1A, PTAFR, SORT1, PRKCE, TXK"
GO_CELL_MIGRATION_IN_HINDBRAIN,0.7845375988233131,1,-0.3753035384131842,-0.7445653947474635,42670,9,"PLXNA2, CEND1"
GO_NEURONAL_STEM_CELL_POPULATION_MAINTENANCE,0.7846595754230061,1,0.32460302911397265,0.7640721136662669,34965,17,"SOX2, PROX1, JAG1, FOXO1"
GO_GAS_TRANSPORT,0.785333504314214,1,-0.3658828668643496,-0.7436653166552393,42868,10,"IPCEF1, CYGB, AQP5, HBQ1"
GO_REGULATION_OF_MEIOTIC_NUCLEAR_DIVISION,0.7860737114103087,1,0.3116034111595697,0.7765004590285459,34679,22,"HORMAD1, WNT4, WNT5A, LIF, RPS6KA2"
GO_CLATHRIN_COAT_ASSEMBLY,0.7866570200824344,1,0.3576609111158227,0.7310235870569832,35880,9,"SNAP91, FCHO1, AP2S1, PICALM, PIK3C2A"
GO_SMALL_MOLECULE_CATABOLIC_PROCESS,0.7869082442839234,1,-0.2513226819367596,-0.8866852569098028,52725,269,"ENPP2, MTMR7, IL4I1, ACOXL, PGM5, KMO, ADH7, FUT5, GLYCTK, HAAO, NPL, DDO, CYP26A1, FTCD, CYP1A1, DHDH, CHDH, OXCT2, AKR1C3, SDS, PFKFB4, SYNJ1, AADAT, CYP39A1, LPIN3, PRODH, GPT, PPM1K, ABAT, HADH, KHK, AMACR, CPT1C, ACADSB"
GO_REGULATION_OF_MYOTUBE_DIFFERENTIATION,0.7870799943764938,1,0.2861943811367231,0.8072099026526119,33590,40,"GDF15, SHOX2, RBM24, CYP26B1, NKX2-5, XBP1, MAMSTR, CEACAM5"
GO_NEGATIVE_REGULATION_OF_MEGAKARYOCYTE_DIFFERENTIATION,0.7883161512027491,1,0.380889488620776,0.7129219157347539,36703,6,"HIST1H4C, HIST1H4J, PRMT1"
GO_MACROMOLECULAR_COMPLEX_REMODELING,0.788759937859819,1,-0.3593893244280463,-0.745195251261627,43156,11,"LCAT, ABCA5, LPL, APOM"
GO_REGULATION_OF_BONE_REMODELING,0.7890427922762923,1,0.3036060830151419,0.7837014347121061,34406,26,"SPP1, PTGER4, GJA1"
GO_NUCLEOTIDE_EXCISION_REPAIR_DNA_DAMAGE_RECOGNITION,0.7894102942847404,1,0.30878518174583364,0.777229939112838,34737,23,"COPS7A, RPS27A, COPS3, UBA52, RAD23B, COPS2, RBX1, COPS7B, COPS4"
GO_BRANCHED_CHAIN_AMINO_ACID_METABOLIC_PROCESS,0.7894530064110578,1,-0.3202996708106406,-0.7761182658018823,44206,23,"GHR, PPM1K, ACADSB"
GO_POSITIVE_REGULATION_OF_LIPID_BIOSYNTHETIC_PROCESS,0.7899047935611007,1,0.27950353756349067,0.812395778645239,33269,47,"IL1B, WNT4, XBP1, SMPD2, FABP3, MID1IP1, ANXA1, PLA2G4A"
GO_CLATHRIN_MEDIATED_ENDOCYTOSIS,0.7900202411335034,1,-0.3044868295042961,-0.7881260762588692,44884,32,"PACSIN1, SYT1, SYNJ1, ITGA4, OPHN1, SYT12, PIP5K1C, HIP1, CDK5"
GO_REGULATION_OF_CELL_MATRIX_ADHESION,0.7905398687611851,1,0.26431145082184926,0.8400286463636357,31804,78,"EPHA3, SEMA3E, ARHGAP6, WNT4, APOD, VEGFA"
GO_POSITIVE_REGULATION_OF_ORGANELLE_ASSEMBLY,0.7907118421669244,1,0.28538894557184535,0.8049381754393257,33745,40,"LCP1, MYLK3, FUZ, PROX1, PIP4K2A, CAPG, BBS4, ARHGEF5, RAB3GAP1"
GO_REGULATION_OF_HISTONE_DEACETYLATION,0.7915136678906569,1,0.30981505756985606,0.7720439693574271,34919,22,"PRKD1, VEGFA, CAMK2D, AKAP8, MAPK8, JDP2, TGFB1"
GO_NEGATIVE_REGULATION_OF_KIDNEY_DEVELOPMENT,0.7926061118653877,1,0.33178360305529053,0.7482513527732653,35610,14,"SIX1, CITED1, OSR1"
GO_LEUKOCYTE_ADHESION_TO_VASCULAR_ENDOTHELIAL_CELL,0.7929620034542314,1,0.36733136307788944,0.7119426963296372,36729,7,"ITGB7, GCNT1, GOLPH3"
GO_ENDOCRINE_PROCESS,0.7929915984260343,1,-0.31094680751205817,-0.7775191075799904,44738,27,"EDN2, OXTR, SERPINF2, EDN1, TACR1, NKX2-1, TBX3, PCSK5"
GO_BILE_ACID_METABOLIC_PROCESS,0.7930323224080874,1,0.3093340327524109,0.7708452790409113,34986,22,"SLCO1A2, SLCO1B3, AKR1C1, STAR, FABP6"
GO_REGULATION_OF_RETROGRADE_PROTEIN_TRANSPORT_ER_TO_CYTOSOL,0.793048902751476,1,0.33552136572746105,0.7437644324454227,35595,13,"BRSK2, UBE2J1, ERLEC1, DERL2"
GO_SPINDLE_LOCALIZATION,0.7930674219910847,1,0.28973881236456717,0.795923413214845,34158,35,"FMN2, NDEL1"
GO_MITOTIC_SISTER_CHROMATID_COHESION,0.7934021749063328,1,-0.35754716981132073,-0.7413755360414872,43410,11,"PDS5B, DSCC1, NIPBL, SMC1A, CDCA5, PDS5A, MAU2, POGZ, SMC3, RB1, NAA50"
GO_2_OXOGLUTARATE_METABOLIC_PROCESS,0.7939724744199452,1,-0.33045213013776675,-0.7604155378753465,44074,18,"GHR, AADAT, ADHFE1"
GO_MITOTIC_CHROMOSOME_CONDENSATION,0.7940925667217011,1,-0.34711155591198817,-0.746474441197158,43767,13,"NCAPD2, TTN, NUSAP1, SMC4, NCAPD3, NCAPH, NCAPG"
GO_FC_RECEPTOR_SIGNALING_PATHWAY,0.794138997601313,1,-0.25812350333613726,-0.8607816582271834,50322,159,"VAV3, WIPF3, ELMO1, CYFIP2, NR4A3, KIT, MAP3K1, PIK3R1, PLCG1, PIK3R2, SYK, ELMO2, PSMB9"
GO_NEGATIVE_REGULATION_OF_CALCIUM_ION_IMPORT,0.7943196004993758,1,0.3282430212905243,0.750446694466817,35629,15,"FKBP1B, TGFB1, SRI, GSTO1, SLC30A1, NTSR1, CALM2, FKBP1A, GSTM2"
GO_REGULATION_OF_CELLULAR_RESPONSE_TO_INSULIN_STIMULUS,0.7946774640088593,1,-0.2894728495016695,-0.8019383597977036,45925,46,"ENPP1, SOCS1, PIK3R1, PIK3R2, CISH, GPLD1, VWA2, TSC1, IGF2, PIK3R3"
GO_NEGATIVE_REGULATION_OF_INTERLEUKIN_1_PRODUCTION,0.7951903629453471,1,0.33854036087490724,0.7373262968152973,35777,12,"NLRP3, PTGER4, ERRFI1"
GO_MACROMITOPHAGY,0.79562162778946,1,-0.265433611490059,-0.84212143754545,48808,108,"MAP1A, REP15, PRKG1, SERPINB10, CD163L1, DKKL1, DZANK1, STAT2, PLOD2, FAM131B, MYOM1, CSPG5, NR2C2, MYLK, NEFM, ALPK1, GABRA5, FAM13B, MAP3K12, TMEM39B, C5"
GO_CELL_DIFFERENTIATION_IN_HINDBRAIN,0.7961645026348672,1,-0.33533232509958943,-0.7525322661879139,43964,16,NOG
GO_NEGATIVE_REGULATION_OF_PROTEIN_POLYMERIZATION,0.7963989575929874,1,0.27902757278071416,0.8082097386156887,33615,46,"PFN4, SNCA, SCIN, AVIL, SGK1, EML2"
GO_NEGATIVE_REGULATION_OF_INTRACELLULAR_STEROID_HORMONE_RECEPTOR_SIGNALING_PATHWAY,0.796748153923772,1,0.3016441212190914,0.7786370030013012,34742,26,"DAB2, NR0B1, PHB2, SIRT1, CYP7B1, PIAS2, ARNTL, STRN3"
GO_REGULATION_OF_ACTIN_CYTOSKELETON_REORGANIZATION,0.7972138984018264,1,-0.31595774960126116,-0.772060791884881,44694,24,"NTF3, ARHGDIB"
GO_TONGUE_DEVELOPMENT,0.7978551193848644,1,0.31426728261547465,0.758869765088608,35486,19,"SIX1, CYP26B1, PRDM16, BNC2, HAND2, KRT13, SIX4, WNT10B"
GO_DETECTION_OF_MECHANICAL_STIMULUS,0.7982482959552543,1,-0.32362315214945553,-0.7612155837615003,44384,20,"PKD1L1, TMC1"
GO_NEGATIVE_REGULATION_OF_JNK_CASCADE,0.7985036528474606,1,-0.30457288072001726,-0.7787155948187245,45358,30,"DUSP19, DACT1, MAPK8IP1"
GO_POSITIVE_REGULATION_OF_TELOMERE_MAINTENANCE_VIA_TELOMERE_LENGTHENING,0.7986431101951976,1,0.29251037065647967,0.7883040119093798,34490,32,"PKIB, PNKP, CCT4, HMBOX1, TCP1, CCT2, CCT6A, MAP2K7, CCT5, PRKCQ, CCT8, HNRNPA1, CCT7, CCT3, POT1"
GO_POSITIVE_REGULATION_OF_PHOSPHATASE_ACTIVITY,0.7993759078926131,1,-0.3214926678140311,-0.7645588950569789,44573,21,"PDGFRB, MAGI2, GPLD1, JAK2, NPNT, CALM3, CALM1"
GO_THYROID_GLAND_DEVELOPMENT,0.7994297089363533,1,-0.32147037356742225,-0.7645058759176335,44576,21,"SHH, TBX1, FOXE1, HHEX, NKX2-1, THRA, PAX8"
GO_POSITIVE_REGULATION_OF_GLYCOGEN_METABOLIC_PROCESS,0.7994509989274482,1,-0.34948521146722394,-0.738664584734889,43976,12,"C1QTNF2, INSR, SORBS1, IGF2"
GO_TETRAHYDROFOLATE_INTERCONVERSION,0.7996958982908018,1,-0.3595498942575883,-0.7307934046159085,43652,10,"FTCD, SARDH"
GO_CENTROSOME_LOCALIZATION,0.8000036218105431,1,-0.33388794317990056,-0.7492908727465226,44176,16,"PLXNA2, SYNE2, NIN"
GO_REGULATION_OF_STEROID_HORMONE_SECRETION,0.8004725417890344,1,0.3407559174307751,0.7283951199956324,36250,11,"REN, NKX3-1, GAL, AGT"
GO_PTERIDINE_CONTAINING_COMPOUND_BIOSYNTHETIC_PROCESS,0.8006074004600165,1,0.32223572743244877,0.7482189542506338,35851,16,"MTHFD2, PTS, ATIC, MTHFS, MTHFD1L, FPGS, SPR, PCBD2"
GO_RESPONSE_TO_PURINE_CONTAINING_COMPOUND,0.8006781302978929,1,-0.2621846906066267,-0.8462610879916991,49589,123,"IGFBP5, HCN4, IL6, KCNJ11, KCNQ1, CCL2, SPARC, KCNE1, RYR2, SLC5A5, CPS1, HMGCS2, P2RX7, SLC6A4, PDE2A, ITPR2, STAT1, PPARGC1A, FOSB, STC1, FOXM1"
GO_CGMP_METABOLIC_PROCESS,0.8007690085124353,1,0.33627487707149273,0.7323921708548069,36028,12,"PDE11A, RORA, NPPC, PDE10A"
GO_REGULATION_OF_SYNAPTIC_VESICLE_EXOCYTOSIS,0.8008969094445645,1,-0.3251538053715922,-0.7568211578776379,44468,19,"LRRK2, RIMS4, STX1B, FMR1"
GO_RESPONSE_TO_CAMP,0.8011403538106544,1,-0.2720582784625966,-0.8254637696423706,47912,79,"IGFBP5, HCN4, KCNQ1, SPARC, KCNE1, SLC5A5, CPS1, HMGCS2, ITPR2, STAT1, FOSB, STC1, FOXM1"
GO_METANEPHRIC_NEPHRON_MORPHOGENESIS,0.8011983304160496,1,0.31895763474850164,0.7507836104225385,35702,17,"WNT4, KIF26B, SMO, SOX9, SALL1"
GO_CELL_FATE_DETERMINATION,0.8013334279026881,1,-0.31045257345197097,-0.7710836038881547,45191,26,"GATA6, POU6F2, PAX6, POU5F1"
GO_NEGATIVE_REGULATION_OF_STEROL_TRANSPORT,0.801766400958048,1,-0.3929343766489962,-0.7146137052431006,42847,6,SHH
GO_POSITIVE_REGULATION_OF_CYTOKINE_SECRETION,0.8021704262362216,1,-0.2798927258213885,-0.8101906013605025,47011,59,"CADM1, NLRP2, P2RX7, RASGRP1, CCR2, TRIM6, CSF1R, SYK, LGALS9, CD276, LPL, CAMP, PYDC1, AIM2, TWIST1, NLRP1, CASP1, C5"
GO_NEGATIVE_REGULATION_OF_PROTEIN_KINASE_B_SIGNALING,0.8028647337414809,1,0.2950491383933845,0.7787760295038675,34751,29,"BANK1, DDIT3, SFRP5"
GO_RESPONSE_TO_IRON_ION,0.803215966994023,1,-0.3046321237361217,-0.7734309375417303,45555,29,"TFR2, CYP1A1, ABAT, SLC40A1, BCL2, APBB1, ABCG2, CYBRD1"
GO_HIGH_DENSITY_LIPOPROTEIN_PARTICLE_REMODELING,0.803456517742232,1,-0.36599981171833673,-0.726107713883434,43699,9,"LCAT, ABCA5"
GO_VENTRICULAR_TRABECULA_MYOCARDIUM_MORPHOGENESIS,0.8035604665438919,1,0.349454562831892,0.7142506214554523,36651,9,"HEY2, NKX2-5"
GO_REGULATION_OF_CELLULAR_EXTRAVASATION,0.8039321789321789,1,-0.3286984246795551,-0.7477185555503009,44569,17,"CCL2, ICAM1, CCR2, ITGA4, PTAFR, CCL28"
GO_NEUROMUSCULAR_PROCESS,0.8041843684671927,1,-0.2742017794125352,-0.8166880898470104,47700,70,"UCN, GLRB, SLURP1, NR4A3, JPH3, HOXC10, MYH10, HERC1, IGDCC3, HMX3, KCNH1, FABP7, DRD1, POU4F2, GRIN2A, CNTNAP1, NRG1"
GO_POSITIVE_REGULATION_OF_THYMOCYTE_AGGREGATION,0.804235920254766,1,0.35513277338662813,0.707591749654036,36870,8,"IL1B, GLI2, IL7R, ADA"
GO_NEGATIVE_REGULATION_OF_DEFENSE_RESPONSE,0.8049733920241772,1,-0.2655970528077533,-0.8334533496998772,49009,100,"FOXF1, ACP5, IRAK3, IFIT1, PTGIS, TAP1, ADORA1, ADRB2, GBA, NLRC5, NOV, EIF2AK2, LGALS9, CD276, ISL1, ADAR, KRT1, SERPINB4, SUSD4, MICB, DHX58, IGF2, IFI16, RABGEF1, NFKB1, TNFRSF1B, ASH1L"
GO_PERICARDIUM_DEVELOPMENT,0.8065836940836941,1,-0.3276531469720494,-0.7453407725159981,44716,17,"TBX20, DLL4, HEG1, NKX2-6"
GO_OXYGEN_TRANSPORT,0.8066709844559585,1,0.35971159572392086,0.6971744563679473,37364,7,"MB, HBE1"
GO_REGULATION_OF_GLOMERULAR_FILTRATION,0.8067305402385183,1,-0.35607143155135945,-0.7237233494037845,44036,10,"PTPRO, ADORA1"
GO_REGULATION_OF_ODONTOGENESIS_OF_DENTIN_CONTAINING_TOOTH,0.8069842516250054,1,0.3537163317731478,0.7047695308258285,36996,8,"DMRT3, BMP2, RUNX2"
GO_FOLIC_ACID_CONTAINING_COMPOUND_BIOSYNTHETIC_PROCESS,0.807119040784331,1,0.33778562066419626,0.7220458548499894,36551,11,"MTHFD2, ATIC, MTHFS, MTHFD1L, FPGS"
GO_REGULATION_OF_MACROPHAGE_CYTOKINE_PRODUCTION,0.8071643973316275,1,-0.3509940801365823,-0.7277876774859269,44163,11,"TLR4, IRAK3, TGFB3"
GO_BLASTOCYST_FORMATION,0.8078475439159749,1,0.2981774063736532,0.7696883371144845,35226,26,"HAND1, CCNB1IP1, JUNB, WDR74, RRP7A, NLE1, SRF, ADA, BYSL, SKIL, RPL7L1"
GO_SEGMENTATION,0.8083986411489691,1,-0.2728024619405952,-0.816145569111988,48068,72,"FOXF1, FOXC2, DLL3, WNT3A, CRB2, PLXNA2, TDRD5"
GO_NUCLEOBASE_METABOLIC_PROCESS,0.8087148798764544,1,-0.2945820631100985,-0.77960400455498,46082,36,"GMPR, CPS1, AOX1, UPRT, XDH, PRTFDC1, TYMP, TET2, UCK1"
