pathway,pval,padj,ES,NES,nMoreExtreme,size,leadingEdge
GO_G_PROTEIN_COUPLED_PURINERGIC_NUCLEOTIDE_RECEPTOR_SIGNALING_PATHWAY,0.24346019984282025,1,-0.6804813176968827,-1.2375635848793813,13010,6,"P2RY1, GPR87, PTAFR"
GO_SYNAPTIC_VESICLE_LOCALIZATION,0.24393591535236575,1,0.34893221541166797,1.120752898857337,9774,83,"SYTL5, RIMS2, SYT11, NRXN1, SNCA, LIN7A, SYT3, CPLX1, SYT14, C2CD4C, SYT15"
GO_ESTABLISHMENT_OR_MAINTENANCE_OF_TRANSMEMBRANE_ELECTROCHEMICAL_GRADIENT,0.24403382974811547,1,-0.6174212871028578,-1.2249032511148767,13272,9,"ATP12A, ATP1A3, ATP1A4"
GO_REGULATION_OF_ENDOTHELIAL_CELL_PROLIFERATION,0.24448203101450247,1,-0.37562080406490395,-1.1333000979468542,14598,76,"CCR3, FLT4, TNFSF12, VASH1, CCL2, SPARC, VASH2, DLL4, CDH13, SEMA5A, PTPRM, ATOH8, CCL26, LRG1, STAT1, XDH, THBS1, THBS4, EGR3"
GO_CALCIUM_ION_TRANSMEMBRANE_TRANSPORT,0.24452931630796465,1,-0.35643719833864335,-1.1230044680495612,14917,103,"PKD1L1, TRPM8, CCR7, TMC1, SLC24A3, RYR2, ATP2A1, JPH3, CACNA1D, TRPV6, CACNB4, CATSPER1, CACNG8, P2RX7, PDE2A, SLC8A2, TRPC4, ATP2B4, ITPR2, ATP2A3, TRPC1, MCOLN1, MCOLN2, ATP2B3, XCL1, GRIN2A, CACNG4, PRKCE, CACNB3, PKD2, CACNG6, TMEM37, ORAI2, DENND5B"
GO_FATTY_ACID_ELONGATION,0.24460816899327867,1,-0.6349051252408913,-1.2281083659868552,13246,8,"ELOVL5, ELOVL4, ELOVL2, ELOVL6"
GO_CELL_DIFFERENTIATION_IN_SPINAL_CORD,0.2447956958998523,1,-0.4489767814150169,-1.1687414151468805,13922,33,"MDGA2, GLI3, WNT3A, NKX6-1, TBX20, SHH, DLL4, PAX6, MDGA1, HOXC10, LHX4"
GO_RIBOSOMAL_SMALL_SUBUNIT_ASSEMBLY,0.24481364864563096,1,0.5160771613792028,1.1983113017184914,10962,16,"RPL38, RRP7A, RPS27, RPS19, RPS15, RPS10, RPS14, RPS5"
GO_MODULATION_BY_VIRUS_OF_HOST_MORPHOLOGY_OR_PHYSIOLOGY,0.2448638872142095,1,0.42767933807461234,1.1607053071923719,10559,33,"KPNA7, CD4, KPNA5"
GO_ESTROGEN_METABOLIC_PROCESS,0.24546967039884887,1,0.49237517397902186,1.1889517403887853,10917,19,"UGT1A1, IL1B, HSD3B1, STAR, HSD17B8, HSD17B14, TIPARP"
GO_G_PROTEIN_COUPLED_RECEPTOR_SIGNALING_PATHWAY_COUPLED_TO_CYCLIC_NUCLEOTIDE_SECOND_MESSENGER,0.24587018187885867,1,-0.3693364565804679,-1.1287496977604765,14734,83,"ADCY2, CNR1, ADRA2A, UCN2, CCR3, S1PR3, CCL2, CHRM1, GRM4, GPR37, ADRA1D, CACNA1D, P2RY1, GPR37L1, GPR1, OPRK1, SSTR1, ADORA1, PRKACB, ADRB2, NPY1R"
GO_NEGATIVE_REGULATION_OF_CELL_PROJECTION_ORGANIZATION,0.24621581067207202,1,0.32171463517110915,1.099871553967094,9352,127,"SPOCK1, SEMA3E, NRXN1, SPP1, SEMA6C, THY1, NLGN3, FGF13, GFI1, LPAR1, IFRD1, VIM, WNT5A, SEMA3B, DPYSL3, EVL, KLK8, NGEF, PTPRZ1, ID1, SEMA3F, TRPV4"
GO_LIVER_REGENERATION,0.2462992687711789,1,0.5249375391675646,1.2001401873558013,11047,15,"GLI1, CEBPB, RAPGEF3, SRSF5, SULF2"
GO_METANEPHRIC_NEPHRON_DEVELOPMENT,0.2466091245376079,1,0.45829279952859003,1.1733289701901553,10799,25,"IRX2, FOXD1, WNT4, KIF26B, SMO, SOX9, SALL1, OSR1, PDGFB, TFAP2B"
GO_EPITHELIAL_TO_MESENCHYMAL_TRANSITION_INVOLVED_IN_ENDOCARDIAL_CUSHION_FORMATION,0.24664561957379638,1,0.60143447200521,1.2292726754324956,11249,9,"SNAI2, HEY1"
GO_ADRENAL_GLAND_DEVELOPMENT,0.24675207911890312,1,0.4994035439360728,1.1906597085193729,10977,18,"DKK3, WNT4, CDKN1C, SALL1, INSM1, FSTL3, WNT11, NR0B1, STRA6, TSPO, MDK"
GO_NEGATIVE_REGULATION_OF_RELEASE_OF_CYTOCHROME_C_FROM_MITOCHONDRIA,0.2468307897961457,1,0.5454625473288945,1.2091499480359478,11078,13,"BCL2L1, PSMD10, NOL3, PRELID1, FXN, PARL, GPX1, LMNA"
GO_POSITIVE_REGULATION_OF_LEUKOCYTE_DEGRANULATION,0.2473102672496689,1,-0.5619049256579823,-1.2083944145403964,13630,13,"VAMP7, SYK, ZAP70, PTAFR"
GO_L_AMINO_ACID_IMPORT,0.2475131441552018,1,-0.6000289507611751,-1.219572601183197,13510,10,"SLC1A2, SLC1A1"
GO_REGULATION_OF_CHROMOSOME_ORGANIZATION,0.24760965698577747,1,0.289212184579705,1.0726307971545108,8286,250,"TAL1, ZNF304, NOS1, IL1B, PRKD1, SNAI2, DPPA2, SNCA, NAP1L2, SLX1A, GFI1, PKIB, CENPV, APOBEC1, VEGFA"
GO_REGULATION_OF_MUSCLE_ADAPTATION,0.2478199427842691,1,-0.40990813440734075,-1.1487342489294947,14379,49,"IGFBP5, NR4A3, TNNI1, RGS2, ATP2B4, EDN1, PPARGC1A, EP300, AKAP13, PDE5A, SLC9A1"
GO_REGULATION_OF_RESPONSE_TO_BIOTIC_STIMULUS,0.24801038197538972,1,-0.3262357603421958,-1.1007441322012654,15861,175,"LY96, MAP1A, REP15, HRG, ELMO1, SERPINB10, CD163L1, KCNQ1, IL12A, DKKL1, BIRC3, IFIT1, PGC, DDX58, HIST1H3D, STAT2, FAM131B, TRIM6, MYOM1, CSPG5, EIF2AK2, MYLK, TRIM5, ALPK1, DDX60, PDK4, GABRA5, PYDC1, AIM2, FAM13B, TMEM39B, MICB, DHX58, CHST3, SLC1A3, NOD1, PML, C1orf210"
GO_REGULATION_OF_MEMBRANE_POTENTIAL,0.24805859915201434,1,-0.31354163432847,-1.0909570642633153,16322,235,"CNR1, KCNH8, GRIK2, SCN4B, GLRB, KCNB1, SCN3B, HCN4, CNIH2, GABRB3, SCN8A, KCNJ11, KCNQ1, KCNE1, LRRK2, KCNQ3, KCND2, RYR2, CACNA1D, NOS1AP, CHRNB4, SLC26A1, DGKI, CACNB4, IFI6, CATSPER1, KCNE3, P2RX7, KCNH3, ADORA1, CCK, KCNH4, ADRB2, HSH2D, STOX1, ABAT, EDN1, SHANK3, BCL2, ATP1A3, NALCN, CNGA2, ABCB5, KCNH1, DRD1, BVES, ADRA1A, ATP1A4, TACR1, GRIN2A, CNTNAP1, CACNG4, GLRX, RIMS4, CASP1, 
CACNB3, KCNK5, KCNK6, STX1B, PKD2"
GO_DENDRITIC_CELL_MIGRATION,0.24850589417892716,1,-0.5858585560695054,-1.2147801401412999,13596,11,"CCR7, CCR2, DOCK8"
GO_BLOOD_COAGULATION_FIBRIN_CLOT_FORMATION,0.2490701598417911,1,-0.5609328872019376,-1.2063040149240778,13727,13,"TFPI, GP1BA, F7, VWF, F8"
GO_ASSOCIATIVE_LEARNING,0.2494399062489229,1,-0.40934526997852794,-1.147156867090473,14473,49,"NPTX2, UCN, NDRG4, OPRK1, NRGN, KIT, SYNGAP1, ADRB2, ATP1A3, DRD1, GABRA5, TACR1, GRIN2A, CTNS"
GO_LOW_DENSITY_LIPOPROTEIN_PARTICLE_REMODELING,0.2498910268385329,1,0.7658301915678933,1.2309234128894362,12038,3,"AGT, APOE, ABCG1"
GO_DNA_STRAND_ELONGATION_INVOLVED_IN_DNA_REPLICATION,0.25007116424708226,1,-0.476837008433924,-1.17514643670677,14055,25,"GINS1, FEN1, GINS3, GINS4, POLA1, DNA2, POLA2, LIG1, PRIM2, RFC4, PRIM1, PARP1"
GO_POSITIVE_REGULATION_OF_REPRODUCTIVE_PROCESS,0.2501093364588982,1,-0.4307040844943991,-1.1565828550417654,14296,39,"PLB1, ZFPM2, SHH, OXTR, PRDM9, DMRT1, P2RY1"
GO_NEGATIVE_REGULATION_OF_CELL_SUBSTRATE_ADHESION,0.25041295011562603,1,0.3971478048829819,1.1413754320172107,10611,44,"SPOCK1, SEMA3E, ARHGAP6, APOD, CDKN2A, PTPRZ1"
GO_POSITIVE_REGULATION_OF_LYMPHOCYTE_DIFFERENTIATION,0.25048782992708224,1,-0.39799203312639625,-1.1420868343505213,14633,56,"IL6, GLI3, IL7, TNFSF4, SHH, IL12A, RAG1, HLA-G, RASGRP1, MYB, SYK, LGALS9"
GO_CALCIUM_INDEPENDENT_CELL_CELL_ADHESION_VIA_PLASMA_MEMBRANE_CELL_ADHESION_MOLECULES,0.2510114846599053,1,-0.5602103452055733,-1.204750165379771,13834,13,"CLDN23, CLDN2, CLDN1, CLDN8, CLDN16"
GO_ENERGY_COUPLED_PROTON_TRANSPORT_DOWN_ELECTROCHEMICAL_GRADIENT,0.2511289085797052,1,0.692494570157132,1.2438026103496784,11789,5,"ATP6V0A4, TCIRG1, STOML2"
GO_ERBB_SIGNALING_PATHWAY,0.2516704160091327,1,-0.3754355285502353,-1.1279051137396598,14990,74,"EFEMP1, PLCE1, ERBB4, NRG2, PAG1, PTPRR, PIK3R1, PLCG1, FAM83B, SHC3, RASSF2, NRG1, BTC, CBL"
GO_LIPOXYGENASE_PATHWAY,0.2517100762957117,1,0.5985352085528836,1.2233468672077983,11480,9,"ALOX12, HPGD"
GO_INOSITOL_PHOSPHATE_METABOLIC_PROCESS,0.2517492158687485,1,-0.40869011011847906,-1.1453208348027748,14607,49,"MTMR7, PLCE1, PLCG1, SYNJ1, PLCH1, INPP5E, NUDT11, PTAFR, INPP4A, NUDT3"
GO_MUSCLE_CELL_DEVELOPMENT,0.25261730812683586,1,0.3434531482869362,1.1112166581101965,10061,87,"ACTA1, SGCD, MYLK3, MYL2, LDB3, CHRNB1, HEY2, NKX2-5, CACNA2D2, ANK2, VEGFA, WFIKKN1, PROX1, UCHL1, SMO, FHL2, KRT8, GATA4, TCAP, KRT19, CAMK2D, SMYD3, AGT, ATG5, CAV2, DMD, SIX4, ANKRD1, PTCD2"
GO_RESPONSE_TO_EXOGENOUS_DSRNA,0.2527661536279169,1,-0.4720032166231033,-1.172333465539302,14254,26,"IRAK3, TLR3, IFIT1, CARD9, DDX58, EIF2AK2, COLEC12, KCNJ8"
GO_NEGATIVE_REGULATION_OF_LEUKOCYTE_CHEMOTAXIS,0.2528966879028352,1,-0.6529032618799456,-1.2249741795323583,13575,7,"CCL2, NOV, C5"
GO_NEGATIVE_REGULATION_OF_PEPTIDASE_ACTIVITY,0.25343403351427896,1,-0.3280188132195712,-1.0995273636076492,16106,166,"BIRC7, TIMP3, TFPI, LXN, COL28A1, HRG, IL6, CST1, SPINK2, SERPINB10, GPC3, SERPINB13, CRB2, LAMP3, SPINK7, RAG1, BIRC3, IFI6, C3, COL6A3, PAPLN, SERPINF2, SSPO, NAIP, BST2, DHCR24, SERPINA1, THBS1, CRIM1, SERPINB7, HMSD, SPINK4, NGF, ITIH6, SPINK8, SORL1, SERPINA3, SERPINB4"
GO_POSITIVE_REGULATION_OF_ACTIN_FILAMENT_DEPOLYMERIZATION,0.2535486755336984,1,-0.6524986235227926,-1.224214998856597,13610,7,"SEMA5A, PDXP, CFL2"
GO_SYNAPTIC_SIGNALING,0.2538362597589064,1,-0.3077763195418221,-1.0837189902999396,16971,264,"NPTX2, NOVA1, LRFN2, GRIK2, SLC1A2, GLRB, CNIH2, GABRB3, SLC1A1, ACHE, TRIM9, CHRM1, LRRK2, GLRA3, STX19, KCNN1, GRM4, KCNQ3, KCND2, SNCB, PCDHB13, DLG2, UNC13A, TMOD2, CHRNB4, SYT13, GPR1, NRXN3, OPRK1, C2CD4A, MPZ, GABBR2, CPLX2, SYTL4, DGKI, CACNB4, SYT1, P2RX7, SLC6A4, SSTR1, NPTX1, ADORA1, SYNJ1, CADPS2, ADRB2, APBA1, PPFIA4, PCDHB11, PCLO, PCDHB9, GABRA3, KIF1B, AKAP5, SHC3, SLC6A11, 
DRD1, EGR3, RIC3, GABRA5, GABRR1, LRFN5, TACR1, GRIN2A, SYT16"
GO_REGULATION_OF_GRANULOCYTE_DIFFERENTIATION,0.2539139267339413,1,0.5662005050328375,1.2103023416717755,11498,11,"PRDM16, TRIB1, TESC, HCLS1, HAX1"
GO_POSITIVE_REGULATION_OF_EPITHELIAL_CELL_PROLIFERATION,0.25392243811980975,1,-0.3416914889374722,-1.1079015829054903,15746,127,"NOG, SOX11, ESR1, CCR3, IL6, FLT4, TNFSF12, WNT3A, CCL2, NR4A3, SHH, VASH2, TBX1, CDH13, SEMA5A, STXBP4, CCL26, LRG1, FGF1"
GO_CELLULAR_WATER_HOMEOSTASIS,0.2540136970921747,1,-0.6749029828072644,-1.2274184950082603,13574,6,"AQP6, AQP5, AQP10"
GO_ASPARTATE_FAMILY_AMINO_ACID_BIOSYNTHETIC_PROCESS,0.2548766980854863,1,0.47593315537718467,1.1744680101622,11275,21,"ASNS, APIP, GOT1, THNSL2, BHMT2, ENOPH1, EIF2B1, EIF2B4, EIF2B2, MTAP, MTRR"
GO_PROTEIN_K63_LINKED_UBIQUITINATION,0.25498413874545584,1,0.42754236635041865,1.1522099606207548,11011,32,"RNF152, RNF5, CDKN2A, UBE2F, STUB1, RNF126, UBE2S, ARIH2, UBE2E3, UBE2V2, UBE2B"
GO_REGULATION_OF_STEM_CELL_DIFFERENTIATION,0.255233637727978,1,0.33606267435739107,1.1035529820134589,10033,96,"TAL1, EPHA3, DACT3, PRICKLE1, DAB2, OLFM1, NKX2-5, FUZ, JAG1, SERPINB3, SMO, OVOL2, SOX9, GATA4, SOX5"
GO_POSITIVE_REGULATION_OF_REACTIVE_OXYGEN_SPECIES_BIOSYNTHETIC_PROCESS,0.2560791871058164,1,-0.43094463080783146,-1.152265562349151,14616,38,"ESR1, IL6, TLR4, NOS1AP, TLR5, ICAM1, RAB27A, EDN1, CLU, INSR"
GO_NEGATIVE_REGULATION_OF_NEURON_DEATH,0.2562994268882272,1,-0.3366372055257541,-1.103648234663206,16009,139,"GRIK2, UCN, NTF3, ESR1, EN1, IL6, GABRB3, CCL2, NR4A3, LRRK2, SNCB, NR4A2, PCP4, LRP1, SYNGAP1, NAIP, TGFB3, BCL2, PPARGC1A, ISL1, MSH2, REL, NGF, GABRA5, FAIM2, SORL1, CNTFR, BDNF, MAP3K12, TRAF2, HIPK2, ERBB3, CDK5, GCLM, DLX1, ALKBH1, UNC5B, KIF14, TP73, TOX3"
GO_PATTERNING_OF_BLOOD_VESSELS,0.25642525435144814,1,-0.4669333116469006,-1.1675616632821968,14466,27,"FOXC2, COL4A1, TBX20, SHH, DLL4, RBM15, EDN1"
GO_PROTEIN_IMPORT_INTO_MITOCHONDRIAL_MATRIX,0.25643120542318987,1,0.5647717223515266,1.2072481956412446,11612,11,"PAM16, TOMM22, TIMM50, TOMM7, DNLZ, TIMM44, TOMM40"
GO_PERIPHERAL_NERVOUS_SYSTEM_AXON_ENSHEATHMENT,0.25664373398084445,1,0.4876841820897791,1.1776242745342569,11414,19,"POU3F1, NDRG1, FA2H"
GO_POSITIVE_REGULATION_OF_MAP_KINASE_ACTIVITY,0.25713703099510604,1,-0.32620677000840315,-1.0965804530003482,16392,170,"BIRC7, CD40, ADRA2A, NTF3, PDE6G, PIK3R5, PLA2G1B, PLCE1, LRRK2, MAP2K6, GRM4, GHR, DUSP19, TLR4, PDGFRB, P2RX7, MAP4K1, KIT, RASGRP1, FGF1, SYK, TNFRSF11A, TGFB3, EDN1, THBS1, C1QTNF2, INSR, DIRAS2, NOX4, MADD, PDGFC, FZD8, ARRB1, TRAF2, C5, EPHA4, CD74, PDE5A, FZD5, NOD1"
GO_REGULATION_OF_LIPID_METABOLIC_PROCESS,0.2573754437507651,1,-0.3147808992436557,-1.0874781834238343,16819,219,"LGALS12, CNR1, VAV3, ADRA2A, PRKAA2, ESR1, PIK3R5, CCR7, ERBB4, DNAJC15, NR4A3, IRS4, CCKBR, UGT1A7, PDGFRB, ACACB, C3, AKR1C3, BSCL2, KIT, ADORA1, PDE3B, FGF1, PIK3R1, PIK3R2, ADRB2, SIRT4, HCAR2, ABHD5, GPLD1, PPARGC1A, C1QTNF2, PDK4, BRCA1"
GO_NEGATIVE_REGULATION_OF_CATION_CHANNEL_ACTIVITY,0.2574260969150383,1,-0.48881205446289877,-1.1733249912590378,14385,22,"KCNQ1, KCNAB1, KCNE1, KCNE3"
GO_NEGATIVE_REGULATION_OF_LYMPHOCYTE_DIFFERENTIATION,0.2576085617222017,1,-0.4505398719958362,-1.1587826160530512,14634,31,"PGLYRP2, GLI3, TNFSF4, SHH"
GO_EXPLORATION_BEHAVIOR,0.258602218873132,1,-0.5470393243804177,-1.1940809134965555,14241,14,"LRRK2, JPH3, ABAT, LRRTM1, LSAMP, PRKCE"
GO_CELL_SUBSTRATE_ADHESION,0.2586147892700134,1,0.31936220029270523,1.0918290967007642,9823,127,"ITGA10, ECM2, CD96, EPHB1, THY1, ARHGAP6, FBLN5, CUZD1, TTYH1, MYO1G, TIAM1, ITGB7, FGFRL1, TNFRSF12A, ITGB6, ID1, PPARD, FREM1"
GO_PYRIMIDINE_NUCLEOSIDE_METABOLIC_PROCESS,0.2586283031584819,1,0.41104284925073653,1.1424077301229043,11127,37,"NME5, NT5M, APOBEC3F, APOBEC1, APOBEC3G, NME2P1, CDA, DHODH, ERH"
GO_NEGATIVE_REGULATION_OF_EPITHELIAL_CELL_MIGRATION,0.2586765064225293,1,-0.4231731588451626,-1.1473762700746766,14861,41,"HRG, VASH1, DLL4, PTPRR, PTPRM, MMRN2, THBS1, STC1"
GO_MEMBRANE_ASSEMBLY,0.2594109882106605,1,0.45738872238583805,1.1616962974735991,11397,24,"NRXN1, IL1RAPL1, PTPRD, NLGN3, NRXN2, RFTN1, NLGN1, S100A10, CAV2"
GO_INTESTINAL_EPITHELIAL_CELL_DIFFERENTIATION,0.2594121801488564,1,-0.5294003710737625,-1.1880478890501953,14324,16,"GATA5, GATA6"
GO_REGULATION_OF_INTERLEUKIN_6_BIOSYNTHETIC_PROCESS,0.2595838379390069,1,0.5785734258092199,1.2100269484102781,11788,10,"IL1B, EREG, TLR1, CEBPB, TLR6, FOXJ1"
GO_ACTIVATION_OF_PROTEIN_KINASE_B_ACTIVITY,0.2597996829514339,1,-0.5137912506462434,-1.182303924180873,14421,18,"ADRA2A, NTF3"
GO_FUSION_OF_SPERM_TO_EGG_PLASMA_MEMBRANE,0.25999657423443656,1,-0.7297522432321673,-1.2197262967536933,13660,4,"SPESP1, CATSPER1"
GO_CEREBRAL_CORTEX_GABAERGIC_INTERNEURON_DIFFERENTIATION,0.2600871800603554,1,-0.6493850699258557,-1.2183733635248084,13961,7,"DLX2, DRD1, NKX2-1, DLX1"
GO_POSITIVE_REGULATION_OF_ACUTE_INFLAMMATORY_RESPONSE,0.26047220106626046,1,-0.5371759786247715,-1.189428783725474,14363,15,"CNR1, CCR7, IL6, C3, CCR2, TNFRSF11A"
GO_NEGATIVE_REGULATION_OF_PROTEIN_LOCALIZATION_TO_CELL_PERIPHERY,0.2607356445883358,1,0.48596245902563107,1.173466782967321,11596,19,"DAB2, PID1, LZTFL1, TMBIM1, TGFB1, BCL2L1"
GO_CHROMATIN_ASSEMBLY_OR_DISASSEMBLY,0.2610578710063188,1,-0.34367240534379784,-1.1062129955456526,16153,120,"HIST1H1B, PADI4, HIST1H1T, HIST2H3D, HIST2H3C, HIST1H4H, HIST1H3D, HIST2H3A, CENPP, HIST1H1E, HIST1H1D, NAP1L3, NFE2, HELLS, HIRIP3, HIRA, MCM2, ARID1A, HDAC8, NAP1L4, SMARCD3, MIS18BP1, CENPO, BAHD1, HIST2H2BF, CENPA, ASF1B, SMARCC2, HIST1H2BN, CENPK, KAT6A, CABIN1, CHAF1B"
GO_DEFINITIVE_HEMOPOIESIS,0.2612136614945604,1,0.5175999824552414,1.1833646740224895,11716,15,"TAL1, LYL1, ZFP36L2"
GO_POSITIVE_REGULATION_OF_CELL_ADHESION,0.2614560868595226,1,-0.30486947511845536,-1.0786388549310195,17578,277,"VAV3, FOXF1, FOXC2, DISC1, HRG, CCR7, IL6, GLI3, WNT3A, CD1D, IL7, TNFSF4, CCL2, NR4A3, SHH, IL12A, FOXA1, EFNB3, RAG1, PREX1, CDH13, SMOC2, FBLN2, PDCD1LG2, CSF1, GCNT2, HLA-G, SERPINF2, ALOX15, RASGRP1, CCDC88B, CHRD, CCR2, PIK3R1, ICOSLG, MYB, SYK, LGALS9, CD276, HLA-DPB1, FOXA2, VEGFC, CD47, ZAP70, HLA-DQA1, COL8A1, ITGA4, EGR3, PYDC1, TNFSF18, VIT, XCL1, HAS2, TSC1, NRG1, MAP3K14, 
PTAFR, PRKCE, TRAF2, FN1, CCDC80, EBI3, CX3CL1, TRIOBP, IGF2, CD74, HLA-DRB1, JAK3, CCL28, PDCD1, AGER"
GO_POSITIVE_REGULATION_OF_CALCIUM_ION_DEPENDENT_EXOCYTOSIS,0.26167027417027416,1,-0.5201387572166117,-1.183204332697625,14506,17,"KCNB1, PLB1, SYT1, CDK5R2"
GO_REGULATION_OF_PROTEIN_KINASE_A_SIGNALING,0.2616796995482338,1,-0.5555045999761719,-1.1946303105933047,14422,13,"LRRK2, PDE4A, AKAP3, AKAP5"
GO_NEGATIVE_REGULATION_OF_PEPTIDYL_SERINE_PHOSPHORYLATION,0.2618302214013829,1,0.4789436898425159,1.1692034795916135,11624,20,"DKK1, DDIT4, CNKSR3, PDE4D, PAQR3, DMD"
GO_PERK_MEDIATED_UNFOLDED_PROTEIN_RESPONSE,0.26249036661895847,1,0.577034758335681,1.2068089832833448,11920,10,"ASNS, DDIT3, HERPUD1, ATF4, ATF3, HSPA5, NFE2L2"
GO_REGULATION_OF_CALCIUM_ION_DEPENDENT_EXOCYTOSIS,0.26251578336689074,1,-0.390137204157136,-1.1293094349686057,15384,59,"ADRA2A, KCNB1, PLB1, SPINK2, TRIM9, LRRK2, SYT13, C2CD4A, TRPV6, SYTL4, SYT1"
GO_MITOCHONDRIAL_CALCIUM_ION_HOMEOSTASIS,0.26251671643431584,1,-0.5926333345335985,-1.2045408416179686,14329,10,"DISC1, ATP2A1"
GO_HYDROGEN_PEROXIDE_CATABOLIC_PROCESS,0.26261434708094994,1,0.5255842336402993,1.185318111552719,11798,14,"PXDN, TPO, DUOX2, DUOX1, LPO, GPX1, PRDX6, PRDX5, HBA1, PRDX1"
GO_POSITIVE_REGULATION_OF_INTERLEUKIN_1_PRODUCTION,0.2626689040007065,1,-0.4597324072101767,-1.159143003736516,14870,28,"NLRP2, TLR4, P2RX7, CCR2, LGALS9, ISL1, PYDC1, AIM2, NLRP1, CASP1, IFI16, NOD1, CARD8"
GO_SULFUR_AMINO_ACID_BIOSYNTHETIC_PROCESS,0.26340828508594766,1,0.49938080364384413,1.175475617729183,11737,17,"CBS, APIP, BHMT2, CTH, ENOPH1, EIF2B1, EIF2B4, AHCY, EIF2B2, MTAP, MTRR"
GO_POSITIVE_REGULATION_OF_PRODUCTION_OF_MOLECULAR_MEDIATOR_OF_IMMUNE_RESPONSE,0.2639178120227683,1,-0.41465619004055654,-1.1390935121182832,15207,44,"CD40, IL6, TNFSF4, NR4A3, TLR4, PGC, RSAD2, TRIM6"
GO_NEGATIVE_REGULATION_OF_SIGNAL_TRANSDUCTION_IN_ABSENCE_OF_LIGAND,0.264560845358482,1,0.4606708742599827,1.159534902315549,11641,23,"IL1A, IL1B, SNAI2, HSPA1A, MAP2K5"
GO_ORGAN_REGENERATION,0.2646296115079753,1,0.3591724804425309,1.112403968349278,10816,67,"UGT1A1, GLI1, PFKFB1, LCP1, CXCL12, CEBPB, FLT3, SOCS3"
GO_NEGATIVE_REGULATION_OF_PROTEIN_SERINE_THREONINE_KINASE_ACTIVITY,0.2646883039264091,1,0.32434458157280166,1.0916269418819882,10185,114,"INCA1, CEBPA, IL1B, PKIA, PKIB, DUSP10, DUSP8, UCHL1, DUSP5, DUSP1, CDKN2B, SERPINB3, CDKN1C, CDKN2A"
GO_MESENCHYME_DEVELOPMENT,0.264930217461863,1,0.3095060807219006,1.0818167263906697,9794,151,"ACTA1, SEMA3E, BASP1, TBX2, SNAI2, DPPA2, OLFM1, SEMA6C, SIX1, GSC, FOXD1, FRZB, HEY2, FGF9, NKX2-5, RET, HAND1, WNT4, FOXF2, WNT5A, SEMA3B, JAG1, HEY1, MESP1, SMO, FGF19, SEMA3F, OVOL2, SOX9, GBX2, BNC2, HAND2, TCF15, GATA4, EFNB1, HOXA5, OSR1"
GO_REGULATION_OF_INTERFERON_BETA_PRODUCTION,0.26506656403617723,1,-0.42576016788392235,-1.1433068045136028,15151,39,"ZBTB20, TLR4, TLR3, TIRAP, DDX58, IRF7, IFIH1, REL, TLR2"
GO_PIGMENT_METABOLIC_PROCESS,0.2653797453233629,1,0.3810851480883997,1.1251303007813904,11107,51,"UGT1A1, UGT1A10, TYRP1, UGT1A4, CITED1, HMOX1, GPR143, BLVRB, DDT, ADA, ALAS1, BDH2"
GO_ISOTYPE_SWITCHING,0.26659161476585624,1,-0.5435551407031433,-1.1864756152250615,14681,14,"BATF, MSH2, NBN, SWAP70, RNF168, MSH6"
GO_OOCYTE_DIFFERENTIATION,0.26666077894550916,1,-0.4582320293386933,-1.155360036763957,15096,28,"ZGLP1, DMC1, GDF9, DMRT1, TDRD5, INSL3, BRCA2, BCL2"
GO_OLIGODENDROCYTE_DIFFERENTIATION,0.267076218242399,1,-0.41379957460165706,-1.1367403214213463,15389,44,"SOX11, SOX6, GLI3, NKX6-1, SHH, WASF3, PAX6"
GO_POSITIVE_REGULATION_OF_TYROSINE_PHOSPHORYLATION_OF_STAT1_PROTEIN,0.26708028657951105,1,-0.6234200626089784,-1.2058926034399966,14463,8,"CD40, KIT, TNFSF18"
GO_NEGATIVE_REGULATION_OF_SMOOTH_MUSCLE_CELL_PROLIFERATION,0.26776721753315835,1,-0.46637999887175463,-1.1583668523431367,15100,26,"IGFBP5, ESR1, IL12A, NDRG4"
GO_POSITIVE_REGULATION_OF_MUSCLE_TISSUE_DEVELOPMENT,0.26882502728264823,1,-0.4111525313770306,-1.1347676465150758,15518,45,"GATA6, ERBB4, WNT3A, TBX20, SHH, TBX1, CDON, ADRB2, USP2, BCL2, PPARGC1A"
GO_REGULATION_OF_DNA_RECOMBINATION,0.2688636679161461,1,-0.4133019836142078,-1.135373399428848,15492,44,"CD40, TNFSF4, PRDM9, APLF, RAD51, RAD51AP1, MSH2, TNFSF13, IL27RA, RPA2, CHEK1, POLQ, FIGNL1, KPNA1, ZRANB3, BLM, SUPT6H, BCL6, UNG, MSH6"
GO_MULTICELLULAR_ORGANISMAL_SIGNALING,0.2695562194368877,1,-0.3644723426242029,-1.1120960240170465,16150,82,"GRIK2, SCN4B, SCN3B, HCN4, SCN8A, KCNQ1, KCNE1, KCND2, RYR2, CACNA1D, CACNB4, CACNG8"
GO_PROTEIN_TARGETING_TO_MITOCHONDRION,0.26985700127424606,1,0.391297839886311,1.12456303561651,11435,44,"MTX2, PAM16, IMMP2L, TOMM22, SLC25A6, MFF, TIMM10, TIMM50, TIMM9, TOMM7, DNLZ, TIMM44, CHCHD4, TSPO, GDAP1, TOMM40, NDUFA13, DNAJC19, TOMM5, IMMP1L, BID"
GO_SCHWANN_CELL_DIFFERENTIATION,0.2699195611588725,1,0.43717743775981877,1.1452720602622044,11710,28,"POU3F1, EGR2, NDRG1, TFAP2A, FA2H, GPC1"
GO_NEGATIVE_REGULATION_OF_MYOTUBE_DIFFERENTIATION,0.27001051753527,1,-0.5328217876450372,-1.1797876227517599,14889,15,"CXCL10, ANKRD2"
GO_PYRIMIDINE_RIBONUCLEOSIDE_METABOLIC_PROCESS,0.2704023382198475,1,0.4490020119926296,1.14954253893259,11841,25,"NME5, APOBEC3F, APOBEC1, APOBEC3G, NME2P1, CDA, DHODH"
GO_SISTER_CHROMATID_SEGREGATION,0.27070048576717987,1,-0.3277808120292964,-1.0909849643251794,17107,157,"KIF4B, SMC1B, CENPP, ESPL1, ERCC6L, CEP57L1, KLHL22, PSRC1, CENPF, KIF18B, KIFC1, CHMP6, NCAPD2, SKA1, DSN1, HDAC8, ZWINT, FBXW7, SPC24, KIF14, INCENP, CENPO, CENPA, TTN, STAG1, CDCA8, CENPK, NDC80, NUSAP1, KIF2C, CHAMP1, NDE1, TOP2A, ZW10, DDX11, SMC4, NUP43, TAOK1, PDS5B, AURKB, RACGAP1, INO80, B9D2, NCAPD3, CLASP1, CENPL, LATS1, PRC1, CEP55, DSCC1, NIPBL, KPNB1, DIS3L2, KIF23, BUB1, 
RAD21, BUB1B, NUF2, NSL1, CKAP5, NCAPH, PLK1, ZWILCH, NCAPG, CLASP2, NUP107, RANGAP1, CENPE, CDC23, CDC14A, CLIP1, CENPM, PINX1, BIRC5, SMC1A"
GO_REGULATION_OF_HAIR_CYCLE,0.2709477633869036,1,0.4690709643075039,1.157534069334788,11986,21,"FOXN1, KRT17, TRADD, GAL, SMO, FA2H, WNT10B"
GO_POSITIVE_REGULATION_OF_MAST_CELL_ACTIVATION_INVOLVED_IN_IMMUNE_RESPONSE,0.27108722948519093,1,-0.6215126069875362,-1.2022029778356151,14680,8,"VAMP7, SYK, ZAP70"
GO_CHEMOSENSORY_BEHAVIOR,0.2716049382716049,1,0.6069573077031761,1.2093448296179266,12451,8,"PRKCG, GJB4, TRPV1, GRIN1"
GO_NEGATIVE_REGULATION_OF_CELLULAR_CATABOLIC_PROCESS,0.27170035671819265,1,-0.3358110964211997,-1.0951884720186538,16908,133,"CNR1, USP44, TIMP3, DAPL1, SHH, LRRK2, LAMP3, ACACB, LZTS1, CBFA2T3, ATP2B4, BCL2, HERC1, GPLD1, PPARGC1A, APC, KLHL22, CENPF"
GO_TRNA_MODIFICATION,0.2719186785260483,1,0.3777740099978418,1.1184203038462104,11341,52,"CTU1, TRMT11, METTL2A, CTU2, RPUSD2, AARS, ELP3, PUS3, YRDC, DUS3L, THG1L, TRMT112, ADAT2, DUS4L, TRMU, RPUSD3, METTL2B, TRDMT1, NSUN2, TRMT5, SSB, METTL1, UBA5, HSD17B10"
GO_REGULATION_OF_TRANSCRIPTION_FROM_RNA_POLYMERASE_I_PROMOTER,0.2727417338938757,1,0.4574154490565003,1.1513408111406307,12001,23,"POU4F1, ATF4, RASL11A"
GO_PRODUCTION_OF_MOLECULAR_MEDIATOR_OF_IMMUNE_RESPONSE,0.273029832729781,1,-0.403966816751811,-1.1279854532282365,15832,48,"CAMK4, BATF, POU2F2, PMS2P5, KIT, MSH2, IL31RA, TLR2, MR1, HLA-DRB1, GALNT2, PRKDC, DENND1B, POLQ, NBN"
GO_CEREBELLAR_CORTEX_FORMATION,0.27329737019554956,1,0.48820473926940233,1.1639599270258516,12158,18,"NRXN1, LHX5, PROX1, RORA, WNT7A"
GO_VENTRICULAR_SYSTEM_DEVELOPMENT,0.2737589624149427,1,0.4475970817625521,1.1459456128151786,11988,25,"NME5, HYDIN, AK8, CDK6, UCHL5, NUMBL, TTC21B, BBS4, ANP32B, DPCD, MNAT1, RPGRIP1L"
GO_SPHINGOLIPID_METABOLIC_PROCESS,0.2740727158424141,1,0.32103723461242994,1.0852384766093164,10462,118,"ST3GAL6, ST8SIA1, PRKD1, CERS1, STS, NEU4, ARSJ, SPTSSB, CERS3, SMPD2, ST6GALNAC2, FAM57B, FA2H, CERS6, ST6GALNAC1, HTRA2, GLTP, ST3GAL1, SPNS2, ARSK, ACER3"
GO_DENDRITIC_CELL_CHEMOTAXIS,0.2741893788315237,1,-0.6197945065442343,-1.198879625346967,14848,8,"CCR7, CCR2"
GO_CELL_MATURATION,0.2742050187950828,1,0.33322440729595404,1.092369544651379,10795,95,"TAL1, CEBPA, NRCAM, EREG, RET, REN, VEGFA, ANG, KLF2, GLDN, PICK1, RND1, GJA1, XBP1, CDKN1C, RPS6KA2, SLC26A3, SIX3, HOXA5"
GO_POTASSIUM_ION_HOMEOSTASIS,0.27443438503547,1,-0.5494533122799644,-1.1816168239357328,15125,13,"ATP12A, UPK3A, ATP1A3, ATP1A4"
GO_POSITIVE_REGULATION_OF_OXIDOREDUCTASE_ACTIVITY,0.2744601222715544,1,0.4091160076807618,1.1302076356111224,11806,36,"IL1B, NPR3, CYP27B1, SNCA"
GO_MAMMARY_GLAND_EPITHELIAL_CELL_DIFFERENTIATION,0.2745076705472745,1,-0.5310333367111129,-1.1758275889756102,15137,15,"FOXF1, ERBB4"
GO_OTIC_VESICLE_DEVELOPMENT,0.2747145980082584,1,0.5544899142659987,1.1852699453713822,12440,11,"SIX1, PROX1, SOX9, TCAP"
GO_REGULATION_OF_WOUND_HEALING,0.2747893606476128,1,-0.3558898561401221,-1.1040861310766208,16632,92,"ADRA2A, FOXC2, HRG, PRKG1, GP1BA, F7, HOPX, TLR4, SERPINF2, ADRB2, SYK, ABAT, EDN1, INSL3, MYLK, FOXA2, THBS1, ZAP70, KRT1, C1QTNF1, PRKCE, LBH, TXK"
GO_REGULATION_OF_LONG_TERM_SYNAPTIC_POTENTIATION,0.274812734082397,1,0.5111063592274027,1.168518606412932,12326,15,"NOS1, NLGN3"
GO_REGULATION_OF_VASOCONSTRICTION,0.2748993614658523,1,-0.4135980274311337,-1.1317929287883994,15842,43,"ADRA2A, TBXA2R, EDN2, CHRM1, OXTR, ADRA1D, PTGS1, ICAM1, NPY1R, EDN1, DRD1, ADRA1A, TACR1, PTAFR, CX3CL1, KCNMB4, DOCK4, ACE2, PER2, ADM, F2R, DOCK5"
GO_OLIGODENDROCYTE_DEVELOPMENT,0.2752111720270729,1,-0.4761347552410563,-1.1537223238176866,15410,23,"SOX11, SHH, WASF3, CLU, ID4"
GO_REGULATION_OF_GLUCONEOGENESIS,0.2753116865324017,1,0.4469947334832002,1.144403470571105,12056,25,"GNMT, MST1, SESN2, FOXO1"
GO_CARTILAGE_MORPHOGENESIS,0.2754156115820764,1,0.5704921628981446,1.1931258163095206,12507,10,"SNAI2, HAND1, HAND2, HOXA5"
GO_SPLICEOSOMAL_SNRNP_ASSEMBLY,0.27552467055569757,1,0.4053729627599306,1.1266494650957344,11854,37,"SRSF12, GEMIN8, SNRPD2, SMN2, SNRPG, SMN1, SNRPE, GEMIN5, STRAP, PRPF3, PRMT5, GEMIN6, SNRPF, DDX20, SNRPD1, SART1, SRSF10, RBM22, PRPF6"
GO_ANATOMICAL_STRUCTURE_HOMEOSTASIS,0.27564872102687227,1,-0.3135095436266569,-1.078608665823257,17909,211,"PIP, CUBN, IL6, ILDR2, PROM1, CDHR1, IL7, ACP5, HAAO, TLR4, CTGF, NPHP3, CSF1, GCNT2, RAD51D, POTEF, CTSK, HIST1H4H, P2RX7, SLX1B, CD7, ADRB2, RAD51, BRCA2, BCL2, FEN1, KRT1, NOX4, SERPINA3, PIF1, XRCC3, SMG6, SMG1, PRR4, DCLRE1B, SLX4, POLA1, LRRK1, DCLRE1A, DNA2, LPCAT1, POLA2, CTC1, SMC6, BBS1, FLT3LG, LIG1, CDH23, RPA2, BBS2, LDB2, ZG16B, F2R, SMC5, PRKDC, TERT, BBS10, NBN, CFL2, 
PRIM2, POLE, BARD1, RFC5"
GO_REGULATION_OF_AMINE_TRANSPORT,0.27589293549802546,1,-0.4269231671476831,-1.1357059427079137,15718,37,"CNR1, ADRA2A, KCNB1, OXTR, P2RY1, PTGS1, OPRK1, PCP4, P2RX7, ADORA1, DPYSL2, CCK, ABAT"
GO_MAST_CELL_ACTIVATION,0.275976498748776,1,-0.5304918593411322,-1.174628635941188,15218,15,"NR4A3, CPLX2, PIK3CD, KIT, RASGRP1"
GO_REGULATION_OF_IRE1_MEDIATED_UNFOLDED_PROTEIN_RESPONSE,0.27630611562882923,1,0.5305987124949294,1.1762006553574407,12401,13,"AGR2, BBC3, HSPA1A, HSPA5"
GO_REGULATION_OF_DNA_DAMAGE_RESPONSE_SIGNAL_TRANSDUCTION_BY_P53_CLASS_MEDIATOR,0.2764069164793836,1,0.44231870256486805,1.141761714249961,12052,26,"SNAI2, PLA2R1, CDKN2A, MIF, ZNF385A, EEF1E1, MDM2, PMAIP1, ANKRD1, PSMD10, SIRT1, DDX5"
