pathway,pval,padj,ES,NES,nMoreExtreme,size,leadingEdge
"NABA_CORE_MATRISOME",5.107056675561457e-6,0.00669535130166107,-0.5286881976916467,-1.860432154148865,3,169,"FBLN7, SPARCL1, COL8A2, COL8A1, HMCN2, SLIT1, DMBT1, CHAD, MFAP2, SPOCK3, EDIL3, COL23A1, COL1A1, VWA7, OTOG, NTNG2, SRGN, LAMC3, AEBP1, MGP, NPNT, FBLN5, SBSPON, HAPLN3, HMCN1, IGFBP5, COL13A1, ZPLD1, COL4A1, COL24A1, SVEP1, COL5A3, NID1, FBLN1, MFAP5, VWA1, FN1, RSPO4, NTN1, COL27A1, HSPG2, SRPX2, THSD4, KCP, COL6A1, CTHRC1, LGI2, PODN, FBN3, SSPO, EFEMP1, CRISPLD2, COL4A6, COL18A1, SRPX, 
MATN3, ECM1, MATN2, AGRN, COL9A3, EMILIN3, IGFBP2, SMOC2, FBN1, NTN4, TINAGL1, LTBP3, PCOLCE2, COL5A1, COL4A4, COL15A1, LAMA3, COCH, IGFBP6, LAMC1, LTBP2, THBS4, LAMA5, SPOCK1, CTGF, COL17A1, SNED1, CYR61, GLDN, PXDN, IGFBP4, VWF, FNDC1, LAMC2"
REACTOME_CYTOKINE_SIGNALING_IN_IMMUNE_SYSTEM,1.10182854568426e-5,0.007222486116960324,-0.4756940813815655,-1.7229875453841017,8,227,"TMEM189-UBE2V1, IFITM1, UBA7, IFI27, IRF8, HLA-DRB1, IL7, IFIT1, OASL, NCAM1, LCK, OAS2, IL7R, SYK, IFITM2, XAF1, IL3RA, PRLR, OAS1, HLA-G, IL1R2, NOD2, HLA-DPB1, IFIT3, CAMK2B, PIK3R3, SOCS2, IL2RG, SOCS3, IL1RN, BLNK, HERC5, JAK3, IL1R1, PTAFR, OAS3, GBP4, IL1B, GBP1, HLA-DRB5, MAP3K8, IFI35, HLA-F, IFITM3, MAPK3, IFIT2, IFNAR2, CISH, KPNA2, ISG15, FLNB"
"NABA_ECM_AFFILIATED",2.0687971599552586e-5,0.00904064358900448,-0.5684642957471846,-1.8688495855085459,14,96,"FREM1, CSPG4, SEMA3D, SEMA3E, SEMA5A, C1QTNF5, SDC2, SEMA3C, PLXNC1, GREM1, ELFN2, MUC3A, COLEC12, ANXA6, FREM2, SEMA6D, REG4, MUC1, SEMA3F, SEMA6B, CLEC2L, C1QL1, LGALS1, ANXA9, C1QL4, PLXND1, MUC5B, SEMA7A, SDC1, LGALS7, GPC5, SEMA3G, SEMA6C, MUC4, GPC1, MUC21, SEMA4G, SEMA4B, SEMA4F, REG1A"
REACTOME_DNA_REPLICATION,2.915089772090677e-5,0.009554206728027195,-0.48694928949007044,-1.7227025764005814,22,178,"CCNA1, POLE2, SPC25, PSMB9, E2F2, POLD1, SPC24, E2F1, KIF20A, BIRC5, CCNA2, PCNA, AURKB, PLK1, CENPM, MCM5, BUB1, MAD2L1, LIG1, MCM6, CDK2, CENPI, INCENP, CDC6, MCM10, ERCC6L, CDCA8, CENPO, POLA2, DNA2, CDT1, ZWINT, ITGB3BP, MCM2, MCM4, FBXO5, GINS2, SKA2, ORC1, RFC2, KNTC1, MCM3, CDC20, BUB1B, RPA3, KIF18A, ORC6, CENPA, GMNN, PSMA2, CENPQ, PPP2R1A, CDC45, KIF23, RFC5, SMC1A, CENPH, 
MCM7, MCM8, NUF2, POLE, RFC3, GINS1, FEN1, CENPK, POLD2, KIF2C, PRIM2, CDKN1B, PSME1, PRIM1, CDC7, RANGAP1, RPA1, DSN1, PPP2R5D, RB1, E2F3, CENPN, NDC80, NUP107, RPA2, DBF4, PSMB8, PMF1, RAD21, NUP85, MAPRE1, PSMB5, NSL1, PPP2R1B"
"NABA_ECM_GLYCOPROTEINS",4.5240800815398905e-5,0.011862137973797593,-0.5227705396989993,-1.779366049843907,33,126,"FBLN7, SPARCL1, HMCN2, SLIT1, DMBT1, MFAP2, EDIL3, VWA7, OTOG, NTNG2, LAMC3, AEBP1, MGP, NPNT, FBLN5, SBSPON, HMCN1, IGFBP5, ZPLD1, SVEP1, NID1, FBLN1, MFAP5, VWA1, FN1, RSPO4, NTN1, SRPX2, THSD4, KCP, CTHRC1, LGI2, FBN3, SSPO, EFEMP1, CRISPLD2, SRPX, MATN3, ECM1, MATN2, AGRN, EMILIN3, IGFBP2, SMOC2, FBN1, NTN4, TINAGL1, LTBP3, PCOLCE2, LAMA3, COCH, IGFBP6, LAMC1, LTBP2, THBS4, LAMA5, 
CTGF, SNED1, CYR61, GLDN, PXDN, IGFBP4, VWF, FNDC1, LAMC2, PCOLCE, VWA2, LRG1"
REACTOME_TRAF6_MEDIATED_INDUCTION_OF_TAK1_COMPLEX,5.455794425666041e-5,0.0119209108200803,0.8347464633811534,2.0597923932887885,21,14,"TICAM2, CD14, TLR4, LY96"
REACTOME_DOWNSTREAM_TCR_SIGNALING,6.515693285657528e-5,0.012202962710710027,-0.74401392272432465,-1.969551634844293,40,27,"TMEM189-UBE2V1, HLA-DRB1, LCK, CD4, HLA-DPB1"
REACTOME_GPCR_LIGAND_BINDING,7.962581006418867e-5,0.013048679624268918,-0.4872328059803587,-1.7069812895221192,61,162,"INSL3, SSTR2, FZD8, CCR3, HTR6, NTSR1, WNT6, EDN2, F2RL2, KISS1, RAMP1, ADRA2A, GIPR, S1PR1, CCR9, NPW, RXFP4, F2R, CNR1, SSTR1, GPR55, NMU, CXCL12, HTR1D, CXCR4, WNT2B, PTH2R, GRM4, OPRL1, ADORA1, TACR2, ADRA1D, WNT10A, GNB3, NPFFR1, ADRB1, FZD2, P2RY2, LTB4R2, EDNRB, PTCH1, XCL1, HCAR3, WNT7A, OPN3, DRD1, GPR68, PTAFR, ADRB2, CCL2, FZD1, NPY1R, HTR7, NMB, LPAR6, VIPR1, ADM, SSTR5, 
C3, WNT11, WNT4, GPR132, CCR7, S1PR3, HRH1, WNT5A, BDKRB1, CXCL1, CXCR6, PTGER4, RLN2, GABBR1, S1PR5, FZD4, BDKRB2, P2RY6"
REACTOME_GPCR_DOWNSTREAM_SIGNALING,1.451956571978932e-4,0.01913894013191947,-0.43845055003007866,-1.5999178572333734,119,247,"INSL3, SSTR2, CCR3, ARHGEF6, HTR6, NTSR1, EDN2, F2RL2, KISS1, RAMP1, ADRA2A, GIPR, S1PR1, RGS9, CCR9, NPW, RXFP4, F2R, CNR1, SSTR1, GPR55, ADCY2, NMU, CXCL12, HTR1D, CXCR4, PTH2R, FGD2, OPRL1, ADORA1, NGEF, RAC2, TACR2, ADRA1D, PDE7B, GNB3, NPFFR1, PDE4D, ADRB1, PLEKHG2, PIK3R5, P2RY2, PLCB1, PIK3R3, LTB4R2, EDNRB, GNA15, FGD3, ADCY5, XCL1, PDE2A, HCAR3, OPN3, DRD1, GPR68, PTAFR, VAV3, 
ADRB2, TIAM1, NPY1R, HTR7, GNAI1, NMB, DGKI, OR2A7, LPAR6, VIPR1, RHOB, ECT2, ADM, SSTR5, GNAL, C3, VAV1, ARHGEF25, GPR132, CCR7, RHOC, S1PR3, HRH1, ITSN1, DGKA, BDKRB1, CXCL1, CXCR6, PTGER4, GNAI2, RLN2, GABBR1, GNAZ, S1PR5, BDKRB2, P2RY6"
REACTOME_CYTOSOLIC_TRNA_AMINOACYLATION,1.459873389162431e-4,0.01913894013191947,0.7226314336601072,2.0383732315413345,54,24,"WARS, SARS, IARS, GARS, EPRS, NARS, CARS, TARS, AIMP2, LARS, YARS, MARS, AARS, FARSB"
REACTOME_CELL_CYCLE_MITOTIC,1.6130437546948992e-4,0.01922454874913648,-0.4200595059571842,-1.556860318955785,136,298,"CDKN2A, TUBB4A, CDKN2C, CCNA1, TYMS, POLE2, PTTG1, SPC25, PSMB9, E2F2, POLD1, SPC24, E2F1, KIF20A, BIRC5, CCNA2, PCNA, CCNE2, DHFR, PKMYT1, PLK4, TUBB, AURKB, PLK1, CENPM, MCM5, BUB1, MAD2L1, LIG1, MCM6, CDK2, RRM2, CENPI, INCENP, CDC6, MCM10, ERCC6L, CCNB1, CDCA8, CENPO, POLA2, DNA2, CDT1, ZWINT, CCNB2, ITGB3BP, TUBA4A, CEP41, MCM2, UBE2C, TUBB4B, MCM4, FBXO5, CDK1, MYBL2, GINS2, SKA2, 
DHFRP1, AURKA, ORC1, RFC2, KNTC1, MCM3, CDC20, NEK2, CCND3, TUBGCP6, SKP2, BUB1B, RPA3, RBBP4P1, WEE1, KIF18A, ORC6, CENPA, GMNN, PSMA2, DCTN3, CENPQ, CDC25A, TUBG2, PPP2R1A, CDC25C, CDC25B, NINL, CENPJ, CDC45, KIF23, RFC5, SMC1A, CENPH, MCM7, CDKN2D, PPP2R3B, MCM8, ANAPC11, CDC14A, NUF2, TUBG1, POLE, RFC3, GINS1, FEN1, CENPK, POLD2, KIF2C, PRIM2, CDKN1B, PSME1, TUBA1A, PRIM1, CCNE1, CDC7, 
RANGAP1, RPA1, DSN1, PPP2R5D, HDAC1, RB1, E2F3"
KEGG_AXON_GUIDANCE,2.1637632816090871e-4,0.023639113851579276,-0.5095331788988883,-1.718717426588618,160,117,"SEMA3D, SEMA3E, SLIT1, SEMA5A, ROBO2, SEMA3C, PLXNC1, SEMA6D, CXCL12, CXCR4, SEMA3F, SEMA6B, DPYSL5, NGEF, RAC2, UNC5A, NTN1, EFNB3, DPYSL2, SEMA7A, EPHA3, EPHB3, EPHB6, SEMA3G, EFNA3, EPHA1, SEMA6C, FES, SRGAP3, GNAI1, SEMA4G, NTN4, SEMA4B, SEMA4F, NFATC4, EFNA4, MAPK3, PPP3CC, EPHA6, NFATC2, SEMA6A, RGS3, RHOD, EPHB2, L1CAM, RND1, GNAI2, NRP1, EPHA8, PAK4"
REACTOME_ACTIVATION_OF_IRF3_IRF7_MEDIATED_BY_TBK1_IKK_EPSILON,2.4095082144560658e-4,0.024298963608860785,0.8163525672481696,1.976081860792237,97,13,"TICAM2, CD14, TLR4, LY96, IRF7"
REACTOME_CLASS_A1_RHODOPSIN_LIKE_RECEPTORS,2.8637583910835323e-4,0.026350754259931178,-0.5151062760643165,-1.7219882545981346,210,109,"INSL3, SSTR2, CCR3, HTR6, NTSR1, EDN2, F2RL2, KISS1, ADRA2A, S1PR1, CCR9, NPW, RXFP4, F2R, CNR1, SSTR1, GPR55, NMU, CXCL12, HTR1D, CXCR4, OPRL1, ADORA1, TACR2, ADRA1D, NPFFR1, ADRB1, P2RY2, LTB4R2, EDNRB, XCL1, HCAR3, OPN3, DRD1, GPR68, PTAFR, ADRB2, CCL2, NPY1R, HTR7, NMB, LPAR6, SSTR5, C3, GPR132, CCR7, S1PR3, HRH1, BDKRB1, CXCL1, CXCR6, PTGER4, RLN2, S1PR5, BDKRB2, P2RY6"
REACTOME_IRAK1_RECRUITS_IKK_COMPLEX,3.014960441639723e-4,0.026350754259931178,-0.8838022703529429,-1.8238956776593658,173,9,TMEM189-UBE2V1
REACTOME_IKK_COMPLEX_RECRUITMENT_MEDIATED_BY_RIP1,3.405197182199332e-4,0.027901334411645776,0.8675851088168521,1.904369010158141,143,9,"TICAM2, CD14, TLR4, LY96"
REACTOME_MITOTIC_M_M_G1_PHASES,5.02690684110463e-4,0.03506525185998293,-0.462925229475945,-1.6173859873255914,389,158,"POLE2, SPC25, PSMB9, E2F2, SPC24, E2F1, KIF20A, BIRC5, AURKB, PLK1, CENPM, MCM5, BUB1, MAD2L1, MCM6, CDK2, CENPI, INCENP, CDC6, MCM10, ERCC6L, CDCA8, CENPO, POLA2, CDT1, ZWINT, ITGB3BP, MCM2, MCM4, FBXO5, SKA2, ORC1, KNTC1, MCM3, CDC20, BUB1B, RPA3, KIF18A, ORC6, CENPA, GMNN, PSMA2, CENPQ, PPP2R1A, CDC45, KIF23, SMC1A, CENPH, MCM7, MCM8, NUF2, POLE, CENPK, KIF2C, PRIM2, PSME1, PRIM1, 
CDC7, RANGAP1, RPA1, DSN1, PPP2R5D, E2F3, CENPN, NDC80, NUP107, RPA2, DBF4, PSMB8, PMF1, RAD21, NUP85, MAPRE1, PSMB5, NSL1, PPP2R1B"
REACTOME_TRNA_AMINOACYLATION,5.044702479194247e-4,0.03506525185998293,0.5869276702674405,1.8743189122253034,172,42,"WARS, SARS, IARS, GARS, EPRS, NARS, CARS, TARS, AIMP2, LARS, YARS, MARS, PARS2, AARS, CARS2, FARSB"
KEGG_AMINOACYL_TRNA_BIOSYNTHESIS,5.081920559417816e-4,0.03506525185998293,0.5900835354220314,1.8750261950587879,174,41,"WARS, SARS, IARS, GARS, EPRS, NARS, CARS, TARS, LARS, YARS, MARS, PARS2, AARS, CARS2, FARSB, PSTK, TARSL2, SEPSECS, MARS2"
REACTOME_INTERFERON_SIGNALING,6.861131491800353e-4,0.04497471692875131,-0.4770333779823568,-1.6329094790595098,518,132,"IFITM1, UBA7, IFI27, IRF8, HLA-DRB1, IFIT1, OASL, NCAM1, OAS2, IFITM2, XAF1, OAS1, HLA-G, HLA-DPB1, IFIT3, CAMK2B, SOCS3, HERC5, PTAFR, OAS3, GBP4, GBP1, HLA-DRB5, IFI35, HLA-F, IFITM3, MAPK3, IFIT2, IFNAR2, KPNA2, ISG15, FLNB"
REACTOME_INTERFERON_ALPHA_BETA_SIGNALING,7.556780601968654e-4,0.04617670672355712,-0.6025867305849731,-1.78537528464218,504,49,"IFITM1, IFI27, IRF8, IFIT1, OASL, OAS2, IFITM2, XAF1, OAS1, HLA-G, IFIT3, SOCS3, OAS3, IFI35, HLA-F, IFITM3, IFIT2, IFNAR2, ISG15"
REACTOME_EXTRACELLULAR_MATRIX_ORGANIZATION,7.748951547812789e-4,0.04617670672355712,-0.5756633282889648,-1.7601164537911085,528,59,"COL8A2, ADAMTS3, COL8A1, MMP10, COL23A1, COL1A1, MMP1, MMP13, MMP16, COL13A1, COL4A1, COL24A1, COL5A3, COL27A1, TIMP2, COL6A1, COL4A6, MMP15, COL9A3, PLOD1, ADAMTS2, MMP2, PCOLCE2, COL5A1, TLL1, COL4A4, COL15A1"
REACTOME_MITOTIC_G1_G1_S_PHASES,9.225141090393147e-4,0.05258330421524094,-0.47275710085962486,-1.6167604959123172,696,131,"CDKN2A, CDKN2C, CCNA1, TYMS, POLE2, PSMB9, E2F2, E2F1, CCNA2, PCNA, CCNE2, DHFR, PKMYT1, MCM5, MCM6, CDK2, RRM2, CDC6, MCM10, CCNB1, POLA2, CDT1, MCM2, MCM4, FBXO5, CDK1, MYBL2, DHFRP1, ORC1, MCM3, CCND3, SKP2, RPA3, RBBP4P1, WEE1, ORC6, PSMA2, CDC25A, PPP2R1A, CDC45, MCM7, CDKN2D, PPP2R3B, MCM8, POLE, PRIM2, CDKN1B, PSME1, PRIM1, CCNE1, CDC7, RPA1, HDAC1, RB1, E2F3"
KEGG_CYTOKINE_CYTOKINE_RECEPTOR_INTERACTION,9.634470051427774e-4,0.05262829265592421,-0.4691163696335428,-1.610028847041327,730,135,"TPO, TNFRSF1B, CCR3, TNFRSF10D, CCL24, TNFRSF6B, TNFSF10, CCR9, PDGFRB, TNFRSF19, CXCL14, IL7, TNFRSF11A, IL7R, TNFSF15, CXCL12, KIT, IL3RA, CXCR4, PRLR, IL1R2, TGFB3, NGFR, PDGFB, KITLG, IL11RA, BMPR1B, IL2RG, IL20RA, XCL1, TGFB1, IL1R1, AMH, TNFSF9, IL1B, CNTFR, IL15, CCL2, INHBA, CD70, IL21R, TNFSF12, IL22RA1, OSMR, VEGFB, IFNAR2, EDA, CCL26, CCR7, FLT4, EGF, CXCL1, CXCR6, TNFRSF12A, TNFRSF25, 
IL4R, EGFR, LIFR, TNFRSF10C"
REACTOME_NOD1_2_SIGNALING_PATHWAY,0.0012379227529886203,0.06193377121550715,-0.6705359484309439,-1.8010811904696102,783,29,"TMEM189-UBE2V1, NOD2"
REACTOME_G_ALPHA_I_SIGNALLING_EVENTS,0.0012427732316722439,0.06193377121550715,-0.5167382461788099,-1.6730290798735978,887,86,"SSTR2, CCR3, ADRA2A, S1PR1, RGS9, CCR9, NPW, RXFP4, CNR1, SSTR1, GPR55, ADCY2, NMU, CXCL12, HTR1D, CXCR4, OPRL1, ADORA1, GNB3, ADCY5, HCAR3, OPN3, NPY1R, GNAI1, SSTR5, C3, CCR7, S1PR3, BDKRB1, CXCL1, CXCR6, GNAI2, GABBR1, GNAZ, S1PR5, BDKRB2"
REACTOME_TCR_SIGNALING,0.001275523892310216,0.06193377121550715,-0.6233299303666183,-1.7727917227073149,831,39,"TMEM189-UBE2V1, HLA-DRB1, LCK, CD4, HLA-DPB1, EVL, HLA-DRB5, LAT"
PID_E2F_PATHWAY,0.0014483246658733655,0.06781262989142793,-0.5383288259986692,-1.690921570577365,1008,70,"CEBPA, CDKN2A, CDKN2C, SERPINE1, CES1, TYMS, TP73, TK1, E2F2, PLAU, E2F1, CCNA2, CCNE2, DHFR, CES3, CDK2, RRM2, CDC6, CDK1, MYBL2, RRM1, ORC1, MCM3, CCND3, CASP7, CDC25A"
REACTOME_DNA_STRAND_ELONGATION,0.0015564239075525116,0.07022423298474623,-0.6583067856577383,-1.780197978963195,988,30,"POLD1, PCNA, MCM5, LIG1, MCM6, POLA2, DNA2, MCM2, MCM4, GINS2, RFC2, MCM3, RPA3, CDC45, RFC5, MCM7, MCM8, RFC3, GINS1, FEN1, POLD2, PRIM2, PRIM1, RPA1"
REACTOME_TRAF6_MEDIATED_IRF7_ACTIVATION_IN_TLR7_8_OR_9_SIGNALING,0.001606961853197854,0.07022423298474623,-0.8823519016552721,-1.7121576054725132,909,7,TMEM189-UBE2V1
REACTOME_G1_S_TRANSITION,0.0017555806763548207,0.07424407311939257,-0.48441178451225,-1.6137091689809446,1288,106,"CCNA1, TYMS, POLE2, PSMB9, E2F1, CCNA2, PCNA, CCNE2, DHFR, PKMYT1, MCM5, MCM6, CDK2, RRM2, CDC6, MCM10, CCNB1, POLA2, CDT1, MCM2, MCM4, FBXO5, CDK1, DHFRP1, ORC1, MCM3, SKP2, RPA3, WEE1, ORC6, PSMA2, CDC25A, PPP2R1A, CDC45, MCM7, PPP2R3B, MCM8, POLE, PRIM2, CDKN1B, PSME1, PRIM1, CCNE1, CDC7, RPA1, RB1, RPA2, DBF4, PSMB8"
KEGG_NEUROACTIVE_LIGAND_RECEPTOR_INTERACTION,0.001925694204635479,0.07889328444615978,-0.4777012780572067,-1.6005633562850987,1421,111,"SSTR2, P2RX6, HTR6, NTSR1, F2RL2, ADRA2A, GIPR, S1PR1, GRIK2, F2R, CNR1, SSTR1, GABRB1, GABRE, HTR1D, GABRP, PRLR, PTH2R, GRM4, OPRL1, GRIN2D, ADRA2C, ADORA1, TACR2, GRIN3B, ADRA1D, P2RX5, NPFFR1, ADRB1, P2RY2, CHRNB4, LTB4R2, EDNRB, GRID1, GLRA3, DRD1, PTAFR, ADRB2, THRB, GRIN2A, NPY1R, HTR7"
REACTOME_SYNTHESIS_OF_DNA,0.00202175863740992,0.08031895677710317,-0.5025179186595111,-1.634857413833295,1450,89,"CCNA1, POLE2, PSMB9, POLD1, CCNA2, PCNA, MCM5, LIG1, MCM6, CDK2, CDC6, POLA2, DNA2, CDT1, MCM2, MCM4, GINS2, ORC1, RFC2, MCM3, RPA3, ORC6, PSMA2, CDC45, RFC5, MCM7, MCM8, POLE, RFC3, GINS1, FEN1, POLD2, PRIM2, CDKN1B, PSME1, PRIM1, RPA1, RB1"
REACTOME_IL1_SIGNALING,0.003083236629957809,0.11888597711396141,-0.6045208626759156,-1.7110049712497588,2005,38,"TMEM189-UBE2V1, IL1R2, NOD2, IL1RN, IL1R1, IL1B, MAP3K8"
REACTOME_UNFOLDED_PROTEIN_RESPONSE,0.0034800025455264047,0.1303509524910033,0.45261245742309286,1.6088951894891277,1038,74,"ERN1, ATF3, DDIT3, HERPUD1, ASNS, ATF4, ATF6, EXOSC5, HYOU1, XBP1, EXOSC8, WIPI1, EDEM1, DNAJB9, SRPRB, GOSR2, TSPYL2, SYVN1, HSPA5, DNAJC3, PARN"
REACTOME_G1_S_SPECIFIC_TRANSCRIPTION,0.0040835769900456655,0.14665448134802384,-0.7107207927842281,-1.7265659888320959,2485,18,"CCNA1, TYMS, E2F1, PCNA, DHFR, RRM2, CDC6, CDT1, FBXO5, CDK1, DHFRP1, ORC1, CDC25A, CDC45"
PID_AURORA_B_PATHWAY,0.004172629033849798,0.14665448134802384,-0.6000010030187656,-1.6896270384025058,2705,37,"VIM, DES, SEPT1, KIF20A, BIRC5, AURKB, NCAPH, STMN1, BUB1, KLHL13, INCENP, CDCA8, NCAPD2, RACGAP1, NCAPG, SMC2, AURKA"
REACTOME_E2F_MEDIATED_REGULATION_OF_DNA_REPLICATION,0.004275430340480291,0.14665448134802384,-0.6117220282904642,-1.6951723973165878,2750,34,"CCNA1, TYMS, E2F1, PCNA, DHFR, RRM2, CDC6, CCNB1, POLA2, CDT1, FBXO5, CDK1, DHFRP1, ORC1, ORC6, CDC25A, PPP2R1A, CDC45, PPP2R3B, MCM8, PRIM2, PRIM1, CCNE1, RB1"
KEGG_HEMATOPOIETIC_CELL_LINEAGE,0.004362719124769588,0.14665448134802384,-0.556297032000153,-1.654375569222269,2922,50,"TPO, CD22, HLA-DRB1, CD1D, CD19, IL7, ITGAM, IL7R, ITGA2B, CD8A, KIT, IL3RA, CD4, IL1R2, KITLG, IL11RA, MME, CD37, ITGA1, IL1R1, GP1BB, IL1B, HLA-DRB5"
REACTOME_S_PHASE,0.0045379734839446,0.1486648169488055,-0.4659663995097416,-1.550414355015863,3327,105,"CCNA1, POLE2, PSMB9, POLD1, CCNA2, PCNA, CCNE2, MCM5, LIG1, MCM6, CDK2, CDC6, POLA2, DNA2, CDT1, MCM2, MCM4, GINS2, ORC1, RFC2, MCM3, SKP2, RPA3, WEE1, ORC6, PSMA2, CDC25A, CDC25B, CDC45, RFC5, MCM7, MCM8, POLE, RFC3, GINS1, FEN1, POLD2, PRIM2, CDKN1B, PSME1, PRIM1, CCNE1, RPA1, RB1"
REACTOME_SIGNALING_BY_ILS,0.004684555747733012,0.1486648169488055,-0.47568247218286563,-1.5614938711214097,3390,95,"TMEM189-UBE2V1, IL7, LCK, IL7R, SYK, IL3RA, IL1R2, NOD2, PIK3R3, IL2RG, SOCS3, IL1RN, BLNK, JAK3, IL1R1, IL1B"
PID_PLK1_PATHWAY,0.004782473373769272,0.1486648169488055,-0.5735962728325953,-1.6603712436706657,3149,43,"SSPO, SPC24, KIF20A, PRC1, PLK1, BUB1, ECT2, INCENP, ERCC6L, CCNB1, FBXO5, CDK1, AURKA, CDC20, TPX2, CLSPN, BUB1B, WEE1, PPP2R1A, CDC25C, CDC25B, NINL"
REACTOME_NUCLEOTIDE_BINDING_DOMAIN_LEUCINE_RICH_REPEAT_CONTAINING_RECEPTOR_NLR_SIGNALING_PATHWAYS,0.0049416498748987925,0.1486648169488055,-0.5762221554171383,-1.6608265331428336,3246,42,"TMEM189-UBE2V1, PSTPIP1, PYCARD, NOD2"
REACTOME_HS_GAG_DEGRADATION,0.005056693534270509,0.1486648169488055,-0.6955670301919686,-1.710131939268254,3090,19,"SDC2, HSPG2, SDC1, GPC5, GPC1, AGRN, GPC4, HPSE, GPC6, SDC4, SGSH, NAGLU, GPC2, GUSB"
REACTOME_AMINO_ACID_TRANSPORT_ACROSS_THE_PLASMA_MEMBRANE,0.005102911336915521,0.1486648169488055,0.6367311877226908,1.7586690653603578,1943,22,"SLC6A15, SLC3A1, SLC43A1, SLC16A10, SLC7A5, SLC38A1, SLC7A7, SLC7A11, SLC7A2, SLC7A1, SLC1A5, SLC3A2, SLC38A2"
KEGG_DNA_REPLICATION,0.00538463565360394,0.15346211612771227,-0.5997000770837835,-1.6711454569319635,3473,35,"POLE2, POLD1, PCNA, MCM5, LIG1, MCM6, POLA2, DNA2, MCM2, MCM4, RFC2, MCM3, RNASEH2A, RPA3, RFC5, MCM7, POLE, RFC3, FEN1, POLD2, PRIM2, PRIM1, RPA1, RPA2, POLE4"
REACTOME_ACTIVATION_OF_THE_PRE_REPLICATIVE_COMPLEX,0.0056259167970643545,0.1555267196591781,-0.6267135711332281,-1.6833728712403888,3562,29,"POLE2, MCM5, MCM6, CDK2, CDC6, MCM10, POLA2, CDT1, MCM2, MCM4, ORC1, MCM3, RPA3, ORC6, CDC45, MCM7, MCM8, POLE, PRIM2, PRIM1, CDC7, RPA1, RPA2, DBF4"
KEGG_MELANOGENESIS,0.0056943421385511435,0.1555267196591781,-0.4808229327083776,-1.559206859079792,4073,87,"FZD8, WNT6, ADCY2, GNAO1, TCF7, KIT, WNT2B, KITLG, WNT10A, CAMK2B, FZD2, CALML3, PLCB1, EDNRB, ADCY5, WNT7A, FZD1, GNAI1, MAPK3, TCF7L1, CALM3, WNT11, WNT4, WNT5A, PRKACB, GNAI2, FZD4, CREB3L1, WNT3, CALML5, MC1R, WNT7B"
REACTOME_PEPTIDE_LIGAND_BINDING_RECEPTORS,0.006482275482173743,0.17343394198224032,-0.5153831960871689,-1.592420084832855,4459,63,"INSL3, SSTR2, CCR3, NTSR1, EDN2, F2RL2, KISS1, CCR9, NPW, RXFP4, F2R, SSTR1, NMU, CXCL12, CXCR4, OPRL1, TACR2, NPFFR1, EDNRB, XCL1, CCL2, NPY1R, NMB, SSTR5, C3, CCR7, BDKRB1, CXCL1, CXCR6, RLN2"
KEGG_GLYCOSPHINGOLIPID_BIOSYNTHESIS_LACTO_AND_NEOLACTO_SERIES,0.006723842306837555,0.17629914528528068,-0.6703635715734355,-1.6842144731194257,4144,21,"FUT9, ST8SIA1, FUT5, B3GNT3, ST3GAL6, FUT4"
REACTOME_CELL_JUNCTION_ORGANIZATION,0.007068273799824725,0.18169621473667086,-0.5231499725600401,-1.5951240625151044,4814,58,"CLDN16, ARHGEF6, CDH11, CDH18, CDH4, CDH6, CDH24, CLDN11, CDH13, CDH10, CLDN3, ITGB4, LAMA3, CLDN2, CDH3, ACTN1, CD151, COL17A1, LAMC2, CLDN9, CDH7, CLDN4"
REACTOME_G2_M_CHECKPOINTS,0.007528475819194563,0.189804457672386,-0.5671445759981466,-1.6277598213229598,4935,41,"MCM5, MCM6, CDK2, CDC6, MCM10, CCNB1, CCNB2, MCM2, MCM4, CDK1, ORC1, RFC2, MCM3, CHEK1, RPA3, WEE1, ORC6, CDC25A, CDC25C, CDC45, CHEK2, RFC5, MCM7, MCM8, RFC3, CDC7, RPA1, RPA2, DBF4"
REACTOME_CELL_CELL_JUNCTION_ORGANIZATION,0.00803240011373854,0.19868823677568348,-0.575511376516834,-1.6288980034076923,5225,38,"CLDN16, CDH11, CDH18, CDH4, CDH6, CDH24, CLDN11, CDH13, CDH10, CLDN3"
PID_A6B1_A6B4_INTEGRIN_PATHWAY,0.008990754832701089,0.20915874267950701,-0.5520127328699282,-1.6044807846044735,5936,44,"LAMC3, PMP22, ITGB4, LAMA3, MST1R, SFN, LAMC1, LAMA5, EGF, COL17A1, EGFR, LAMC2, CD9, CASP7, MST1, ERBB2, AKT1, LAMA1, LAMB1, ITGB1, LAMB2, YWHAH, YWHAQ"
KEGG_ECM_RECEPTOR_INTERACTION,0.008990992962112096,0.20915874267950701,-0.5097628666949704,-1.567096795586484,6163,61,"CHAD, SDC2, COL1A1, LAMC3, ITGA2B, COL4A1, COL5A3, FN1, HSPG2, COL6A1, ITGA1, SDC1, ITGB5, ITGB6, GP1BB, COL4A6, AGRN, ITGA7, COL5A1, ITGB4, COL4A4, LAMA3, ITGA2, LAMC1, THBS4, LAMA5, ITGA10, ITGA3, VWF, LAMC2, SDC4, THBS1"
REACTOME_SIGNALING_BY_RHO_GTPASES,0.009137307787233404,0.20915874267950701,-0.4491560973635637,-1.4944812796116926,6700,105,"STARD8, ARHGEF6, ARHGAP40, ARHGAP6, ARHGDIG, PRR5-ARHGAP8, ARHGAP20, FGD2, NGEF, RAC2, ARHGAP25, STARD13, RHOF, PLEKHG2, DLC1, ARHGAP31, FGD3, TAGAP, VAV3, DEPDC1B, SRGAP3, TIAM1, ARHGAP8, RHOB, ECT2, RHOD, RACGAP1, VAV1, RHOBTB2, RHOC, ITSN1, ARHGDIB, ARHGDIA"
REACTOME_CELL_CELL_COMMUNICATION,0.009222461842880487,0.20915874267950701,-0.4630118622907017,-1.5109466353472798,6636,91,"CLDN16, KIRREL2, ARHGEF6, CDH11, CDH18, CDH4, CDH6, KIRREL3, CDH24, NTN1, CLDN11, CDH13, CDH10, CLDN3, SIRPA, ITGB4, LAMA3, CLDN2, CDH3, ACTN1, CD151, COL17A1, LAMC2, ACTN4, CLDN9, CDH7, CLDN4, SKAP2, ILK, PTK2B, PIK3R2"
REACTOME_ADHERENS_JUNCTIONS_INTERACTIONS,0.009392555603009297,0.20915874267950701,-0.6821544672900666,-1.6571693333171922,5717,18,"CDH11, CDH18, CDH4, CDH6, CDH24, CDH13, CDH10"
REACTOME_DEGRADATION_OF_THE_EXTRACELLULAR_MATRIX,0.009412941127453023,0.20915874267950701,-0.7109958564461256,-1.6570498581015618,5647,15,"MMP10, MMP1, MMP13, MMP16, TIMP2, MMP15, MMP2, MMP17"
KEGG_PHENYLALANINE_METABOLISM,0.01066591147879972,0.22197971756749207,-0.7174622743214438,-1.6454321482191503,6364,14,"DDC, ALDH3A1, IL4I1, AOC2, ALDH3B1, ALDH1A3, ALDH3B2, MAOA, AOC3"
SA_REG_CASCADE_OF_CYCLIN_EXPR,0.010684992842750827,0.22197971756749207,-0.7415814800433134,-1.640887276539732,6299,12,"CDKN2A, CCNA1, E2F2, E2F1, CCNA2, CCNE2, CDK2"
KEGG_CELL_CYCLE,0.01085315641958057,0.22197971756749207,-0.4309934859278283,-1.4614354047153144,8123,122,"CDKN2A, CDKN2C, SMC1B, TGFB3, CCNA1, PTTG1, TGFB1, E2F2, ESPL1, E2F1, CCNA2, PCNA, CCNE2, PKMYT1, PLK1, MCM5, BUB1, MAD2L1, MCM6, CDK2, CDC6, CCNB1, CCNB2, MCM2, SFN, MCM4, CDK1, ORC1, MCM3, CDC20, CCND3, CHEK1, SKP2, BUB1B, WEE1, CDKN1C, ORC6, CDC25A, CDC25C, CDC25B, TTK, CDC45, CHEK2, SMC1A, MCM7, CDKN2D, ANAPC11, CDC14A"
KEGG_BIOSYNTHESIS_OF_UNSATURATED_FATTY_ACIDS,0.011003338955517129,0.22197971756749207,-0.6675911083444767,-1.6413499018725703,6725,19,"ACOT4, ACOT1, SCD, ELOVL2, TECR, FADS2, ELOVL6, ACOT7, FADS1"
BIOCARTA_TOLL_PATHWAY,0.011242938480150054,0.22197971756749207,0.5411902814213537,1.630826139564026,4051,32,"CD14, TLR4, LY96, FOS, TLR2, TLR6, JUN, MAPK8, EIF2AK2, IRAK1, NFKB1, CHUK, TAB1, ECSIT, IKBKB"
REACTOME_M_G1_TRANSITION,0.011296655928256426,0.22197971756749207,-0.4775938318131395,-1.518779979500212,7945,76,"POLE2, PSMB9, E2F2, E2F1, MCM5, MCM6, CDK2, CDC6, MCM10, POLA2, CDT1, MCM2, MCM4, ORC1, MCM3, RPA3, ORC6, GMNN, PSMA2, CDC45, MCM7, MCM8, POLE, PRIM2, PSME1, PRIM1, CDC7, RPA1, E2F3, RPA2, DBF4, PSMB8"
"NABA_SECRETED_FACTORS",0.011393429563776567,0.22197971756749207,-0.40142871327887364,-1.4143472521347757,8938,171,"PTN, FRZB, CCBE1, INSL3, TPO, ANGPTL4, CCL24, INHA, WNT6, HRNR, TNFSF10, NGF, CXCL14, IL7, SCUBE3, TNFSF15, CXCL12, WNT2B, BMP4, EBI3, TGFB3, PDGFB, KITLG, SFRP5, FLG, WNT10A, MEGF6, CRLF1, BDNF, NTF3, FGF18, BMP8B, CHRD, S100A1, NRG2, XCL1, IL1RN, PIK3IP1, WNT7A, ISM2, TGFB1, AMH, TNFSF9, IL1B, FST, IL15, CCL2, NRTN, INHBA, FGF9, TNFSF12, NODAL, VEGFB, PGF, FSTL1, EDA, S100A13, CCL26, 
WNT11, ISM1, WNT4, FGF12, EGF, WNT5A, S100A2, S100A4, CXCL1"
REACTOME_CHROMOSOME_MAINTENANCE,0.011446669213791984,0.22197971756749207,-0.46350177885831756,-1.5006668469722149,8178,86,"SMC1B, HIST1H4C, HIST1H4J, HSPA2, POLE2, SYNE1, HIST1H2BJ, LMNB1, POLD1, SUN2, STAG3, PCNA, LIG1, CENPI, OIP5, CENPO, POLA2, LMNA, DNA2, ITGB3BP, REC8, H2AFX, RFC2, HJURP, SYNE2, RPA3, RBBP4P1, HIST1H2BK, CENPA, CENPQ, RFC5, SMC1A, CENPH, TERF1, POLE, RFC3, FEN1, CENPK, POLD2, PRIM2, MIS18BP1, PRIM1, RPA1, CENPN, WRAP53, RPA2"
REACTOME_OTHER_SEMAPHORIN_INTERACTIONS,0.011513822116391655,0.22197971756749207,-0.7147082989935633,-1.6391161652022275,6870,14,"SEMA3E, SEMA5A, PLXNC1, SEMA6D, PLXND1, SEMA7A, ITGA1"
REACTOME_INTERFERON_GAMMA_SIGNALING,0.011760483465031288,0.22344918583559448,-0.5236233096994523,-1.5626098392678671,7896,51,"IRF8, HLA-DRB1, OASL, NCAM1, OAS2, OAS1, HLA-G, HLA-DPB1, CAMK2B, SOCS3, PTAFR, OAS3, GBP4, GBP1, HLA-DRB5, HLA-F"
REACTOME_ACTIVATION_OF_GENES_BY_ATF4,0.012024916067083334,0.22520949948494642,0.6042305768148918,1.6689014835126899,4580,22,"ATF3, DDIT3, HERPUD1, ASNS, ATF4, ATF6, EXOSC5, EXOSC8"
REACTOME_COLLAGEN_FORMATION,0.012216341457874293,0.2255721641024394,-0.5418638212650881,-1.5749819475578066,8066,44,"COL8A2, ADAMTS3, COL8A1, COL23A1, COL1A1, COL13A1, COL4A1, COL24A1, COL5A3, COL27A1, COL6A1, COL4A6, COL9A3, PLOD1, ADAMTS2, PCOLCE2, COL5A1, TLL1, COL4A4, COL15A1"
PID_INTEGRIN5_PATHWAY,0.012477356931837033,0.22719187413386596,-0.711454991050019,-1.6316550098635343,7445,14,"EDIL3, FN1, SDC1, ITGB5, PLAUR, ITGB6, PLAU, FBN1"
"NABA_COLLAGENS",0.013425018939958372,0.24109862781212912,-0.5869816406142622,-1.5977388331931088,8558,31,"COL8A2, COL8A1, COL23A1, COL1A1, COL13A1, COL4A1, COL24A1, COL5A3, COL27A1, COL6A1, COL4A6, COL18A1, COL9A3, COL5A1, COL4A4, COL15A1"
REACTOME_SEMAPHORIN_INTERACTIONS,0.013854835797774141,0.2454552666335392,-0.49460190979103597,-1.5243409217292534,9515,62,"MYL9, SEMA3E, SEMA5A, PLXNC1, SEMA6D, DPYSL5, RAC2, DPYSL3, PLXND1, DPYSL2, SEMA7A, ITGA1, RRAS, FES, RHOB, SEMA6A, RHOC, RND1, NRP1, PLXNB3, MYH10, ERBB2, CFL1, MYL6, CRMP1, CDK5R1, ROCK1P1, ITGB1, CDC42, RHOA"
PID_INTEGRIN3_PATHWAY,0.014795230754317556,0.25522151458686765,-0.5785720051319193,-1.5847382900979472,9462,32,"PDGFRB, EDIL3, COL1A1, ITGA2B, COL4A1, PDGFB, FN1, SDC1, PLAUR, COL4A6, PLAU, FBN1, COL4A4, LAMC1, L1CAM, CYR61, SDC4, HMGB1, THBS1"
REACTOME_PI3K_EVENTS_IN_ERBB4_SIGNALING,0.01498613286949033,0.25522151458686765,0.5114401543968025,1.5811930435775785,5289,36,"ERBB4, TRIB3, HBEGF, AKT3, NRG4, BTC, EREG, PDPK1, THEM4, MAPKAP1, TSC2, CREB1, FOXO3, CASP9"
PID_WNT_SIGNALING_PATHWAY,0.015134912039621763,0.25522151458686765,-0.6136110265722104,-1.5985534462498316,9460,25,"FZD8, FZD2, ROR2, CTHRC1, WNT7A, FZD1, LRP5, WNT5A, KREMEN1, DKK1, FZD4, IGFBP4, KREMEN2, WNT3, WNT7B"
REACTOME_A_TETRASACCHARIDE_LINKER_SEQUENCE_IS_REQUIRED_FOR_GAG_SYNTHESIS,0.015355960732937777,0.25522151458686765,-0.6319869380760048,-1.6037668260530347,9505,22,"CSPG4, SDC2, HSPG2, B3GAT2, SDC1, GPC5, GPC1, AGRN, GPC4, GPC6, SDC4"
PID_S1P_META_PATHWAY,0.015379481046805907,0.25522151458686765,-0.6547488840357039,-1.6097758090700143,9400,19,"S1PR1, GNAO1, GNA15, GNAI1, S1PR3, GNAI2, GNAZ, S1PR5"
REACTOME_LAGGING_STRAND_SYNTHESIS,0.01649846466940087,0.2686694054512497,-0.6517042640739978,-1.602290258988651,10084,19,"POLD1, PCNA, LIG1, POLA2, DNA2, RFC2, RPA3, RFC5, RFC3, FEN1, POLD2, PRIM2, PRIM1, RPA1, RPA2"
KEGG_CELL_ADHESION_MOLECULES_CAMS,0.016599711549619544,0.2686694054512497,-0.443526737557519,-1.4559382001115626,12015,95,"HLA-DMB, CLDN16, CNTN1, CD22, SDC2, CNTNAP2, HLA-DRB1, CDH4, NCAM1, ITGAM, SELL, CD8A, HLA-G, CD4, MPZ, HLA-DPB1, MAG, CLDN11, NRCAM, NRXN2, SDC1, CLDN3, HLA-DOB, ESAM, HLA-DRB5, HLA-F, ITGB2, HLA-DMA, NLGN2, PTPRF, CLDN2, JAM3, CDH3, L1CAM"
