pathway,pval,padj,ES,NES,nMoreExtreme,size,leadingEdge
GO_NEUROTRANSMITTER_UPTAKE,0.09676380182816338,0.5044366521480728,0.6437019830579729,1.4448830492894045,36044,8,"SLC22A3, SLC6A4, SLC38A1"
GO_POSITIVE_REGULATION_OF_HISTONE_DEACETYLATION,0.09692528632031823,0.5044366521480728,0.5379623472045281,1.4115362042685284,32260,14,"VEGFA, JDP2, BCL6, TP53"
GO_LEUKOCYTE_MIGRATION,0.09717340079812202,0.5044366521480728,-0.3579619730284145,-1.231808150100527,87880,163,"PTPRO, RET, CCR7, COL1A1, MYO1G, FN1, ATP1B2, CEACAM1, ITGAX, HRH1, VAV3, GAS6, PROC, FOXJ1, ITGA4, SIRPA, MMP1, CXCR4, NKX2-3, TNFRSF11A, XCL1, ITGB2, CORO1A, CAV1, GCNT1, ARTN, PIK3CD, ESAM, CCL24, SLC16A3, VAV1, EDN2, IL6R, CXCR2, PODXL, CD47"
GO_TRANSCYTOSIS,0.09733113609863621,0.5044366521480728,-0.7016672126891133,-1.378105489993952,60184,7,"PTAFR, RAB17, FCGRT, MFSD2A"
GO_CALCIUM_DEPENDENT_CELL_CELL_ADHESION_VIA_PLASMA_MEMBRANE_CELL_ADHESION_MOLECULES,0.09736964145966784,0.5044366521480728,-0.5518170334663378,-1.368308868618555,67186,19,"CDH23, PCDHB9, PCDHB13, CDH17, PCDHB14, ARVCF, CDH13, DSG1, CDH2, PCDHB10, NRXN1, PCDHGC3"
GO_POSITIVE_REGULATION_OF_STEM_CELL_PROLIFERATION,0.09742092294455042,0.5044366521480728,-0.4398625664857514,-1.3117902117934999,75633,51,"MYCN, PAX6, CHRD, DMRTA2, KITLG, GLI3, VEGFC, TERT, ASPM, SHOX2, FGFR1, TBX1, HMGA2, FGFR2, LRP5, STAT1, LTBP3, SMARCD3"
GO_T_CELL_DIFFERENTIATION,0.0974703137000059,0.5044366521480728,-0.3893297073255664,-1.2684699716655305,82493,96,"FZD8, CCR7, IL7R, CD4, WNT4, IL15, CARD11, TCF7, PTGER4, RSAD2, IL7, GLI3, FOXN1, NKX2-3, MAFB, PIK3CD, IL18R1, VAV1, B2M, JAG2, BCL11B, FAS"
GO_CANONICAL_WNT_SIGNALING_PATHWAY,0.0977944040645965,0.5044366521480728,-0.3994538348639424,-1.2779226731097248,81091,83,"FZD8, WNT4, SFRP1, TCF7, WNT8B, NR4A2, PTPRU, WNT2B, SDC1, FZD2, TCF7L1, CAV1, LGR4, WNT3A, FZD10, FZD4, FZD1, NDP, PTK7, CDH3, EGF, DIXDC1"
GO_GERM_CELL_DEVELOPMENT,0.09781699513144423,0.5044366521480728,-0.36716129004461506,-1.2432461619547255,86654,137,"LGR5, INSL3, DPY19L2P1, ANG, DPY19L2P2, WNT4, DMRT1, FMN2, PCSK4, REC8, DMC1, PAQR8, AMH, ZMYND15, HMGB2, ASPM, CCNB1, PAQR5, BMPR1B, YBX2, HSPA2, CCDC155, SLC26A6, CATSPERB, PAQR7, PTK2B, RPS6KA2, FBXO5, SMARCA2, SEPT4, RFX2, TRIP13, MSH2"
GO_REGULATION_OF_FAT_CELL_DIFFERENTIATION,0.09786940248791773,0.5044366521480728,0.31113036229652324,1.2221470806629577,16159,87,"TRIB3, DDIT3, BMP2, CEBPB, PTGS2, XBP1, PTPRQ, JDP2, WIF1, ZFPM2, ARNTL, RARRES2, KLF5, TGFB1I1"
GO_REGULATION_OF_DELAYED_RECTIFIER_POTASSIUM_CHANNEL_ACTIVITY,0.09789771315674281,0.5044366521480728,0.5501501260786813,1.4152772222973937,33099,13,"KCNG1, KCNE3, NOS1AP, AKAP7, AKAP6"
GO_ACTIVATION_OF_ADENYLATE_CYCLASE_ACTIVITY,0.09834697321687062,0.5053155738359573,-0.5211853472710041,-1.3560753609700165,69638,24,"ADCY2, GIPR, GNAL, ADCY5, ADCY1, PRKCA, ADRB2, CALM3, ADRB1, ADCY6, CALM2"
GO_DIVALENT_INORGANIC_ANION_HOMEOSTASIS,0.09836937800900133,0.5053155738359573,-0.7009279486412989,-1.3766535426542101,60826,7,"TFAP2B, ENPP1, FGFR4, GPCPD1, SLC9A3R1"
GO_TROPHECTODERMAL_CELL_DIFFERENTIATION,0.0984365047890303,0.5053155738359573,0.5367460715104047,1.4083448709242,32763,14,"HOPX, HAND1, BYSL, CUL3, CDX2, SRF, SP3"
GO_TELOMERE_ORGANIZATION,0.09869322954481818,0.5056749576996293,-0.4017895794368437,-1.2790152295876327,81422,80,"PIF1, POLE2, RTEL1, LIG1, SLX1B, PCNA, TERT, POLA2, POLD1, HIST1H4C, RAD51, FEN1, HSPA1A, DNA2, RFC2, SLX1A, RFC5, TERF1, RPA3, PRIM1, POLE, RFC4, RPA2, ACD, PRIM2, H3F3A, XRCC3, DCLRE1B"
GO_CHONDROCYTE_DEVELOPMENT,0.09897062618175351,0.5056749576996293,-0.5580414318607594,-1.3681124903459785,67888,18,"SULF2, CHST11, COL27A1, BMPR1B, SHOX2"
GO_AUTONOMIC_NERVOUS_SYSTEM_DEVELOPMENT,0.09898528077083177,0.5056749576996293,-0.4868205510973238,-1.3397047332755136,72527,32,"TFAP2B, RET, SEMA3F, KIF26A, NRP1, HAND2, TFAP2A, TBX1"
GO_NEGATIVE_REGULATION_OF_CHEMOKINE_PRODUCTION,0.09899781780565976,0.5056749576996293,0.563120315660008,1.417565774556811,34069,12,"TICAM2, KLF4"
GO_NEGATIVE_REGULATION_OF_HEART_GROWTH,0.09914357823717779,0.5057919598543507,-0.6444622598153116,-1.3801799861098245,63716,10,"KCNK2, TP73, GJA1"
GO_CYCLIC_NUCLEOTIDE_METABOLIC_PROCESS,0.0993911038331718,0.5064164666063337,-0.46796326540493544,-1.3283656648614783,74351,38,"CACNB4, PDE5A, GUCY1A2, NPPC, ADCY2, NPR1, PDE4A, ADCY5, ADCY1, PDE8B, PDE9A, AQP1, ADM"
GO_SPHINGOLIPID_BIOSYNTHETIC_PROCESS,0.0995120042469089,0.5064164666063337,-0.41773519750851246,-1.2924434498770463,79854,65,"FAM57B, ST3GAL6, ST8SIA4, ST6GALNAC1, ST3GAL5, ALDH3B2, SPTLC3, ST8SIA1, SMPD1, ST3GAL3, ALDH3B1, B4GALNT1, SPTSSB, ST3GAL2, ACER2, FA2H, DEGS2, ST3GAL4, UGT8, ST8SIA2"
GO_RENAL_TUBULE_DEVELOPMENT,0.09979547208963485,0.5065306260788882,-0.4152096647909501,-1.2903023089912249,80410,67,"TFAP2B, WNT6, LGR5, FGF1, WNT4, GPC3, IRX3, NPNT, CITED1, MTSS1, GLI3, FAT4, LGR4, SALL1, GREM1, TCF21"
GO_PROTEIN_IMPORT_INTO_MITOCHONDRIAL_MATRIX,0.10004621467572702,0.5065306260788882,0.5786643146243297,1.4218884041844424,35069,11,"DNLZ, TIMM44, TIMM50, PAM16, TIMM17A, TOMM7, TOMM40, TOMM22"
GO_LEUKOCYTE_CELL_CELL_ADHESION,0.10008904388310091,0.5065306260788882,-0.3523849518375836,-1.2224224065604328,91496,179,"FZD8, CCR7, IL7R, CD4, PRLR, WNT4, RAC2, IL15, MICB, CARD11, TCF7, PTGER4, CERCAM, BTN3A1, RSAD2, IL7, ITGA4, GLI3, FOXN1, DPP4, NKX2-3, SLC11A1, HSH2D, ITGB2, MAFB, WAS, GCNT1, FKBP1B, BMP7, PIK3CD, EBI3, IL18R1, VAV1"
GO_ACTIVATION_OF_PROTEIN_KINASE_A_ACTIVITY,0.10015226681074708,0.5065306260788882,-0.5829118273747118,-1.3723028499783527,67286,15,"ADCY2, ADCY5, ADCY1, PRKAR2B, UCN, PRKACA, ADCY6"
GO_REGULATION_OF_VASCULAR_PERMEABILITY,0.10017916665239271,0.5065306260788882,0.4493069148440897,1.3543278795712923,29242,24,"SLIT2, TACR1, VEGFA, MYLK3, BDKRB2"
GO_DENDRITIC_CELL_MIGRATION,0.10044698190978141,0.5065306260788882,-0.6290155843579935,-1.3782170322156015,65236,11,"CCR7, CXCR4, CXCR2, HMGB1, ANO6"
GO_REGULATION_OF_ENDOTHELIAL_CELL_APOPTOTIC_PROCESS,0.10049075335936562,0.5065306260788882,-0.5199147201168096,-1.3527693083616599,71156,24,"SEMA5A, SERPINE1, ANGPTL4, THBS1, GAS6, COL18A1"
GO_BODY_MORPHOGENESIS,0.10061530393047569,0.5065306260788882,-0.45948778057495443,-1.3214421823716085,75971,41,"COL1A1, GPC3, CRISPLD2, DLX5, CRISPLD1, TGFB3, STRA6, RRAS, TBX1, MMP2, IFT122, ASPH, PLEKHA1, SSBP3"
GO_UDP_N_ACETYLGLUCOSAMINE_METABOLIC_PROCESS,0.10064174207736958,0.5065306260788882,0.5349018879369469,1.4035059971725705,33497,14,"RENBP, GFPT1, B4GALNT2, GNE"
GO_AMINO_ACID_TRANSMEMBRANE_TRANSPORT,0.10091548717150357,0.5072882303847133,0.36543190397176734,1.2809575378686435,23335,47,"SLC6A9, SLC7A5P1, SLC43A1, SLC7A5, SLC38A1, SLC7A11, SLC6A17, SLC7A1, SLC1A5, SLC1A4, SLC16A12, SLC38A2, SLC7A4"
GO_POSITIVE_REGULATION_OF_PROTEIN_DEACETYLATION,0.10113962381906123,0.5077949161744818,0.49199131590358913,1.3791709694422853,31762,18,"VEGFA, JDP2, RIPK3"
GO_REGULATION_OF_TRIGLYCERIDE_CATABOLIC_PROCESS,0.10137759950521086,0.5083697651193095,0.8211347314889144,1.3909254630821286,44911,3,"ABHD5, GPLD1"
GO_ATP_DEPENDENT_CHROMATIN_REMODELING,0.1017158987749773,0.5094038835373563,-0.4308978768003202,-1.3004272751451262,79776,55,"CENPW, CENPA, CENPM, HIST1H4C, CENPI, CENPO, CENPK, OIP5, HJURP, MIS18BP1, ITGB3BP, NASP, CENPH, ANP32E, CENPQ, RBBP4, HDAC1, RBBP7, SMARCD2, SMARCA1, CENPN, SMARCC2, SMARCA4"
GO_RESPONSE_TO_DIETARY_EXCESS,0.10183941561728069,0.5094038835373563,-0.6028276271143613,-1.3734197498794158,67406,13,"APOE, VGF, CLIC5, PCSK1N, ADRB2, ACVR1C, ADRB1, RMI1, TRPV4"
GO_ERROR_PRONE_TRANSLESION_SYNTHESIS,0.10195501579664358,0.5094038835373563,-0.5489100686257379,-1.3611006355794821,70350,19,"POLE2, PCNA, RFC2, RFC5, RPA3, RFC4, RPA2, RPA1, RFC3"
GO_POSITIVE_REGULATION_OF_NUCLEAR_DIVISION,0.10255625543959691,0.5106538773786687,-0.43921603303846024,-1.305751427418726,79420,50,"WNT4, DMRT1, PRDM9, DLGAP5, NUSAP1, BIRC5, UBE2C, ESPL1, PLK1, AURKA, EGF, FBXO5, TERF1, LRP5, SH2B1, CDCA5, MSX2, PDGFB"
GO_CGMP_BIOSYNTHETIC_PROCESS,0.10261982114967677,0.5106538773786687,-0.7226076705624653,-1.3657983692616398,62288,6,"GUCY1A2, NPPC, NPR1, AQP1"
GO_NEGATIVE_REGULATION_OF_B_CELL_ACTIVATION,0.10268874700031824,0.5106538773786687,-0.5354750223240408,-1.3559434965942263,71632,21,"INHA, TBC1D10C, SFRP1, INHBA, FOXJ1"
GO_DEFENSE_RESPONSE_TO_OTHER_ORGANISM,0.1027013384672183,0.5106538773786687,-0.3308897132714014,-1.186684814220839,98475,293,"IFIT1, OAS2, DMBT1, SERPINE1, IFITM1, TRIM34, IFIT3, ZNF681, PRB3, ANG, DKKL1, OAS1, CD4, TRIM22, DDX60, PYCARD, OASL, FAM131B, OAS3, CD163L1, GBP3, ACP5, PGLYRP3, MTSS1, RSAD2, APOBEC3G, TLR3, IFIT2, BST2, VGF, IL22RA1, HIST1H2BJ, REP15, PHYHIP, ABCC9, SLC11A1, CHAF1B, PLSCR1, GBP1, IRF9, HMGB2, PLAC8, CSPG5, NLRC5, RNASE7, KCNJ8, REEP2, GABRA5, ISG15, APOBEC3D, IL6R, IL12A, LEAP2, SLFN11, 
TMEM173, FAM111A, B2M, APOBEC3B, ADM, NOD1, APOBEC3C"
GO_REGULATION_OF_CARDIAC_CONDUCTION,0.10288764737253603,0.5109631414146331,-0.4408779484760466,-1.3063774749040464,79483,49,"FXYD6, ATP1B2, ATP2B3, ACE2, NPPC, ATP2A1, NPR1, ABCC9, CAV1, FKBP1B, FXYD3, ATP2B4, CALM3, ATP2A3, ASPH, ATP1B3, RNF207, TNNI3"
GO_GLYCOSPHINGOLIPID_BIOSYNTHETIC_PROCESS,0.10314367480518731,0.5116174809312725,-0.5414725568857762,-1.3569795483966587,71541,20,"ST3GAL6, ST8SIA4, ST6GALNAC1, ST3GAL5, ST8SIA1, ST3GAL3, B4GALNT1, ST3GAL2, ST3GAL4, UGT8, ST8SIA2, ST6GALNAC2"
GO_DIVALENT_INORGANIC_CATION_TRANSPORT,0.10347477684793957,0.5122153335556922,-0.35117333264184786,-1.2187952461072205,94651,180,"PKD1L1, PKD1L2, CCR7, CACNB4, SLC39A2, CDH23, ANXA6, SLC24A3, CACNG4, CACNA2D3, SLC35G1, ATP2B3, GAS6, MCOLN3, ATP2A1, TRPM3, SLC30A2, NALCN, TRPC4, TMEM37, SLC11A1, XCL1, CORO1A, CACNA2D2, F2R, CACHD1, CAV1, TRPV3, FKBP1B, GRIN3B, CACNA1C, IL1RAPL1, ATP2B4, RASA3, GRIN2A, CATSPER1, CATSPER2, CTGF, ATP2A3, KCNJ2, DENND5B, PKDREJ, CACNA1G"
GO_NEGATIVE_REGULATION_OF_WOUND_HEALING,0.10351303315966381,0.5122153335556922,-0.4580408274283615,-1.317280885804743,78159,41,"SERPINE1, TSPAN8, WNT4, SERPINF2, APOE, PLAU, PROC, GP1BA, GJA1, PRKG1, CD109, ADRB2"
GO_MONOVALENT_INORGANIC_CATION_HOMEOSTASIS,0.10367699403746757,0.5124107856569675,-0.3898411744866769,-1.2636042149183604,87235,92,"TFAP2B, SCNN1G, TTPA, SLC4A4, SLC17A7, ATP1B2, CA2, SLC9A5, ATP12A, SLC26A10, TCIRG1, SLC11A1, CYP4F12, SCNN1A, SLC26A1, ATP6V0E2, SLC4A8, SLC26A6, PDK2, KCNJ2, SGK1"
GO_MATURATION_OF_5_8S_RRNA_FROM_TRICISTRONIC_RRNA_TRANSCRIPT_SSU_RRNA_5_8S_RRNA_LSU_RRNA_,0.10382071701729974,0.5125058656597399,0.4900531860369105,1.373737921417397,32604,18,"EXOSC8, PES1, NOL9, RRS1, NOP14, UTP20, RPS21, WDR12, RPSA"
GO_RESPONSE_TO_CADMIUM_ION,0.1039610622041247,0.5125840635860855,-0.471265405776421,-1.3249401930832938,77256,36,"STAR, MT1X, MT1F, PCNA, CDK1, MT1G, HAAO, CDK2, B2M, GSN, AKR1C3, ALAD, DTYMK, SPARC, CAT, CYB5A, ECE1"
GO_LYMPHOCYTE_DIFFERENTIATION,0.10426161662322107,0.5134510474136377,-0.3604414800504664,-1.2303366601902113,93312,149,"BLNK, FZD8, CCR7, IL7R, CD4, IKZF1, WNT4, IL15, CARD11, TCF7, PTGER4, RSAD2, IL7, ITGA4, GLI3, FOXN1, CDH17, MFNG, NKX2-3, MAFB, FLT3LG, PIK3CD, NFAM1, IL18R1, VAV1, B2M, PTK2B, PLCL2, JAG2, JAK3, BCL11B, FAS, MSH2, ID2, LGALS1, RAG1, HMGB1, TPD52, FADD, SOX4, MALT1, TYRO3"
GO_REGULATION_OF_RESPIRATORY_GASEOUS_EXCHANGE,0.10461504147535763,0.5140261356538758,-0.5623150171530333,-1.3615595673559044,71293,17,"NR4A2, PBX3, TSHZ3, ADORA1, NLGN3, PASK, NLGN2"
GO_POSITIVE_REGULATION_OF_VASCULAR_ENDOTHELIAL_GROWTH_FACTOR_PRODUCTION,0.1048163746338758,0.5140261356538758,0.44066663286626157,1.3412155697439059,30238,25,"C3AR1, C5AR1, PTGS2, CYP1B1, ATF4, HIF1A, IL1A, SULF1, C3"
GO_MUSCLE_ATROPHY,0.10501855061385068,0.5140261356538758,-0.7209719668368861,-1.362706731057395,63744,6,"IL15, PSMB9, GSN"
GO_RESPONSE_TO_KETONE,0.10507330735098108,0.5140261356538758,-0.36315856249351103,-1.233157478314842,93416,141,"CCR7, PTN, PTAFR, FN1, SFRP1, TYMS, GJB2, STAR, THBS1, CATSPERG, GAS6, PTGER4, GNG2, F7, ADCY2, TK1, SERPINF1, GHR, TGFB3, ADCY5, ADCY1, CAV1, SREBF1, DSG1, ADRB2, GNAI1, CATSPER1, CATSPER2, CATSPERB, CALM3, AQP1, CHEK2, CALR, FAS, SOCS3, NASP, DNMT1, AGER"
GO_REGULATION_OF_MULTICELLULAR_ORGANISMAL_METABOLIC_PROCESS,0.10509156866510196,0.5140261356538758,-0.4947073668779472,-1.336116874826665,76073,29,"WNT4, SERPINF2, SERPINB7, TGFB3, F2R, IL6R, ITGA2, CTGF, AGER, RAPGEF3, UCN"
GO_REGULATION_OF_VIRAL_GENOME_REPLICATION,0.10512752154980894,0.5140261356538758,-0.41777266886285735,-1.2867341361459665,83992,63,"IFIT1, IFITM1, NR5A2, OAS1, OASL, OAS3, RSAD2, APOBEC3G, BST2, PLSCR1, TOP2A, PARP10, ISG15, APOBEC3D, HMGA2, FAM111A, APOBEC3C"
GO_NEGATIVE_REGULATION_OF_HEART_CONTRACTION,0.10542285325697487,0.5148587032727941,-0.6121462149597763,-1.3691457256248982,69141,12,"PDE5A, SPTBN4, FKBP1B, ADORA1"
GO_REGULATION_OF_CGMP_METABOLIC_PROCESS,0.10567008418331036,0.515207675419712,-0.5616400959489566,-1.35992534917821,72012,17,"PDE5A, THBS1, APOE, GUCY1A2, NPPC, NPR1, FZD2, GUCA1B, RUNDC3A, PTK2B"
GO_POSITIVE_REGULATION_OF_OSTEOBLAST_DIFFERENTIATION,0.10581776823470464,0.515207675419712,-0.43580692691591566,-1.2996951878118552,82152,51,"IFITM1, WNT4, NPNT, PTGER4, DLX5, NPPC, GLI3, ID4, GJA1, BMPR1B, BMP7, IL6R, CTHRC1, CEBPA, MSX2, CD276, LMNA, WNT10B, WNT7B"
GO_REGULATION_OF_ACTIN_FILAMENT_BUNDLE_ASSEMBLY,0.10586973364223375,0.515207675419712,-0.4174647409767934,-1.2857857224463625,84585,63,"WNT4, SFRP1, NOX4, PTGER4, SERPINF2, AMOT, VIL1, PRKCQ, ASAP3, SYNPO, SHANK1, CTGF, LPAR1, S100A10, FHOD1, EVL, RAPGEF3, SWAP70, SMAD3, ID1"
GO_PROTEIN_LOCALIZATION_TO_CHROMOSOME_CENTROMERIC_REGION,0.10602109312030672,0.5153351126048439,-0.6396328026114813,-1.369837223481008,68136,10,"CENPA, AURKB, CDK1, BUB1B"
GO_METALLO_SULFUR_CLUSTER_ASSEMBLY,0.10625161889960537,0.5155509878918372,0.518158186947593,1.3851784177037003,34866,15,"ISCU, ISCA1, IBA57, FXN, NFU1, CIAPIN1, CIAO1, SDHAF1, NDOR1, MMS19, HSCB"
GO_BONE_MORPHOGENESIS,0.10646775366029743,0.5155509878918372,-0.4159759369535486,-1.284122382230349,85239,64,"COL1A1, MMP13, INSIG1, ACP5, FGFR3, FREM1, DLX5, NPPC, GLI3, RARB, TGFB3, COL27A1, CSGALNACT1, TFAP2A, BMPR1B, SHOX2, FGFR2, SP5, LRP5, CYP26B1, NAB1, MSX2, PHOSPHO1"
GO_RENAL_VESICLE_DEVELOPMENT,0.10653351132544071,0.5155509878918372,-0.6247103397163221,-1.3687839408255642,69189,11,"WNT4, SIX2, SALL1, GREM1, FMN1, SMO, CTNNB1, BMP4"
GO_NUCLEOSIDE_DIPHOSPHATE_METABOLIC_PROCESS,0.10656640531842444,0.5155509878918372,-0.4065675212696656,-1.2760645980333847,86688,72,"CMPK2, PGAM4, MPP1, DLG2, CARD11, OGDHL, GALK1, ENO2, RRM2, MPP2, PFKFB1, ALDOC, NME3, PFKFB4, PGM1, NUDT7, ENTPD2, HK2, ENO3, DTYMK, PGAM1, DHTKD1, AK7, NUDT16"
GO_SULFUR_COMPOUND_BIOSYNTHETIC_PROCESS,0.10682962374138845,0.5155707627507303,-0.3544356500125095,-1.2210254362374504,96761,165,"VCAN, ST3GAL6, CHST9, ACSBG1, B3GNT3, HS6ST1, ELOVL3, ELOVL2, CHST11, ST3GAL3, CSGALNACT1, CSPG5, SLC26A1, MAT1A, SCD, GGT6, HS6ST3, ACOT4, CHST7, DSE, CHST6, PAPSS1, CHST2, ST3GAL2, CHSY3, SCD5, CHST14, ACSF2, B3GNT4, GGT7, TPK1, GLCE, MGST3, ACOT7, B4GALT6, XYLT1, ACACB, TECR, SLC25A1, B3GNT7, VANGL2, FASN, ST3GAL4, CHST15, ACSL3, GSTA4, CHST1, B3GAT3, EXTL2, EXT1, HAGH, MRI1"
GO_MACROMOLECULE_METHYLATION,0.10695514470859119,0.5155707627507303,0.2728770783356685,1.1623919992595837,11008,152,"PIWIL4, TDRD5, FBLL1, PRMT8, PLD6, RAB6A, TRMT61A, SETD7, TET3, PRMT3, METTL1, CAMKMT, MOV10L1, MTRR, PRDM6, PRDM16, BCDIN3D, TRMT1, EMG1, NSUN4, PRMT5, TET2, TRMT6, NSD1, NSUN3, TFB2M, ETF1, FBXO11, KDM1B, NSUN2, GSPT1, OGT, ASH1L, SETD1B, MEPCE, METTL2B, GNAS, TRMT5, TGS1, GATAD2B, ALKBH8, METTL16, BAZ2A, TFB1M"
GO_VESICLE_FUSION_TO_PLASMA_MEMBRANE,0.10748917664113464,0.5155707627507303,0.5909125470278401,1.414237236092622,38408,10,"STX19, SNAP23, STX4"
GO_DNA_METHYLATION_INVOLVED_IN_GAMETE_GENERATION,0.10765451962412063,0.5155707627507303,0.5724450976258794,1.4066066038215772,37736,11,"PIWIL4, TDRD5, PLD6, MOV10L1, KDM1B"
GO_PROSTATE_GLANDULAR_ACINUS_DEVELOPMENT,0.10775143309821746,0.5155707627507303,-0.6238734092534336,-1.366950167788112,69980,11,"SFRP1, ESR1, FGFR2, FOXA1, NOTCH1, HOXB13, WDR77"
GO_PROTEIN_HETEROOLIGOMERIZATION,0.10784515905449549,0.5155707627507303,-0.4019833458160903,-1.2709884897344943,88378,76,"COL1A1, P2RX6, CHRNB4, GCHFR, SCUBE3, COL6A1, CLDN3, COL6A2, LRP4, RRM2, HIST1H4C, CDH2"
GO_LIPOPOLYSACCHARIDE_MEDIATED_SIGNALING_PATHWAY,0.1078886636410188,0.5155707627507303,0.4329615877418178,1.3300954647729941,30760,26,"NOS3, IL18, LY96, TLR4, CD6, PTPN22"
GO_POSITIVE_REGULATION_OF_VIRAL_GENOME_REPLICATION,0.1078985163031138,0.5155707627507303,-0.5011694495884835,-1.3349897940217765,77456,27,"IFIT1, NR5A2, TOP2A"
GO_RESPONSE_TO_INTERFERON_BETA,0.10795629112199646,0.5155707627507303,-0.5452361563681771,-1.3519906472687397,74491,19,"IFITM1, TLR3, BST2, PLSCR1, XAF1, TMEM173, STAT1"
GO_BASEMENT_MEMBRANE_ORGANIZATION,0.1080139983617582,0.5155707627507303,-0.6726912585515431,-1.365571183547172,67778,8,"NID1, FLRT2, CTSS"
GO_I_KAPPAB_KINASE_NF_KAPPAB_SIGNALING,0.10803846575185876,0.5155707627507303,0.3415938404898675,1.2489340713627544,22682,58,"TICAM2, RBCK1, LY96, TLR4, RIPK3, NFKBIL1, RPS27A, RIPK1, AZI2, CHUK, TRIP6, IRAK1BP1, BCL3, TRAF6, RIPK2, TNIP2, NLRC3, ROCK1, TANK, ROCK2, TAB2, BCL10, IKBKB, TNFRSF1A, TAB3"
GO_REGULATION_OF_INTERLEUKIN_2_BIOSYNTHETIC_PROCESS,0.10828721979832245,0.5155707627507303,-0.6543411659176865,-1.3667751194252344,68823,9,"CD4, CARD11, PRKCQ"
GO_VERY_LONG_CHAIN_FATTY_ACID_METABOLIC_PROCESS,0.10835442460074017,0.5155707627507303,-0.5261128939650805,-1.3448020063167958,75947,22,"ACSBG1, ELOVL3, ELOVL2, CYP4F12, ACOT4, TECR"
GO_FOREBRAIN_NEURON_FATE_COMMITMENT,0.10850592146564732,0.5155707627507303,-0.6541648219013215,-1.366406775468624,68962,9,"PAX6, NKX2-1, DLX2, DLX1, BCL11B"
GO_CELLULAR_RESPONSE_TO_INSULIN_STIMULUS,0.10867319738771158,0.5155707627507303,0.2813267260877585,1.1738417195371045,13045,130,"TRIB3, ATP6V0A4, GFPT1, XBP1, ERRFI1, PDK4, EIF4EBP1, GOT1, VLDLR, IGF2, HIF1A, IRS2, GRB10"
GO_NEGATIVE_REGULATION_OF_DNA_TEMPLATED_TRANSCRIPTION_ELONGATION,0.1086813552776293,0.5155707627507303,0.5899248504699669,1.4118733714951777,38834,10,"SHH, EAPP, AXIN1, SUPT4H1"
GO_NEGATIVE_REGULATION_OF_MULTI_ORGANISM_PROCESS,0.10882303661022628,0.5155707627507303,-0.3775605418682692,-1.2469586588865431,93525,108,"IFIT1, IFITM1, OAS1, OASL, OAS3, MICB, NPPC, RSAD2, APOBEC3G, BST2, FBLN1, POU2F3, PTX3, PLSCR1, HTRA1, ARHGDIB, PARP10, ISG15, NODAL, APOBEC3D, PTGDS, HMGA2, FAM111A, SPINK5, GSN, APOBEC3C, STAT1, TRIM5, TRIM21, DHX58, ACVR1C, TNFAIP3, TRIM32, MX1"
GO_RESPIRATORY_GASEOUS_EXCHANGE,0.10926593681779931,0.5155707627507303,-0.47457039632624193,-1.3205693191674088,80633,34,"HNMT, NDN, PBX3, MAFB, CHST11, FUT8, ELN, ADRB2, RAB3A, JAG2"
GO_C21_STEROID_HORMONE_METABOLIC_PROCESS,0.10931655570390282,0.5155707627507303,-0.5769724641334002,-1.3583202805393058,73443,15,"STAR, DHRS2, ADM, AKR1C3, SCP2, STARD5, AKR1B1, AKR1C2, SRD5A1, FDXR"
GO_MULTIVESICULAR_BODY_SORTING_PATHWAY,0.10935582562316484,0.5155707627507303,-0.6227608218487994,-1.364512411158504,71022,11,"RAB27B, SYTL4"
GO_TRANSCRIPTION_FROM_MITOCHONDRIAL_PROMOTER,0.1093913795735586,0.5155707627507303,0.6895368704941951,1.4234784835014116,42992,6,"PPARGC1B, SLC25A33, TFB2M, TFAM"
GO_REGULATION_OF_TELOMERASE_RNA_LOCALIZATION_TO_CAJAL_BODY,0.10941475826972011,0.5155707627507303,0.5157162624947207,1.37865048639819,35904,15,"DKC1, NAF1, NOP10, RUVBL1, SHQ1, CCT7, CCT8, CCT3, CCT2, CCT4, RUVBL2, CCT5, CCT6A, TCP1"
GO_MUSCLE_CONTRACTION,0.1095012787865184,0.5155707627507303,-0.3543174955167202,-1.2192668819211645,99029,163,"MAP2K6, P2RX6, SSTR2, SULF2, ACTA2, MYL9, CHRNB4, SCN4B, DYSF, DTNA, SMTN, NPY1R, SCN1B, MB, ANKRD2, CXCR4, CALD1, HTR1D, TMOD2, VIM, ITGB5, GAMT, FKBP1B, GJA1, LTB4R, VIPR1, CACNA1C, SSPN, ADRB2, TACR2, EDN2, STBD1, VEGFB, ATP8A2, CALM3, KCNJ2, GJC1, KCNQ1, ASPH, PLA2G6"
GO_REGULATION_OF_CIRCADIAN_SLEEP_WAKE_CYCLE,0.10957600617121424,0.5155707627507303,-0.6226208426743072,-1.36420570702074,71165,11,"PTGER4, PER3, ADORA1, PTGDS"
GO_GASTRULATION,0.11050182728170907,0.5184551797013783,-0.3674168537362014,-1.2347359186054259,96968,127,"MESP1, FN1, SFRP1, ITGA7, NR4A3, ATOH8, CHRD, COL6A1, AMOT, INHBA, WNT8B, MMP15, ITGA4, SIX2, FOXC2, ITGB2, ITGB5, WNT3A, BMP7, COL8A1, NODAL, COL4A2, HMGA2, MMP2, CRB2, ITGA2, EYA2, GSC, COL7A1, FGFR2, LRP5, LAMA3, SOX7, VANGL2, DUSP4, EXT1, TAL1, TWSG1, PRKACA, ETS2, SMAD3"
GO_ACID_SECRETION,0.1106540550992353,0.5184551797013783,-0.45454207581097694,-1.3072188163258383,83551,41,"NMU, CACNB4, PLA2G4F, PPFIA4, SLC17A7, CCKBR, APBA1, SLC1A1, TRPC4, NMB, ACE, SLC26A6, RAB3A"
GO_LONG_TERM_SYNAPTIC_DEPRESSION,0.11098964098717093,0.5184551797013783,-0.6085709923922157,-1.36114926893382,72792,12,"PLK2, SHANK2, PTK2B, STXBP1, ABHD6, GRID2IP"
GO_VENTRAL_SPINAL_CORD_INTERNEURON_SPECIFICATION,0.11100713687914752,0.5184551797013783,-0.7167987757574538,-1.354818996394311,67379,6,"PAX6, GLI3, NKX6-1, GLI2, SUFU"
GO_REGULATION_OF_SMOOTH_MUSCLE_CELL_DIFFERENTIATION,0.11111571050561851,0.5184551797013783,0.48486908712830723,1.3592056350002437,34895,18,"CTH, SHH, KIT, PRDM6, EREG"
GO_ADAPTATION_OF_SIGNALING_PATHWAY,0.11137264974051776,0.5184551797013783,-0.5964567695186913,-1.3589050507315903,73716,13,"GIPR, ARRB1, DNM1, ADRB2, ADM"
GO_SUBSTRATE_ADHESION_DEPENDENT_CELL_SPREADING,0.11139938448100557,0.5184551797013783,-0.4801003575441405,-1.3212111115674041,81623,32,"FN1, ITGA4, EPHB3, FZD4, BVES, KIF14, RADIL, FGFRL1, MICALL2, TYRO3, LAMB1, EFNA1, LAMC1, ANTXR1, ILK, ITGAV, PARVA, AXL, LAMA5"
GO_MITOCHONDRIAL_DNA_METABOLIC_PROCESS,0.11168698874146794,0.5184551797013783,0.5874239482052669,1.4058879357071634,39908,10,"SESN2, LONP1, DNAJA3, SLC25A33, RRM2B"
GO_ARGININE_METABOLIC_PROCESS,0.11171854763754933,0.5184551797013783,0.5139266662519238,1.3738664066434558,36660,15,"NOS3, ASS1, ARG2, AGMAT, ASL, NOS2"
GO_PSEUDOURIDINE_SYNTHESIS,0.11178507627632153,0.5184551797013783,0.4932373610289285,1.3628207989797958,35604,17,"DKC1, PUS1, GAR1, PUS7L, NAF1, NOP10, TRUB1, PUS3, PUSL1, PUS10, RPUSD2, PUS7, RPUSD1, TRUB2"
GO_ENDODERMAL_CELL_FATE_COMMITMENT,0.11181572164587816,0.5184551797013783,0.5873158944669677,1.4056293295547466,39954,10,"POU5F1, CDC73"
GO_REGULATION_OF_MEIOTIC_CELL_CYCLE,0.11184180769278214,0.5184551797013783,-0.48344635429301197,-1.3224988092350585,81598,31,"FBXO43, WNT4, DMRT1, NPPC, PRDM9, CDC20, ASPM, RPS6KA2, FBXO5, CALR, MSH2, MSX2"
GO_VOCALIZATION_BEHAVIOR,0.11186970743093694,0.5184551797013783,-0.5961348941920622,-1.3581717234740003,74045,13,"NRXN3, CNTNAP2, SHANK1, SHANK2, NLGN3, NRXN1, NRXN2, SRPX2"
GO_MUSCLE_ADAPTATION,0.11200682476490272,0.5184551797013783,0.4606118713763394,1.3434120406961265,33873,21,"NOS3, ACTA1, MEF2C, HMOX1, HDAC4, KLF15, PPP3CA"
GO_MYOTUBE_DIFFERENTIATION,0.11228183805415158,0.5184551797013783,0.39261495687500847,1.29232323573531,29123,35,"ACTA1, SHH, MEF2C, TANC1, XK, BARX2, HOMER1, PPP3CA, PITX2"
GO_OLFACTORY_BULB_INTERNEURON_DIFFERENTIATION,0.11231762986380898,0.5184551797013783,0.5524878984791675,1.3908003564441578,38653,12,"SLIT2, SALL3, ATF5"
GO_RESPONSE_TO_NUTRIENT,0.11240415660041173,0.5184551797013783,-0.3577000169947717,-1.2217506651259022,100683,150,"COL1A1, SSTR2, TTPA, ALOX5, PTN, CD4, SFRP1, TYMS, IL15, STAR, ACP5, TNC, GAS6, BCHE, F7, IGFBP2, HMGCS1, GIPR, CNR1, CDKN2D, PDX1, CAV1, FKBP1B, BMP7, AGL, GATA4, FZD1, AQP3, BRIP1, ITGA2, PDK2, CYP1A1, GSN, SUOX, AKR1C3, GNAI2, DNMT1, AGER"
GO_FATTY_ACYL_COA_METABOLIC_PROCESS,0.11245596150494129,0.5184551797013783,-0.45121753366323886,-1.3030211397450788,85161,42,"ACSBG1, ELOVL3, ELOVL2, SCD, ACOT4, SCD5, ACSF2, ACOT7, ACACB, TECR, SLC25A1, FASN, ACSL3, DGAT1, PPT2, ACSL4, DGAT2, ELOVL6, ACOT1, ACSL6, ACOT11, ACLY, HSD17B4"
GO_BRANCHING_INVOLVED_IN_SALIVARY_GLAND_MORPHOGENESIS,0.11280187945217897,0.5184551797013783,-0.5955117276303642,-1.3567519656115457,74662,13,"SEMA3C, TGM2, NRP1, BMP7, FGFR1, PLXND1, FGFR2"
GO_FOREBRAIN_NEURON_DEVELOPMENT,0.11285810845941871,0.5184551797013783,0.43579409017101844,1.3263854699821085,32558,25,"SLIT2, SALL3, ATF5, LHX6"
GO_FEEDING_BEHAVIOR,0.11316814747328448,0.5184551797013783,-0.4381059053808158,-1.2938031653543334,87198,48,"NMU, NPW, DMBX1, CCKBR, NKX2-1, NPY1R, ACE2, OPRL1, NEGR1, CNTFR, P2RY1, HAND2, STRA6"
GO_AROMATIC_AMINO_ACID_FAMILY_METABOLIC_PROCESS,0.11317864264867078,0.5184551797013783,-0.557015167225177,-1.3487267936352987,77129,17,"IL4I1, HPDL, ASRGL1, HAAO"
GO_REGULATION_OF_LIPOPROTEIN_PARTICLE_CLEARANCE,0.1132386884822891,0.5184551797013783,-0.6509956218335615,-1.3597870119160431,71970,9,"PCSK9, MYLIP"
GO_LENS_DEVELOPMENT_IN_CAMERA_TYPE_EYE,0.11324601635765698,0.5184551797013783,-0.4380681718046993,-1.2936917315215088,87258,48,"CRYGS, SLITRK6, PAX6, SIX3, MAF, WNT2B, NHS, VIM, WNT5B, GJA1"
GO_HOMOLOGOUS_CHROMOSOME_SEGREGATION,0.11333729942463941,0.5184551797013783,-0.49400545918395744,-1.3254187751640265,81728,28,"FMN2, REC8, SYCE2, PTTG1, DMC1, SYCE3, ESPL1, PLK1, TEX15, CCDC155, TERF1, TRIP13, SYCP2"
GO_NEGATIVE_REGULATION_OF_STEM_CELL_DIFFERENTIATION,0.11373772021331433,0.5195423512658254,-0.4754327948320206,-1.3157460322474661,83625,33,"NKX2-1, SFRP1, DACT3, WNT3A, BMP7, SMAD7, PRICKLE1, FOXA1, OVOL2, DAB2IP, EFNA1, NOTCH1"
GO_INNERVATION,0.11382735021660785,0.5195423512658254,-0.5288305426962578,-1.3391181759649982,79402,21,"RET, SULF2, SLITRK6, ISL1, NPTX1, NRP1, NTF4, GABRA5, RNF165"
GO_CELLULAR_RESPONSE_TO_ESTROGEN_STIMULUS,0.11397242873169669,0.519628448602874,-0.49365531612322094,-1.3244793398236556,82186,28,"SSTR2, SFRP1, ESR1, CCNA2, TRIM24, ITGA2, FAS, MSX2, EGFR, H2AFZ"
