pathway,pval,padj,ES,NES,nMoreExtreme,size,leadingEdge
GO_POSITIVE_REGULATION_OF_TRANSCRIPTION_FROM_RNA_POLYMERASE_II_PROMOTER_IN_RESPONSE_TO_ENDOPLASMIC_RETICULUM_STRESS,2.8527577609274885e-6,0.0022395009454099202,0.906721564217827,2.2279875316353253,0,11,"DDIT3, ATF3, CEBPB, XBP1, CREB3L1, ATF4, HSPA5, ATF6"
GO_CELL_CYCLE_PHASE_TRANSITION,3.1791144894501088e-6,0.0022395009454099202,-0.4760491702236519,-1.6885873646109866,2,243,"USH1C, CDKN2C, NES, TYMS, GPR132, POLE2, RHOU, INHBA, DHFR, PLK2, DHFRP1, E2F1, MCM4, ID4, RRM2, FBXL7, CDKN2D, PCNA, MCM3, IQGAP3, BIRC5, MCM6, MCM10, MCM5, CDT1, ABCB1, HMMR, HAUS7, PRKAR2B, UBE2C, POLA2, PLK1, CCNB2, CDKN3, CCNB1, PKMYT1, CDK1, CCNE2, MASTL, NEK2, MCM2, TPX2, FOXM1, CDC6, TIMELESS, CCNA1, AURKA, CHEK1, BUB1B, UBE2S, HAUS6, CDK2, CALM3, CDC45, MCM7, PLK4, ORC6, HAUS4, 
TUBB4A, ORC1, SKP2, FBXO5, SFI1, TUBB, CHEK2, CEP152, HAUS8, GFI1, TERF1, CDC25A, CENPJ, RPA3, WEE1, CDCA5, MELK, CEP192, CDC25C, TUBA1A, ID2, PRIM1, POLE, RPA2, OPTN, CDC7, BORA, WNT10B, CDC25B, PPM1D, CEP78, PRKACA, PRIM2, HAUS1, TUBB4B, CDKN2A, FBXL15, CNTRL, CDC23, MCM8, CAMK2G, RANBP1, NDE1, NINL, ODF2, RPA1, CALM2, HAUS5, BRSK2, SSNA1, CCND1, CDK3, CDKN1A, POLA1, CDKN1B, CCNE1, CEP70, 
TUBG1, DNM2, DBF4, RB1, CHMP2A, CEP250, PPP2R1A"
GO_POSITIVE_REGULATION_OF_TRANSCRIPTION_FROM_RNA_POLYMERASE_II_PROMOTER_IN_RESPONSE_TO_STRESS,3.3065721427910112e-6,0.0022395009454099202,0.8025353031180363,2.3406595797692833,0,21,"DDIT3, VEGFA, ATF3, CEBPB, XBP1, CREB3L1, ATF4, HSPA5, HIF1A, ATF6, KLF2, MT3"
GO_INTRINSIC_APOPTOTIC_SIGNALING_PATHWAY_IN_RESPONSE_TO_ENDOPLASMIC_RETICULUM_STRESS,3.62162690723927e-6,0.0022395009454099202,0.7484079303563529,2.359990293186216,0,29,"TRIB3, ITPR1, CHAC1, DDIT3, ERN1, CEBPB, BCL2, XBP1, PPP1R15A, TNFRSF10B, ATF4, BBC3, DNAJC10"
GO_RIBOSOMAL_LARGE_SUBUNIT_BIOGENESIS,4.245815748579775e-6,0.0022395009454099202,0.7072430386812829,2.4570484506736263,0,45,"RPL3L, RPF2, MAK16, RSL24D1, MDN1, EIF6, SDAD1, WDR74, RPL26, RPL12, PES1, NOL9, EBNA1BP2, RRS1, DDX28, RPL6, RPL14, NLE1, NOC2L, PPAN, RPL7L1, RPL35, RPL24, RPL7, RPL38, RPL35A, RPL10, FASTKD2, NOP16, MRTO4, RPL5, RPF1, WDR12, RPL23A, RPL26L1, ZNF622, WDR55, NSA2, RPL11"
GO_RIBOSOME_ASSEMBLY,4.357754187801774e-6,0.0022395009454099202,0.6791668749616794,2.391899245858652,0,48,"RPS17, RPL3L, RPF2, SBDS, RSL24D1, MDN1, EIF6, PWP2, NIP7, TSR1, RPL12, DDX28, RPS19, RPS27, NPM1, RPS5, RPL6, NSUN4, RPS14, PPAN, BMS1, RPL24, RPL38, RPL10, RRP7A, FASTKD2, MRTO4, RPL5, RPF1, RPL23A, EIF2A, RPS10, DDX3X, RPSA, RPL11"
GO_NEURON_PROJECTION_GUIDANCE,4.409394656254616e-6,0.0022395009454099202,-0.5047352057849425,-1.7407830850746178,3,167,"PTPRO, SEMA3C, PLXNC1, DPYSL2, NFASC, FEZF1, NGFR, CDH4, UNC5C, PAX6, DPYSL5, NKX2-1, NCAM1, LHX4, NRXN3, NR4A3, NTN1, NTN4, SEMA3F, SCN1B, DLX5, FLRT2, SLIT1, KIF26A, EPHB1, EFNA2, GLI3, ISL1, POU4F2, EPHB3, SPTBN4, PRKCQ, CDK5R1, EFNA3, EPHA7, NRP1, BOC, DPYSL4, WNT3A, LAMA2, BMPR1B, ARTN, BMP7, EFNA4, EPHB2, UNC5A, SEMA4F, LHX2, EFNB3, PLXND1, MYH10, ZNF280A, RNF165, MATN2, GLI2, SPTB, 
BCL11B, EFNB1, FLRT3, NRXN1, VANGL2, CSF1R, ROBO2, RPS6KA5, EVL"
GO_RIBOSOMAL_SMALL_SUBUNIT_BIOGENESIS,4.557054320087495e-6,0.0022395009454099202,0.6521485659322062,2.342666719990507,0,53,"RPS17, HEATR1, BYSL, PWP2, WDR3, UTP6, RRS1, UTP14C, RPS19, RPS27, RPS6, SRFBP1, NOP14, RPS5, DCAF13, EMG1, RPS8, RPS24, UTP14A, FCF1, RPS14, UTP23, UTP20, RPS16, RPS28, KRR1, NOB1, WDR46, RPL38, RRP7A, RPS21, RCL1, NGDN, MPHOSPH10, RPS10"
GO_CELL_MORPHOGENESIS_INVOLVED_IN_NEURON_DIFFERENTIATION,6.267811029675996e-6,0.0022395009454099202,-0.4544791642334767,-1.6280499915743307,5,287,"LRFN2, NTNG2, PTPRO, SEMA3C, PLXNC1, DPYSL2, NFASC, FEZF1, NGFR, SLITRK5, SLITRK6, CDH4, UNC5C, PAX6, DPYSL5, NKX2-1, NCAM1, LHX4, NRXN3, LINGO3, NR4A3, NTN1, ATL1, NTN4, SEMA3F, SCN1B, DLX5, RTN4R, FLRT2, SLIT1, KIF26A, MAP6, NR4A2, EPHB1, NDN, EFNA2, GLI3, ISL1, NPTX1, POU4F2, EPHB3, CLIC5, LRP4, SPTBN4, PRKCQ, STMN1, PDZD7, CDK5R1, LRRN1, ADCY1, EFNA3, MYO7A, EPHA7, NRP1, BOC, WNT3A, 
LAMA2, BMPR1B, ARTN, BMP7, EFNA4, EPHB2, UNC5A, CDH11, LINGO1, CELSR2, SEMA4F, LHX2, EFNB3, PLXND1, SEMA7A, SHANK1, MYH10, ZNF280A, ATP8A2, RNF165, MATN2, RAB3A, GLI2, SPTB, BCL11B, NLGN3, FGFR2, EFNB1, FLRT3, COBL, NRXN1, LRFN1, VANGL2, CSF1R, ROBO2, RPS6KA5, EVL, ID2, EFNB2, FMN1, WNT7A, APBB1, STXBP1, EXT1, MAPT, GBX2, NKX2-8"
GO_ESTABLISHMENT_OF_PROTEIN_LOCALIZATION_TO_ENDOPLASMIC_RETICULUM,6.855748202080034e-6,0.0022395009454099202,0.6428764526943453,2.5935563815554517,0,103,"RPS17, RPL3L, SEC63, RAB3GAP1, RPS12, SEC61A1, RPL21, RPL36, SRPRB, RPL37, CHMP4A, RPS18, RPL26, RPL37A, SRP72, RPL36A, RPL12, RPS23, RPL4, RPS27A, RPS19, RPS27, RPL9, RPS6, RPL41, RPLP0, RPL18A, RPS5, RPLP1, RPL13A, RPL30, RPS8, RPL6, RPL14, RPL28, RPS24, RPS3A, RPL19, RPS14, RPL34, RPL8, RPS13, RPL39, RPS16, RPS28, RPL35, RPL24, RPL18, RPL10A, RPS2, RPL7, RPL38, RPL35A, RPS29, RPL10, 
RPLP2, RPS21, RPL32, RPS4X, RAB10, RPL5, RPL27A, RPL27, RPL17, RPS3, RPL13, RPL23A, RPL26L1, RPS10, RPL29, RPL15, RPS15A, FAU, SPCS1, RAB3GAP2, RYR2, RPL23, RPL31, RPS11, RPSA, RPL11, SRP19, RPS9, RPS20, RPS26, RPL3"
GO_CELLULAR_RESPONSE_TO_TOPOLOGICALLY_INCORRECT_PROTEIN,7.059703916017762e-6,0.0022395009454099202,0.5352204101157598,2.1714266420349952,0,107,"CTH, DDIT3, ATF3, ERN1, STC2, ASNS, GFPT1, HERPUD1, XBP1, CREB3L1, PPP1R15A, SEC63, ATF4, BHLHA15, HYOU1, HSPA5, ATF6, RHBDD1, SEC61A1, EDEM1, WIPI1, DERL3, AARS, SRPRB, SYVN1, YIF1A, DNAJC3, TBL2, DNAJB9, NFE2L2"
GO_NUCLEAR_TRANSCRIBED_MRNA_CATABOLIC_PROCESS_NONSENSE_MEDIATED_DECAY,7.489739057491237e-6,0.0022395009454099202,0.6127208969418567,2.512468572912042,0,115,"RPS17, RPL3L, RPS12, RPL21, RPL36, SMG1, SMG7, RPL37, RPS18, RPL26, RPL37A, CTIF, RPL36A, RPL12, RPS23, RPL4, PABPC1, RPS27A, RPS19, RPS27, RPL9, RPS6, RPL41, RPLP0, RPL18A, RPS5, RPLP1, SMG5, RPL13A, RPL30, RPS8, RPL6, RPL14, PARN, RPL28, RPS24, RPS3A, RPL19, RPS14, RPL34, RPL8, RPS13, RPL39, RPS16, ETF1, RPS28, RPL35, RPL24, RPL18, RPL10A, RPS2, RPL7, RPL38, GSPT1, RPL35A, RPS29, RPL10, 
RPLP2, RPS21, RPL32, RPS4X, RPL5, RPL27A, RPL27, RPL17, RPS3, RPL13, RPL23A, RPL26L1, MAGOH, RPS10, RPL29, RPL15, RPS15A, FAU, PPP2R2A, MAGOHB, RPL23, RPL31, RPS11, RPSA, RPL11, NCBP2, EIF3E, RPS9, RPS20, UHMK1, SMG6, RPS26, RPL3, CASC3"
GO_PROTEIN_LOCALIZATION_TO_ENDOPLASMIC_RETICULUM,7.774598830700336e-6,0.0022395009454099202,0.5672573914745591,2.3404554221248146,0,120,"RPS17, RPL3L, ANK2, PPP1R15A, SEC63, HSPA5, RAB3GAP1, RPS12, SEC61A1, RPL21, RPL36, SRPRB, RPL37, CHMP4A, RPS18, RPL26, RPL37A, SRP72, RPL36A, RPL12, RPS23, RPL4, RPS27A, RPS19, RPS27, RPL9, RPS6, RPL41, RPLP0, RPL18A, RPS5, PEX16, RPLP1, RPL13A, RPL30, RPS8, RPL6, RPL14, RPL28, RPS24, RPS3A, RPL19, RPS14, RPL34, RPL8, RPS13, RPL39, RPS16, RPS28, RPL35, RPL24, RPL18, RPL10A, RPS2, RPL7, 
RPL38, RPL35A, RPS29, RPL10, RPLP2, RPS21, RPL32, RPS4X, RAB10, RPL5, RPL27A, RPL27, RPL17, RPS3, RPL13, RPL23A, RPL26L1, RPS10, RPL29, RPL15, RPS15A, FAU, SPCS1, RAB3GAP2, RYR2, RPL23, RPL31, RPS11, RPSA, RPL11, SRP19, ANKRD13C, RPS9, RPS20, RPS26"
GO_CYTOPLASMIC_TRANSLATION,8.165665011758557e-6,0.0022395009454099202,0.6618753417572185,2.255580123290653,1,41,"EIF4EBP1, RPL22L1, RPL36, EIF3D, EIF3J, RPL26, RPL36A, RPL9, RPLP0, RPLP1, RPLP0P6, RPL6, RPL8, EIF3A, RPL7L1, RPL7, GSPT1, RPL35A, DENR, RPLP2, MRTO4, RPL26L1, CDC123, RPL29, RPL15, MCTS1, EIF3M, SSB, RPL31"
GO_MULTI_ORGANISM_METABOLIC_PROCESS,8.640279253825483e-6,0.0022395009454099202,0.4776221350513809,2.002592412347349,0,135,"RPS17, RPL3L, RPS12, RPL21, RPL36, EIF3D, RPL37, RPS18, RPL26, RPL37A, RPL36A, RPL12, RPS23, RPL4, RPS27A, RPS19, RPS27, RPL9, RPS6, RPL41, RPLP0, RPL18A, RPS5, RPLP1, RPL13A, RPL30, RPS8, RPL6, RPL14, RPL28, RPS24, RPS3A, ATG16L1, SEH1L, RPL19, RPS14, RPL34, RPL8, RPS13, EIF3A, RPL39, RPS16, RPS28, EIF3G, RPL35, RANBP2, RPL24, RPL18, RPL10A, RPS2, RPL7, RPL38, RPL35A, RPS29, RPL10, RPLP2, 
RPS21, NUP88, RPL32, RPS4X, RPL5, RPL27A, RPL27, RPL17, MON1B, RPS3, RPL13, RPL23A, RPL26L1, RPS10, RPL29, RPL15, RPS15A, SSB, FAU, RPL23, RPL31, RPS11, NUPL2, RPSA, RPL11, EIF3L, MAP2K2, RPS9, RPS20, RPS26, RPL3, EIF3B, NUP160"
GO_TRANSLATIONAL_INITIATION,8.944383821398544e-6,0.0022395009454099202,0.6321597620356288,2.6641349728326555,0,140,"RPS17, EIF4EBP1, RPL3L, EIF3CL, RPS12, RPL21, EIF1, EIF4G3, RPL36, EIF3D, EIF6, EIF2S2, EIF3J, EIF3C, RPL37, RPS18, RPL26, RPL37A, MTIF2, RPL36A, EIF5, LARP1, RPL12, RPS23, RPL4, PABPC1, RPS27A, RPS19, RPS27, RPL9, RPS6, RPL41, RPLP0, RPL18A, EIF1AX, RPS5, RPLP1, RPL13A, RPL30, RPS8, RPL6, RPL14, RPL28, RPS24, RPS3A, RPL19, RPS14, EIF2B2, RPL34, EIF1B, RPL8, RPS13, EIF2S3, EIF3A, RPL39, 
RPS16, RPS28, EIF3G, EIF2S1, RPL35, RPL24, RPL18, RPL10A, RPS2, RPL7, RPL38, RPL35A, DENR, RPS29, RPL10, RPLP2, RPS21, RPL32, PAIP1, RPS4X, RPL5, RPL27A, RPL27, RPL17, RPS3, RPL13, RPL23A, RPL26L1, CDC123, EIF2A, RPS10, RPL29, RPL15, MCTS1, RPS15A, EIF3M, SSB, FAU, RPL23, RPL31, RPS11, RPSA, RPL11, EIF3L, EIF4A1, EIF3E, EIF3K, RPS9, RPS20, RPS26, RPL3, EIF3B"
GO_PROTEIN_TARGETING_TO_MEMBRANE,9.715246135760849e-6,0.0022395009454099202,0.414014165908409,1.763602707003769,0,152,"RPS17, RPL3L, ANK2, SEC63, RPS12, SEC61A1, RPL21, RTP4, NKD2, RPL36, SRPRB, RPL37, CHMP4A, RPS18, RPL26, RPL37A, SRP72, RPL36A, RPL12, RPS23, RPL4, PEX26, RPS27A, RPS19, RPS27, RPL9, RPS6, RPL41, RPLP0, RPL18A, RPS5, PEX16, RPLP1, RPL13A, RPL30, RPS8, RPL6, RPL14, RPL28, RPS24, RPS3A, RPL19, RPS14, RPL34, RPL8, RPS13, RPL39, RPS16, RPS28, RPL35, RPL24, RPL18, RPL10A, RPS2, RPL7, RPL38, 
RPL35A, RPS29, RPL10, RPLP2, RPS21, RPL32, RPS4X, RPL5, PRKCI, TMED2, RPL27A, PIP5K1A, RPL27, RPL17, RPS3, RPL13, RPL23A, RPL26L1, RPS10, RPL29, RPL15, RPS15A, FAU, MYADM, ATG3, RPL23, RPL31, RPS11, RPSA, RPL11, SRP19, RABGEF1"
GO_SENSORY_PERCEPTION,1.0442882653327624e-5,0.0022395009454099202,-0.450995253065883,-1.6159109969820378,9,288,"CST4, CRYM, CST1, KCND2, SCNN1G, MYO1A, USH1C, COL1A1, HMCN1, NMU, CACNB4, ADRA2A, GJC3, ALOX5, NGFR, SLITRK6, AZGP1, CDH23, PAX6, RGS9BP, EFEMP1, CCKBR, DLG2, RGS9, GJB2, SIX3, ESPN, IRX5, NPY1R, SFRP5, SCNN1D, LXN, SCN3A, MME, PPEF1, KIFC3, EPHB1, TRPM3, NDN, PIEZO2, CNR1, P2RY2, PDE4A, POU4F2, USH1G, OPRL1, SOX14, CLIC5, SPTBN4, COL18A1, CDKN2D, RDH5, PDZD7, GNAL, HOXD1, ROM1, FZD2, 
ALDH7A1, MYO7A, ANO1, P2RY1, SCNN1A, PLCB2, CNGA1, TFAP2A, DNM1, FZD4, ADORA1, REEP2, FGFR1, GABRA5, GJA3, TBX1, GRIN2A, GUCA1B, RPGRIP1, SHANK1, MC1R, NDP, ITGA2, ATP8A2, CDH3, RAB3A, EPAS1, HSF4, NXNL2, COL11A2, GJC1, KCNQ1"
GO_TRNA_METABOLIC_PROCESS,1.0457078919574606e-5,0.0022395009454099202,0.45469975247174843,1.9549418252947888,0,163,"WARS, SARS, GARS, EPRS, IARS, RPP40, CARS, MARS, FBLL1, EXOSC8, TARS, NARS, YARS, TSEN15, TRMT61A, LARS, DUS4L, RPP38, AARS, AIMP2, MTO1, TYW5, YRDC, MARS2, TP53RK, METTL1, FARSB, DUS3L, PSTK, NAT10, PARS2, GTF3C3, PUS1, TRMT12, THG1L, TRMT1, DTD1, TYW3, TYW1, CTU1, AARSD1, ELP3, TRMT6, GTF3C6, TRNT1, RPP14, AIMP1, TSEN2, NSUN2, ADAT1, KARS, MOCS3, GTF3C4, QRSL1, PUS7L, ELAC1, METTL2B, 
TRMT5, TRIT1, MRPL39, SSB, ALKBH8, DUS1L, FARSA, RARS"
GO_DNA_REPLICATION,1.0879285622588878e-5,0.0022395009454099202,-0.48731657979527476,-1.6972878408803929,9,188,"ADRA2A, POLE2, RTEL1, GINS2, MCM4, LIG1, RRM2, DSCC1, PCNA, MCM3, ACHE, CHAF1B, DUT, MCM6, MCM10, MCM5, TREX1, CDT1, TONSL, TOP2A, POLA2, POLD1, DTL, CLSPN, CDK1, CCNE2, MCM2, CDC6, BARD1, TIMELESS, CHEK1, ING4, BRIP1, RMI2, RAD51, FEN1, PNKP, CDK2, RECQL4, DNA2, GINS4, FAM111A, RFC2, CHTF18, CDC45, MCM7, EGF, ORC6, POLQ, ORC1, RFC5, SLBP, RNASEH2A, CHAF1A, CDC25A, BLM, RPA3, NASP, 
CDC25C, RRM1, PRIM1, GINS3, NT5M, POLE, RFC4, PDGFB, RPA2, CDC7, FANCM, RBBP4, GINS1, NFIA, PTMS"
GO_RIBONUCLEOPROTEIN_COMPLEX_SUBUNIT_ORGANIZATION,1.1727866583789743e-5,0.0022641405669975526,0.43249491475273555,1.882271313347353,0,180,"RPS17, RPL3L, TDRD5, PLD6, RPF2, SBDS, EIF3CL, RSL24D1, MDN1, EIF3D, EIF6, ZRSR2, EIF3J, EIF3C, PWP2, MTIF2, NIP7, TSR1, MRRF, RPL12, ZNHIT6, OGFOD1, DDX28, RPS19, RPS27, NPM1, RPS5, TXNL4B, RPL6, NSUN4, PRMT5, RPS14, ATXN2L, PPAN, DDX20, EIF2S3, EIF3A, EIF3G, BMS1, RPL24, SART3, RPL38, DENR, BICD1, RPL10, RRP7A, PRPF18, FASTKD2, MRTO4, KIF5B, RPL5, RPF1, CRNKL1, RPL23A, CDC123, EIF2A, 
SMN2, CIRBP, RPS10, TGS1, MCTS1, EIF3M, DDX3X, GEMIN5, NUFIP1, CNOT7, RPSA, RPL11, EIF3L, EIF3E, EIF3K"
GO_CELL_CELL_ADHESION_VIA_PLASMA_MEMBRANE_ADHESION_MOLECULES,1.24516508059048e-5,0.0022641405669975526,-0.5251670979914957,-1.7743559948164618,10,134,"PCDHGA3, RET, DCHS2, PCDH18, CLDN11, PCDHA1, CLDN22, CDH10, CDH4, CDH23, CEACAM1, PCDHB7, PCDHGA6, PCDHB8, KIRREL3, PCDHA3, CDHR2, PCDH7, PCDHB9, PCDHB13, CDHR1, PCDHB12, PCDHAC1, SDK2, FAT2, CLDN3, CDH17, PCDHB14, PCDHGB1, CDHR5, CDH24, SDK1, ARVCF, CDH13, PCDHGA1, FAT4, PCDHA5, DSG1, CDH2, PCDHGA2, PCDHA2, IL1RAPL1, CDHR3, CDH11, ESAM, CELSR2, PCDHA11, CLDN8, CLDN16, CLSTN1, PCDHGA9, PCDHGA4, 
PCDHGB2, CDH3, PCDHB10, TIGIT, NRXN1, MPZL2, PCDHGC3, ROBO2, CLDN23, PCDHA10, NPTN, IGSF9, FAT3"
GO_CHROMOSOME_SEGREGATION,1.2798511959676155e-5,0.0022641405669975526,-0.46590653736400967,-1.6454986395877367,11,228,"GEM, FMN2, KIFC1, REC8, SYCE2, CENPW, CENPA, PTTG1, PSRC1, SMC1B, DMC1, AURKB, DLGAP5, SPC24, NUSAP1, SYCE3, CEP55, DSCC1, KIF4B, PRC1, BIRC5, CENPM, CDC20, NUF2, SPAG5, CDCA8, BUB1, SPC25, INCENP, ESPL1, TOP2A, ESCO2, ZWINT, PLK1, CCNB1, NEK2, TEX15, RACGAP1, KIF4A, KIF18B, CENPF, CDC14A, ERCC6L, FAM83D, SKA2, KIF11, KIF18A, NEK3, MAD2L1, CENPI, CENPO, NCAPD2, BUB1B, CENPK, NCAPH, CCDC155, 
DDX11, SMC4, KIF14, KIF23, CDCA2, HJURP, NCAPG, ITGB3BP, TTK, KNTC1, SKA3, CENPE, TERF1, KIF2C, TRIP13, DSN1, KIF22, CDCA5, NCAPD3"
GO_AMINO_ACID_ACTIVATION,1.341447600820966e-5,0.0022641405669975526,0.6081851661119764,2.168301743076492,2,51,"WARS, SARS, GARS, EPRS, IARS, CARS, MARS, TARS, NARS, YARS, LARS, AARS, AIMP2, MARS2, FARSB, PARS2"
GO_RNA_CATABOLIC_PROCESS,1.3748728242637556e-5,0.0022641405669975526,0.42086669692172324,1.8585986680908055,0,204,"RPS17, ERN1, RPL3L, EXOSC8, RPS12, EXOSC5, RPL21, RPL36, ZFP36L1, SMG1, SMG7, RPL37, RPS18, RPL26, RPL37A, CTIF, RPL36A, RPL12, SUPV3L1, RPS23, RPL4, PNPT1, ABCE1, PABPC1, RPS27A, RPS19, RPS27, RPL9, RPS6, RPL41, RPLP0, PELO, RPL18A, RPS5, RPLP1, SMG5, RPL13A, RPL30, RNASEH2B, RPS8, RPL6, RPL14, PARN, RPL28, RPS24, RPS3A, RPL19, RPS14, RPL34, RPL8, RPS13, RPL39, DHX34, RPS16, ETF1, RPS28, 
RPL35, RPL24, RPL18, RPL10A, RPS2, RPL7, RPL38, GSPT1, RPL35A, RPS29, DIS3, RPL10, PRPF18, RPLP2, RPS21, RPL32, MRTO4, PAIP1, RPS4X, PAN3, RPL5, EXOSC1, RPL27A, ISG20, RPL27, RPL17, RPS3, RPL13, RPL23A, RPL26L1, MAGOH, RPS10, RPL29, RPL15, RPS15A, CSDE1, FAU, PPP2R2A, CNOT1, MAGOHB, RPL23, RNH1, CNOT7, RPL31, RPS11, RPSA, RPL11, NCBP2, EIF4A1, EIF3E, PABPC4, DIS3L2, RPS9, RPS20, UHMK1, SMG6, 
RPS26, ZFP36, RPL3, CASC3"
GO_RESPONSE_TO_ENDOPLASMIC_RETICULUM_STRESS,1.4412544678888505e-5,0.002282171017037845,0.4382713413776359,1.9422113012599895,0,211,"TRIB3, FAM129A, ITPR1, CTH, CHAC1, DDIT3, ATF3, ERN1, STC2, ASNS, CEBPB, BCL2, GFPT1, HERPUD1, XBP1, CREB3L1, PPP1R15A, SEL1L, TNFRSF10B, SEC63, ATF4, BHLHA15, BBC3, HYOU1, HSPA5, ATF6, RHBDD1, SEC61A1, EDEM1, WIPI1, DNAJC10, DERL3, AARS, SRPRB, UBXN8, UBE2J1, SYVN1, YIF1A, DNAJC3, PMAIP1, TMEM33, EEF2, TBL2, CCDC47, DNAJB9, HM13, DDRGK1"
GO_INTERFERON_GAMMA_MEDIATED_SIGNALING_PATHWAY,1.6420713846324854e-5,0.00250385477427109,-0.6204234339699934,-1.8923109307325028,12,59,"OAS2, TRIM34, HLA-DPB1, OAS1, MT2A, TRIM22, HLA-DRB1, PTAFR, NCAM1, OASL, OAS3, HLA-DPA1, GBP2, GBP1, IRF9, CAMK2B, HLA-G, IFI30, HLA-F, B2M, HLA-DQA1, HLA-DRA, STAT1, TRIM5, TRIM21"
GO_RRNA_METABOLIC_PROCESS,1.702939273185518e-5,0.0025039289241802778,0.5952696821962468,2.671329056440292,0,237,"RPS17, RPL3L, RPP40, FBLL1, EXOSC8, RPF2, SBDS, NOL6, RIOK3, MAK16, RPS12, PDCD11, DDX21, EXOSC5, RPL21, RPP38, HEATR1, DDX49, RPL36, EIF6, UTP15, WDR75, RPL37, RPS18, BYSL, PWP2, RPL26, DKC1, RPL37A, RIOK2, PNO1, NAT10, TSR1, WDR3, RPL36A, RIOK1, RPL12, PES1, RPS23, RPL4, WDR43, UTP6, NOL9, EBNA1BP2, RRS1, UTP14C, RPS27A, RPS19, RPS27, RPL9, RPS6, RPL41, RPLP0, SRFBP1, ISG20L2, RPL18A, 
NOP14, RPS5, GAR1, IMP4, DCAF13, RPLP1, RPL13A, RPL30, EMG1, NOP2, RPS8, RPL6, RPL14, NSUN4, RPL28, RPS24, NOL8, UTP14A, RPS3A, LTV1, RRP9, FCF1, RPL19, NOP58, NOLC1, RPS14, NSUN3, RPL34, UTP23, UTP20, DDX27, RPL8, RPS13, TFB2M, RPL39, RPS16, RPS28, RPP14, RPL7L1, RPL35, BMS1, RPL24, RPL18, KRR1, NOB1, RPL10A, RPS2, WDR46, RPL7, RPL38, RPL35A, RPS29, DIS3, DDX56, RPL10, RRP7A, RPLP2, 
RPS21, NOP56, RPL32, MRTO4, WDR36, RPS4X, RPL5, RPF1, WDR12, EXOSC1, TEX10, RRP1B, RPL27A, RCL1, ISG20, NGDN, RPL27, RPL17, MPHOSPH10, RPS3, RPL13, RPL23A, RPL26L1, RPS10, RPL29, RPL15, NSUN5, RPS15A, FAU, METTL16, NAF1, WDR55, PA2G4, TFB1M, RPL23, NOP10, RPL31, RPS11, NSA2, RPSA, RPL11, RRP1, CSNK1E, NOL11, DIS3L2, RPS9, RPS20, YBEY, RPS26, NPM3"
GO_HOMOPHILIC_CELL_ADHESION_VIA_PLASMA_MEMBRANE_ADHESION_MOLECULES,2.105051421728341e-5,0.002988447139053648,-0.5480342604750037,-1.8023461783934782,17,104,"PCDHGA3, RET, DCHS2, PCDH18, PCDHA1, CDH10, CDH4, CDH23, CEACAM1, PCDHB7, PCDHGA6, PCDHB8, KIRREL3, PCDHA3, CDHR2, PCDH7, PCDHB9, PCDHB13, CDHR1, PCDHB12, PCDHAC1, SDK2, FAT2, CDH17, PCDHB14, PCDHGB1, CDHR5, CDH24, SDK1, CDH13, PCDHGA1, FAT4, PCDHA5, DSG1, CDH2, PCDHGA2, PCDHA2, CDHR3, CDH11, ESAM, CELSR2, PCDHA11, CLSTN1, PCDHGA9, PCDHGA4, PCDHGB2, CDH3, PCDHB10, TIGIT, MPZL2, PCDHGC3, ROBO2, 
PCDHA10, NPTN, IGSF9, FAT3, CDH18"
GO_CELLULAR_RESPONSE_TO_GLUCOSE_STARVATION,2.1960807279275586e-5,0.0030104601975043236,0.6943648993935888,2.20770803828752,5,30,"ASNS, BCL2, XBP1, IFI16, UPP1, VLDLR, ATF4, BHLHA15, HSPA5, PMAIP1, TBL2, NFE2L2, ATG14, MYBBP1A, BECN1"
GO_RIBOSOME_BIOGENESIS,2.2668026748271564e-5,0.0030104601975043236,0.6038566536993395,2.7541671694790097,0,282,"RPS17, RPL3L, RPP40, FBLL1, EXOSC8, RPF2, SBDS, NOL6, RIOK3, MAK16, RPS12, PDCD11, DDX21, EXOSC5, RSL24D1, RPL21, RPP38, HEATR1, MDN1, DDX49, RPL36, EIF6, UTP15, WDR75, DDX31, SDAD1, RPL37, RPS18, WDR74, BYSL, PWP2, RPL26, GTPBP10, DKC1, RPL37A, RIOK2, PNO1, NIP7, NAT10, TSR1, WDR3, RPL36A, RIOK1, RPL12, PES1, ZNHIT6, RPS23, RPL4, WDR43, UTP6, NOL9, EBNA1BP2, RRS1, UTP14C, DDX28, RPS27A, 
RPS19, RPS27, RPL9, RPS6, RPL41, RPLP0, SRFBP1, ISG20L2, RPL18A, NOP14, NPM1, RPS5, GAR1, IMP4, DCAF13, NMD3, RPLP1, RPL13A, GNL3L, RPL30, EMG1, RPLP0P6, NOP2, RPS8, RPL6, RPL14, NSUN4, RPL28, RPS24, NOL8, NLE1, UTP14A, RPS3A, LTV1, RRP9, FCF1, RPL19, NOP58, NOC2L, NOLC1, RPS14, GTPBP4, NSUN3, RPL34, UTP23, UTP20, GNL3, DDX27, PPAN, RPL8, RPS13, LSG1, TFB2M, RPL39, RPS16, RPS28, RPP14, 
RRN3, RPL7L1, RPL35, BMS1, RPL24, RPL18, KRR1, NOB1, RPL10A, RPS2, WDR46, RPL7, RPL38, RPL35A, RPS29, DIS3, DDX56, RPL10, RRP7A, RPLP2, FASTKD2, RPS21, NOP16, NUP88, NOP56, NVL, RPL32, MRTO4, WDR36, RPS4X, RPL5, RPF1, WDR12, EXOSC1, TEX10, RRP1B, RPL27A, RCL1, ISG20, NGDN, RPL27, RPL17, MPHOSPH10, RPS3, RPL13, RPL23A, RPL26L1, EIF2A, RPS10, RPL29, RPL15, ZNF622, NSUN5, RPS15A, DDX3X, MRPL10, 
FAU, METTL16, NAF1, WDR55, PA2G4, TFB1M, RPL23, NOP10, RPL31, RPS11, NSA2, RPSA, RPL11, GNL2, RRP1, CSNK1E, NOL11, DIS3L2, RPS9, RPS20, YBEY, RPS26, NPM3"
GO_MATURATION_OF_SSU_RRNA,2.40460722744779e-5,0.0030936774860632972,0.6495635007589844,2.1895612268087454,5,39,"HEATR1, BYSL, PWP2, WDR3, UTP6, RRS1, UTP14C, RPS19, SRFBP1, NOP14, DCAF13, EMG1, RPS8, RPS24, UTP14A, FCF1, RPS14, UTP23, UTP20, RPS16, KRR1, NOB1, WDR46, RPS21, RCL1, NGDN, MPHOSPH10"
GO_MATURATION_OF_SSU_RRNA_FROM_TRICISTRONIC_RRNA_TRANSCRIPT_SSU_RRNA_5_8S_RRNA_LSU_RRNA_,2.9930374466397543e-5,0.0037340409599442024,0.6747981789887956,2.1771804888879336,7,32,"HEATR1, BYSL, PWP2, WDR3, UTP6, RRS1, RPS19, NOP14, DCAF13, EMG1, RPS8, RPS24, FCF1, RPS14, UTP23, UTP20, RPS16, KRR1, WDR46, RPS21, RCL1, NGDN"
GO_ANTIGEN_PROCESSING_AND_PRESENTATION_OF_PEPTIDE_ANTIGEN,3.445474258417238e-5,0.004172063977030521,-0.4972786498844329,-1.7044897834872481,30,156,"HLA-DPB1, HLA-DMB, AZGP1, HLA-DRB1, HLA-DMA, HLA-DPA1, CYBB, KIF26A, CTSF, HLA-DOB, CTSS, RILP, PSMB9, SLC11A1, KIF4B, ERAP2, ABCB1, TAPBP, ITGB5, RACGAP1, KIF4A, AP1S1, KIF11, KIF18A, HLA-G, ACE, KIF23, IFI30, HFE, HLA-F, B2M, HLA-DQA1, CENPE, CALR, KIF2C, KIF22, OSBPL1A, HLA-DRA, PSMA2, KIF15, KIF3C, PSMB8"
GO_ANTIGEN_PROCESSING_AND_PRESENTATION_OF_PEPTIDE_OR_POLYSACCHARIDE_ANTIGEN_VIA_MHC_CLASS_II,3.7385025970533363e-5,0.004397547197733882,-0.5684732435880425,-1.8186453192640586,30,83,"HLA-DPB1, HLA-DMB, HLA-DRB1, HLA-DMA, HLA-DPA1, KIF26A, CTSF, HLA-DOB, CTSS, RILP, KIF4B, RACGAP1, KIF4A, AP1S1, KIF11, KIF18A, KIF23, IFI30, HLA-DQA1, CENPE, KIF2C, KIF22, OSBPL1A, HLA-DRA, KIF15, KIF3C"
GO_NUCLEAR_CHROMOSOME_SEGREGATION,4.025335680357885e-5,0.0046034186100092815,-0.4754471797141226,-1.6559475925253138,36,188,"GEM, FMN2, KIFC1, REC8, SYCE2, CENPA, PTTG1, PSRC1, SMC1B, DMC1, AURKB, DLGAP5, SPC24, NUSAP1, SYCE3, CEP55, DSCC1, KIF4B, PRC1, BIRC5, CENPM, CDC20, NUF2, SPAG5, CDCA8, BUB1, SPC25, INCENP, ESPL1, TOP2A, ZWINT, PLK1, CCNB1, NEK2, TEX15, RACGAP1, KIF4A, KIF18B, CENPF, CDC14A, ERCC6L, FAM83D, SKA2, KIF18A, MAD2L1, CENPI, CENPO, NCAPD2, BUB1B, CENPK, NCAPH, CCDC155, DDX11, SMC4, KIF14, KIF23, 
NCAPG, ITGB3BP, KNTC1, CENPE, TERF1, KIF2C, TRIP13, DSN1, KIF22, CDCA5, NCAPD3, CENPH, SYCP2, SMC2, FANCM, CENPQ"
GO_SENSORY_ORGAN_MORPHOGENESIS,4.686607637208613e-5,0.005214800984429151,-0.4759409172489473,-1.6554632799677764,42,185,"COL8A2, TFAP2B, NKX3-2, PTN, SLITRK6, PAX6, FRZB, INSIG1, EFEMP1, NR4A3, SIX3, IRX5, NTN1, TSPAN12, DLX5, EPHB1, SDK2, SIX2, GLI3, MFAP2, TSHZ1, USH1G, CLIC5, WNT2B, RARB, PDZD7, KRT13, MAFB, SDK1, ROM1, FZD2, MYO7A, NRP1, STRA6, WNT3A, TFAP2A, SALL1, BMP7, EPHB2, COL8A1, FGFR1, FBN1, TBX1, RPGRIP1, PTK7, ROR2, ATP8A2, CTHRC1, ALDH1A3, GSC, GLI2, DLX6, FGFR2, IFT122, LRP5, TBX2"
GO_ADENYLATE_CYCLASE_INHIBITING_G_PROTEIN_COUPLED_RECEPTOR_SIGNALING_PATHWAY,5.480733883634662e-5,0.005914286658305931,-0.6705789264550547,-1.9035127056645469,40,38,"PSAPL1, INSL3, SSTR2, ADRA2A, GRM4, NPY1R, APLP1, ADCY2, GPR37L1, OPRL1, GNAL, HTR1D, ADCY5, ADCY1, SSTR5, P2RY1, GNAZ, ADORA1, GNAI1, S1PR3, GPR37, LPAR1, GNAI2"
GO_RESPONSE_TO_TOPOLOGICALLY_INCORRECT_PROTEIN,5.6025547649728273e-05,0.005914286658305931,0.4034340242599627,1.7089218937088166,5,146,"CTH, CHAC1, DDIT3, ATF3, ERN1, STC2, ASNS, GFPT1, HERPUD1, XBP1, CREB3L1, PPP1R15A, SEC63, ATF4, BHLHA15, HYOU1, HSPA5, ATF6, RHBDD1, SEC61A1, EDEM1, WIPI1, DERL3, AARS, SRPRB, SYVN1, YIF1A, DNAJC3"
GO_SYNAPSE_ORGANIZATION,7.606911686060449e-5,0.007829413852877717,-0.5207487144762402,-1.7334209194464443,65,116,"CACNB4, SEZ6L, CEL, NFASC, SLITRK6, ZC4H2, KIRREL3, NRXN3, SEMA3E, DNM3, PCDHB9, TNC, SNCB, APOE, PCDHB13, SDK2, SNCA, LRP4, PCDHB14, ACHE, SDK1, CACNA2D2, ELFN1, F2R, WNT3A, CDH2, IL1RAPL1, AGRN, FZD1, PLXND1, SHANK1, SHANK2, RAB3A, PCDHB10, NLGN3, FLRT3, COL4A5, NRXN1, PCDHGC3, PALM, CACNB3, LRRTM4, PIN1, COL4A1, NLGN2, WNT7A, NFIA, LRRTM1, CHRNB1, LRRK2, WNT7B, ERBB2, NRXN2, PCDHB11, CLSTN3
"
GO_NEGATIVE_REGULATION_OF_CELL_DEVELOPMENT,8.583609121515293e-5,0.008619199695921577,-0.44611577960987864,-1.582411052725733,80,243,"MYCN, PTPRO, SEMA3G, SEMA5A, FSTL4, SEMA3C, TTPA, PTN, NGFR, PAX6, FRZB, EFEMP1, IRX3, NKX2-1, SFRP1, SEMA3E, DNM3, SIX3, CITED1, NTN1, SEMA3F, DACT3, APOE, DPYSL3, TP73, PMP22, NPPC, RTN4R, PLK2, GLI3, FBLN1, ISL1, ID4, GPR37L1, LRP4, SEMA4G, FOXC2, CDK5R1, GBP1, VIM, SEMA6D, EPHA7, CAV1, ASPM, NRP1, DLX2, WNT3A, SEMA6B, SEMA4B, BMP7, EPHB2, GPR173, LINGO1, SEMA4F, NGEF, NODAL, S1PR3, 
ERBB4, SEMA7A, DLX1, SMAD7, B2M, NKX6-1, DIXDC1, NLGN3, CALR, GFI1, FOXA1, LPAR1, INPP5F, STAT1, SEMA4C, PBX1, ARHGDIA, ID2, OVOL2, RAP1GAP"
GO_REGULATION_OF_DNA_TEMPLATED_TRANSCRIPTION_IN_RESPONSE_TO_STRESS,1.0750744000351843e-4,0.01028712783324264,0.535104729984196,1.975387335303742,21,61,"DDIT3, VEGFA, ATF3, CEBPB, XBP1, CREB3L1, PPP1R15A, ATF4, HSPA5, HIF1A, ATF6, HMOX1, KLF2, NEDD4, MT3, HIF3A, CREBBP, RPS6KA3, NFE2L2, RPS27A"
GO_EXTRACELLULAR_STRUCTURE_ORGANIZATION,1.0935019184526305e-4,0.01028712783324264,-0.45405733536504567,-1.597814265156519,101,216,"COL8A2, VCAN, COL1A1, MMP13, SERPINE1, ADAMTS3, SULF2, CCDC80, ITGA2B, ADAMTS2, OLFML2A, FN1, COL9A3, COL4A4, NPNT, ITGA7, ITGB6, ITGAX, THBS1, CRISPLD2, TNC, GAS6, COL6A1, NID1, SERPINF2, ICAM5, ITGA10, MMP15, FLRT2, FBLN5, ITGA4, MMP1, SNCA, MATN3, COL4A6, FBLN1, COL6A2, VWF, MFAP2, LAMA1, CTSS, TIMP2, COL5A3, COL18A1, VWA1, FOXC2, ITGB2, HTRA1, LTBP2, ELF3, COL9A2, RECK, COL27A1, HSPG2, 
CSGALNACT1, ITGB5, WNT3A, MMP10, LAMA2, THSD4, GREM1, COL8A1, ELN, AGRN, FBN1, LAMC2, COL4A2, MMP2, CD47, ITGA2, SPINK5, CTGF"
GO_SISTER_CHROMATID_SEGREGATION,1.0994258553866314e-4,0.01028712783324264,-0.48335392892235646,-1.6578046702200262,98,157,"KIFC1, REC8, CENPA, PSRC1, SMC1B, AURKB, DLGAP5, SPC24, NUSAP1, CEP55, DSCC1, KIF4B, PRC1, BIRC5, CENPM, CDC20, NUF2, SPAG5, CDCA8, BUB1, SPC25, INCENP, ESPL1, TOP2A, ZWINT, PLK1, CCNB1, NEK2, RACGAP1, KIF4A, KIF18B, CENPF, CDC14A, ERCC6L, SKA2, KIF18A, MAD2L1, CENPI, CENPO, NCAPD2, BUB1B, CENPK, NCAPH, DDX11, SMC4, KIF14, KIF23, NCAPG, ITGB3BP, KNTC1, CENPE, KIF2C, DSN1, KIF22, CDCA5, 
NCAPD3, CENPH"
GO_CELLULAR_RESPONSE_TO_INTERFERON_GAMMA,1.354995517626435e-4,0.01239670343570674,-0.553249243811816,-1.7642216061998783,111,81,"OAS2, TRIM34, HLA-DPB1, OAS1, MT2A, TRIM22, HLA-DRB1, PTAFR, NCAM1, OASL, OAS3, STAR, HLA-DPA1, GBP2, TLR3, XCL1, GBP1, IRF9, LGALS9, CAMK2B, CCL24, HLA-G, IFI30, SLC26A6, HLA-F, B2M, HLA-DQA1, HLA-DRA, STAT1, TRIM5, TRIM21"
GO_UROGENITAL_SYSTEM_DEVELOPMENT,1.666438146667651e-4,0.014914621412675477,-0.43390368124133355,-1.544108293130253,157,256,"PCSK9, PSAPL1, PTPRO, TFAP2B, RET, WNT6, LGR5, SULF2, ACTA2, FGF1, PRLR, WNT4, SMAD6, EMX2, GPC3, CYP7B1, AR, IRX3, CA2, KIRREL3, SFRP1, COL4A4, NPNT, CITED1, DACT2, MTSS1, TNC, ID3, CTSH, NID1, TP73, ESR1, FOXJ1, MME, PKHD1, SIX2, GLI3, SERPINF1, GCNT4, AMH, ID4, EPHB3, LRP4, RARB, FOXC2, SDC1, SMAD9, BCL2L11, FAT4, EPHA7, NRP1, STRA6, LGR4, GCNT1, TFAP2A, SALL1, CENPF, BMP7, EPHB2, 
CRLF1, GREM1, TCF21, KCNJ8, FGFR1, FBN1"
GO_PERK_MEDIATED_UNFOLDED_PROTEIN_RESPONSE,1.9030081521510987e-4,0.016653144588390338,0.8552195505052957,2.0468059773691025,67,10,"DDIT3, ATF3, ASNS, HERPUD1, ATF4, HSPA5"
