pathway,pval,padj,ES,NES,nMoreExtreme,size,leadingEdge
GO_REGULATION_OF_CELL_CYCLE_G1_S_PHASE_TRANSITION,0.6326457940194513,0.88351517434806,-0.2740885125149473,-0.9246606319895048,557861,132,"TP73, GTSE1, PLK2, E2F1, PCNA, PPP1R1C, CCNB1, CDK1, BTG2, KANK2, CDC6, FAM83D, AURKA, ATP2B4, ZNF385A, KIF14, SUSD2, SLFN11, CDK2, CYP1A1, CDC45, CHEK2, PID1, CENPJ, RBL2, CRADD, CDC25C, ID2, CTDSPL, RPA2, PCBP4, RFWD3, SOX4, EGFR, PLAGL1, MUC1, SFN, PIM1, CASP2, BID, CCND1, PKD2, CDKN1A, PSME1"
GO_EMBRYONIC_FORELIMB_MORPHOGENESIS,0.6329754197883852,0.8836757556014858,-0.3364425248945118,-0.8895854321397217,452503,26,"CRABP2, RECK, TFAP2A, SHOX2, CACNA1C, EN1, IFT122, MSX2, WNT7A, RDH10"
GO_EXPLORATION_BEHAVIOR,0.633559616223419,0.8841806488659192,-0.38060544657245976,-0.8821120061440664,422684,14,"DPP4, LSAMP, NLGN2, LRRTM1, LRRK2, ABAT"
GO_NEGATIVE_REGULATION_OF_TOR_SIGNALING,0.633766600632336,0.8841806488659192,0.2830142018431734,0.892442132281668,174994,29,"DDIT4, ARNTL, HIF1A"
GO_POSITIVE_REGULATION_OF_MEMBRANE_DEPOLARIZATION,0.6345528529842553,0.8849776747073778,0.39423129888978564,0.8510948440740237,242178,7,"P2RX7, CCK, TRPM4, MLLT11"
GO_POSITIVE_REGULATION_OF_MUSCLE_TISSUE_DEVELOPMENT,0.6354208634411022,0.8856167020236271,-0.3071794949648072,-0.8977710009664542,485763,45,"CCNB1, CDK1, WNT3A, GJA1, SHOX2, GREM1, FGFR1, ADRB2, TBX1, ERBB4, FGFR2, TBX2, CYP26B1, EFNB2, PIN1, HMGCR, FGF9, USP2, NOTCH1, CDON, NRG1, CTNNB1, BMP4, MAPK14, TGFB1"
GO_MESODERM_MORPHOGENESIS,0.6354412770895784,0.8856167020236271,-0.29572097670434416,-0.9043191020605916,504296,60,"NR4A3, CHRD, INHBA, SIX2, FOXC2, WNT3A, BMP7, NODAL, HMGA2, CRB2, ITGA2, EYA2, FGFR2"
GO_SLEEP,0.6360211395142082,0.8859697686774637,0.3686728458725659,0.8558540190551609,231788,9,"IL18, OXTR, BTBD9"
GO_ANDROGEN_BIOSYNTHETIC_PROCESS,0.636125002722998,0.8859697686774637,-0.41075462315782213,-0.879671852696191,408820,10,"WNT4, STAR, AKR1C3, HSD3B1, SRD5A3"
GO_REGULATION_OF_B_CELL_RECEPTOR_SIGNALING_PATHWAY,0.6364162706209047,0.8860756801306272,0.36854569653179525,0.8555588487557014,231932,9,"PTPN22, PRKCH, LPXN"
GO_GOLGI_TO_PLASMA_MEMBRANE_PROTEIN_TRANSPORT,0.6370488079184875,0.8865281892667989,-0.3353715593326099,-0.8867536992531314,455415,26,RAB26
GO_NEGATIVE_REGULATION_OF_DNA_DEPENDENT_DNA_REPLICATION,0.6371719485160209,0.8865281892667989,-0.3793629315867945,-0.8792322854344979,425094,14,"CHEK2, PID1, TERF1, BLM, SMC1A, BRCA2, ZRANB3, SMC3"
GO_CELLULAR_RESPONSE_TO_UV,0.6381495294884701,0.88752159143329,-0.2928083269125705,-0.9039025888024873,510913,64,"PTN, TP73, AURKB, MME, DDB2, PCNA, PBK, POLD1, CHEK1, MC1R, AQP1, CDC25A, TP53INP1"
GO_LIPID_PHOSPHORYLATION,0.638492545440592,0.88752159143329,-0.2867671390359297,-0.9083164091155118,524142,77,"FGF1, NRG2, EFR3B, FGFR3, FGF19, KITLG, KL, PIK3R5, PIK3CD, FGFR1, VAV1, ERBB4, IMPA2, EGF, FGFR4, FGFR2, IRS1, PIK3R2"
GO_POSITIVE_REGULATION_OF_POTASSIUM_ION_TRANSMEMBRANE_TRANSPORTER_ACTIVITY,0.6385326582038875,0.88752159143329,0.33565534035568334,0.8634831389276785,215892,13,"ANK2, GAL, NOS1AP, AKAP7, AKAP6"
GO_GOLGI_RIBBON_FORMATION,0.6400903753658662,0.8892741488986584,0.34894710883964286,0.8574294892452208,224375,11,"VTI1A, STX16, PRMT5"
GO_POSITIVE_REGULATION_OF_TYROSINE_PHOSPHORYLATION_OF_STAT3_PROTEIN,0.6402255470817643,0.8892741488986584,-0.3345582642209117,-0.8846032710823049,457686,26,"IL15, FGFR3, PTGER4, ISL1, GHR, CRLF1, IL6R, SOCS3, CSF1R"
GO_LONG_TERM_MEMORY,0.640522055235818,0.8893859363932082,-0.34476196753720656,-0.8812492355994874,448955,22,"SLC17A7, CAMK4, ADCY1, NTF4, SHANK1, SGK1"
GO_POSITIVE_REGULATION_OF_IMMUNOGLOBULIN_PRODUCTION,0.6411041021880571,0.8895976280749763,-0.358187091615793,-0.8781431018235558,439765,18,"XCL1, MSH6, UNG, IL4R, TNFSF13, CD40, HLA-E"
GO_REGULATION_OF_LYMPHOCYTE_APOPTOTIC_PROCESS,0.6411066705121338,0.8895976280749763,0.26311601200638457,0.9012631736630919,155602,42,"TSC22D3, BBC3, HIF1A, IRS2, PDCD1, P2RX7, RIPK3, ZC3H8"
GO_CELLULAR_RESPONSE_TO_AMINO_ACID_STARVATION,0.641519388024268,0.8898703910026656,0.2923183425083703,0.8811234990819853,187263,24,"ATF3, ATF4, SLC38A2, MIOS, SEH1L, EIF2S1"
GO_EPITHELIAL_TO_MESENCHYMAL_TRANSITION,0.6418918626725998,0.8900577255848179,0.2584521135759823,0.9059586190066615,148432,47,"BMP2, HAS2, SNAI1, WNT16, HIF1A, EPB41L5, LOXL2"
GO_NEGATIVE_REGULATION_OF_T_CELL_APOPTOTIC_PROCESS,0.6421724311272152,0.8900577255848179,0.3408903755435214,0.8581372680187123,221002,12,"TSC22D3, HIF1A"
GO_RETINA_VASCULATURE_DEVELOPMENT_IN_CAMERA_TYPE_EYE,0.6423030125607223,0.8900577255848179,-0.3908473817944521,-0.8741817054128475,421256,12,"ROM1, NRP1, FZD4, NDP, LRP5, COL4A1"
GO_NEGATIVE_REGULATION_OF_PROTEIN_AUTOPHOSPHORYLATION,0.6429426730564152,0.8905963047912292,0.3911394545934153,0.844419948532419,245380,7,"ERRFI1, ENG, IMPACT, JUN"
GO_RESPONSE_TO_AMMONIUM_ION,0.6431243172563333,0.8905963047912292,-0.3236036924423849,-0.8852388566358627,469218,31,"PTAFR, HRH1, PLAU, CDK5R1, CCNA2, HCN3, AGRN, GNAI2, GABRB1, LRRK2, ID1, GNA15"
GO_REGULATION_OF_CELL_MATURATION,0.6435833887267439,0.8908742551221971,-0.3617252718953117,-0.8758622652424047,438594,17,"RET, NPPC, AURKA, KIF14"
GO_REGULATION_OF_THE_FORCE_OF_HEART_CONTRACTION,0.643868702001064,0.8908742551221971,0.30319178317526047,0.8736276173481865,197272,20,"NOS3, ADRA1A, CHGA, SLC8A1"
GO_REGULATION_OF_CELL_KILLING,0.6439742004478161,0.8908742551221971,-0.31324227286250494,-0.8891729561158275,481740,38,"IL7R, CEACAM1, XCL1, BCL2L11, LGALS9, VAV1, IL12A, B2M, AGER, FADD, MICA, HLA-E, BAD"
GO_POSITIVE_CHEMOTAXIS,0.6445221199510335,0.8912665971233066,-0.33577684651890566,-0.8809325271506584,458581,25,"SEMA5A, VEGFC, CORO1A, HMGB2, NRP1, NTF3, VEGFB"
GO_RETROGRADE_TRANSPORT_ENDOSOME_TO_PLASMA_MEMBRANE,0.6446907763500624,0.8912665971233066,-0.407538576236533,-0.8727843685533252,414325,10,ANKRD50
GO_REGULATION_OF_DIGESTIVE_SYSTEM_PROCESS,0.6449833880262584,0.8913718054730131,-0.35700624627256916,-0.8752481030456971,442426,18,"MMP13, OPRL1, AQP1, SGK1, KCNQ1"
GO_REGULATION_OF_TELOMERASE_ACTIVITY,0.6452837735109407,0.8914876830686386,-0.3095109739833054,-0.8901234683905648,487236,41,"PIF1, AURKB, PRKCQ, PARM1, NEK2, GREM1, PNKP, TERF1, ACD, CERS1, MAP3K4, WRAP53, MAPK3, CTNNB1"
GO_GOLGI_TO_VACUOLE_TRANSPORT,0.6458700887611465,0.8919983748506005,0.2914850927545076,0.8786118676447221,188533,24,"AP1AR, VTI1A, WIPI1, EPS15, GOSR2, MON2, SYS1"
GO_RESPONSE_TO_CORTICOSTERONE,0.6466875898641022,0.8922643454331199,0.31790802036061705,0.8644659315883872,209141,16,"FOSB, FOSL1, PTGS1, ATP2B1, SLC18A2"
GO_REGULATION_OF_SYNAPTIC_TRANSMISSION_GABAERGIC,0.6467102476986222,0.8922643454331199,0.30966017068008966,0.8680525529402078,203099,18,"TACR1, OXTR, ADRA1A"
GO_POSITIVE_REGULATION_OF_INTRACELLULAR_PROTEIN_TRANSPORT,0.6467128508070027,0.8922643454331199,-0.2652309257098079,-0.9308013493241174,600911,208,"SEMA5A, SULF2, RAC2, HNMT, DAB2, EDAR, ITGAX, SEC16B, OSCP1, RHOU, GAS6, GTSE1, TLR3, GLI3, RBPMS, PRKCQ, AKAP5, TGFB3, ECT2, CDK5R1, LGALS9, CDK1, WNT3A, KIF20B, GREM1, ELMOD1, IL18R1, NODAL, EDA, ERBB4, TMEM173, EGF, ASPH, PIK3R2, HHAT, CTSK, HSPA1L, HYAL2, ACSL3, RAPGEF3, B3GAT3, CAMK1, MICALL2, ERBB2, ZDHHC8, PRKACA, EGFR, SMAD3, CDKL2, KANK1, BMP6, SFN, SMO, PARP1, RUFY3, DDX58, 
UBL5, SPHK1, RANBP3L"
GO_FATTY_ACID_DERIVATIVE_METABOLIC_PROCESS,0.6472836757438337,0.8927527279857164,-0.28958666368636243,-0.8999172526383902,521553,67,"PTGES, PLA2G4F, ALOX5, HPGD, ALOX15, CYP4F12, GGT6, CYP4F8, EDN2, PTGDS, MGLL, CYP1A1, GGT7"
GO_SYNAPTIC_VESICLE_CYCLE,0.6481591132626593,0.8934336575910866,-0.2889670062472495,-0.8998072133721022,523241,68,"PACSIN1, SLC17A7, DDC, SYNDIG1, SNCA, CPLX2, C2CD4C, SYTL4, WNT3A, SYT12, DOC2A, SYTL3, RAB3A, C2CD4A, NRXN1, SYT17, ITSN1, CADPS2, WNT7A, PLD2, SNPH, STX2, TRIM9, SYT15, SEPT5, SYT3"
GO_CARDIAC_MUSCLE_CELL_CONTRACTION,0.6485942801053469,0.8934336575910866,-0.3425752930231629,-0.8756598567658204,454613,22,"SCN4B, SCN1B, GJA1, CACNA1C, KCNJ2, GJC1, KCNQ1"
GO_NEGATIVE_REGULATION_OF_T_CELL_PROLIFERATION,0.6489204714070256,0.8934336575910866,-0.317479888346503,-0.883439429110263,478877,34,"HLA-DRB1, PDE5A, PDCD1LG2, FOXJ1, XCL1, LGALS9, HLA-G"
GO_ZINC_II_ION_TRANSPORT,0.6491039914655046,0.8934336575910866,-0.33963858825435256,-0.8762176953159487,457555,23,"SLC39A2, SLC30A2, SLC30A3, SLC39A8, SLC39A13, SLC39A10, SLC39A1, SLC39A3, SLC30A10, SLC39A11"
GO_NEGATIVE_REGULATION_OF_MAP_KINASE_ACTIVITY,0.6494033359229995,0.8934336575910866,-0.2907417661233686,-0.8975230924713086,519923,64,"DUSP9, SFRP1, RGS3, APOE, TP73, DUSP19, SMPD1, CAV1, BMP7, HYAL2, DUSP4, SPRY2, MAPK7, HMGCR, NUP62, MAPK8IP1, DAB2IP, SORL1, DUSP10, CDK5RAP3, PTPRJ, BMP4, PPP2R1A"
GO_CELLULAR_RESPONSE_TO_LIGHT_STIMULUS,0.6496446106452081,0.8934336575910866,-0.2868674386055861,-0.9003704516040398,528468,72,"PTN, TP73, AURKB, MME, DDB2, PCNA, PBK, POLD1, CNGA1, CHEK1, MC1R, AQP1, CDC25A, TP53INP1"
GO_GLYCEROPHOSPHOLIPID_CATABOLIC_PROCESS,0.6497327808803218,0.8934336575910866,-0.39643857421881357,-0.8686245759289101,421979,11,"INPP5F, GPCPD1, ENPP2, ABHD12, SMPD4, GDE1, PLA2G4C"
GO_HUMORAL_IMMUNE_RESPONSE_MEDIATED_BY_CIRCULATING_IMMUNOGLOBULIN,0.6497941283052893,0.8934336575910866,-0.3422273075277479,-0.8747703678409693,455454,22,"C1R, HLA-DRB1, SUSD4, C1S, C5"
GO_REGULATION_OF_ER_TO_GOLGI_VESICLE_MEDIATED_TRANSPORT,0.6502701445954914,0.8934336575910866,-0.396242689784746,-0.8681953794668648,422328,11,INSIG1
GO_NEUROTRANSMITTER_TRANSPORT,0.6503853931596377,0.8934336575910866,-0.2769583170229016,-0.9088070575469972,554794,102,"LIN7A, PPFIA4, SLC17A7, GRM4, NRXN3, DDC, APBA1, NAAA, SNCA, CPLX2, C2CD4C, SYTL4, BAIAP3, SYT12, DOC2A, RIMS3, SLC6A6, SYTL3, GAD1, RAB3A, C2CD4A, NRXN1, SYT17, CADPS2, WNT7A, STXBP1, SYN1, SNPH, STX2, NRXN2, TRIM9, SYT15, PDZD11, SEPT5, SYT3"
GO_REGULATION_OF_CAMP_MEDIATED_SIGNALING,0.6505660569669299,0.8934336575910866,-0.37501214746400874,-0.8691486701173439,434030,14,"PDE4A, RASD2, GNAI1"
GO_POSITIVE_REGULATION_OF_PROTEIN_TARGETING_TO_MEMBRANE,0.650695220583817,0.8934336575910866,0.32679975291173863,0.8574757790726023,216579,14,"PDZK1, FIS1, KCNB1, CCL2, MFF, STOM"
GO_REGULATION_OF_MITOCHONDRION_ORGANIZATION,0.6509181849568003,0.8934336575910866,-0.2663465116777225,-0.9247872058624178,595774,181,"TNFSF10, SIAH3, RAC2, HNMT, PYCARD, CIDEB, ITGAX, OSCP1, RHOU, BMF, STOX1, TP73, E2F1, BCL2L11, ACAA2, SREBF1, ELMOD1, ADRB2, HSPA1A, PID1, PLA2G6, HHAT, CTSK, HSPA1L, PLAUR, NOL3, LMNA, TMEM102, MICALL2, LRRK2, SIVA1, SIRT4, YWHAH, ZDHHC8, CDKN2A, CDKL2, VAT1, SFN, BAD, BID, BNIP3L, UBL5, HDAC6, SREBF2, YWHAQ"
GO_REGULATION_OF_CELL_COMMUNICATION_BY_ELECTRICAL_COUPLING,0.6510065756511078,0.8934336575910866,-0.40514159439545205,-0.8676509936911934,418384,10,"CAV1, CALM3, ASPH, CALM2"
GO_SKELETAL_MUSCLE_ADAPTATION,0.6511725787872523,0.8934336575910866,0.42581767914253654,0.8337981169857939,264560,5,"ACTA1, CFLAR"
GO_POSITIVE_REGULATION_OF_ACTIN_NUCLEATION,0.6512495522056961,0.8934336575910866,-0.3747824365568726,-0.8686162795513344,434486,14,"SCIN, WAS, GSN, FMN1, WASF1"
GO_POSITIVE_REGULATION_OF_INTERLEUKIN_1_PRODUCTION,0.6515081547552186,0.8934906972442489,-0.3272115331619647,-0.8779099530994787,469810,28,"PYCARD, ISL1, LGALS9, HSPB1, CASP1, NOD1, GSDMD, HMGB1, NLRP1, SMAD3"
GO_NEGATIVE_REGULATION_OF_INTERLEUKIN_17_PRODUCTION,0.6518119862807314,0.8936097061331241,0.38774026181949267,0.8370815270218832,248765,7,"TLR4, PRNP"
GO_RESPONSE_TO_ACETYLCHOLINE,0.6528193804951247,0.8946928726692503,0.34523933618549635,0.8483187858390401,228837,11,"CHRM1, GNAQ, CHRM3"
GO_CELLULAR_RESPONSE_TO_ATP,0.6535993440218958,0.8954637269012129,0.35306587768702835,0.8449962918035551,233549,10,"PTGS2, P2RY11"
GO_INTESTINAL_EPITHELIAL_CELL_DIFFERENTIATION,0.6540998556008969,0.8958513325046217,-0.3633738115479093,-0.8679579154326276,442561,16,"NKX3-2, TYMS"
GO_POSITIVE_REGULATION_OF_ENDOTHELIAL_CELL_MIGRATION,0.6550606354795715,0.8968452175142625,-0.2931922225928994,-0.8920453643563703,517529,58,"SEMA5A, ATOH8, THBS1, AMOT, FLT4, VEGFC, FOXC2, NRP1, PRKCA, HSPB1, FGFR1, PTK2B, CCBE1, PDGFB, ZNF580, WNT7A, SPARC, PLCG1, SRPX2"
GO_SUBSTRATE_DEPENDENT_CELL_MIGRATION,0.6552612130879042,0.8968452175142625,-0.3407036419263575,-0.8708757121858626,459286,22,"NTN1, VEGFC, NRP1, FGFR1, MYH10, FMNL1, ITGA2"
GO_POSITIVE_REGULATION_OF_CATION_TRANSMEMBRANE_TRANSPORT,0.6559606775394723,0.8973821247062322,-0.2875072305985981,-0.8952616540862175,529539,68,"ATP1B2, SNCA, CTSS, XCL1, GLRX, F2R, HSPA2, WNK2, CALM3, KCNJ2, KCNQ1, ASPH, ATP1B3, AGER, RNF207, RAPGEF3, PLCG1, ANO6, ATP1B1, CALM2, PLCG2, PKD2, AMIGO1, DNM2, BMP4"
GO_TYROSINE_PHOSPHORYLATION_OF_STAT_PROTEIN,0.6560959824762284,0.8973821247062322,0.3861761551404322,0.8337048211797063,250400,7,"LIF, PTK6"
GO_POSITIVE_REGULATION_OF_FATTY_ACID_OXIDATION,0.6563074028395592,0.8973821247062322,-0.3940737166077356,-0.863443007905156,426249,11,"NR4A3, IRS1"
GO_CELLULAR_RESPONSE_TO_GAMMA_RADIATION,0.6565534332338193,0.8974204796227204,-0.3499717538720045,-0.8678047714129978,453034,19,"NOX4, H2AFX, RAD51"
GO_POSITIVE_REGULATION_OF_HEART_CONTRACTION,0.6581543194604305,0.8979988940469269,0.2806778883112544,0.8775063101286289,183551,28,"SCN3B, NOS1AP, ADRA1A, CHGA"
GO_REGULATION_OF_CHEMOKINE_PRODUCTION,0.658509283687176,0.8979988940469269,0.2597249848473473,0.8940273690042718,158248,43,"TICAM2, KLF4, HIF1A, HMOX1, TLR4"
GO_MYELOID_LEUKOCYTE_MEDIATED_IMMUNITY,0.6585479849724435,0.8979988940469269,-0.31990251409788883,-0.8751140435932228,480471,31,"NR4A3, CAMK4, CPLX2, PIK3CD, IL6R, ACE"
GO_REGULATION_OF_CYTOKINE_SECRETION,0.6585638217706401,0.8979988940469269,-0.27794275046092853,-0.9020943559853799,554949,93,"CCR7, HLA-DRB1, FN1, PYCARD, GAS6, PTGER4, FBLN1, GBP1, F2R, LGALS9, LGR4, CASP1, C5, CSF1R, CD276, IL4R, HYAL2, SSC5D, GSDMD, HMGB1"
GO_MICROTUBULE_POLYMERIZATION,0.658735853307683,0.8979988940469269,0.28696970584320836,0.8734226937453419,190041,25,"FGF13, TPPP, RANBP9, MAP7D3, NDEL1, BLOC1S2, AKAP9, CLASP2"
GO_POSITIVE_REGULATION_OF_CARTILAGE_DEVELOPMENT,0.6593185769693728,0.8979988940469269,0.29400569872464033,0.8677458508335322,197188,22,"HOXA11, BMP2, LOXL2, PKDCC, SOX9"
GO_REGULATION_OF_BICELLULAR_TIGHT_JUNCTION_ASSEMBLY,0.6595518888109135,0.8979988940469269,0.34328636116595507,0.8435199543511326,231197,11,"SNAI1, PRKCH, ROCK1, ROCK2, IKBKB"
GO_POSITIVE_REGULATION_OF_TYROSINE_PHOSPHORYLATION_OF_STAT5_PROTEIN,0.6597720966427619,0.8979988940469269,0.3848292715795319,0.8307970722072667,251803,7,"KIT, FYN, IL23A"
GO_VENTRICULAR_CARDIAC_MUSCLE_CELL_DEVELOPMENT,0.6599639553925112,0.8979988940469269,-0.3847246342893803,-0.8604873732895975,432839,12,"CCNB1, CDK1, MYH10, LMNA"
GO_POSITIVE_REGULATION_OF_I_KAPPAB_KINASE_NF_KAPPAB_SIGNALING,0.6600962911401442,0.8979988940469269,-0.2677776862188064,-0.9151453384417012,591741,151,"TNFSF10, CCR7, TRIM22, EDAR, CARD11, TLR3, ECM1, SECTM1, CXXC5, PLK2, BST2, PRKCQ, TNFRSF19, ECT2, F2R, LGALS9, GJA1, GREM1, IL18R1, EDA, CASP1"
GO_NEGATIVE_REGULATION_OF_INTERLEUKIN_1_BETA_PRODUCTION,0.6604781587836419,0.8979988940469269,0.35090729838612866,0.839830141178144,236007,10,"ERRFI1, NLRP3"
GO_REGULATION_OF_HEART_RATE_BY_CARDIAC_CONDUCTION,0.6605271891483487,0.8979988940469269,-0.33392415975454814,-0.8688393252934246,467715,24,"SCN4B, SCN1B, CAV1, CACNA1C, KCNJ2, CACNA1G, KCNQ1"
GO_AMMONIUM_TRANSMEMBRANE_TRANSPORT,0.6606237905867653,0.8979988940469269,0.3190164827249966,0.8528182278959231,216786,15,"PRKAB2, SLC22A3"
GO_NEGATIVE_REGULATION_OF_NEURAL_PRECURSOR_CELL_PROLIFERATION,0.6607620068983507,0.8979988940469269,-0.3487533670963388,-0.8647836080029476,455938,19,"PAX6, BTG2, ID2, GATA2, LIMS2, ILK, SPINT1, TGFB1, KDM2B, IL1B"
GO_REGULATION_OF_RENAL_SODIUM_EXCRETION,0.660801580945578,0.8979988940469269,-0.41165367785338997,-0.859854207584246,419984,9,"PTGER4, NPR1, ADORA1"
GO_IRON_ION_IMPORT,0.6612711148185141,0.8979988940469269,0.36055941251846135,0.8370191235043051,240990,9,"STEAP1, STEAP2, TFR2, STEAP4, STEAP3"
GO_POSITIVE_REGULATION_OF_CALCIUM_ION_TRANSPORT,0.6612889915319476,0.8979988940469269,-0.28519593006407706,-0.8933888476826234,536883,71,"CD4, P2RX5, SNCA, AKAP5, XCL1, F2R, CAV1, TRPV3, HSPA2, CLDN16, CALM3, JAK3, ASPH, PDGFB, RAPGEF3, UCN, PLCG1, P2RX4, ATP1B1, CALM2, PLCG2"
GO_ESTABLISHMENT_OF_EPITHELIAL_CELL_POLARITY,0.661370693288454,0.8979988940469269,-0.3418463482295543,-0.8656320339734712,461354,21,"PTK7, FBF1, FRMD4A, MYO18A, SLC9A3R1, FOXF1, TCF15, FERMT1, RAP2A, SIPA1L3, CYTH3, CLASP1"
GO_CYCLIC_NUCLEOTIDE_CATABOLIC_PROCESS,0.6617298125334441,0.8979988940469269,-0.3713134268188645,-0.8605763127907823,441478,14,"PDE5A, PDE4A, PDE8B, PDE9A"
GO_REGULATION_OF_CATION_CHANNEL_ACTIVITY,0.661772900162318,0.8979988940469269,0.2461210025349009,0.9057136079896052,136579,60,"KCNG1, KCNE3, ANK2, GAL, CACNB1, NOS1AP, CACNA2D1, HOMER1, STIM2, AKAP7, JPH2"
GO_REGULATION_OF_LIPID_TRANSPORT,0.6619036632829114,0.8979988940469269,0.24376303566882368,0.907928005191612,131972,64,"ABCA12, REN, SHH, GAL, PLTP, GDF9, IRS2, P2RX7, LIPG, ABCG1"
GO_CELLULAR_RESPONSE_TO_EXTRACELLULAR_STIMULUS,0.6619616242550689,0.8979988940469269,-0.26677624602587086,-0.9155056343135378,596486,158,"PCSK9, COL1A1, PTN, SLC38A3, WNT4, SFRP1, IL15, TNC, GAS6, RNF152, KIF26A, NR4A2, WNT2B, NUAK2, CAV1, DNAJC15, SREBF1, DAPL1, FZD1, BRIP1, GAS2L1, PDK2, HFE, SKP2, UCP2, SIPA1, RRAGA, NUDT1, AKR1C3, FADS1, UCN2, DEPDC5, RRAGD, CADPS2, GSDMD"
GO_REGULATION_OF_VACUOLE_ORGANIZATION,0.6619933552179799,0.8979988940469269,0.26470505782562725,0.8872379365129353,166773,38,"RAB3GAP1, CALCOCO2, SCFD1, CHMP4A, RALB, RAB5A, MTM1, UBQLN4, IFT20, RAB3GAP2, PHF23, PIKFYVE"
GO_DEVELOPMENTAL_GROWTH_INVOLVED_IN_MORPHOGENESIS,0.6624827910653242,0.8983668151567653,-0.27847724694391285,-0.8988418032712419,554829,89,"FGF1, MESP1, SFRP1, CSF1, TNC, SEMA3F, ESR1, SLIT1, NDN, POU4F2, NRP1, WNT3A, SALL1, EMX1, AURKA, LHX2, SEMA7A, PTK7, NLGN3, FGFR2, FLRT3, COBL, TBX2"
GO_SMOOTH_MUSCLE_CELL_DIFFERENTIATION,0.6628604746178203,0.8985830009883325,-0.33583912601895594,-0.866415640548114,467252,23,"WNT4, MESP1, NPNT"
GO_POSITIVE_REGULATION_OF_IMMUNE_EFFECTOR_PROCESS,0.6635337074064137,0.8991995633285731,-0.2740491392583247,-0.9031859532175476,568800,106,"HLA-DMB, DDX60, MYB, RAC2, PTAFR, NR4A3, RSAD2, IL13RA2, XCL1, LGALS9, VAV1, IL12A, SEMA7A, B2M, MSH6, UNG, TRAF2, IL4R, DHX58, TNFSF13, FADD, MALT1, VAMP8, CD40, SPON2, HLA-E"
GO_POSITIVE_REGULATION_OF_METANEPHROS_DEVELOPMENT,0.6645811095516545,0.9001637034691079,-0.4000657647925471,-0.8567806000814251,427108,10,RET
GO_NEUROTROPHIN_TRK_RECEPTOR_SIGNALING_PATHWAY,0.6647440864921256,0.9001637034691079,-0.3703342205295346,-0.8583068507216282,443489,14,"NGFR, NDN"
GO_POSITIVE_REGULATION_OF_MYELOID_LEUKOCYTE_CYTOKINE_PRODUCTION_INVOLVED_IN_IMMUNE_RESPONSE,0.6649191511857878,0.9001637034691079,-0.4099954611577237,-0.8563905567545238,422601,9,"NR4A3, SEMA7A"
GO_BROWN_FAT_CELL_DIFFERENTIATION,0.6651531362846062,0.9001637034691079,0.2928100046791555,0.864216808534908,198933,22,"CEBPB, PTGS2, RARRES2"
GO_POSITIVE_REGULATION_OF_T_HELPER_1_TYPE_IMMUNE_RESPONSE,0.6654116232855913,0.9001637034691079,-0.4098085708703514,-0.8560001839518523,422914,9,"SLC11A1, XCL1, IL27RA"
GO_GLUCAN_METABOLIC_PROCESS,0.6655570350643586,0.9001637034691079,-0.2982493167435126,-0.8807822613851963,512828,48,"GYG2, PPP1R1A, MGAM"
GO_POSITIVE_REGULATION_OF_B_CELL_PROLIFERATION,0.6664751512262663,0.9006504624120468,-0.33484676923218903,-0.8638555057262697,469800,23,"CARD11, VAV3, IL7, NFATC2, WNT3A"
GO_POSITIVE_REGULATION_OF_OXIDATIVE_STRESS_INDUCED_CELL_DEATH,0.6666098275383983,0.9006504624120468,-0.4213922062438836,-0.8554311454218526,418298,8,"TRPM2, ENDOG, HDAC6, PARK7, SFPQ"
GO_REGULATION_OF_LEUKOCYTE_MEDIATED_CYTOTOXICITY,0.666862970977337,0.9006504624120468,-0.31470147859835734,-0.8709269244972832,490312,33,"IL7R, CEACAM1, XCL1, LGALS9, VAV1, IL12A, B2M, AGER, FADD, MICA, HLA-E"
GO_POSITIVE_REGULATION_OF_LEUKOCYTE_DEGRANULATION,0.666978901487396,0.9006504624120468,-0.37553566331699995,-0.8555813860962765,441469,13,"PTAFR, IL4R, VAMP8"
GO_HETEROPHILIC_CELL_CELL_ADHESION_VIA_PLASMA_MEMBRANE_CELL_ADHESION_MOLECULES,0.6671929794695448,0.9006504624120468,-0.33465983537665106,-0.8633732438227626,470306,23,"CDH4, FAT4, CDH2, IL1RAPL1, TIGIT, NRXN1"
GO_INNATE_IMMUNE_RESPONSE_IN_MUCOSA,0.6672771568275051,0.9006504624120468,0.34099484803141594,0.83788927025382,233905,11,"HIST2H2BE, NOS2, RPL39, FAU, BPIFB1, CAMP, PLA2G1B, DEFB1"
GO_REGULATION_OF_EXOSOMAL_SECRETION,0.6675391702889608,0.9006504624120468,-0.35913850215711424,-0.857841417784139,451654,16,"SDC1, SMPD3, CHMP2A, CHMP6, SDC4, RAB7A"
GO_DIOL_METABOLIC_PROCESS,0.6677133352212786,0.9006504624120468,-0.39892431406278195,-0.8543360698884488,429121,10,"ACER2, DEGS2, SPHK1, ACER3, GBA, SGPP1"
GO_HYDROGEN_PEROXIDE_CATABOLIC_PROCESS,0.6680596379573684,0.9006504624120468,-0.3692122186439358,-0.8557064377661227,445701,14,"TPO, GPX3, PXDN, PRDX2, PRDX3, CAT"
GO_CELLULAR_RESPONSE_TO_TOXIC_SUBSTANCE,0.6681470352966137,0.9006504624120468,-0.3399763622066755,-0.8608968077150367,466081,21,"PLA2G4F, STAR, SCN3A"
GO_NEGATIVE_REGULATION_OF_LIPID_TRANSPORT,0.668323333171922,0.9006504624120468,-0.35417292623810814,-0.8575754185961844,455454,17,"THBS1, APOE, EGF, PLA2R1, APOC1, ACSL4, SREBF2, ITGAV, AKT1"
GO_REGULATION_OF_RELEASE_OF_SEQUESTERED_CALCIUM_ION_INTO_CYTOSOL,0.6689154737227793,0.9010671663777937,-0.2936555781939274,-0.8810684093340874,522129,53,"SNCA, XCL1, CORO1A, F2R, FKBP1B, CACNA1C, CALM3, PTK2B, ASPH, PRKACA, PLCG1, CALM2, CYBA, PKD2"
GO_PRE_MIRNA_PROCESSING,0.6690702763218157,0.9010671663777937,0.39729644765796923,0.8201779614878839,262957,6,"PRKRA, DICER1, MRPL44, DROSHA, ADAR, TARBP2"
GO_REGULATION_OF_HEART_MORPHOGENESIS,0.6696695358066722,0.9015087258175611,-0.3246609532967023,-0.8648154023042786,480734,27,"MESP1, ISL1, FOXC2, TGFB3, HAND2, WNT3A, TBX2, RNF207, SMO, NOTCH1, TGFB2, CTNNB1, BMP4, TWIST1, TGFB1"
GO_REGULATION_OF_SYSTEMIC_ARTERIAL_BLOOD_PRESSURE_BY_CIRCULATORY_RENIN_ANGIOTENSIN,0.6698575016260188,0.9015087258175611,-0.3981465248448776,-0.8526703569694778,430499,10,"ACE2, MME, ACE"
GO_PATTERN_RECOGNITION_RECEPTOR_SIGNALING_PATHWAY,0.6703637870650294,0.9015087258175611,-0.27772165444941527,-0.8938707889355662,559675,87,"MAP2K6, DMBT1, SCARA3, PGLYRP3, TLR3, CTSS, ITGB2, COLEC12, LGALS9"
GO_REGULATION_OF_N_METHYL_D_ASPARTATE_SELECTIVE_GLUTAMATE_RECEPTOR_ACTIVITY,0.6704081962593943,0.9015087258175611,-0.3889473884197928,-0.852210865177626,435407,11,"CNIH2, PTK2B, NLGN3, NRXN1"
GO_EYE_PHOTORECEPTOR_CELL_DEVELOPMENT,0.6704930090972485,0.9015087258175611,0.30423063202613804,0.8528322393961731,210568,18,"VEGFA, PRDM1, RORB"
GO_NEGATIVE_REGULATION_OF_LEUKOCYTE_APOPTOTIC_PROCESS,0.6708656748085353,0.901715306296683,-0.31375348177189216,-0.8683033716490925,493255,33,"CCR7, GAS6, AURKB, KITLG, PRKCQ, HSH2D"
GO_TRANSITION_METAL_ION_TRANSPORT,0.6710953180951426,0.9017295772185712,-0.27702731423796984,-0.8941618513457826,562042,89,"TTYH1, SLC39A2, HEPHL1, TCIRG1, SLC30A2, TRPC4, REP15, SLC11A1"
GO_REGULATION_OF_IMMUNOGLOBULIN_PRODUCTION,0.6715562172187763,0.9017573667164069,-0.31844081737524127,-0.865662020933794,488078,30,"IL13RA2, XCL1, MSH6, UNG, TRAF2, IL4R, IL27RA, TNFSF13, CD40, HLA-E"
GO_REGULATION_OF_NIK_NF_KAPPAB_SIGNALING,0.6717043446090365,0.9017573667164069,-0.31077264664748305,-0.8693367221499732,497476,35,"RASSF2, TLR3, UACA, CARD14, NOD1, TNFSF15, TRAF2, CARD10, HMGB1, MALT1"
GO_POLARIZED_EPITHELIAL_CELL_DIFFERENTIATION,0.6721034325069634,0.9017573667164069,-0.3882706641381091,-0.8507281150608983,436508,11,"PTK7, SLC9A3R1, FOXF1, TCF15"
GO_CHRONIC_INFLAMMATORY_RESPONSE,0.6721567603202799,0.9017573667164069,-0.4072395915856999,-0.8506341499141554,427201,9,"PTGES, THBS1, GJA1"
GO_PROTEIN_MANNOSYLATION,0.6722716772317938,0.9017573667164069,-0.3576207798888728,-0.8542161728867784,454856,16,"DPY19L2P2, SDF2L1, POMT2"
GO_NEGATIVE_REGULATION_OF_KINASE_ACTIVITY,0.6724301957297473,0.9017573667164069,-0.26162665219464387,-0.9203642533407447,626944,215,"CDKN2C, PPP1R1A, CHAD, PIK3IP1, DUSP9, RTN4RL1, PKIA, PYCARD, SFRP1, RGS3, APOE, TP73, RTN4R, FLRT2, DUSP19, LRRC4B, CDKN2D, SMPD1, PPP1R1C, PRKAR2B, UBE2C, SOCS2, CAV1, PLK1, GP1BA, HSPB1, BMP7"
GO_POSITIVE_REGULATION_OF_TYPE_2_IMMUNE_RESPONSE,0.6727316399447547,0.9018678481447592,-0.38803825612577547,-0.8502188928905946,436916,11,"RSAD2, XCL1"
GO_NEUROBLAST_PROLIFERATION,0.6732429970554799,0.902214669139149,-0.3304884190376509,-0.8598998503882654,476719,24,"ID4, ASPM, WNT3A, RACGAP1, ARTN, FGFR1, FGFR2, TEAD3, NDE1, FZD9, EML1"
GO_NEGATIVE_REGULATION_OF_GLYCOPROTEIN_BIOSYNTHETIC_PROCESS,0.6735584717930241,0.902214669139149,-0.3877236120407178,-0.8495294857472804,437453,11,"BACE2, ACER2, JAK3, ABCA7, ITM2B, ITM2C"
GO_NEGATIVE_REGULATION_OF_B_CELL_APOPTOTIC_PROCESS,0.6736477757915337,0.902214669139149,-0.38768673803488063,-0.8494486922277642,437511,11,"AURKB, HSH2D"
GO_MRNA_CLEAVAGE,0.6739505137937855,0.902326590337891,0.3070549758747281,0.8483966151294366,214661,17,"ERN1, NCBP2, CPSF2"
GO_REGULATION_OF_GLYCOPROTEIN_METABOLIC_PROCESS,0.6746018037328647,0.9028473454728574,-0.31286043737568353,-0.8658318980071712,496002,33,"CCR7, IL15, PTX3, BACE2, ACER2, JAK3, ABCA7, ITM2B, ITM2C, RAB1B, CST3, SOAT1, CTNNB1"
GO_REGULATION_OF_EXTRACELLULAR_MATRIX_DISASSEMBLY,0.6749054310802253,0.9028473454728574,0.33886881504626026,0.8326652023925263,236579,11,"ETS1, CLASP2"
GO_POSITIVE_REGULATION_OF_LEUKOCYTE_DIFFERENTIATION,0.6749973595738293,0.9028473454728574,-0.2752270523919736,-0.8932802534534665,568797,93,"IL7R, MYB, CA2, IL15, CSF1, GAS6, KITLG, IL7, GLI3, LGALS9, PRKCA, GPR68, FLT3LG, HLA-G, EGR3, IL12A, GLI2, AGER, CSF1R, ID2, IL4R, LGALS1, RAG1, HMGB1, CD83, FADD"
GO_REGULATION_OF_CILIUM_MOVEMENT,0.6758218010496504,0.9029087266867869,0.36600257449861784,0.8215461965443533,251746,8,"ARMC4, DNAH11, MKKS"
GO_PHOTOTRANSDUCTION_VISIBLE_LIGHT,0.6758405927437215,0.9029087266867869,0.36599825726407764,0.8215365058813274,251753,8,"ABCA4, GNAQ, RP1"
